\set ECHO none
--Testcase 1:
CREATE EXTENSION pgspider_ext;
--Testcase 2:
CREATE SERVER spdsrv FOREIGN DATA WRAPPER pgspider_ext;
--Testcase 3:
CREATE USER MAPPING FOR CURRENT_USER SERVER spdsrv;
--Testcase 4:
CREATE EXTENSION dynamodb_fdw;
--Testcase 5:
CREATE SERVER dynamodb_server FOREIGN DATA WRAPPER dynamodb_fdw
  OPTIONS (endpoint :DYNAMODB_ENDPOINT);
--Testcase 6:
CREATE USER MAPPING FOR public SERVER dynamodb_server 
  OPTIONS (user :DYNAMODB_USER, password :DYNAMODB_PASSWORD);
-- ===================================================================
-- create objects used through FDW loopback server
-- ===================================================================
--Testcase 7:
CREATE TYPE user_enum AS ENUM ('foo', 'bar', 'buz');
--Testcase 8:
CREATE SCHEMA "S 1";
-- DynamoDB does not have timestamp or timestamptz data type. DynamoDB FDW also
-- does not support this type. Therefore, change data type of c4, c5 to text.
--Testcase 9:
CREATE FOREIGN TABLE "S 1"."T 1" (
	"C 1" int options (column_name 'C_1'),
	c2 int NOT NULL,
	c3 text,
	c4 text,
	c5 text,
	c6 varchar(10),
	c7 char(10),
	c8 text
) SERVER dynamodb_server OPTIONS (table_name 'T_1', partition_key 'C_1');
--Testcase 10:
CREATE FOREIGN TABLE "S 1"."T 2" (
	c1 int NOT NULL,
	c2 text
) SERVER dynamodb_server OPTIONS (table_name 'T_2', partition_key 'c1');
--Testcase 11:
CREATE FOREIGN TABLE "S 1"."T 3" (
	c1 int NOT NULL,
	c2 int NOT NULL,
	c3 text
) SERVER dynamodb_server OPTIONS (table_name 'T_3', partition_key 'c1');
--Testcase 12:
CREATE FOREIGN TABLE "S 1"."T 4" (
	c1 int NOT NULL,
	c2 int NOT NULL,
	c3 text
) SERVER dynamodb_server OPTIONS (table_name 'T_4', partition_key 'c1');
--Testcase 13:
INSERT INTO "S 1"."T 1"
	SELECT id,
	       id % 10,
	       to_char(id, 'FM00000'),
	       ('1970-01-01'::timestamptz + ((id % 100) || ' days')::interval)::text,
	       ('1970-01-01'::timestamp + ((id % 100) || ' days')::interval)::text,
	       id % 10,
	       id % 10,
	       'foo'
	FROM generate_series(1, 1000) id;
--Testcase 14:
INSERT INTO "S 1"."T 2"
	SELECT id,
	       'AAA' || to_char(id, 'FM000')
	FROM generate_series(1, 100) id;
--Testcase 15:
INSERT INTO "S 1"."T 3"
	SELECT id,
	       id + 1,
	       'AAA' || to_char(id, 'FM000')
	FROM generate_series(1, 100) id;
--Testcase 16:
DELETE FROM "S 1"."T 3" WHERE c1 % 2 != 0;	-- delete for outer join tests
--Testcase 17:
INSERT INTO "S 1"."T 4"
	SELECT id,
	       id + 1,
	       'AAA' || to_char(id, 'FM000')
	FROM generate_series(1, 100) id;
--Testcase 18:
DELETE FROM "S 1"."T 4" WHERE c1 % 3 != 0;	-- delete for outer join tests
-- ===================================================================
-- create foreign tables
-- ===================================================================
--Testcase 19:
CREATE FOREIGN TABLE ft1_a_child(
	c0 int,
	c1 int,
	c2 int NOT NULL,
	c3 text,
	c4 text,
	c5 text,
	c6 text,
	c7 text default 'ft1',
	c8 text
) SERVER dynamodb_server OPTIONS (partition_key 'c1');
--Testcase 20:
CREATE TABLE ft1 (
	c1 int,
	c2 int,
	c3 text,
	c4 text,
	c5 text,
	c6 text,
	c7 char(10) default 'ft1',
	c8 text,
	spdurl text
) PARTITION BY LIST (spdurl);
ALTER FOREIGN TABLE ft1_a_child DROP COLUMN c0;
--Testcase 21:
CREATE FOREIGN TABLE ft1_a PARTITION OF ft1 FOR VALUES IN ('/node1/') SERVER spdsrv;
--Testcase 22:
CREATE FOREIGN TABLE ft2_a_child (
	c1 int NOT NULL,
	c2 int NOT NULL,
	cx int,
	c3 text,
	c4 text,
	c5 text,
	c6 varchar(10),
	c7 char(10) default 'ft2',
	c8 text
) SERVER dynamodb_server OPTIONS (partition_key 'c1');
ALTER FOREIGN TABLE ft2_a_child DROP COLUMN cx;
--Testcase 23:
CREATE TABLE ft2 (
	c1 int NOT NULL,
	c2 int NOT NULL,
	c3 text,
	c4 text,
	c5 text,
	c6 varchar(10),
	c7 char(10) default 'ft2',
	c8 text,
	spdurl text
) PARTITION BY LIST (spdurl);
--Testcase 24:
CREATE FOREIGN TABLE ft2_a PARTITION OF ft2 FOR VALUES IN ('/node1/') SERVER spdsrv;
--Testcase 25:
CREATE FOREIGN TABLE ft4_a_child (
	c1 int NOT NULL,
	c2 int NOT NULL,
	c3 text
) SERVER dynamodb_server OPTIONS (table_name 'T_3');
--Testcase 26:
CREATE TABLE ft4 (
	c1 int NOT NULL,
	c2 int NOT NULL,
	c3 text,
	spdurl text
) PARTITION BY LIST (spdurl);
--Testcase 27:
CREATE FOREIGN TABLE ft4_a PARTITION OF ft4 FOR VALUES IN ('/node1/') SERVER spdsrv;
--Testcase 28:
CREATE FOREIGN TABLE ft5_a_child (
	c1 int NOT NULL,
	c2 int NOT NULL,
	c3 text
) SERVER dynamodb_server OPTIONS (table_name 'T_4', partition_key 'c1');
--Testcase 29:
CREATE TABLE ft5 (
	c1 int NOT NULL,
	c2 int NOT NULL,
	c3 text,
	spdurl text
) PARTITION BY LIST (spdurl);
--Testcase 30:
CREATE FOREIGN TABLE ft5_a PARTITION OF ft5 FOR VALUES IN ('/node1/') SERVER spdsrv;
--Testcase 31:
CREATE FOREIGN TABLE ft6_a_child (
	c1 int NOT NULL,
	c2 int NOT NULL,
	c3 text
) SERVER dynamodb_server OPTIONS (table_name 'T_4');
--Testcase 32:
CREATE TABLE ft6 (
	c1 int NOT NULL,
	c2 int NOT NULL,
	c3 text,
	spdurl text
) PARTITION BY LIST (spdurl);
--Testcase 33:
CREATE FOREIGN TABLE ft6_a PARTITION OF ft6 FOR VALUES IN ('/node1/') SERVER spdsrv;
-- Enable to pushdown aggregate
SET enable_partitionwise_aggregate TO on;
-- Turn off leader node participation to avoid duplicate data error when executing
-- parallel query
SET parallel_leader_participation TO off;
-- ===================================================================
-- tests for validator
-- ===================================================================
-- requiressl and some other parameters are omitted because
-- valid values for them depend on configure options
-- ALTER SERVER dynamodb_server OPTIONS (
	-- use_remote_estimate 'false',
	-- updatable 'true',
	-- fdw_startup_cost '123.456',
	-- fdw_tuple_cost '0.123',
	-- service 'value',
	-- connect_timeout 'value',
	-- dbname 'value',
	-- hostaddr 'value',
	-- port 'value',
	--client_encoding 'value',
	-- application_name 'value',
	--fallback_application_name 'value',
	-- keepalives 'value',
	-- keepalives_idle 'value',
	-- keepalives_interval 'value',
	-- tcp_user_timeout 'value',
	-- requiressl 'value',
	-- sslcompression 'value',
	-- sslmode 'value',
	-- sslcert 'value',
	-- sslkey 'value',
	-- sslrootcert 'value',
	-- sslcrl 'value',
	--requirepeer 'value',
	-- krbsrvname 'value',
	-- gsslib 'value'
	--replication 'value'
-- );
-- DynamoDB FDW does not support extensions option
-- -- Error, invalid list syntax
-- ALTER SERVER testserver1 OPTIONS (ADD extensions 'foo; bar');
-- -- OK but gets a warning
-- ALTER SERVER testserver1 OPTIONS (ADD extensions 'foo, bar');
-- ALTER SERVER testserver1 OPTIONS (DROP extensions);
-- ALTER USER MAPPING FOR public SERVER dynamodb_server
-- 	OPTIONS (DROP user, DROP password);
-- -- Attempt to add a valid option that's not allowed in a user mapping
-- ALTER USER MAPPING FOR public SERVER dynamodb_server
-- 	OPTIONS (ADD sslmode 'require');
-- -- But we can add valid ones fine
-- ALTER USER MAPPING FOR public SERVER dynamodb_server
-- 	OPTIONS (ADD sslpassword 'dummy');
-- -- Ensure valid options we haven't used in a user mapping yet are
-- -- permitted to check validation.
-- ALTER USER MAPPING FOR public SERVER testserver1
-- 	OPTIONS (ADD sslkey 'value', ADD sslcert 'value');
ALTER FOREIGN TABLE ft1_a_child OPTIONS (table_name 'T_1');
ALTER FOREIGN TABLE ft2_a_child OPTIONS (table_name 'T_1');
ALTER FOREIGN TABLE ft1_a_child ALTER COLUMN c1 OPTIONS (column_name 'C_1');
ALTER FOREIGN TABLE ft2_a_child ALTER COLUMN c1 OPTIONS (column_name 'C_1');
--Testcase 34:
\det+
                                    List of foreign tables
 Schema |    Table    |     Server      |              FDW options               | Description 
--------+-------------+-----------------+----------------------------------------+-------------
 public | ft1_a       | spdsrv          |                                        | 
 public | ft1_a_child | dynamodb_server | (partition_key 'c1', table_name 'T_1') | 
 public | ft2_a       | spdsrv          |                                        | 
 public | ft2_a_child | dynamodb_server | (partition_key 'c1', table_name 'T_1') | 
 public | ft4_a       | spdsrv          |                                        | 
 public | ft4_a_child | dynamodb_server | (table_name 'T_3')                     | 
 public | ft5_a       | spdsrv          |                                        | 
 public | ft5_a_child | dynamodb_server | (table_name 'T_4', partition_key 'c1') | 
 public | ft6_a       | spdsrv          |                                        | 
 public | ft6_a_child | dynamodb_server | (table_name 'T_4')                     | 
(10 rows)

-- DynamoDB FDW does not support dbname option
-- -- Test that alteration of server options causes reconnection
-- -- Remote's errors might be non-English, so hide them to ensure stable results
-- \set VERBOSITY terse
-- SELECT c3, c4 FROM ft1 ORDER BY c3, c1 LIMIT 1;  -- should work
-- ALTER SERVER dynamodb_server OPTIONS (SET dbname 'no such database');
-- SELECT c3, c4 FROM ft1 ORDER BY c3, c1 LIMIT 1;  -- should fail
-- DO $d$
--     BEGIN
--         EXECUTE $$ALTER SERVER loopback
--             OPTIONS (SET dbname '$$||current_database()||$$')$$;
--     END;
-- $d$;
-- SELECT c3, c4 FROM ft1 ORDER BY c3, c1 LIMIT 1;  -- should work again
-- For DynamoDB local, user and password does not have any affect.
-- Therefore, skip these test cases.
-- -- Test that alteration of user mapping options causes reconnection
-- ALTER USER MAPPING FOR public SERVER dynamodb_server
--   OPTIONS (ADD user 'no such user', ADD password 'no such password');
-- SELECT c3, c4 FROM ft1 ORDER BY c3, c1 LIMIT 1;  -- should fail
-- ALTER USER MAPPING FOR public SERVER dynamodb_server
--   OPTIONS (SET user :DYNAMODB_USER, SET password :DYNAMODB_PASSWORD);
--Testcase 35:
SELECT c3, c4 FROM ft1 ORDER BY c3, c1 LIMIT 1;  -- should work again
  c3   |              c4              
-------+------------------------------
 00001 | Fri Jan 02 00:00:00 1970 PST
(1 row)

-- \set VERBOSITY default
-- Now we should be able to run ANALYZE.
-- To exercise multiple code paths, we use local stats on ft1
-- and remote-estimate mode on ft2.
-- ANALYZE ft1;
-- ALTER FOREIGN TABLE ft2 OPTIONS (use_remote_estimate 'true');
-- ===================================================================
-- simple queries
-- ===================================================================
-- single table without alias
--Testcase 36:
EXPLAIN (COSTS OFF) SELECT * FROM ft1 ORDER BY c3, c1 OFFSET 100 LIMIT 10;
              QUERY PLAN               
---------------------------------------
 Limit
   ->  Sort
         Sort Key: ft1.c3, ft1.c1
         ->  Foreign Scan on ft1_a ft1
(4 rows)

--Testcase 37:
SELECT * FROM ft1 ORDER BY c3, c1 OFFSET 100 LIMIT 10;
 c1  | c2 |  c3   |              c4              |            c5            | c6 |     c7     | c8  | spdurl  
-----+----+-------+------------------------------+--------------------------+----+------------+-----+---------
 101 |  1 | 00101 | Fri Jan 02 00:00:00 1970 PST | Fri Jan 02 00:00:00 1970 | 1  | 1          | foo | /node1/
 102 |  2 | 00102 | Sat Jan 03 00:00:00 1970 PST | Sat Jan 03 00:00:00 1970 | 2  | 2          | foo | /node1/
 103 |  3 | 00103 | Sun Jan 04 00:00:00 1970 PST | Sun Jan 04 00:00:00 1970 | 3  | 3          | foo | /node1/
 104 |  4 | 00104 | Mon Jan 05 00:00:00 1970 PST | Mon Jan 05 00:00:00 1970 | 4  | 4          | foo | /node1/
 105 |  5 | 00105 | Tue Jan 06 00:00:00 1970 PST | Tue Jan 06 00:00:00 1970 | 5  | 5          | foo | /node1/
 106 |  6 | 00106 | Wed Jan 07 00:00:00 1970 PST | Wed Jan 07 00:00:00 1970 | 6  | 6          | foo | /node1/
 107 |  7 | 00107 | Thu Jan 08 00:00:00 1970 PST | Thu Jan 08 00:00:00 1970 | 7  | 7          | foo | /node1/
 108 |  8 | 00108 | Fri Jan 09 00:00:00 1970 PST | Fri Jan 09 00:00:00 1970 | 8  | 8          | foo | /node1/
 109 |  9 | 00109 | Sat Jan 10 00:00:00 1970 PST | Sat Jan 10 00:00:00 1970 | 9  | 9          | foo | /node1/
 110 |  0 | 00110 | Sun Jan 11 00:00:00 1970 PST | Sun Jan 11 00:00:00 1970 | 0  | 0          | foo | /node1/
(10 rows)

-- single table with alias - also test that tableoid sort is not pushed to remote side
--Testcase 38:
EXPLAIN (VERBOSE, COSTS OFF) SELECT * FROM ft1 t1 ORDER BY t1.c3, t1.c1, t1.tableoid OFFSET 100 LIMIT 10;
                                              QUERY PLAN                                              
------------------------------------------------------------------------------------------------------
 Limit
   Output: t1.c1, t1.c2, t1.c3, t1.c4, t1.c5, t1.c6, t1.c7, t1.c8, t1.spdurl, t1.tableoid
   ->  Sort
         Output: t1.c1, t1.c2, t1.c3, t1.c4, t1.c5, t1.c6, t1.c7, t1.c8, t1.spdurl, t1.tableoid
         Sort Key: t1.c3, t1.c1, t1.tableoid
         ->  Foreign Scan on public.ft1_a t1
               Output: t1.c1, t1.c2, t1.c3, t1.c4, t1.c5, t1.c6, t1.c7, t1.c8, t1.spdurl, t1.tableoid
                 Remote SQL: SELECT C_1, c2, c3, c4, c5, c6, c7, c8 FROM T_1
(8 rows)

--Testcase 39:
SELECT * FROM ft1 t1 ORDER BY t1.c3, t1.c1, t1.tableoid OFFSET 100 LIMIT 10;
 c1  | c2 |  c3   |              c4              |            c5            | c6 |     c7     | c8  | spdurl  
-----+----+-------+------------------------------+--------------------------+----+------------+-----+---------
 101 |  1 | 00101 | Fri Jan 02 00:00:00 1970 PST | Fri Jan 02 00:00:00 1970 | 1  | 1          | foo | /node1/
 102 |  2 | 00102 | Sat Jan 03 00:00:00 1970 PST | Sat Jan 03 00:00:00 1970 | 2  | 2          | foo | /node1/
 103 |  3 | 00103 | Sun Jan 04 00:00:00 1970 PST | Sun Jan 04 00:00:00 1970 | 3  | 3          | foo | /node1/
 104 |  4 | 00104 | Mon Jan 05 00:00:00 1970 PST | Mon Jan 05 00:00:00 1970 | 4  | 4          | foo | /node1/
 105 |  5 | 00105 | Tue Jan 06 00:00:00 1970 PST | Tue Jan 06 00:00:00 1970 | 5  | 5          | foo | /node1/
 106 |  6 | 00106 | Wed Jan 07 00:00:00 1970 PST | Wed Jan 07 00:00:00 1970 | 6  | 6          | foo | /node1/
 107 |  7 | 00107 | Thu Jan 08 00:00:00 1970 PST | Thu Jan 08 00:00:00 1970 | 7  | 7          | foo | /node1/
 108 |  8 | 00108 | Fri Jan 09 00:00:00 1970 PST | Fri Jan 09 00:00:00 1970 | 8  | 8          | foo | /node1/
 109 |  9 | 00109 | Sat Jan 10 00:00:00 1970 PST | Sat Jan 10 00:00:00 1970 | 9  | 9          | foo | /node1/
 110 |  0 | 00110 | Sun Jan 11 00:00:00 1970 PST | Sun Jan 11 00:00:00 1970 | 0  | 0          | foo | /node1/
(10 rows)

-- whole-row reference
--Testcase 40:
EXPLAIN (VERBOSE, COSTS OFF) SELECT t1 FROM ft1 t1 ORDER BY t1.c3, t1.c1 OFFSET 100 LIMIT 10;
                                 QUERY PLAN                                  
-----------------------------------------------------------------------------
 Limit
   Output: ((t1.*)::ft1), t1.c3, t1.c1
   ->  Sort
         Output: ((t1.*)::ft1), t1.c3, t1.c1
         Sort Key: t1.c3, t1.c1
         ->  Foreign Scan on public.ft1_a t1
               Output: t1.*, t1.c3, t1.c1
                 Remote SQL: SELECT C_1, c2, c3, c4, c5, c6, c7, c8 FROM T_1
(8 rows)

--Testcase 41:
SELECT t1 FROM ft1 t1 ORDER BY t1.c3, t1.c1 OFFSET 100 LIMIT 10;
                                                 t1                                                 
----------------------------------------------------------------------------------------------------
 (101,1,00101,"Fri Jan 02 00:00:00 1970 PST","Fri Jan 02 00:00:00 1970",1,"1         ",foo,/node1/)
 (102,2,00102,"Sat Jan 03 00:00:00 1970 PST","Sat Jan 03 00:00:00 1970",2,"2         ",foo,/node1/)
 (103,3,00103,"Sun Jan 04 00:00:00 1970 PST","Sun Jan 04 00:00:00 1970",3,"3         ",foo,/node1/)
 (104,4,00104,"Mon Jan 05 00:00:00 1970 PST","Mon Jan 05 00:00:00 1970",4,"4         ",foo,/node1/)
 (105,5,00105,"Tue Jan 06 00:00:00 1970 PST","Tue Jan 06 00:00:00 1970",5,"5         ",foo,/node1/)
 (106,6,00106,"Wed Jan 07 00:00:00 1970 PST","Wed Jan 07 00:00:00 1970",6,"6         ",foo,/node1/)
 (107,7,00107,"Thu Jan 08 00:00:00 1970 PST","Thu Jan 08 00:00:00 1970",7,"7         ",foo,/node1/)
 (108,8,00108,"Fri Jan 09 00:00:00 1970 PST","Fri Jan 09 00:00:00 1970",8,"8         ",foo,/node1/)
 (109,9,00109,"Sat Jan 10 00:00:00 1970 PST","Sat Jan 10 00:00:00 1970",9,"9         ",foo,/node1/)
 (110,0,00110,"Sun Jan 11 00:00:00 1970 PST","Sun Jan 11 00:00:00 1970",0,"0         ",foo,/node1/)
(10 rows)

-- empty result
--Testcase 42:
SELECT * FROM ft1 WHERE false;
 c1 | c2 | c3 | c4 | c5 | c6 | c7 | c8 | spdurl 
----+----+----+----+----+----+----+----+--------
(0 rows)

-- with WHERE clause
--Testcase 43:
EXPLAIN (VERBOSE, COSTS OFF) SELECT * FROM ft1 t1 WHERE t1.c1 = 101 AND t1.c6 = '1' AND t1.c7 >= '1';
                                            QUERY PLAN                                            
--------------------------------------------------------------------------------------------------
 Foreign Scan on public.ft1_a t1
   Output: t1.c1, t1.c2, t1.c3, t1.c4, t1.c5, t1.c6, t1.c7, t1.c8, t1.spdurl
   Filter: (t1.c7 >= '1'::bpchar)
     Remote SQL: SELECT C_1, c2, c3, c4, c5, c6, c7, c8 FROM T_1 WHERE (C_1 = 101) AND (c6 = '1')
(4 rows)

--Testcase 44:
SELECT * FROM ft1 t1 WHERE t1.c1 = 101 AND t1.c6 = '1' AND t1.c7 >= '1';
 c1  | c2 |  c3   |              c4              |            c5            | c6 |     c7     | c8  | spdurl  
-----+----+-------+------------------------------+--------------------------+----+------------+-----+---------
 101 |  1 | 00101 | Fri Jan 02 00:00:00 1970 PST | Fri Jan 02 00:00:00 1970 | 1  | 1          | foo | /node1/
(1 row)

-- with FOR UPDATE/SHARE
--Testcase 45:
EXPLAIN (VERBOSE, COSTS OFF) SELECT * FROM ft1 t1 WHERE c1 = 101 FOR UPDATE;
                                                    QUERY PLAN                                                    
------------------------------------------------------------------------------------------------------------------
 LockRows
   Output: t1.c1, t1.c2, t1.c3, t1.c4, t1.c5, t1.c6, t1.c7, t1.c8, t1.spdurl, t1.ctid, ((t1.*)::ft1), t1.tableoid
   ->  Foreign Scan on public.ft1_a t1
         Output: t1.c1, t1.c2, t1.c3, t1.c4, t1.c5, t1.c6, t1.c7, t1.c8, t1.spdurl, t1.ctid, t1.*, t1.tableoid
           Remote SQL: SELECT C_1, c2, c3, c4, c5, c6, c7, c8 FROM T_1 WHERE (C_1 = 101)
(5 rows)

--Testcase 46:
SELECT * FROM ft1 t1 WHERE c1 = 101 FOR UPDATE;
 c1  | c2 |  c3   |              c4              |            c5            | c6 |     c7     | c8  | spdurl  
-----+----+-------+------------------------------+--------------------------+----+------------+-----+---------
 101 |  1 | 00101 | Fri Jan 02 00:00:00 1970 PST | Fri Jan 02 00:00:00 1970 | 1  | 1          | foo | /node1/
(1 row)

--Testcase 47:
EXPLAIN (VERBOSE, COSTS OFF) SELECT * FROM ft1 t1 WHERE c1 = 102 FOR SHARE;
                                                    QUERY PLAN                                                    
------------------------------------------------------------------------------------------------------------------
 LockRows
   Output: t1.c1, t1.c2, t1.c3, t1.c4, t1.c5, t1.c6, t1.c7, t1.c8, t1.spdurl, t1.ctid, ((t1.*)::ft1), t1.tableoid
   ->  Foreign Scan on public.ft1_a t1
         Output: t1.c1, t1.c2, t1.c3, t1.c4, t1.c5, t1.c6, t1.c7, t1.c8, t1.spdurl, t1.ctid, t1.*, t1.tableoid
           Remote SQL: SELECT C_1, c2, c3, c4, c5, c6, c7, c8 FROM T_1 WHERE (C_1 = 102)
(5 rows)

--Testcase 48:
SELECT * FROM ft1 t1 WHERE c1 = 102 FOR SHARE;
 c1  | c2 |  c3   |              c4              |            c5            | c6 |     c7     | c8  | spdurl  
-----+----+-------+------------------------------+--------------------------+----+------------+-----+---------
 102 |  2 | 00102 | Sat Jan 03 00:00:00 1970 PST | Sat Jan 03 00:00:00 1970 | 2  | 2          | foo | /node1/
(1 row)

-- aggregate
--Testcase 49:
SELECT COUNT(*) FROM ft1 t1;
 count 
-------
  1000
(1 row)

-- subquery
--Testcase 50:
SELECT * FROM ft1 t1 WHERE t1.c3 IN (SELECT c3 FROM ft2 t2 WHERE c1 <= 10) ORDER BY c1;
 c1 | c2 |  c3   |              c4              |            c5            | c6 |     c7     | c8  | spdurl  
----+----+-------+------------------------------+--------------------------+----+------------+-----+---------
  1 |  1 | 00001 | Fri Jan 02 00:00:00 1970 PST | Fri Jan 02 00:00:00 1970 | 1  | 1          | foo | /node1/
  2 |  2 | 00002 | Sat Jan 03 00:00:00 1970 PST | Sat Jan 03 00:00:00 1970 | 2  | 2          | foo | /node1/
  3 |  3 | 00003 | Sun Jan 04 00:00:00 1970 PST | Sun Jan 04 00:00:00 1970 | 3  | 3          | foo | /node1/
  4 |  4 | 00004 | Mon Jan 05 00:00:00 1970 PST | Mon Jan 05 00:00:00 1970 | 4  | 4          | foo | /node1/
  5 |  5 | 00005 | Tue Jan 06 00:00:00 1970 PST | Tue Jan 06 00:00:00 1970 | 5  | 5          | foo | /node1/
  6 |  6 | 00006 | Wed Jan 07 00:00:00 1970 PST | Wed Jan 07 00:00:00 1970 | 6  | 6          | foo | /node1/
  7 |  7 | 00007 | Thu Jan 08 00:00:00 1970 PST | Thu Jan 08 00:00:00 1970 | 7  | 7          | foo | /node1/
  8 |  8 | 00008 | Fri Jan 09 00:00:00 1970 PST | Fri Jan 09 00:00:00 1970 | 8  | 8          | foo | /node1/
  9 |  9 | 00009 | Sat Jan 10 00:00:00 1970 PST | Sat Jan 10 00:00:00 1970 | 9  | 9          | foo | /node1/
 10 |  0 | 00010 | Sun Jan 11 00:00:00 1970 PST | Sun Jan 11 00:00:00 1970 | 0  | 0          | foo | /node1/
(10 rows)

-- subquery+MAX
--Testcase 51:
SELECT * FROM ft1 t1 WHERE t1.c3 = (SELECT MAX(c3) FROM ft2 t2) ORDER BY c1;
  c1  | c2 |  c3   |              c4              |            c5            | c6 |     c7     | c8  | spdurl  
------+----+-------+------------------------------+--------------------------+----+------------+-----+---------
 1000 |  0 | 01000 | Thu Jan 01 00:00:00 1970 PST | Thu Jan 01 00:00:00 1970 | 0  | 0          | foo | /node1/
(1 row)

-- used in CTE
--Testcase 52:
WITH t1 AS (SELECT * FROM ft1 WHERE c1 <= 10) SELECT t2.c1, t2.c2, t2.c3, t2.c4 FROM t1, ft2 t2 WHERE t1.c1 = t2.c1 ORDER BY t1.c1;
 c1 | c2 |  c3   |              c4              
----+----+-------+------------------------------
  1 |  1 | 00001 | Fri Jan 02 00:00:00 1970 PST
  2 |  2 | 00002 | Sat Jan 03 00:00:00 1970 PST
  3 |  3 | 00003 | Sun Jan 04 00:00:00 1970 PST
  4 |  4 | 00004 | Mon Jan 05 00:00:00 1970 PST
  5 |  5 | 00005 | Tue Jan 06 00:00:00 1970 PST
  6 |  6 | 00006 | Wed Jan 07 00:00:00 1970 PST
  7 |  7 | 00007 | Thu Jan 08 00:00:00 1970 PST
  8 |  8 | 00008 | Fri Jan 09 00:00:00 1970 PST
  9 |  9 | 00009 | Sat Jan 10 00:00:00 1970 PST
 10 |  0 | 00010 | Sun Jan 11 00:00:00 1970 PST
(10 rows)

-- fixed values
--Testcase 53:
SELECT 'fixed', NULL FROM ft1 t1 WHERE c1 = 1;
 ?column? | ?column? 
----------+----------
 fixed    | 
(1 row)

-- Test forcing the remote server to produce sorted data for a merge join.
SET enable_hashjoin TO false;
SET enable_nestloop TO false;
-- inner join; expressions in the clauses appear in the equivalence class list
--Testcase 54:
EXPLAIN (VERBOSE, COSTS OFF)
	SELECT t1.c1, t2."C 1" FROM ft2 t1 JOIN "S 1"."T 1" t2 ON (t1.c1 = t2."C 1") OFFSET 100 LIMIT 10;
                      QUERY PLAN                       
-------------------------------------------------------
 Limit
   Output: t1.c1, t2."C 1"
   ->  Merge Join
         Output: t1.c1, t2."C 1"
         Merge Cond: (t2."C 1" = t1.c1)
         ->  Sort
               Output: t2."C 1"
               Sort Key: t2."C 1"
               ->  Foreign Scan on "S 1"."T 1" t2
                     Output: t2."C 1"
                     Remote SQL: SELECT C_1 FROM T_1
         ->  Sort
               Output: t1.c1
               Sort Key: t1.c1
               ->  Foreign Scan on public.ft2_a t1
                     Output: t1.c1
                       Remote SQL: SELECT C_1 FROM T_1
(17 rows)

--Testcase 55:
SELECT t1.c1, t2."C 1" FROM ft2 t1 JOIN "S 1"."T 1" t2 ON (t1.c1 = t2."C 1") OFFSET 100 LIMIT 10;
 c1  | C 1 
-----+-----
 101 | 101
 102 | 102
 103 | 103
 104 | 104
 105 | 105
 106 | 106
 107 | 107
 108 | 108
 109 | 109
 110 | 110
(10 rows)

-- outer join; expressions in the clauses do not appear in equivalence class
-- list but no output change as compared to the previous query
--Testcase 56:
EXPLAIN (VERBOSE, COSTS OFF)
	SELECT t1.c1, t2."C 1" FROM ft2 t1 LEFT JOIN "S 1"."T 1" t2 ON (t1.c1 = t2."C 1") OFFSET 100 LIMIT 10;
                      QUERY PLAN                       
-------------------------------------------------------
 Limit
   Output: t1.c1, t2."C 1"
   ->  Merge Right Join
         Output: t1.c1, t2."C 1"
         Merge Cond: (t2."C 1" = t1.c1)
         ->  Sort
               Output: t2."C 1"
               Sort Key: t2."C 1"
               ->  Foreign Scan on "S 1"."T 1" t2
                     Output: t2."C 1"
                     Remote SQL: SELECT C_1 FROM T_1
         ->  Sort
               Output: t1.c1
               Sort Key: t1.c1
               ->  Foreign Scan on public.ft2_a t1
                     Output: t1.c1
                       Remote SQL: SELECT C_1 FROM T_1
(17 rows)

--Testcase 57:
SELECT t1.c1, t2."C 1" FROM ft2 t1 LEFT JOIN "S 1"."T 1" t2 ON (t1.c1 = t2."C 1") OFFSET 100 LIMIT 10;
 c1  | C 1 
-----+-----
 101 | 101
 102 | 102
 103 | 103
 104 | 104
 105 | 105
 106 | 106
 107 | 107
 108 | 108
 109 | 109
 110 | 110
(10 rows)

-- A join between local table and foreign join. ORDER BY clause is added to the
-- foreign join so that the local table can be joined using merge join strategy.
--Testcase 58:
EXPLAIN (VERBOSE, COSTS OFF)
	SELECT t1."C 1" FROM "S 1"."T 1" t1 left join ft1 t2 join ft2 t3 on (t2.c1 = t3.c1) on (t3.c1 = t1."C 1") OFFSET 100 LIMIT 10;
                            QUERY PLAN                             
-------------------------------------------------------------------
 Limit
   Output: t1."C 1"
   ->  Merge Left Join
         Output: t1."C 1"
         Merge Cond: (t1."C 1" = t3.c1)
         ->  Sort
               Output: t1."C 1"
               Sort Key: t1."C 1"
               ->  Foreign Scan on "S 1"."T 1" t1
                     Output: t1."C 1"
                     Remote SQL: SELECT C_1 FROM T_1
         ->  Materialize
               Output: t3.c1
               ->  Merge Join
                     Output: t3.c1
                     Merge Cond: (t2.c1 = t3.c1)
                     ->  Sort
                           Output: t2.c1
                           Sort Key: t2.c1
                           ->  Foreign Scan on public.ft1_a t2
                                 Output: t2.c1
                                   Remote SQL: SELECT C_1 FROM T_1
                     ->  Sort
                           Output: t3.c1
                           Sort Key: t3.c1
                           ->  Foreign Scan on public.ft2_a t3
                                 Output: t3.c1
                                   Remote SQL: SELECT C_1 FROM T_1
(28 rows)

--Testcase 59:
SELECT t1."C 1" FROM "S 1"."T 1" t1 left join ft1 t2 join ft2 t3 on (t2.c1 = t3.c1) on (t3.c1 = t1."C 1") OFFSET 100 LIMIT 10;
 C 1 
-----
 101
 102
 103
 104
 105
 106
 107
 108
 109
 110
(10 rows)

-- Test similar to above, except that the full join prevents any equivalence
-- classes from being merged. This produces single relation equivalence classes
-- included in join restrictions.
--Testcase 60:
EXPLAIN (VERBOSE, COSTS OFF)
	SELECT t1."C 1", t2.c1, t3.c1 FROM "S 1"."T 1" t1 left join ft1 t2 full join ft2 t3 on (t2.c1 = t3.c1) on (t3.c1 = t1."C 1") OFFSET 100 LIMIT 10;
                            QUERY PLAN                             
-------------------------------------------------------------------
 Limit
   Output: t1."C 1", t2.c1, t3.c1
   ->  Merge Left Join
         Output: t1."C 1", t2.c1, t3.c1
         Merge Cond: (t1."C 1" = t3.c1)
         ->  Sort
               Output: t1."C 1"
               Sort Key: t1."C 1"
               ->  Foreign Scan on "S 1"."T 1" t1
                     Output: t1."C 1"
                     Remote SQL: SELECT C_1 FROM T_1
         ->  Materialize
               Output: t3.c1, t2.c1
               ->  Merge Left Join
                     Output: t3.c1, t2.c1
                     Merge Cond: (t3.c1 = t2.c1)
                     ->  Sort
                           Output: t3.c1
                           Sort Key: t3.c1
                           ->  Foreign Scan on public.ft2_a t3
                                 Output: t3.c1
                                   Remote SQL: SELECT C_1 FROM T_1
                     ->  Sort
                           Output: t2.c1
                           Sort Key: t2.c1
                           ->  Foreign Scan on public.ft1_a t2
                                 Output: t2.c1
                                   Remote SQL: SELECT C_1 FROM T_1
(28 rows)

--Testcase 61:
SELECT t1."C 1", t2.c1, t3.c1 FROM "S 1"."T 1" t1 left join ft1 t2 full join ft2 t3 on (t2.c1 = t3.c1) on (t3.c1 = t1."C 1") OFFSET 100 LIMIT 10;
 C 1 | c1  | c1  
-----+-----+-----
 101 | 101 | 101
 102 | 102 | 102
 103 | 103 | 103
 104 | 104 | 104
 105 | 105 | 105
 106 | 106 | 106
 107 | 107 | 107
 108 | 108 | 108
 109 | 109 | 109
 110 | 110 | 110
(10 rows)

-- Test similar to above with all full outer joins
--Testcase 62:
EXPLAIN (VERBOSE, COSTS OFF)
	SELECT t1."C 1", t2.c1, t3.c1 FROM "S 1"."T 1" t1 full join ft1 t2 full join ft2 t3 on (t2.c1 = t3.c1) on (t3.c1 = t1."C 1") OFFSET 100 LIMIT 10;
                            QUERY PLAN                             
-------------------------------------------------------------------
 Limit
   Output: t1."C 1", t2.c1, t3.c1
   ->  Merge Full Join
         Output: t1."C 1", t2.c1, t3.c1
         Merge Cond: (t1."C 1" = t3.c1)
         ->  Sort
               Output: t1."C 1"
               Sort Key: t1."C 1"
               ->  Foreign Scan on "S 1"."T 1" t1
                     Output: t1."C 1"
                     Remote SQL: SELECT C_1 FROM T_1
         ->  Sort
               Output: t2.c1, t3.c1
               Sort Key: t3.c1
               ->  Merge Full Join
                     Output: t2.c1, t3.c1
                     Merge Cond: (t2.c1 = t3.c1)
                     ->  Sort
                           Output: t2.c1
                           Sort Key: t2.c1
                           ->  Foreign Scan on public.ft1_a t2
                                 Output: t2.c1
                                   Remote SQL: SELECT C_1 FROM T_1
                     ->  Sort
                           Output: t3.c1
                           Sort Key: t3.c1
                           ->  Foreign Scan on public.ft2_a t3
                                 Output: t3.c1
                                   Remote SQL: SELECT C_1 FROM T_1
(29 rows)

--Testcase 63:
SELECT t1."C 1", t2.c1, t3.c1 FROM "S 1"."T 1" t1 full join ft1 t2 full join ft2 t3 on (t2.c1 = t3.c1) on (t3.c1 = t1."C 1") OFFSET 100 LIMIT 10;
 C 1 | c1  | c1  
-----+-----+-----
 101 | 101 | 101
 102 | 102 | 102
 103 | 103 | 103
 104 | 104 | 104
 105 | 105 | 105
 106 | 106 | 106
 107 | 107 | 107
 108 | 108 | 108
 109 | 109 | 109
 110 | 110 | 110
(10 rows)

RESET enable_hashjoin;
RESET enable_nestloop;
-- Test executing assertion in estimate_path_cost_size() that makes sure that
-- retrieved_rows for foreign rel re-used to cost pre-sorted foreign paths is
-- a sensible value even when the rel has tuples=0
--Testcase 64:
CREATE FOREIGN TABLE ft_empty_a_child (c1 int NOT NULL, c2 text)
  SERVER dynamodb_server OPTIONS (table_name 'loct_empty', partition_key 'c1');
--Testcase 65:
CREATE TABLE ft_empty (c1 int NOT NULL, c2 text, spdurl text)
   PARTITION BY LIST (spdurl);
--Testcase 66:
CREATE FOREIGN TABLE ft_empty_a PARTITION OF ft_empty FOR VALUES IN ('/node1/') SERVER spdsrv;
--Testcase 67:
INSERT INTO ft_empty_a_child
  SELECT id, 'AAA' || to_char(id, 'FM000') FROM generate_series(1, 100) id;
--Testcase 68:
DELETE FROM ft_empty_a_child;
-- ANALYZE ft_empty;
--Testcase 69:
EXPLAIN (VERBOSE, COSTS OFF) SELECT * FROM ft_empty ORDER BY c1;
                        QUERY PLAN                         
-----------------------------------------------------------
 Sort
   Output: ft_empty.c1, ft_empty.c2, ft_empty.spdurl
   Sort Key: ft_empty.c1
   ->  Foreign Scan on public.ft_empty_a ft_empty
         Output: ft_empty.c1, ft_empty.c2, ft_empty.spdurl
           Remote SQL: SELECT c1, c2 FROM loct_empty
(6 rows)

-- ===================================================================
-- WHERE with remotely-executable conditions
-- ===================================================================
--Testcase 70:
EXPLAIN (VERBOSE, COSTS OFF) SELECT * FROM ft1 t1 WHERE t1.c1 = 1;         -- Var, OpExpr(b), Const
                                   QUERY PLAN                                    
---------------------------------------------------------------------------------
 Foreign Scan on public.ft1_a t1
   Output: t1.c1, t1.c2, t1.c3, t1.c4, t1.c5, t1.c6, t1.c7, t1.c8, t1.spdurl
     Remote SQL: SELECT C_1, c2, c3, c4, c5, c6, c7, c8 FROM T_1 WHERE (C_1 = 1)
(3 rows)

--Testcase 71:
EXPLAIN (VERBOSE, COSTS OFF) SELECT * FROM ft1 t1 WHERE t1.c1 = 100 AND t1.c2 = 0; -- BoolExpr
                                           QUERY PLAN                                           
------------------------------------------------------------------------------------------------
 Foreign Scan on public.ft1_a t1
   Output: t1.c1, t1.c2, t1.c3, t1.c4, t1.c5, t1.c6, t1.c7, t1.c8, t1.spdurl
     Remote SQL: SELECT C_1, c2, c3, c4, c5, c6, c7, c8 FROM T_1 WHERE (C_1 = 100) AND (c2 = 0)
(3 rows)

--Testcase 72:
EXPLAIN (VERBOSE, COSTS OFF) SELECT * FROM ft1 t1 WHERE c1 IS NULL;        -- NullTest
                                     QUERY PLAN                                      
-------------------------------------------------------------------------------------
 Foreign Scan on public.ft1_a t1
   Output: t1.c1, t1.c2, t1.c3, t1.c4, t1.c5, t1.c6, t1.c7, t1.c8, t1.spdurl
     Remote SQL: SELECT C_1, c2, c3, c4, c5, c6, c7, c8 FROM T_1 WHERE (C_1 IS NULL)
(3 rows)

--Testcase 73:
EXPLAIN (VERBOSE, COSTS OFF) SELECT * FROM ft1 t1 WHERE c1 IS NOT NULL;    -- NullTest
                                       QUERY PLAN                                        
-----------------------------------------------------------------------------------------
 Foreign Scan on public.ft1_a t1
   Output: t1.c1, t1.c2, t1.c3, t1.c4, t1.c5, t1.c6, t1.c7, t1.c8, t1.spdurl
     Remote SQL: SELECT C_1, c2, c3, c4, c5, c6, c7, c8 FROM T_1 WHERE (C_1 IS NOT NULL)
(3 rows)

-- DynamoDB does not support round and abs function => not push down
--Testcase 74:
EXPLAIN (VERBOSE, COSTS OFF) SELECT * FROM ft1 t1 WHERE round(abs(c1), 0) = 1; -- FuncExpr
                                 QUERY PLAN                                  
-----------------------------------------------------------------------------
 Foreign Scan on public.ft1_a t1
   Output: t1.c1, t1.c2, t1.c3, t1.c4, t1.c5, t1.c6, t1.c7, t1.c8, t1.spdurl
   Filter: (round((abs(t1.c1))::numeric, 0) = '1'::numeric)
     Remote SQL: SELECT C_1, c2, c3, c4, c5, c6, c7, c8 FROM T_1
(4 rows)

-- DynamoDB does not support - operator => not push down
--Testcase 75:
EXPLAIN (VERBOSE, COSTS OFF) SELECT * FROM ft1 t1 WHERE c1 = -c1;          -- OpExpr(l)
                                 QUERY PLAN                                  
-----------------------------------------------------------------------------
 Foreign Scan on public.ft1_a t1
   Output: t1.c1, t1.c2, t1.c3, t1.c4, t1.c5, t1.c6, t1.c7, t1.c8, t1.spdurl
   Filter: (t1.c1 = (- t1.c1))
     Remote SQL: SELECT C_1, c2, c3, c4, c5, c6, c7, c8 FROM T_1
(4 rows)

-- DynamoDB does not support ! operator => not push down
--Testcase 76:
EXPLAIN (VERBOSE, COSTS OFF) SELECT * FROM ft1 t1 WHERE 1 = c1!;           -- OpExpr(r)
                                 QUERY PLAN                                  
-----------------------------------------------------------------------------
 Foreign Scan on public.ft1_a t1
   Output: t1.c1, t1.c2, t1.c3, t1.c4, t1.c5, t1.c6, t1.c7, t1.c8, t1.spdurl
   Filter: ('1'::numeric = ((t1.c1)::bigint !))
     Remote SQL: SELECT C_1, c2, c3, c4, c5, c6, c7, c8 FROM T_1
(4 rows)

-- DynamoDB does not support IS DISTINCT FROM => not push down
--Testcase 77:
EXPLAIN (VERBOSE, COSTS OFF) SELECT * FROM ft1 t1 WHERE (c1 IS NOT NULL) IS DISTINCT FROM (c1 IS NOT NULL); -- DistinctExpr
                                 QUERY PLAN                                  
-----------------------------------------------------------------------------
 Foreign Scan on public.ft1_a t1
   Output: t1.c1, t1.c2, t1.c3, t1.c4, t1.c5, t1.c6, t1.c7, t1.c8, t1.spdurl
   Filter: ((t1.c1 IS NOT NULL) IS DISTINCT FROM (t1.c1 IS NOT NULL))
     Remote SQL: SELECT C_1, c2, c3, c4, c5, c6, c7, c8 FROM T_1
(4 rows)

-- DynamoDB FDW only support ANY(ARRAY) with constant value => not push down.
--Testcase 78:
EXPLAIN (VERBOSE, COSTS OFF) SELECT * FROM ft1 t1 WHERE c1 = ANY(ARRAY[c2, 1, c1 + 0]); -- ScalarArrayOpExpr
                                 QUERY PLAN                                  
-----------------------------------------------------------------------------
 Foreign Scan on public.ft1_a t1
   Output: t1.c1, t1.c2, t1.c3, t1.c4, t1.c5, t1.c6, t1.c7, t1.c8, t1.spdurl
   Filter: (t1.c1 = ANY (ARRAY[t1.c2, 1, (t1.c1 + 0)]))
     Remote SQL: SELECT C_1, c2, c3, c4, c5, c6, c7, c8 FROM T_1
(4 rows)

-- DynamoDB FDW does not support SubscriptingRef => not push down.
--Testcase 79:
EXPLAIN (VERBOSE, COSTS OFF) SELECT * FROM ft1 t1 WHERE c1 = (ARRAY[c1,c2,3])[1]; -- SubscriptingRef
                                 QUERY PLAN                                  
-----------------------------------------------------------------------------
 Foreign Scan on public.ft1_a t1
   Output: t1.c1, t1.c2, t1.c3, t1.c4, t1.c5, t1.c6, t1.c7, t1.c8, t1.spdurl
   Filter: (t1.c1 = (ARRAY[t1.c1, t1.c2, 3])[1])
     Remote SQL: SELECT C_1, c2, c3, c4, c5, c6, c7, c8 FROM T_1
(4 rows)

--Testcase 80:
EXPLAIN (VERBOSE, COSTS OFF) SELECT * FROM ft1 t1 WHERE c6 = E'foo''s\\bar';  -- check special chars
                                        QUERY PLAN                                         
-------------------------------------------------------------------------------------------
 Foreign Scan on public.ft1_a t1
   Output: t1.c1, t1.c2, t1.c3, t1.c4, t1.c5, t1.c6, t1.c7, t1.c8, t1.spdurl
     Remote SQL: SELECT C_1, c2, c3, c4, c5, c6, c7, c8 FROM T_1 WHERE (c6 = 'foo''s\bar')
(3 rows)

--Testcase 81:
EXPLAIN (VERBOSE, COSTS OFF) SELECT * FROM ft1 t1 WHERE c8 = 'foo';  -- DynamoDB FDW can push down this case
                                     QUERY PLAN                                     
------------------------------------------------------------------------------------
 Foreign Scan on public.ft1_a t1
   Output: t1.c1, t1.c2, t1.c3, t1.c4, t1.c5, t1.c6, t1.c7, t1.c8, t1.spdurl
     Remote SQL: SELECT C_1, c2, c3, c4, c5, c6, c7, c8 FROM T_1 WHERE (c8 = 'foo')
(3 rows)

-- parameterized remote path for foreign table
--Testcase 82:
EXPLAIN (VERBOSE, COSTS OFF)
  SELECT * FROM "S 1"."T 1" a, ft2 b WHERE a."C 1" = 47 AND b.c1 = a.c2;
                                                      QUERY PLAN                                                       
-----------------------------------------------------------------------------------------------------------------------
 Hash Join
   Output: a."C 1", a.c2, a.c3, a.c4, a.c5, a.c6, a.c7, a.c8, b.c1, b.c2, b.c3, b.c4, b.c5, b.c6, b.c7, b.c8, b.spdurl
   Hash Cond: (b.c1 = a.c2)
   ->  Foreign Scan on public.ft2_a b
         Output: b.c1, b.c2, b.c3, b.c4, b.c5, b.c6, b.c7, b.c8, b.spdurl
           Remote SQL: SELECT C_1, c2, c3, c4, c5, c6, c7, c8 FROM T_1
   ->  Hash
         Output: a."C 1", a.c2, a.c3, a.c4, a.c5, a.c6, a.c7, a.c8
         ->  Foreign Scan on "S 1"."T 1" a
               Output: a."C 1", a.c2, a.c3, a.c4, a.c5, a.c6, a.c7, a.c8
               Remote SQL: SELECT C_1, c2, c3, c4, c5, c6, c7, c8 FROM T_1 WHERE (C_1 = 47)
(11 rows)

--Testcase 83:
SELECT * FROM ft2 a, ft2 b WHERE a.c1 = 47 AND b.c1 = a.c2;
 c1 | c2 |  c3   |              c4              |            c5            | c6 |     c7     | c8  | spdurl  | c1 | c2 |  c3   |              c4              |            c5            | c6 |     c7     | c8  | spdurl  
----+----+-------+------------------------------+--------------------------+----+------------+-----+---------+----+----+-------+------------------------------+--------------------------+----+------------+-----+---------
 47 |  7 | 00047 | Tue Feb 17 00:00:00 1970 PST | Tue Feb 17 00:00:00 1970 | 7  | 7          | foo | /node1/ |  7 |  7 | 00007 | Thu Jan 08 00:00:00 1970 PST | Thu Jan 08 00:00:00 1970 | 7  | 7          | foo | /node1/
(1 row)

-- check both safe and unsafe join conditions
--Testcase 84:
EXPLAIN (VERBOSE, COSTS OFF)
  SELECT * FROM ft2 a, ft2 b
  WHERE a.c2 = 6 AND b.c1 = a.c1 AND a.c8 = 'foo' AND b.c7 = upper(a.c7) ORDER BY a.c1;
                                                             QUERY PLAN                                                             
------------------------------------------------------------------------------------------------------------------------------------
 Sort
   Output: a.c1, a.c2, a.c3, a.c4, a.c5, a.c6, a.c7, a.c8, a.spdurl, b.c1, b.c2, b.c3, b.c4, b.c5, b.c6, b.c7, b.c8, b.spdurl
   Sort Key: a.c1
   ->  Hash Join
         Output: a.c1, a.c2, a.c3, a.c4, a.c5, a.c6, a.c7, a.c8, a.spdurl, b.c1, b.c2, b.c3, b.c4, b.c5, b.c6, b.c7, b.c8, b.spdurl
         Hash Cond: ((b.c1 = a.c1) AND ((b.c7)::text = upper((a.c7)::text)))
         ->  Foreign Scan on public.ft2_a b
               Output: b.c1, b.c2, b.c3, b.c4, b.c5, b.c6, b.c7, b.c8, b.spdurl
                 Remote SQL: SELECT C_1, c2, c3, c4, c5, c6, c7, c8 FROM T_1
         ->  Hash
               Output: a.c1, a.c2, a.c3, a.c4, a.c5, a.c6, a.c7, a.c8, a.spdurl
               ->  Foreign Scan on public.ft2_a a
                     Output: a.c1, a.c2, a.c3, a.c4, a.c5, a.c6, a.c7, a.c8, a.spdurl
                       Remote SQL: SELECT C_1, c2, c3, c4, c5, c6, c7, c8 FROM T_1 WHERE (c2 = 6) AND (c8 = 'foo')
(14 rows)

--Testcase 85:
SELECT * FROM ft2 a, ft2 b
WHERE a.c2 = 6 AND b.c1 = a.c1 AND a.c8 = 'foo' AND b.c7 = upper(a.c7) ORDER BY a.c1;
 c1  | c2 |  c3   |              c4              |            c5            | c6 |     c7     | c8  | spdurl  | c1  | c2 |  c3   |              c4              |            c5            | c6 |     c7     | c8  | spdurl  
-----+----+-------+------------------------------+--------------------------+----+------------+-----+---------+-----+----+-------+------------------------------+--------------------------+----+------------+-----+---------
   6 |  6 | 00006 | Wed Jan 07 00:00:00 1970 PST | Wed Jan 07 00:00:00 1970 | 6  | 6          | foo | /node1/ |   6 |  6 | 00006 | Wed Jan 07 00:00:00 1970 PST | Wed Jan 07 00:00:00 1970 | 6  | 6          | foo | /node1/
  16 |  6 | 00016 | Sat Jan 17 00:00:00 1970 PST | Sat Jan 17 00:00:00 1970 | 6  | 6          | foo | /node1/ |  16 |  6 | 00016 | Sat Jan 17 00:00:00 1970 PST | Sat Jan 17 00:00:00 1970 | 6  | 6          | foo | /node1/
  26 |  6 | 00026 | Tue Jan 27 00:00:00 1970 PST | Tue Jan 27 00:00:00 1970 | 6  | 6          | foo | /node1/ |  26 |  6 | 00026 | Tue Jan 27 00:00:00 1970 PST | Tue Jan 27 00:00:00 1970 | 6  | 6          | foo | /node1/
  36 |  6 | 00036 | Fri Feb 06 00:00:00 1970 PST | Fri Feb 06 00:00:00 1970 | 6  | 6          | foo | /node1/ |  36 |  6 | 00036 | Fri Feb 06 00:00:00 1970 PST | Fri Feb 06 00:00:00 1970 | 6  | 6          | foo | /node1/
  46 |  6 | 00046 | Mon Feb 16 00:00:00 1970 PST | Mon Feb 16 00:00:00 1970 | 6  | 6          | foo | /node1/ |  46 |  6 | 00046 | Mon Feb 16 00:00:00 1970 PST | Mon Feb 16 00:00:00 1970 | 6  | 6          | foo | /node1/
  56 |  6 | 00056 | Thu Feb 26 00:00:00 1970 PST | Thu Feb 26 00:00:00 1970 | 6  | 6          | foo | /node1/ |  56 |  6 | 00056 | Thu Feb 26 00:00:00 1970 PST | Thu Feb 26 00:00:00 1970 | 6  | 6          | foo | /node1/
  66 |  6 | 00066 | Sun Mar 08 00:00:00 1970 PST | Sun Mar 08 00:00:00 1970 | 6  | 6          | foo | /node1/ |  66 |  6 | 00066 | Sun Mar 08 00:00:00 1970 PST | Sun Mar 08 00:00:00 1970 | 6  | 6          | foo | /node1/
  76 |  6 | 00076 | Wed Mar 18 00:00:00 1970 PST | Wed Mar 18 00:00:00 1970 | 6  | 6          | foo | /node1/ |  76 |  6 | 00076 | Wed Mar 18 00:00:00 1970 PST | Wed Mar 18 00:00:00 1970 | 6  | 6          | foo | /node1/
  86 |  6 | 00086 | Sat Mar 28 00:00:00 1970 PST | Sat Mar 28 00:00:00 1970 | 6  | 6          | foo | /node1/ |  86 |  6 | 00086 | Sat Mar 28 00:00:00 1970 PST | Sat Mar 28 00:00:00 1970 | 6  | 6          | foo | /node1/
  96 |  6 | 00096 | Tue Apr 07 00:00:00 1970 PST | Tue Apr 07 00:00:00 1970 | 6  | 6          | foo | /node1/ |  96 |  6 | 00096 | Tue Apr 07 00:00:00 1970 PST | Tue Apr 07 00:00:00 1970 | 6  | 6          | foo | /node1/
 106 |  6 | 00106 | Wed Jan 07 00:00:00 1970 PST | Wed Jan 07 00:00:00 1970 | 6  | 6          | foo | /node1/ | 106 |  6 | 00106 | Wed Jan 07 00:00:00 1970 PST | Wed Jan 07 00:00:00 1970 | 6  | 6          | foo | /node1/
 116 |  6 | 00116 | Sat Jan 17 00:00:00 1970 PST | Sat Jan 17 00:00:00 1970 | 6  | 6          | foo | /node1/ | 116 |  6 | 00116 | Sat Jan 17 00:00:00 1970 PST | Sat Jan 17 00:00:00 1970 | 6  | 6          | foo | /node1/
 126 |  6 | 00126 | Tue Jan 27 00:00:00 1970 PST | Tue Jan 27 00:00:00 1970 | 6  | 6          | foo | /node1/ | 126 |  6 | 00126 | Tue Jan 27 00:00:00 1970 PST | Tue Jan 27 00:00:00 1970 | 6  | 6          | foo | /node1/
 136 |  6 | 00136 | Fri Feb 06 00:00:00 1970 PST | Fri Feb 06 00:00:00 1970 | 6  | 6          | foo | /node1/ | 136 |  6 | 00136 | Fri Feb 06 00:00:00 1970 PST | Fri Feb 06 00:00:00 1970 | 6  | 6          | foo | /node1/
 146 |  6 | 00146 | Mon Feb 16 00:00:00 1970 PST | Mon Feb 16 00:00:00 1970 | 6  | 6          | foo | /node1/ | 146 |  6 | 00146 | Mon Feb 16 00:00:00 1970 PST | Mon Feb 16 00:00:00 1970 | 6  | 6          | foo | /node1/
 156 |  6 | 00156 | Thu Feb 26 00:00:00 1970 PST | Thu Feb 26 00:00:00 1970 | 6  | 6          | foo | /node1/ | 156 |  6 | 00156 | Thu Feb 26 00:00:00 1970 PST | Thu Feb 26 00:00:00 1970 | 6  | 6          | foo | /node1/
 166 |  6 | 00166 | Sun Mar 08 00:00:00 1970 PST | Sun Mar 08 00:00:00 1970 | 6  | 6          | foo | /node1/ | 166 |  6 | 00166 | Sun Mar 08 00:00:00 1970 PST | Sun Mar 08 00:00:00 1970 | 6  | 6          | foo | /node1/
 176 |  6 | 00176 | Wed Mar 18 00:00:00 1970 PST | Wed Mar 18 00:00:00 1970 | 6  | 6          | foo | /node1/ | 176 |  6 | 00176 | Wed Mar 18 00:00:00 1970 PST | Wed Mar 18 00:00:00 1970 | 6  | 6          | foo | /node1/
 186 |  6 | 00186 | Sat Mar 28 00:00:00 1970 PST | Sat Mar 28 00:00:00 1970 | 6  | 6          | foo | /node1/ | 186 |  6 | 00186 | Sat Mar 28 00:00:00 1970 PST | Sat Mar 28 00:00:00 1970 | 6  | 6          | foo | /node1/
 196 |  6 | 00196 | Tue Apr 07 00:00:00 1970 PST | Tue Apr 07 00:00:00 1970 | 6  | 6          | foo | /node1/ | 196 |  6 | 00196 | Tue Apr 07 00:00:00 1970 PST | Tue Apr 07 00:00:00 1970 | 6  | 6          | foo | /node1/
 206 |  6 | 00206 | Wed Jan 07 00:00:00 1970 PST | Wed Jan 07 00:00:00 1970 | 6  | 6          | foo | /node1/ | 206 |  6 | 00206 | Wed Jan 07 00:00:00 1970 PST | Wed Jan 07 00:00:00 1970 | 6  | 6          | foo | /node1/
 216 |  6 | 00216 | Sat Jan 17 00:00:00 1970 PST | Sat Jan 17 00:00:00 1970 | 6  | 6          | foo | /node1/ | 216 |  6 | 00216 | Sat Jan 17 00:00:00 1970 PST | Sat Jan 17 00:00:00 1970 | 6  | 6          | foo | /node1/
 226 |  6 | 00226 | Tue Jan 27 00:00:00 1970 PST | Tue Jan 27 00:00:00 1970 | 6  | 6          | foo | /node1/ | 226 |  6 | 00226 | Tue Jan 27 00:00:00 1970 PST | Tue Jan 27 00:00:00 1970 | 6  | 6          | foo | /node1/
 236 |  6 | 00236 | Fri Feb 06 00:00:00 1970 PST | Fri Feb 06 00:00:00 1970 | 6  | 6          | foo | /node1/ | 236 |  6 | 00236 | Fri Feb 06 00:00:00 1970 PST | Fri Feb 06 00:00:00 1970 | 6  | 6          | foo | /node1/
 246 |  6 | 00246 | Mon Feb 16 00:00:00 1970 PST | Mon Feb 16 00:00:00 1970 | 6  | 6          | foo | /node1/ | 246 |  6 | 00246 | Mon Feb 16 00:00:00 1970 PST | Mon Feb 16 00:00:00 1970 | 6  | 6          | foo | /node1/
 256 |  6 | 00256 | Thu Feb 26 00:00:00 1970 PST | Thu Feb 26 00:00:00 1970 | 6  | 6          | foo | /node1/ | 256 |  6 | 00256 | Thu Feb 26 00:00:00 1970 PST | Thu Feb 26 00:00:00 1970 | 6  | 6          | foo | /node1/
 266 |  6 | 00266 | Sun Mar 08 00:00:00 1970 PST | Sun Mar 08 00:00:00 1970 | 6  | 6          | foo | /node1/ | 266 |  6 | 00266 | Sun Mar 08 00:00:00 1970 PST | Sun Mar 08 00:00:00 1970 | 6  | 6          | foo | /node1/
 276 |  6 | 00276 | Wed Mar 18 00:00:00 1970 PST | Wed Mar 18 00:00:00 1970 | 6  | 6          | foo | /node1/ | 276 |  6 | 00276 | Wed Mar 18 00:00:00 1970 PST | Wed Mar 18 00:00:00 1970 | 6  | 6          | foo | /node1/
 286 |  6 | 00286 | Sat Mar 28 00:00:00 1970 PST | Sat Mar 28 00:00:00 1970 | 6  | 6          | foo | /node1/ | 286 |  6 | 00286 | Sat Mar 28 00:00:00 1970 PST | Sat Mar 28 00:00:00 1970 | 6  | 6          | foo | /node1/
 296 |  6 | 00296 | Tue Apr 07 00:00:00 1970 PST | Tue Apr 07 00:00:00 1970 | 6  | 6          | foo | /node1/ | 296 |  6 | 00296 | Tue Apr 07 00:00:00 1970 PST | Tue Apr 07 00:00:00 1970 | 6  | 6          | foo | /node1/
 306 |  6 | 00306 | Wed Jan 07 00:00:00 1970 PST | Wed Jan 07 00:00:00 1970 | 6  | 6          | foo | /node1/ | 306 |  6 | 00306 | Wed Jan 07 00:00:00 1970 PST | Wed Jan 07 00:00:00 1970 | 6  | 6          | foo | /node1/
 316 |  6 | 00316 | Sat Jan 17 00:00:00 1970 PST | Sat Jan 17 00:00:00 1970 | 6  | 6          | foo | /node1/ | 316 |  6 | 00316 | Sat Jan 17 00:00:00 1970 PST | Sat Jan 17 00:00:00 1970 | 6  | 6          | foo | /node1/
 326 |  6 | 00326 | Tue Jan 27 00:00:00 1970 PST | Tue Jan 27 00:00:00 1970 | 6  | 6          | foo | /node1/ | 326 |  6 | 00326 | Tue Jan 27 00:00:00 1970 PST | Tue Jan 27 00:00:00 1970 | 6  | 6          | foo | /node1/
 336 |  6 | 00336 | Fri Feb 06 00:00:00 1970 PST | Fri Feb 06 00:00:00 1970 | 6  | 6          | foo | /node1/ | 336 |  6 | 00336 | Fri Feb 06 00:00:00 1970 PST | Fri Feb 06 00:00:00 1970 | 6  | 6          | foo | /node1/
 346 |  6 | 00346 | Mon Feb 16 00:00:00 1970 PST | Mon Feb 16 00:00:00 1970 | 6  | 6          | foo | /node1/ | 346 |  6 | 00346 | Mon Feb 16 00:00:00 1970 PST | Mon Feb 16 00:00:00 1970 | 6  | 6          | foo | /node1/
 356 |  6 | 00356 | Thu Feb 26 00:00:00 1970 PST | Thu Feb 26 00:00:00 1970 | 6  | 6          | foo | /node1/ | 356 |  6 | 00356 | Thu Feb 26 00:00:00 1970 PST | Thu Feb 26 00:00:00 1970 | 6  | 6          | foo | /node1/
 366 |  6 | 00366 | Sun Mar 08 00:00:00 1970 PST | Sun Mar 08 00:00:00 1970 | 6  | 6          | foo | /node1/ | 366 |  6 | 00366 | Sun Mar 08 00:00:00 1970 PST | Sun Mar 08 00:00:00 1970 | 6  | 6          | foo | /node1/
 376 |  6 | 00376 | Wed Mar 18 00:00:00 1970 PST | Wed Mar 18 00:00:00 1970 | 6  | 6          | foo | /node1/ | 376 |  6 | 00376 | Wed Mar 18 00:00:00 1970 PST | Wed Mar 18 00:00:00 1970 | 6  | 6          | foo | /node1/
 386 |  6 | 00386 | Sat Mar 28 00:00:00 1970 PST | Sat Mar 28 00:00:00 1970 | 6  | 6          | foo | /node1/ | 386 |  6 | 00386 | Sat Mar 28 00:00:00 1970 PST | Sat Mar 28 00:00:00 1970 | 6  | 6          | foo | /node1/
 396 |  6 | 00396 | Tue Apr 07 00:00:00 1970 PST | Tue Apr 07 00:00:00 1970 | 6  | 6          | foo | /node1/ | 396 |  6 | 00396 | Tue Apr 07 00:00:00 1970 PST | Tue Apr 07 00:00:00 1970 | 6  | 6          | foo | /node1/
 406 |  6 | 00406 | Wed Jan 07 00:00:00 1970 PST | Wed Jan 07 00:00:00 1970 | 6  | 6          | foo | /node1/ | 406 |  6 | 00406 | Wed Jan 07 00:00:00 1970 PST | Wed Jan 07 00:00:00 1970 | 6  | 6          | foo | /node1/
 416 |  6 | 00416 | Sat Jan 17 00:00:00 1970 PST | Sat Jan 17 00:00:00 1970 | 6  | 6          | foo | /node1/ | 416 |  6 | 00416 | Sat Jan 17 00:00:00 1970 PST | Sat Jan 17 00:00:00 1970 | 6  | 6          | foo | /node1/
 426 |  6 | 00426 | Tue Jan 27 00:00:00 1970 PST | Tue Jan 27 00:00:00 1970 | 6  | 6          | foo | /node1/ | 426 |  6 | 00426 | Tue Jan 27 00:00:00 1970 PST | Tue Jan 27 00:00:00 1970 | 6  | 6          | foo | /node1/
 436 |  6 | 00436 | Fri Feb 06 00:00:00 1970 PST | Fri Feb 06 00:00:00 1970 | 6  | 6          | foo | /node1/ | 436 |  6 | 00436 | Fri Feb 06 00:00:00 1970 PST | Fri Feb 06 00:00:00 1970 | 6  | 6          | foo | /node1/
 446 |  6 | 00446 | Mon Feb 16 00:00:00 1970 PST | Mon Feb 16 00:00:00 1970 | 6  | 6          | foo | /node1/ | 446 |  6 | 00446 | Mon Feb 16 00:00:00 1970 PST | Mon Feb 16 00:00:00 1970 | 6  | 6          | foo | /node1/
 456 |  6 | 00456 | Thu Feb 26 00:00:00 1970 PST | Thu Feb 26 00:00:00 1970 | 6  | 6          | foo | /node1/ | 456 |  6 | 00456 | Thu Feb 26 00:00:00 1970 PST | Thu Feb 26 00:00:00 1970 | 6  | 6          | foo | /node1/
 466 |  6 | 00466 | Sun Mar 08 00:00:00 1970 PST | Sun Mar 08 00:00:00 1970 | 6  | 6          | foo | /node1/ | 466 |  6 | 00466 | Sun Mar 08 00:00:00 1970 PST | Sun Mar 08 00:00:00 1970 | 6  | 6          | foo | /node1/
 476 |  6 | 00476 | Wed Mar 18 00:00:00 1970 PST | Wed Mar 18 00:00:00 1970 | 6  | 6          | foo | /node1/ | 476 |  6 | 00476 | Wed Mar 18 00:00:00 1970 PST | Wed Mar 18 00:00:00 1970 | 6  | 6          | foo | /node1/
 486 |  6 | 00486 | Sat Mar 28 00:00:00 1970 PST | Sat Mar 28 00:00:00 1970 | 6  | 6          | foo | /node1/ | 486 |  6 | 00486 | Sat Mar 28 00:00:00 1970 PST | Sat Mar 28 00:00:00 1970 | 6  | 6          | foo | /node1/
 496 |  6 | 00496 | Tue Apr 07 00:00:00 1970 PST | Tue Apr 07 00:00:00 1970 | 6  | 6          | foo | /node1/ | 496 |  6 | 00496 | Tue Apr 07 00:00:00 1970 PST | Tue Apr 07 00:00:00 1970 | 6  | 6          | foo | /node1/
 506 |  6 | 00506 | Wed Jan 07 00:00:00 1970 PST | Wed Jan 07 00:00:00 1970 | 6  | 6          | foo | /node1/ | 506 |  6 | 00506 | Wed Jan 07 00:00:00 1970 PST | Wed Jan 07 00:00:00 1970 | 6  | 6          | foo | /node1/
 516 |  6 | 00516 | Sat Jan 17 00:00:00 1970 PST | Sat Jan 17 00:00:00 1970 | 6  | 6          | foo | /node1/ | 516 |  6 | 00516 | Sat Jan 17 00:00:00 1970 PST | Sat Jan 17 00:00:00 1970 | 6  | 6          | foo | /node1/
 526 |  6 | 00526 | Tue Jan 27 00:00:00 1970 PST | Tue Jan 27 00:00:00 1970 | 6  | 6          | foo | /node1/ | 526 |  6 | 00526 | Tue Jan 27 00:00:00 1970 PST | Tue Jan 27 00:00:00 1970 | 6  | 6          | foo | /node1/
 536 |  6 | 00536 | Fri Feb 06 00:00:00 1970 PST | Fri Feb 06 00:00:00 1970 | 6  | 6          | foo | /node1/ | 536 |  6 | 00536 | Fri Feb 06 00:00:00 1970 PST | Fri Feb 06 00:00:00 1970 | 6  | 6          | foo | /node1/
 546 |  6 | 00546 | Mon Feb 16 00:00:00 1970 PST | Mon Feb 16 00:00:00 1970 | 6  | 6          | foo | /node1/ | 546 |  6 | 00546 | Mon Feb 16 00:00:00 1970 PST | Mon Feb 16 00:00:00 1970 | 6  | 6          | foo | /node1/
 556 |  6 | 00556 | Thu Feb 26 00:00:00 1970 PST | Thu Feb 26 00:00:00 1970 | 6  | 6          | foo | /node1/ | 556 |  6 | 00556 | Thu Feb 26 00:00:00 1970 PST | Thu Feb 26 00:00:00 1970 | 6  | 6          | foo | /node1/
 566 |  6 | 00566 | Sun Mar 08 00:00:00 1970 PST | Sun Mar 08 00:00:00 1970 | 6  | 6          | foo | /node1/ | 566 |  6 | 00566 | Sun Mar 08 00:00:00 1970 PST | Sun Mar 08 00:00:00 1970 | 6  | 6          | foo | /node1/
 576 |  6 | 00576 | Wed Mar 18 00:00:00 1970 PST | Wed Mar 18 00:00:00 1970 | 6  | 6          | foo | /node1/ | 576 |  6 | 00576 | Wed Mar 18 00:00:00 1970 PST | Wed Mar 18 00:00:00 1970 | 6  | 6          | foo | /node1/
 586 |  6 | 00586 | Sat Mar 28 00:00:00 1970 PST | Sat Mar 28 00:00:00 1970 | 6  | 6          | foo | /node1/ | 586 |  6 | 00586 | Sat Mar 28 00:00:00 1970 PST | Sat Mar 28 00:00:00 1970 | 6  | 6          | foo | /node1/
 596 |  6 | 00596 | Tue Apr 07 00:00:00 1970 PST | Tue Apr 07 00:00:00 1970 | 6  | 6          | foo | /node1/ | 596 |  6 | 00596 | Tue Apr 07 00:00:00 1970 PST | Tue Apr 07 00:00:00 1970 | 6  | 6          | foo | /node1/
 606 |  6 | 00606 | Wed Jan 07 00:00:00 1970 PST | Wed Jan 07 00:00:00 1970 | 6  | 6          | foo | /node1/ | 606 |  6 | 00606 | Wed Jan 07 00:00:00 1970 PST | Wed Jan 07 00:00:00 1970 | 6  | 6          | foo | /node1/
 616 |  6 | 00616 | Sat Jan 17 00:00:00 1970 PST | Sat Jan 17 00:00:00 1970 | 6  | 6          | foo | /node1/ | 616 |  6 | 00616 | Sat Jan 17 00:00:00 1970 PST | Sat Jan 17 00:00:00 1970 | 6  | 6          | foo | /node1/
 626 |  6 | 00626 | Tue Jan 27 00:00:00 1970 PST | Tue Jan 27 00:00:00 1970 | 6  | 6          | foo | /node1/ | 626 |  6 | 00626 | Tue Jan 27 00:00:00 1970 PST | Tue Jan 27 00:00:00 1970 | 6  | 6          | foo | /node1/
 636 |  6 | 00636 | Fri Feb 06 00:00:00 1970 PST | Fri Feb 06 00:00:00 1970 | 6  | 6          | foo | /node1/ | 636 |  6 | 00636 | Fri Feb 06 00:00:00 1970 PST | Fri Feb 06 00:00:00 1970 | 6  | 6          | foo | /node1/
 646 |  6 | 00646 | Mon Feb 16 00:00:00 1970 PST | Mon Feb 16 00:00:00 1970 | 6  | 6          | foo | /node1/ | 646 |  6 | 00646 | Mon Feb 16 00:00:00 1970 PST | Mon Feb 16 00:00:00 1970 | 6  | 6          | foo | /node1/
 656 |  6 | 00656 | Thu Feb 26 00:00:00 1970 PST | Thu Feb 26 00:00:00 1970 | 6  | 6          | foo | /node1/ | 656 |  6 | 00656 | Thu Feb 26 00:00:00 1970 PST | Thu Feb 26 00:00:00 1970 | 6  | 6          | foo | /node1/
 666 |  6 | 00666 | Sun Mar 08 00:00:00 1970 PST | Sun Mar 08 00:00:00 1970 | 6  | 6          | foo | /node1/ | 666 |  6 | 00666 | Sun Mar 08 00:00:00 1970 PST | Sun Mar 08 00:00:00 1970 | 6  | 6          | foo | /node1/
 676 |  6 | 00676 | Wed Mar 18 00:00:00 1970 PST | Wed Mar 18 00:00:00 1970 | 6  | 6          | foo | /node1/ | 676 |  6 | 00676 | Wed Mar 18 00:00:00 1970 PST | Wed Mar 18 00:00:00 1970 | 6  | 6          | foo | /node1/
 686 |  6 | 00686 | Sat Mar 28 00:00:00 1970 PST | Sat Mar 28 00:00:00 1970 | 6  | 6          | foo | /node1/ | 686 |  6 | 00686 | Sat Mar 28 00:00:00 1970 PST | Sat Mar 28 00:00:00 1970 | 6  | 6          | foo | /node1/
 696 |  6 | 00696 | Tue Apr 07 00:00:00 1970 PST | Tue Apr 07 00:00:00 1970 | 6  | 6          | foo | /node1/ | 696 |  6 | 00696 | Tue Apr 07 00:00:00 1970 PST | Tue Apr 07 00:00:00 1970 | 6  | 6          | foo | /node1/
 706 |  6 | 00706 | Wed Jan 07 00:00:00 1970 PST | Wed Jan 07 00:00:00 1970 | 6  | 6          | foo | /node1/ | 706 |  6 | 00706 | Wed Jan 07 00:00:00 1970 PST | Wed Jan 07 00:00:00 1970 | 6  | 6          | foo | /node1/
 716 |  6 | 00716 | Sat Jan 17 00:00:00 1970 PST | Sat Jan 17 00:00:00 1970 | 6  | 6          | foo | /node1/ | 716 |  6 | 00716 | Sat Jan 17 00:00:00 1970 PST | Sat Jan 17 00:00:00 1970 | 6  | 6          | foo | /node1/
 726 |  6 | 00726 | Tue Jan 27 00:00:00 1970 PST | Tue Jan 27 00:00:00 1970 | 6  | 6          | foo | /node1/ | 726 |  6 | 00726 | Tue Jan 27 00:00:00 1970 PST | Tue Jan 27 00:00:00 1970 | 6  | 6          | foo | /node1/
 736 |  6 | 00736 | Fri Feb 06 00:00:00 1970 PST | Fri Feb 06 00:00:00 1970 | 6  | 6          | foo | /node1/ | 736 |  6 | 00736 | Fri Feb 06 00:00:00 1970 PST | Fri Feb 06 00:00:00 1970 | 6  | 6          | foo | /node1/
 746 |  6 | 00746 | Mon Feb 16 00:00:00 1970 PST | Mon Feb 16 00:00:00 1970 | 6  | 6          | foo | /node1/ | 746 |  6 | 00746 | Mon Feb 16 00:00:00 1970 PST | Mon Feb 16 00:00:00 1970 | 6  | 6          | foo | /node1/
 756 |  6 | 00756 | Thu Feb 26 00:00:00 1970 PST | Thu Feb 26 00:00:00 1970 | 6  | 6          | foo | /node1/ | 756 |  6 | 00756 | Thu Feb 26 00:00:00 1970 PST | Thu Feb 26 00:00:00 1970 | 6  | 6          | foo | /node1/
 766 |  6 | 00766 | Sun Mar 08 00:00:00 1970 PST | Sun Mar 08 00:00:00 1970 | 6  | 6          | foo | /node1/ | 766 |  6 | 00766 | Sun Mar 08 00:00:00 1970 PST | Sun Mar 08 00:00:00 1970 | 6  | 6          | foo | /node1/
 776 |  6 | 00776 | Wed Mar 18 00:00:00 1970 PST | Wed Mar 18 00:00:00 1970 | 6  | 6          | foo | /node1/ | 776 |  6 | 00776 | Wed Mar 18 00:00:00 1970 PST | Wed Mar 18 00:00:00 1970 | 6  | 6          | foo | /node1/
 786 |  6 | 00786 | Sat Mar 28 00:00:00 1970 PST | Sat Mar 28 00:00:00 1970 | 6  | 6          | foo | /node1/ | 786 |  6 | 00786 | Sat Mar 28 00:00:00 1970 PST | Sat Mar 28 00:00:00 1970 | 6  | 6          | foo | /node1/
 796 |  6 | 00796 | Tue Apr 07 00:00:00 1970 PST | Tue Apr 07 00:00:00 1970 | 6  | 6          | foo | /node1/ | 796 |  6 | 00796 | Tue Apr 07 00:00:00 1970 PST | Tue Apr 07 00:00:00 1970 | 6  | 6          | foo | /node1/
 806 |  6 | 00806 | Wed Jan 07 00:00:00 1970 PST | Wed Jan 07 00:00:00 1970 | 6  | 6          | foo | /node1/ | 806 |  6 | 00806 | Wed Jan 07 00:00:00 1970 PST | Wed Jan 07 00:00:00 1970 | 6  | 6          | foo | /node1/
 816 |  6 | 00816 | Sat Jan 17 00:00:00 1970 PST | Sat Jan 17 00:00:00 1970 | 6  | 6          | foo | /node1/ | 816 |  6 | 00816 | Sat Jan 17 00:00:00 1970 PST | Sat Jan 17 00:00:00 1970 | 6  | 6          | foo | /node1/
 826 |  6 | 00826 | Tue Jan 27 00:00:00 1970 PST | Tue Jan 27 00:00:00 1970 | 6  | 6          | foo | /node1/ | 826 |  6 | 00826 | Tue Jan 27 00:00:00 1970 PST | Tue Jan 27 00:00:00 1970 | 6  | 6          | foo | /node1/
 836 |  6 | 00836 | Fri Feb 06 00:00:00 1970 PST | Fri Feb 06 00:00:00 1970 | 6  | 6          | foo | /node1/ | 836 |  6 | 00836 | Fri Feb 06 00:00:00 1970 PST | Fri Feb 06 00:00:00 1970 | 6  | 6          | foo | /node1/
 846 |  6 | 00846 | Mon Feb 16 00:00:00 1970 PST | Mon Feb 16 00:00:00 1970 | 6  | 6          | foo | /node1/ | 846 |  6 | 00846 | Mon Feb 16 00:00:00 1970 PST | Mon Feb 16 00:00:00 1970 | 6  | 6          | foo | /node1/
 856 |  6 | 00856 | Thu Feb 26 00:00:00 1970 PST | Thu Feb 26 00:00:00 1970 | 6  | 6          | foo | /node1/ | 856 |  6 | 00856 | Thu Feb 26 00:00:00 1970 PST | Thu Feb 26 00:00:00 1970 | 6  | 6          | foo | /node1/
 866 |  6 | 00866 | Sun Mar 08 00:00:00 1970 PST | Sun Mar 08 00:00:00 1970 | 6  | 6          | foo | /node1/ | 866 |  6 | 00866 | Sun Mar 08 00:00:00 1970 PST | Sun Mar 08 00:00:00 1970 | 6  | 6          | foo | /node1/
 876 |  6 | 00876 | Wed Mar 18 00:00:00 1970 PST | Wed Mar 18 00:00:00 1970 | 6  | 6          | foo | /node1/ | 876 |  6 | 00876 | Wed Mar 18 00:00:00 1970 PST | Wed Mar 18 00:00:00 1970 | 6  | 6          | foo | /node1/
 886 |  6 | 00886 | Sat Mar 28 00:00:00 1970 PST | Sat Mar 28 00:00:00 1970 | 6  | 6          | foo | /node1/ | 886 |  6 | 00886 | Sat Mar 28 00:00:00 1970 PST | Sat Mar 28 00:00:00 1970 | 6  | 6          | foo | /node1/
 896 |  6 | 00896 | Tue Apr 07 00:00:00 1970 PST | Tue Apr 07 00:00:00 1970 | 6  | 6          | foo | /node1/ | 896 |  6 | 00896 | Tue Apr 07 00:00:00 1970 PST | Tue Apr 07 00:00:00 1970 | 6  | 6          | foo | /node1/
 906 |  6 | 00906 | Wed Jan 07 00:00:00 1970 PST | Wed Jan 07 00:00:00 1970 | 6  | 6          | foo | /node1/ | 906 |  6 | 00906 | Wed Jan 07 00:00:00 1970 PST | Wed Jan 07 00:00:00 1970 | 6  | 6          | foo | /node1/
 916 |  6 | 00916 | Sat Jan 17 00:00:00 1970 PST | Sat Jan 17 00:00:00 1970 | 6  | 6          | foo | /node1/ | 916 |  6 | 00916 | Sat Jan 17 00:00:00 1970 PST | Sat Jan 17 00:00:00 1970 | 6  | 6          | foo | /node1/
 926 |  6 | 00926 | Tue Jan 27 00:00:00 1970 PST | Tue Jan 27 00:00:00 1970 | 6  | 6          | foo | /node1/ | 926 |  6 | 00926 | Tue Jan 27 00:00:00 1970 PST | Tue Jan 27 00:00:00 1970 | 6  | 6          | foo | /node1/
 936 |  6 | 00936 | Fri Feb 06 00:00:00 1970 PST | Fri Feb 06 00:00:00 1970 | 6  | 6          | foo | /node1/ | 936 |  6 | 00936 | Fri Feb 06 00:00:00 1970 PST | Fri Feb 06 00:00:00 1970 | 6  | 6          | foo | /node1/
 946 |  6 | 00946 | Mon Feb 16 00:00:00 1970 PST | Mon Feb 16 00:00:00 1970 | 6  | 6          | foo | /node1/ | 946 |  6 | 00946 | Mon Feb 16 00:00:00 1970 PST | Mon Feb 16 00:00:00 1970 | 6  | 6          | foo | /node1/
 956 |  6 | 00956 | Thu Feb 26 00:00:00 1970 PST | Thu Feb 26 00:00:00 1970 | 6  | 6          | foo | /node1/ | 956 |  6 | 00956 | Thu Feb 26 00:00:00 1970 PST | Thu Feb 26 00:00:00 1970 | 6  | 6          | foo | /node1/
 966 |  6 | 00966 | Sun Mar 08 00:00:00 1970 PST | Sun Mar 08 00:00:00 1970 | 6  | 6          | foo | /node1/ | 966 |  6 | 00966 | Sun Mar 08 00:00:00 1970 PST | Sun Mar 08 00:00:00 1970 | 6  | 6          | foo | /node1/
 976 |  6 | 00976 | Wed Mar 18 00:00:00 1970 PST | Wed Mar 18 00:00:00 1970 | 6  | 6          | foo | /node1/ | 976 |  6 | 00976 | Wed Mar 18 00:00:00 1970 PST | Wed Mar 18 00:00:00 1970 | 6  | 6          | foo | /node1/
 986 |  6 | 00986 | Sat Mar 28 00:00:00 1970 PST | Sat Mar 28 00:00:00 1970 | 6  | 6          | foo | /node1/ | 986 |  6 | 00986 | Sat Mar 28 00:00:00 1970 PST | Sat Mar 28 00:00:00 1970 | 6  | 6          | foo | /node1/
 996 |  6 | 00996 | Tue Apr 07 00:00:00 1970 PST | Tue Apr 07 00:00:00 1970 | 6  | 6          | foo | /node1/ | 996 |  6 | 00996 | Tue Apr 07 00:00:00 1970 PST | Tue Apr 07 00:00:00 1970 | 6  | 6          | foo | /node1/
(100 rows)

-- bug before 9.3.5 due to sloppy handling of remote-estimate parameters
--Testcase 86:
SELECT * FROM ft1 WHERE c1 = ANY (ARRAY(SELECT c1 FROM ft2 WHERE c1 < 5)) ORDER BY c1;
 c1 | c2 |  c3   |              c4              |            c5            | c6 |     c7     | c8  | spdurl  
----+----+-------+------------------------------+--------------------------+----+------------+-----+---------
  1 |  1 | 00001 | Fri Jan 02 00:00:00 1970 PST | Fri Jan 02 00:00:00 1970 | 1  | 1          | foo | /node1/
  2 |  2 | 00002 | Sat Jan 03 00:00:00 1970 PST | Sat Jan 03 00:00:00 1970 | 2  | 2          | foo | /node1/
  3 |  3 | 00003 | Sun Jan 04 00:00:00 1970 PST | Sun Jan 04 00:00:00 1970 | 3  | 3          | foo | /node1/
  4 |  4 | 00004 | Mon Jan 05 00:00:00 1970 PST | Mon Jan 05 00:00:00 1970 | 4  | 4          | foo | /node1/
(4 rows)

--Testcase 87:
SELECT * FROM ft2 WHERE c1 = ANY (ARRAY(SELECT c1 FROM ft1 WHERE c1 < 5)) ORDER BY c1;
 c1 | c2 |  c3   |              c4              |            c5            | c6 |     c7     | c8  | spdurl  
----+----+-------+------------------------------+--------------------------+----+------------+-----+---------
  1 |  1 | 00001 | Fri Jan 02 00:00:00 1970 PST | Fri Jan 02 00:00:00 1970 | 1  | 1          | foo | /node1/
  2 |  2 | 00002 | Sat Jan 03 00:00:00 1970 PST | Sat Jan 03 00:00:00 1970 | 2  | 2          | foo | /node1/
  3 |  3 | 00003 | Sun Jan 04 00:00:00 1970 PST | Sun Jan 04 00:00:00 1970 | 3  | 3          | foo | /node1/
  4 |  4 | 00004 | Mon Jan 05 00:00:00 1970 PST | Mon Jan 05 00:00:00 1970 | 4  | 4          | foo | /node1/
(4 rows)

-- we should not push order by clause with volatile expressions or unsafe
-- collations
--Testcase 88:
EXPLAIN (VERBOSE, COSTS OFF)
	SELECT * FROM ft2 ORDER BY ft2.c1, random();
                                              QUERY PLAN                                              
------------------------------------------------------------------------------------------------------
 Sort
   Output: ft2.c1, ft2.c2, ft2.c3, ft2.c4, ft2.c5, ft2.c6, ft2.c7, ft2.c8, ft2.spdurl, (random())
   Sort Key: ft2.c1, (random())
   ->  Foreign Scan on public.ft2_a ft2
         Output: ft2.c1, ft2.c2, ft2.c3, ft2.c4, ft2.c5, ft2.c6, ft2.c7, ft2.c8, ft2.spdurl, random()
           Remote SQL: SELECT C_1, c2, c3, c4, c5, c6, c7, c8 FROM T_1
(6 rows)

--Testcase 89:
EXPLAIN (VERBOSE, COSTS OFF)
	SELECT * FROM ft2 ORDER BY ft2.c1, ft2.c3 collate "C";
                                               QUERY PLAN                                               
--------------------------------------------------------------------------------------------------------
 Sort
   Output: ft2.c1, ft2.c2, ft2.c3, ft2.c4, ft2.c5, ft2.c6, ft2.c7, ft2.c8, ft2.spdurl, ((ft2.c3)::text)
   Sort Key: ft2.c1, ft2.c3 COLLATE "C"
   ->  Foreign Scan on public.ft2_a ft2
         Output: ft2.c1, ft2.c2, ft2.c3, ft2.c4, ft2.c5, ft2.c6, ft2.c7, ft2.c8, ft2.spdurl, ft2.c3
           Remote SQL: SELECT C_1, c2, c3, c4, c5, c6, c7, c8 FROM T_1
(6 rows)

-- user-defined operator/function
--Testcase 90:
CREATE FUNCTION dynamodb_fdw_abs(int) RETURNS int AS $$
BEGIN
RETURN abs($1);
END
$$ LANGUAGE plpgsql IMMUTABLE;
--Testcase 91:
CREATE OPERATOR === (
    LEFTARG = int,
    RIGHTARG = int,
    PROCEDURE = int4eq,
    COMMUTATOR = ===
);
-- DynamoDB does not support count and abs function => can not push down
--Testcase 92:
EXPLAIN (VERBOSE, COSTS OFF)
  SELECT count(c3) FROM ft1 t1 WHERE t1.c1 = abs(t1.c2);
                    QUERY PLAN                     
---------------------------------------------------
 Aggregate
   Output: count(t1.c3)
   ->  Foreign Scan on public.ft1_a t1
         Output: t1.c3
         Filter: (t1.c1 = abs(t1.c2))
           Remote SQL: SELECT C_1, c2, c3 FROM T_1
(6 rows)

--Testcase 93:
SELECT count(c3) FROM ft1 t1 WHERE t1.c1 = abs(t1.c2);
 count 
-------
     9
(1 row)

--Testcase 94:
EXPLAIN (VERBOSE, COSTS OFF)
  SELECT count(c3) FROM ft1 t1 WHERE t1.c1 = t1.c2;
                        QUERY PLAN                         
-----------------------------------------------------------
 Aggregate
   Output: count(t1.c3)
   ->  Foreign Scan on public.ft1_a t1
         Output: t1.c3
           Remote SQL: SELECT c3 FROM T_1 WHERE (C_1 = c2)
(5 rows)

--Testcase 95:
SELECT count(c3) FROM ft1 t1 WHERE t1.c1 = t1.c2;
 count 
-------
     9
(1 row)

-- by default, user-defined ones cannot
--Testcase 96:
EXPLAIN (VERBOSE, COSTS OFF)
  SELECT count(c3) FROM ft1 t1 WHERE t1.c1 = dynamodb_fdw_abs(t1.c2);
                    QUERY PLAN                     
---------------------------------------------------
 Aggregate
   Output: count(t1.c3)
   ->  Foreign Scan on public.ft1_a t1
         Output: t1.c3
         Filter: (t1.c1 = dynamodb_fdw_abs(t1.c2))
           Remote SQL: SELECT C_1, c2, c3 FROM T_1
(6 rows)

--Testcase 97:
SELECT count(c3) FROM ft1 t1 WHERE t1.c1 = dynamodb_fdw_abs(t1.c2);
 count 
-------
     9
(1 row)

--Testcase 98:
EXPLAIN (VERBOSE, COSTS OFF)
  SELECT count(c3) FROM ft1 t1 WHERE t1.c1 === t1.c2;
                    QUERY PLAN                     
---------------------------------------------------
 Aggregate
   Output: count(t1.c3)
   ->  Foreign Scan on public.ft1_a t1
         Output: t1.c3
         Filter: (t1.c1 === t1.c2)
           Remote SQL: SELECT C_1, c2, c3 FROM T_1
(6 rows)

--Testcase 99:
SELECT count(c3) FROM ft1 t1 WHERE t1.c1 === t1.c2;
 count 
-------
     9
(1 row)

-- DynamoDB FDW does not support push-down ORDER BY
--Testcase 100:
EXPLAIN (VERBOSE, COSTS OFF)
  SELECT * FROM ft1 t1 WHERE t1.c1 === t1.c2 order by t1.c2 limit 1;
                                       QUERY PLAN                                        
-----------------------------------------------------------------------------------------
 Limit
   Output: t1.c1, t1.c2, t1.c3, t1.c4, t1.c5, t1.c6, t1.c7, t1.c8, t1.spdurl
   ->  Sort
         Output: t1.c1, t1.c2, t1.c3, t1.c4, t1.c5, t1.c6, t1.c7, t1.c8, t1.spdurl
         Sort Key: t1.c2
         ->  Foreign Scan on public.ft1_a t1
               Output: t1.c1, t1.c2, t1.c3, t1.c4, t1.c5, t1.c6, t1.c7, t1.c8, t1.spdurl
               Filter: (t1.c1 === t1.c2)
                 Remote SQL: SELECT C_1, c2, c3, c4, c5, c6, c7, c8 FROM T_1
(9 rows)

--Testcase 101:
SELECT * FROM ft1 t1 WHERE t1.c1 === t1.c2 order by t1.c2 limit 1;
 c1 | c2 |  c3   |              c4              |            c5            | c6 |     c7     | c8  | spdurl  
----+----+-------+------------------------------+--------------------------+----+------------+-----+---------
  1 |  1 | 00001 | Fri Jan 02 00:00:00 1970 PST | Fri Jan 02 00:00:00 1970 | 1  | 1          | foo | /node1/
(1 row)

-- but let's put them in an extension ...
ALTER EXTENSION dynamodb_fdw ADD FUNCTION dynamodb_fdw_abs(int);
ALTER EXTENSION dynamodb_fdw ADD OPERATOR === (int, int);
-- ALTER SERVER dynamodb_server OPTIONS (ADD extensions 'dynamodb_fdw');
-- ... they can not be shipped because DynamoDB does not support it.
--Testcase 102:
EXPLAIN (VERBOSE, COSTS OFF)
  SELECT count(c3) FROM ft1 t1 WHERE t1.c1 = dynamodb_fdw_abs(t1.c2);
                    QUERY PLAN                     
---------------------------------------------------
 Aggregate
   Output: count(t1.c3)
   ->  Foreign Scan on public.ft1_a t1
         Output: t1.c3
         Filter: (t1.c1 = dynamodb_fdw_abs(t1.c2))
           Remote SQL: SELECT C_1, c2, c3 FROM T_1
(6 rows)

--Testcase 103:
SELECT count(c3) FROM ft1 t1 WHERE t1.c1 = dynamodb_fdw_abs(t1.c2);
 count 
-------
     9
(1 row)

--Testcase 104:
EXPLAIN (VERBOSE, COSTS OFF)
  SELECT count(c3) FROM ft1 t1 WHERE t1.c1 === t1.c2;
                    QUERY PLAN                     
---------------------------------------------------
 Aggregate
   Output: count(t1.c3)
   ->  Foreign Scan on public.ft1_a t1
         Output: t1.c3
         Filter: (t1.c1 === t1.c2)
           Remote SQL: SELECT C_1, c2, c3 FROM T_1
(6 rows)

--Testcase 105:
SELECT count(c3) FROM ft1 t1 WHERE t1.c1 === t1.c2;
 count 
-------
     9
(1 row)

-- and both ORDER BY and LIMIT can not be shipped
--Testcase 106:
EXPLAIN (VERBOSE, COSTS OFF)
  SELECT * FROM ft1 t1 WHERE t1.c1 === t1.c2 order by t1.c2 limit 1;
                                       QUERY PLAN                                        
-----------------------------------------------------------------------------------------
 Limit
   Output: t1.c1, t1.c2, t1.c3, t1.c4, t1.c5, t1.c6, t1.c7, t1.c8, t1.spdurl
   ->  Sort
         Output: t1.c1, t1.c2, t1.c3, t1.c4, t1.c5, t1.c6, t1.c7, t1.c8, t1.spdurl
         Sort Key: t1.c2
         ->  Foreign Scan on public.ft1_a t1
               Output: t1.c1, t1.c2, t1.c3, t1.c4, t1.c5, t1.c6, t1.c7, t1.c8, t1.spdurl
               Filter: (t1.c1 === t1.c2)
                 Remote SQL: SELECT C_1, c2, c3, c4, c5, c6, c7, c8 FROM T_1
(9 rows)

--Testcase 107:
SELECT * FROM ft1 t1 WHERE t1.c1 === t1.c2 order by t1.c2 limit 1;
 c1 | c2 |  c3   |              c4              |            c5            | c6 |     c7     | c8  | spdurl  
----+----+-------+------------------------------+--------------------------+----+------------+-----+---------
  1 |  1 | 00001 | Fri Jan 02 00:00:00 1970 PST | Fri Jan 02 00:00:00 1970 | 1  | 1          | foo | /node1/
(1 row)

-- ===================================================================
-- JOIN queries
-- ===================================================================
-- Analyze ft4 and ft5 so that we have better statistics. These tables do not
-- have use_remote_estimate set.
-- ANALYZE ft4;
-- ANALYZE ft5;
-- DynamoDB does not support JOIN => not push down
-- join two tables
--Testcase 108:
EXPLAIN (VERBOSE, COSTS OFF)
SELECT t1.c1, t2.c1 FROM ft1 t1 JOIN ft2 t2 ON (t1.c1 = t2.c1) ORDER BY t1.c3, t1.c1 OFFSET 100 LIMIT 10;
                              QUERY PLAN                               
-----------------------------------------------------------------------
 Limit
   Output: t1.c1, t2.c1, t1.c3
   ->  Nested Loop
         Output: t1.c1, t2.c1, t1.c3
         Join Filter: (t1.c1 = t2.c1)
         ->  Gather Merge
               Output: t1.c1, t1.c3
               Workers Planned: 1
               ->  Sort
                     Output: t1.c1, t1.c3
                     Sort Key: t1.c3, t1.c1
                     ->  Parallel Append
                           ->  Foreign Scan on public.ft1_a t1_1
                                 Output: t1_1.c1, t1_1.c3
                                   Remote SQL: SELECT C_1, c3 FROM T_1
         ->  Materialize
               Output: t2.c1
               ->  Foreign Scan on public.ft2_a t2
                     Output: t2.c1
                       Remote SQL: SELECT C_1 FROM T_1
(20 rows)

--Testcase 109:
SELECT t1.c1, t2.c1 FROM ft1 t1 JOIN ft2 t2 ON (t1.c1 = t2.c1) ORDER BY t1.c3, t1.c1 OFFSET 100 LIMIT 10;
 c1  | c1  
-----+-----
 101 | 101
 102 | 102
 103 | 103
 104 | 104
 105 | 105
 106 | 106
 107 | 107
 108 | 108
 109 | 109
 110 | 110
(10 rows)

-- join three tables
--Testcase 110:
EXPLAIN (VERBOSE, COSTS OFF)
SELECT t1.c1, t2.c2, t3.c3 FROM ft1 t1 JOIN ft2 t2 ON (t1.c1 = t2.c1) JOIN ft4 t3 ON (t3.c1 = t1.c1) ORDER BY t1.c3, t1.c1 OFFSET 10 LIMIT 10;
                                 QUERY PLAN                                  
-----------------------------------------------------------------------------
 Limit
   Output: t1.c1, t2.c2, t3.c3, t1.c3
   ->  Nested Loop
         Output: t1.c1, t2.c2, t3.c3, t1.c3
         Join Filter: (t1.c1 = t3.c1)
         ->  Nested Loop
               Output: t1.c1, t1.c3, t2.c2, t2.c1
               Join Filter: (t1.c1 = t2.c1)
               ->  Gather Merge
                     Output: t1.c1, t1.c3
                     Workers Planned: 1
                     ->  Sort
                           Output: t1.c1, t1.c3
                           Sort Key: t1.c3, t1.c1
                           ->  Parallel Append
                                 ->  Foreign Scan on public.ft1_a t1_1
                                       Output: t1_1.c1, t1_1.c3
                                         Remote SQL: SELECT C_1, c3 FROM T_1
               ->  Materialize
                     Output: t2.c2, t2.c1
                     ->  Foreign Scan on public.ft2_a t2
                           Output: t2.c2, t2.c1
                             Remote SQL: SELECT C_1, c2 FROM T_1
         ->  Materialize
               Output: t3.c3, t3.c1
               ->  Foreign Scan on public.ft4_a t3
                     Output: t3.c3, t3.c1
                       Remote SQL: SELECT c1, c3 FROM T_3
(28 rows)

--Testcase 111:
SELECT t1.c1, t2.c2, t3.c3 FROM ft1 t1 JOIN ft2 t2 ON (t1.c1 = t2.c1) JOIN ft4 t3 ON (t3.c1 = t1.c1) ORDER BY t1.c3, t1.c1 OFFSET 10 LIMIT 10;
 c1 | c2 |   c3   
----+----+--------
 22 |  2 | AAA022
 24 |  4 | AAA024
 26 |  6 | AAA026
 28 |  8 | AAA028
 30 |  0 | AAA030
 32 |  2 | AAA032
 34 |  4 | AAA034
 36 |  6 | AAA036
 38 |  8 | AAA038
 40 |  0 | AAA040
(10 rows)

-- left outer join
--Testcase 112:
EXPLAIN (VERBOSE, COSTS OFF)
SELECT t1.c1, t2.c1 FROM ft4 t1 LEFT JOIN ft5 t2 ON (t1.c1 = t2.c1) ORDER BY t1.c1, t2.c1 OFFSET 10 LIMIT 10;
                         QUERY PLAN                         
------------------------------------------------------------
 Limit
   Output: t1.c1, t2.c1
   ->  Incremental Sort
         Output: t1.c1, t2.c1
         Sort Key: t1.c1, t2.c1
         Presorted Key: t1.c1
         ->  Merge Left Join
               Output: t1.c1, t2.c1
               Merge Cond: (t1.c1 = t2.c1)
               ->  Sort
                     Output: t1.c1
                     Sort Key: t1.c1
                     ->  Foreign Scan on public.ft4_a t1
                           Output: t1.c1
                             Remote SQL: SELECT c1 FROM T_3
               ->  Sort
                     Output: t2.c1
                     Sort Key: t2.c1
                     ->  Foreign Scan on public.ft5_a t2
                           Output: t2.c1
                             Remote SQL: SELECT c1 FROM T_4
(21 rows)

--Testcase 113:
SELECT t1.c1, t2.c1 FROM ft4 t1 LEFT JOIN ft5 t2 ON (t1.c1 = t2.c1) ORDER BY t1.c1, t2.c1 OFFSET 10 LIMIT 10;
 c1 | c1 
----+----
 22 |   
 24 | 24
 26 |   
 28 |   
 30 | 30
 32 |   
 34 |   
 36 | 36
 38 |   
 40 |   
(10 rows)

-- left outer join three tables
--Testcase 114:
EXPLAIN (VERBOSE, COSTS OFF)
SELECT t1.c1, t2.c2, t3.c3 FROM ft2 t1 LEFT JOIN ft2 t2 ON (t1.c1 = t2.c1) LEFT JOIN ft4 t3 ON (t2.c1 = t3.c1) ORDER BY t1.c1 OFFSET 10 LIMIT 10;
                           QUERY PLAN                            
-----------------------------------------------------------------
 Limit
   Output: t1.c1, t2.c2, t3.c3
   ->  Nested Loop Left Join
         Output: t1.c1, t2.c2, t3.c3
         Join Filter: (t2.c1 = t3.c1)
         ->  Merge Left Join
               Output: t1.c1, t2.c2, t2.c1
               Merge Cond: (t1.c1 = t2.c1)
               ->  Sort
                     Output: t1.c1
                     Sort Key: t1.c1
                     ->  Foreign Scan on public.ft2_a t1
                           Output: t1.c1
                             Remote SQL: SELECT C_1 FROM T_1
               ->  Sort
                     Output: t2.c2, t2.c1
                     Sort Key: t2.c1
                     ->  Foreign Scan on public.ft2_a t2
                           Output: t2.c2, t2.c1
                             Remote SQL: SELECT C_1, c2 FROM T_1
         ->  Materialize
               Output: t3.c3, t3.c1
               ->  Foreign Scan on public.ft4_a t3
                     Output: t3.c3, t3.c1
                       Remote SQL: SELECT c1, c3 FROM T_3
(25 rows)

--Testcase 115:
SELECT t1.c1, t2.c2, t3.c3 FROM ft2 t1 LEFT JOIN ft2 t2 ON (t1.c1 = t2.c1) LEFT JOIN ft4 t3 ON (t2.c1 = t3.c1) ORDER BY t1.c1 OFFSET 10 LIMIT 10;
 c1 | c2 |   c3   
----+----+--------
 11 |  1 | 
 12 |  2 | AAA012
 13 |  3 | 
 14 |  4 | AAA014
 15 |  5 | 
 16 |  6 | AAA016
 17 |  7 | 
 18 |  8 | AAA018
 19 |  9 | 
 20 |  0 | AAA020
(10 rows)

-- left outer join + placement of clauses.
-- clauses within the nullable side are not pulled up, but top level clause on
-- non-nullable side is pushed into non-nullable side
--Testcase 116:
EXPLAIN (VERBOSE, COSTS OFF)
SELECT t1.c1, t1.c2, t2.c1, t2.c2 FROM ft4 t1 LEFT JOIN (SELECT * FROM ft5 WHERE c1 < 10) t2 ON (t1.c1 = t2.c1) WHERE t1.c1 < 10;
                             QUERY PLAN                             
--------------------------------------------------------------------
 Merge Left Join
   Output: t1.c1, t1.c2, ft5.c1, ft5.c2
   Merge Cond: (t1.c1 = ft5.c1)
   ->  Sort
         Output: t1.c1, t1.c2
         Sort Key: t1.c1
         ->  Foreign Scan on public.ft4_a t1
               Output: t1.c1, t1.c2
                 Remote SQL: SELECT c1, c2 FROM T_3 WHERE (c1 < 10)
   ->  Sort
         Output: ft5.c1, ft5.c2
         Sort Key: ft5.c1
         ->  Foreign Scan on public.ft5_a ft5
               Output: ft5.c1, ft5.c2
                 Remote SQL: SELECT c1, c2 FROM T_4 WHERE (c1 < 10)
(15 rows)

--Testcase 117:
SELECT t1.c1, t1.c2, t2.c1, t2.c2 FROM ft4 t1 LEFT JOIN (SELECT * FROM ft5 WHERE c1 < 10) t2 ON (t1.c1 = t2.c1) WHERE t1.c1 < 10;
 c1 | c2 | c1 | c2 
----+----+----+----
  2 |  3 |    |   
  4 |  5 |    |   
  6 |  7 |  6 |  7
  8 |  9 |    |   
(4 rows)

-- clauses within the nullable side are not pulled up, but the top level clause
-- on nullable side is not pushed down into nullable side
--Testcase 118:
EXPLAIN (VERBOSE, COSTS OFF)
SELECT t1.c1, t1.c2, t2.c1, t2.c2 FROM ft4 t1 LEFT JOIN (SELECT * FROM ft5 WHERE c1 < 10) t2 ON (t1.c1 = t2.c1)
			WHERE (t2.c1 < 10 OR t2.c1 IS NULL) AND t1.c1 < 10;
                             QUERY PLAN                             
--------------------------------------------------------------------
 Merge Left Join
   Output: t1.c1, t1.c2, ft5.c1, ft5.c2
   Merge Cond: (t1.c1 = ft5.c1)
   Filter: ((ft5.c1 < 10) OR (ft5.c1 IS NULL))
   ->  Sort
         Output: t1.c1, t1.c2
         Sort Key: t1.c1
         ->  Foreign Scan on public.ft4_a t1
               Output: t1.c1, t1.c2
                 Remote SQL: SELECT c1, c2 FROM T_3 WHERE (c1 < 10)
   ->  Sort
         Output: ft5.c1, ft5.c2
         Sort Key: ft5.c1
         ->  Foreign Scan on public.ft5_a ft5
               Output: ft5.c1, ft5.c2
                 Remote SQL: SELECT c1, c2 FROM T_4 WHERE (c1 < 10)
(16 rows)

--Testcase 119:
SELECT t1.c1, t1.c2, t2.c1, t2.c2 FROM ft4 t1 LEFT JOIN (SELECT * FROM ft5 WHERE c1 < 10) t2 ON (t1.c1 = t2.c1)
			WHERE (t2.c1 < 10 OR t2.c1 IS NULL) AND t1.c1 < 10;
 c1 | c2 | c1 | c2 
----+----+----+----
  2 |  3 |    |   
  4 |  5 |    |   
  6 |  7 |  6 |  7
  8 |  9 |    |   
(4 rows)

-- right outer join
--Testcase 120:
EXPLAIN (VERBOSE, COSTS OFF)
SELECT t1.c1, t2.c1 FROM ft5 t1 RIGHT JOIN ft4 t2 ON (t1.c1 = t2.c1) ORDER BY t2.c1, t1.c1 OFFSET 10 LIMIT 10;
                         QUERY PLAN                         
------------------------------------------------------------
 Limit
   Output: t1.c1, t2.c1
   ->  Incremental Sort
         Output: t1.c1, t2.c1
         Sort Key: t2.c1, t1.c1
         Presorted Key: t2.c1
         ->  Merge Left Join
               Output: t1.c1, t2.c1
               Merge Cond: (t2.c1 = t1.c1)
               ->  Sort
                     Output: t2.c1
                     Sort Key: t2.c1
                     ->  Foreign Scan on public.ft4_a t2
                           Output: t2.c1
                             Remote SQL: SELECT c1 FROM T_3
               ->  Sort
                     Output: t1.c1
                     Sort Key: t1.c1
                     ->  Foreign Scan on public.ft5_a t1
                           Output: t1.c1
                             Remote SQL: SELECT c1 FROM T_4
(21 rows)

--Testcase 121:
SELECT t1.c1, t2.c1 FROM ft5 t1 RIGHT JOIN ft4 t2 ON (t1.c1 = t2.c1) ORDER BY t2.c1, t1.c1 OFFSET 10 LIMIT 10;
 c1 | c1 
----+----
    | 22
 24 | 24
    | 26
    | 28
 30 | 30
    | 32
    | 34
 36 | 36
    | 38
    | 40
(10 rows)

-- right outer join three tables
--Testcase 122:
EXPLAIN (VERBOSE, COSTS OFF)
SELECT t1.c1, t2.c2, t3.c3 FROM ft2 t1 RIGHT JOIN ft2 t2 ON (t1.c1 = t2.c1) RIGHT JOIN ft4 t3 ON (t2.c1 = t3.c1) OFFSET 10 LIMIT 10;
                           QUERY PLAN                            
-----------------------------------------------------------------
 Limit
   Output: t1.c1, t2.c2, t3.c3
   ->  Nested Loop Left Join
         Output: t1.c1, t2.c2, t3.c3
         Join Filter: (t1.c1 = t2.c1)
         ->  Nested Loop Left Join
               Output: t3.c3, t2.c2, t2.c1
               Join Filter: (t2.c1 = t3.c1)
               ->  Foreign Scan on public.ft4_a t3
                     Output: t3.c3, t3.c1
                       Remote SQL: SELECT c1, c3 FROM T_3
               ->  Materialize
                     Output: t2.c2, t2.c1
                     ->  Foreign Scan on public.ft2_a t2
                           Output: t2.c2, t2.c1
                             Remote SQL: SELECT C_1, c2 FROM T_1
         ->  Materialize
               Output: t1.c1
               ->  Foreign Scan on public.ft2_a t1
                     Output: t1.c1
                       Remote SQL: SELECT C_1 FROM T_1
(21 rows)

--Testcase 123:
SELECT t1.c1, t2.c2, t3.c3 FROM ft2 t1 RIGHT JOIN ft2 t2 ON (t1.c1 = t2.c1) RIGHT JOIN ft4 t3 ON (t2.c1 = t3.c1) ORDER BY 1 OFFSET 10 LIMIT 10;
 c1 | c2 |   c3   
----+----+--------
 22 |  2 | AAA022
 24 |  4 | AAA024
 26 |  6 | AAA026
 28 |  8 | AAA028
 30 |  0 | AAA030
 32 |  2 | AAA032
 34 |  4 | AAA034
 36 |  6 | AAA036
 38 |  8 | AAA038
 40 |  0 | AAA040
(10 rows)

-- full outer join
--Testcase 124:
EXPLAIN (VERBOSE, COSTS OFF)
SELECT t1.c1, t2.c1 FROM ft4 t1 FULL JOIN ft5 t2 ON (t1.c1 = t2.c1) ORDER BY t1.c1, t2.c1 OFFSET 45 LIMIT 10;
                         QUERY PLAN                         
------------------------------------------------------------
 Limit
   Output: t1.c1, t2.c1
   ->  Sort
         Output: t1.c1, t2.c1
         Sort Key: t1.c1, t2.c1
         ->  Merge Full Join
               Output: t1.c1, t2.c1
               Merge Cond: (t1.c1 = t2.c1)
               ->  Sort
                     Output: t1.c1
                     Sort Key: t1.c1
                     ->  Foreign Scan on public.ft4_a t1
                           Output: t1.c1
                             Remote SQL: SELECT c1 FROM T_3
               ->  Sort
                     Output: t2.c1
                     Sort Key: t2.c1
                     ->  Foreign Scan on public.ft5_a t2
                           Output: t2.c1
                             Remote SQL: SELECT c1 FROM T_4
(20 rows)

--Testcase 125:
SELECT t1.c1, t2.c1 FROM ft4 t1 FULL JOIN ft5 t2 ON (t1.c1 = t2.c1) ORDER BY t1.c1, t2.c1 OFFSET 45 LIMIT 10;
 c1  | c1 
-----+----
  92 |   
  94 |   
  96 | 96
  98 |   
 100 |   
     |  3
     |  9
     | 15
     | 21
     | 27
(10 rows)

-- full outer join with restrictions on the joining relations
-- a. the joining relations are both base relations
--Testcase 126:
EXPLAIN (VERBOSE, COSTS OFF)
SELECT t1.c1, t2.c1 FROM (SELECT c1 FROM ft4 WHERE c1 between 50 and 60) t1 FULL JOIN (SELECT c1 FROM ft5 WHERE c1 between 50 and 60) t2 ON (t1.c1 = t2.c1) ORDER BY t1.c1, t2.c1;
                                      QUERY PLAN                                      
--------------------------------------------------------------------------------------
 Sort
   Output: ft4.c1, ft5.c1
   Sort Key: ft4.c1, ft5.c1
   ->  Hash Full Join
         Output: ft4.c1, ft5.c1
         Hash Cond: (ft4.c1 = ft5.c1)
         ->  Foreign Scan on public.ft4_a ft4
               Output: ft4.c1
                 Remote SQL: SELECT c1 FROM T_3 WHERE (c1 >= 50) AND (c1 <= 60)
         ->  Hash
               Output: ft5.c1
               ->  Foreign Scan on public.ft5_a ft5
                     Output: ft5.c1
                       Remote SQL: SELECT c1 FROM T_4 WHERE (c1 >= 50) AND (c1 <= 60)
(14 rows)

--Testcase 127:
SELECT t1.c1, t2.c1 FROM (SELECT c1 FROM ft4 WHERE c1 between 50 and 60) t1 FULL JOIN (SELECT c1 FROM ft5 WHERE c1 between 50 and 60) t2 ON (t1.c1 = t2.c1) ORDER BY t1.c1, t2.c1;
 c1 | c1 
----+----
 50 |   
 52 |   
 54 | 54
 56 |   
 58 |   
 60 | 60
    | 51
    | 57
(8 rows)

--Testcase 128:
EXPLAIN (VERBOSE, COSTS OFF)
SELECT 1 FROM (SELECT c1 FROM ft4 WHERE c1 between 50 and 60) t1 FULL JOIN (SELECT c1 FROM ft5 WHERE c1 between 50 and 60) t2 ON (TRUE) OFFSET 10 LIMIT 10;
                                     QUERY PLAN                                      
-------------------------------------------------------------------------------------
 Limit
   Output: 1
   ->  Merge Full Join
         Output: 1
         ->  Foreign Scan on public.ft4_a ft4
                 Remote SQL: SELECT * FROM T_3 WHERE (c1 >= 50) AND (c1 <= 60)
         ->  Materialize
               ->  Foreign Scan on public.ft5_a ft5
                       Remote SQL: SELECT * FROM T_4 WHERE (c1 >= 50) AND (c1 <= 60)
(9 rows)

--Testcase 129:
SELECT 1 FROM (SELECT c1 FROM ft4 WHERE c1 between 50 and 60) t1 FULL JOIN (SELECT c1 FROM ft5 WHERE c1 between 50 and 60) t2 ON (TRUE) OFFSET 10 LIMIT 10;
 ?column? 
----------
        1
        1
        1
        1
        1
        1
        1
        1
        1
        1
(10 rows)

-- b. one of the joining relations is a base relation and the other is a join
-- relation
--Testcase 130:
EXPLAIN (VERBOSE, COSTS OFF)
SELECT t1.c1, ss.a, ss.b FROM (SELECT c1 FROM ft4 WHERE c1 between 50 and 60) t1 FULL JOIN (SELECT t2.c1, t3.c1 FROM ft4 t2 LEFT JOIN ft5 t3 ON (t2.c1 = t3.c1) WHERE (t2.c1 between 50 and 60)) ss(a, b) ON (t1.c1 = ss.a) ORDER BY t1.c1, ss.a, ss.b;
                                         QUERY PLAN                                         
--------------------------------------------------------------------------------------------
 Sort
   Output: ft4.c1, t2.c1, t3.c1
   Sort Key: ft4.c1, t2.c1, t3.c1
   ->  Hash Full Join
         Output: ft4.c1, t2.c1, t3.c1
         Hash Cond: (t2.c1 = ft4.c1)
         ->  Hash Right Join
               Output: t2.c1, t3.c1
               Hash Cond: (t3.c1 = t2.c1)
               ->  Foreign Scan on public.ft5_a t3
                     Output: t3.c1
                       Remote SQL: SELECT c1 FROM T_4
               ->  Hash
                     Output: t2.c1
                     ->  Foreign Scan on public.ft4_a t2
                           Output: t2.c1
                             Remote SQL: SELECT c1 FROM T_3 WHERE (c1 >= 50) AND (c1 <= 60)
         ->  Hash
               Output: ft4.c1
               ->  Foreign Scan on public.ft4_a ft4
                     Output: ft4.c1
                       Remote SQL: SELECT c1 FROM T_3 WHERE (c1 >= 50) AND (c1 <= 60)
(22 rows)

--Testcase 131:
SELECT t1.c1, ss.a, ss.b FROM (SELECT c1 FROM ft4 WHERE c1 between 50 and 60) t1 FULL JOIN (SELECT t2.c1, t3.c1 FROM ft4 t2 LEFT JOIN ft5 t3 ON (t2.c1 = t3.c1) WHERE (t2.c1 between 50 and 60)) ss(a, b) ON (t1.c1 = ss.a) ORDER BY t1.c1, ss.a, ss.b;
 c1 | a  | b  
----+----+----
 50 | 50 |   
 52 | 52 |   
 54 | 54 | 54
 56 | 56 |   
 58 | 58 |   
 60 | 60 | 60
(6 rows)

-- c. test deparsing the remote query as nested subqueries
--Testcase 132:
EXPLAIN (VERBOSE, COSTS OFF)
SELECT t1.c1, ss.a, ss.b FROM (SELECT c1 FROM ft4 WHERE c1 between 50 and 60) t1 FULL JOIN (SELECT t2.c1, t3.c1 FROM (SELECT c1 FROM ft4 WHERE c1 between 50 and 60) t2 FULL JOIN (SELECT c1 FROM ft5 WHERE c1 between 50 and 60) t3 ON (t2.c1 = t3.c1) WHERE t2.c1 IS NULL OR t2.c1 IS NOT NULL) ss(a, b) ON (t1.c1 = ss.a) ORDER BY t1.c1, ss.a, ss.b;
                                         QUERY PLAN                                         
--------------------------------------------------------------------------------------------
 Sort
   Output: ft4.c1, ft4_1.c1, ft5.c1
   Sort Key: ft4.c1, ft4_1.c1, ft5.c1
   ->  Hash Full Join
         Output: ft4.c1, ft4_1.c1, ft5.c1
         Hash Cond: (ft4_1.c1 = ft4.c1)
         ->  Hash Full Join
               Output: ft4_1.c1, ft5.c1
               Hash Cond: (ft4_1.c1 = ft5.c1)
               Filter: ((ft4_1.c1 IS NULL) OR (ft4_1.c1 IS NOT NULL))
               ->  Foreign Scan on public.ft4_a ft4_1
                     Output: ft4_1.c1
                       Remote SQL: SELECT c1 FROM T_3 WHERE (c1 >= 50) AND (c1 <= 60)
               ->  Hash
                     Output: ft5.c1
                     ->  Foreign Scan on public.ft5_a ft5
                           Output: ft5.c1
                             Remote SQL: SELECT c1 FROM T_4 WHERE (c1 >= 50) AND (c1 <= 60)
         ->  Hash
               Output: ft4.c1
               ->  Foreign Scan on public.ft4_a ft4
                     Output: ft4.c1
                       Remote SQL: SELECT c1 FROM T_3 WHERE (c1 >= 50) AND (c1 <= 60)
(23 rows)

--Testcase 133:
SELECT t1.c1, ss.a, ss.b FROM (SELECT c1 FROM ft4 WHERE c1 between 50 and 60) t1 FULL JOIN (SELECT t2.c1, t3.c1 FROM (SELECT c1 FROM ft4 WHERE c1 between 50 and 60) t2 FULL JOIN (SELECT c1 FROM ft5 WHERE c1 between 50 and 60) t3 ON (t2.c1 = t3.c1) WHERE t2.c1 IS NULL OR t2.c1 IS NOT NULL) ss(a, b) ON (t1.c1 = ss.a) ORDER BY t1.c1, ss.a, ss.b;
 c1 | a  | b  
----+----+----
 50 | 50 |   
 52 | 52 |   
 54 | 54 | 54
 56 | 56 |   
 58 | 58 |   
 60 | 60 | 60
    |    | 51
    |    | 57
(8 rows)

-- d. test deparsing rowmarked relations as subqueries
--Testcase 134:
EXPLAIN (VERBOSE, COSTS OFF)
SELECT t1.c1, ss.a, ss.b FROM (SELECT c1 FROM "S 1"."T 3" WHERE c1 = 50) t1 INNER JOIN (SELECT t2.c1, t3.c1 FROM (SELECT c1 FROM ft4 WHERE c1 between 50 and 60) t2 FULL JOIN (SELECT c1 FROM ft5 WHERE c1 between 50 and 60) t3 ON (t2.c1 = t3.c1) WHERE t2.c1 IS NULL OR t2.c1 IS NOT NULL) ss(a, b) ON (TRUE) ORDER BY t1.c1, ss.a, ss.b FOR UPDATE OF t1;
                                                               QUERY PLAN                                                                
-----------------------------------------------------------------------------------------------------------------------------------------
 LockRows
   Output: "T 3".c1, ft4.c1, ft5.c1, "T 3".*, ft4.ctid, ft5.ctid, ((ft4.*)::ft4), ft4.tableoid, ((ft5.*)::ft5), ft5.tableoid
   ->  Sort
         Output: "T 3".c1, ft4.c1, ft5.c1, "T 3".*, ft4.ctid, ft5.ctid, ((ft4.*)::ft4), ft4.tableoid, ((ft5.*)::ft5), ft5.tableoid
         Sort Key: ft4.c1, ft5.c1
         ->  Nested Loop
               Output: "T 3".c1, ft4.c1, ft5.c1, "T 3".*, ft4.ctid, ft5.ctid, ((ft4.*)::ft4), ft4.tableoid, ((ft5.*)::ft5), ft5.tableoid
               ->  Hash Full Join
                     Output: ft4.c1, ft4.ctid, ((ft4.*)::ft4), ft4.tableoid, ft5.c1, ft5.ctid, ((ft5.*)::ft5), ft5.tableoid
                     Hash Cond: (ft4.c1 = ft5.c1)
                     Filter: ((ft4.c1 IS NULL) OR (ft4.c1 IS NOT NULL))
                     ->  Foreign Scan on public.ft4_a ft4
                           Output: ft4.c1, ft4.ctid, ft4.*, ft4.tableoid
                             Remote SQL: SELECT c1, c2, c3 FROM T_3 WHERE (c1 >= 50) AND (c1 <= 60)
                     ->  Hash
                           Output: ft5.c1, ft5.ctid, ((ft5.*)::ft5), ft5.tableoid
                           ->  Foreign Scan on public.ft5_a ft5
                                 Output: ft5.c1, ft5.ctid, ft5.*, ft5.tableoid
                                   Remote SQL: SELECT c1, c2, c3 FROM T_4 WHERE (c1 >= 50) AND (c1 <= 60)
               ->  Materialize
                     Output: "T 3".c1, "T 3".*
                     ->  Foreign Scan on "S 1"."T 3"
                           Output: "T 3".c1, "T 3".*
                           Remote SQL: SELECT c1, c2, c3 FROM T_3 WHERE (c1 = 50)
(24 rows)

--Testcase 135:
SELECT t1.c1, ss.a, ss.b FROM (SELECT c1 FROM "S 1"."T 3" WHERE c1 = 50) t1 INNER JOIN (SELECT t2.c1, t3.c1 FROM (SELECT c1 FROM ft4 WHERE c1 between 50 and 60) t2 FULL JOIN (SELECT c1 FROM ft5 WHERE c1 between 50 and 60) t3 ON (t2.c1 = t3.c1) WHERE t2.c1 IS NULL OR t2.c1 IS NOT NULL) ss(a, b) ON (TRUE) ORDER BY t1.c1, ss.a, ss.b FOR UPDATE OF t1;
 c1 | a  | b  
----+----+----
 50 | 50 |   
 50 | 52 |   
 50 | 54 | 54
 50 | 56 |   
 50 | 58 |   
 50 | 60 | 60
 50 |    | 51
 50 |    | 57
(8 rows)

-- full outer join + inner join
--Testcase 136:
EXPLAIN (VERBOSE, COSTS OFF)
SELECT t1.c1, t2.c1, t3.c1 FROM ft4 t1 INNER JOIN ft5 t2 ON (t1.c1 = t2.c1 + 1 and t1.c1 between 50 and 60) FULL JOIN ft4 t3 ON (t2.c1 = t3.c1) ORDER BY t1.c1, t2.c1, t3.c1 LIMIT 10;
                                               QUERY PLAN                                               
--------------------------------------------------------------------------------------------------------
 Limit
   Output: t1.c1, t2.c1, t3.c1
   ->  Sort
         Output: t1.c1, t2.c1, t3.c1
         Sort Key: t1.c1, t2.c1, t3.c1
         ->  Hash Full Join
               Output: t1.c1, t2.c1, t3.c1
               Hash Cond: (t3.c1 = t2.c1)
               ->  Foreign Scan on public.ft4_a t3
                     Output: t3.c1
                       Remote SQL: SELECT c1 FROM T_3
               ->  Hash
                     Output: t1.c1, t2.c1
                     ->  Hash Join
                           Output: t1.c1, t2.c1
                           Hash Cond: ((t2.c1 + 1) = t1.c1)
                           ->  Foreign Scan on public.ft5_a t2
                                 Output: t2.c1
                                   Remote SQL: SELECT c1 FROM T_4
                           ->  Hash
                                 Output: t1.c1
                                 ->  Foreign Scan on public.ft4_a t1
                                       Output: t1.c1
                                         Remote SQL: SELECT c1 FROM T_3 WHERE (c1 >= 50) AND (c1 <= 60)
(24 rows)

--Testcase 137:
SELECT t1.c1, t2.c1, t3.c1 FROM ft4 t1 INNER JOIN ft5 t2 ON (t1.c1 = t2.c1 + 1 and t1.c1 between 50 and 60) FULL JOIN ft4 t3 ON (t2.c1 = t3.c1) ORDER BY t1.c1, t2.c1, t3.c1 LIMIT 10;
 c1 | c1 | c1 
----+----+----
 52 | 51 |   
 58 | 57 |   
    |    |  2
    |    |  4
    |    |  6
    |    |  8
    |    | 10
    |    | 12
    |    | 14
    |    | 16
(10 rows)

-- full outer join three tables
--Testcase 138:
EXPLAIN (VERBOSE, COSTS OFF)
SELECT t1.c1, t2.c2, t3.c3 FROM ft2 t1 FULL JOIN ft2 t2 ON (t1.c1 = t2.c1) FULL JOIN ft4 t3 ON (t2.c1 = t3.c1) ORDER BY t1.c1 OFFSET 10 LIMIT 10;
                                 QUERY PLAN                                  
-----------------------------------------------------------------------------
 Limit
   Output: t1.c1, t2.c2, t3.c3
   ->  Sort
         Output: t1.c1, t2.c2, t3.c3
         Sort Key: t1.c1
         ->  Merge Full Join
               Output: t1.c1, t2.c2, t3.c3
               Merge Cond: (t3.c1 = t2.c1)
               ->  Sort
                     Output: t3.c3, t3.c1
                     Sort Key: t3.c1
                     ->  Foreign Scan on public.ft4_a t3
                           Output: t3.c3, t3.c1
                             Remote SQL: SELECT c1, c3 FROM T_3
               ->  Sort
                     Output: t1.c1, t2.c2, t2.c1
                     Sort Key: t2.c1
                     ->  Merge Full Join
                           Output: t1.c1, t2.c2, t2.c1
                           Merge Cond: (t1.c1 = t2.c1)
                           ->  Sort
                                 Output: t1.c1
                                 Sort Key: t1.c1
                                 ->  Foreign Scan on public.ft2_a t1
                                       Output: t1.c1
                                         Remote SQL: SELECT C_1 FROM T_1
                           ->  Sort
                                 Output: t2.c2, t2.c1
                                 Sort Key: t2.c1
                                 ->  Foreign Scan on public.ft2_a t2
                                       Output: t2.c2, t2.c1
                                         Remote SQL: SELECT C_1, c2 FROM T_1
(32 rows)

--Testcase 139:
SELECT t1.c1, t2.c2, t3.c3 FROM ft2 t1 FULL JOIN ft2 t2 ON (t1.c1 = t2.c1) FULL JOIN ft4 t3 ON (t2.c1 = t3.c1) ORDER BY t1.c1 OFFSET 10 LIMIT 10;
 c1 | c2 |   c3   
----+----+--------
 11 |  1 | 
 12 |  2 | AAA012
 13 |  3 | 
 14 |  4 | AAA014
 15 |  5 | 
 16 |  6 | AAA016
 17 |  7 | 
 18 |  8 | AAA018
 19 |  9 | 
 20 |  0 | AAA020
(10 rows)

-- full outer join + right outer join
--Testcase 140:
EXPLAIN (VERBOSE, COSTS OFF)
SELECT t1.c1, t2.c2, t3.c3 FROM ft2 t1 FULL JOIN ft2 t2 ON (t1.c1 = t2.c1) RIGHT JOIN ft4 t3 ON (t2.c1 = t3.c1) ORDER BY 1 OFFSET 10 LIMIT 10;
                                 QUERY PLAN                                  
-----------------------------------------------------------------------------
 Limit
   Output: t1.c1, t2.c2, t3.c3
   ->  Sort
         Output: t1.c1, t2.c2, t3.c3
         Sort Key: t1.c1
         ->  Merge Left Join
               Output: t1.c1, t2.c2, t3.c3
               Merge Cond: (t3.c1 = t2.c1)
               ->  Sort
                     Output: t3.c3, t3.c1
                     Sort Key: t3.c1
                     ->  Foreign Scan on public.ft4_a t3
                           Output: t3.c3, t3.c1
                             Remote SQL: SELECT c1, c3 FROM T_3
               ->  Materialize
                     Output: t2.c2, t2.c1, t1.c1
                     ->  Merge Left Join
                           Output: t2.c2, t2.c1, t1.c1
                           Merge Cond: (t2.c1 = t1.c1)
                           ->  Sort
                                 Output: t2.c2, t2.c1
                                 Sort Key: t2.c1
                                 ->  Foreign Scan on public.ft2_a t2
                                       Output: t2.c2, t2.c1
                                         Remote SQL: SELECT C_1, c2 FROM T_1
                           ->  Sort
                                 Output: t1.c1
                                 Sort Key: t1.c1
                                 ->  Foreign Scan on public.ft2_a t1
                                       Output: t1.c1
                                         Remote SQL: SELECT C_1 FROM T_1
(31 rows)

--Testcase 141:
SELECT t1.c1, t2.c2, t3.c3 FROM ft2 t1 FULL JOIN ft2 t2 ON (t1.c1 = t2.c1) RIGHT JOIN ft4 t3 ON (t2.c1 = t3.c1) ORDER BY 1 OFFSET 10 LIMIT 10;
 c1 | c2 |   c3   
----+----+--------
 22 |  2 | AAA022
 24 |  4 | AAA024
 26 |  6 | AAA026
 28 |  8 | AAA028
 30 |  0 | AAA030
 32 |  2 | AAA032
 34 |  4 | AAA034
 36 |  6 | AAA036
 38 |  8 | AAA038
 40 |  0 | AAA040
(10 rows)

-- right outer join + full outer join
--Testcase 142:
EXPLAIN (VERBOSE, COSTS OFF)
SELECT t1.c1, t2.c2, t3.c3 FROM ft2 t1 RIGHT JOIN ft2 t2 ON (t1.c1 = t2.c1) FULL JOIN ft4 t3 ON (t2.c1 = t3.c1) ORDER BY t1.c1 OFFSET 10 LIMIT 10;
                                 QUERY PLAN                                  
-----------------------------------------------------------------------------
 Limit
   Output: t1.c1, t2.c2, t3.c3
   ->  Sort
         Output: t1.c1, t2.c2, t3.c3
         Sort Key: t1.c1
         ->  Merge Full Join
               Output: t1.c1, t2.c2, t3.c3
               Merge Cond: (t3.c1 = t2.c1)
               ->  Sort
                     Output: t3.c3, t3.c1
                     Sort Key: t3.c1
                     ->  Foreign Scan on public.ft4_a t3
                           Output: t3.c3, t3.c1
                             Remote SQL: SELECT c1, c3 FROM T_3
               ->  Materialize
                     Output: t2.c2, t2.c1, t1.c1
                     ->  Merge Left Join
                           Output: t2.c2, t2.c1, t1.c1
                           Merge Cond: (t2.c1 = t1.c1)
                           ->  Sort
                                 Output: t2.c2, t2.c1
                                 Sort Key: t2.c1
                                 ->  Foreign Scan on public.ft2_a t2
                                       Output: t2.c2, t2.c1
                                         Remote SQL: SELECT C_1, c2 FROM T_1
                           ->  Sort
                                 Output: t1.c1
                                 Sort Key: t1.c1
                                 ->  Foreign Scan on public.ft2_a t1
                                       Output: t1.c1
                                         Remote SQL: SELECT C_1 FROM T_1
(31 rows)

--Testcase 143:
SELECT t1.c1, t2.c2, t3.c3 FROM ft2 t1 RIGHT JOIN ft2 t2 ON (t1.c1 = t2.c1) FULL JOIN ft4 t3 ON (t2.c1 = t3.c1) ORDER BY t1.c1 OFFSET 10 LIMIT 10;
 c1 | c2 |   c3   
----+----+--------
 11 |  1 | 
 12 |  2 | AAA012
 13 |  3 | 
 14 |  4 | AAA014
 15 |  5 | 
 16 |  6 | AAA016
 17 |  7 | 
 18 |  8 | AAA018
 19 |  9 | 
 20 |  0 | AAA020
(10 rows)

-- full outer join + left outer join
--Testcase 144:
EXPLAIN (VERBOSE, COSTS OFF)
SELECT t1.c1, t2.c2, t3.c3 FROM ft2 t1 FULL JOIN ft2 t2 ON (t1.c1 = t2.c1) LEFT JOIN ft4 t3 ON (t2.c1 = t3.c1) ORDER BY t1.c1 OFFSET 10 LIMIT 10;
                                 QUERY PLAN                                  
-----------------------------------------------------------------------------
 Limit
   Output: t1.c1, t2.c2, t3.c3
   ->  Sort
         Output: t1.c1, t2.c2, t3.c3
         Sort Key: t1.c1
         ->  Merge Right Join
               Output: t1.c1, t2.c2, t3.c3
               Merge Cond: (t3.c1 = t2.c1)
               ->  Sort
                     Output: t3.c3, t3.c1
                     Sort Key: t3.c1
                     ->  Foreign Scan on public.ft4_a t3
                           Output: t3.c3, t3.c1
                             Remote SQL: SELECT c1, c3 FROM T_3
               ->  Sort
                     Output: t1.c1, t2.c2, t2.c1
                     Sort Key: t2.c1
                     ->  Merge Full Join
                           Output: t1.c1, t2.c2, t2.c1
                           Merge Cond: (t1.c1 = t2.c1)
                           ->  Sort
                                 Output: t1.c1
                                 Sort Key: t1.c1
                                 ->  Foreign Scan on public.ft2_a t1
                                       Output: t1.c1
                                         Remote SQL: SELECT C_1 FROM T_1
                           ->  Sort
                                 Output: t2.c2, t2.c1
                                 Sort Key: t2.c1
                                 ->  Foreign Scan on public.ft2_a t2
                                       Output: t2.c2, t2.c1
                                         Remote SQL: SELECT C_1, c2 FROM T_1
(32 rows)

--Testcase 145:
SELECT t1.c1, t2.c2, t3.c3 FROM ft2 t1 FULL JOIN ft2 t2 ON (t1.c1 = t2.c1) LEFT JOIN ft4 t3 ON (t2.c1 = t3.c1) ORDER BY t1.c1 OFFSET 10 LIMIT 10;
 c1 | c2 |   c3   
----+----+--------
 11 |  1 | 
 12 |  2 | AAA012
 13 |  3 | 
 14 |  4 | AAA014
 15 |  5 | 
 16 |  6 | AAA016
 17 |  7 | 
 18 |  8 | AAA018
 19 |  9 | 
 20 |  0 | AAA020
(10 rows)

-- left outer join + full outer join
--Testcase 146:
EXPLAIN (VERBOSE, COSTS OFF)
SELECT t1.c1, t2.c2, t3.c3 FROM ft2 t1 LEFT JOIN ft2 t2 ON (t1.c1 = t2.c1) FULL JOIN ft4 t3 ON (t2.c1 = t3.c1) ORDER BY t1.c1 OFFSET 10 LIMIT 10;
                                 QUERY PLAN                                  
-----------------------------------------------------------------------------
 Limit
   Output: t1.c1, t2.c2, t3.c3
   ->  Sort
         Output: t1.c1, t2.c2, t3.c3
         Sort Key: t1.c1
         ->  Merge Full Join
               Output: t1.c1, t2.c2, t3.c3
               Merge Cond: (t3.c1 = t2.c1)
               ->  Sort
                     Output: t3.c3, t3.c1
                     Sort Key: t3.c1
                     ->  Foreign Scan on public.ft4_a t3
                           Output: t3.c3, t3.c1
                             Remote SQL: SELECT c1, c3 FROM T_3
               ->  Sort
                     Output: t1.c1, t2.c2, t2.c1
                     Sort Key: t2.c1
                     ->  Merge Left Join
                           Output: t1.c1, t2.c2, t2.c1
                           Merge Cond: (t1.c1 = t2.c1)
                           ->  Sort
                                 Output: t1.c1
                                 Sort Key: t1.c1
                                 ->  Foreign Scan on public.ft2_a t1
                                       Output: t1.c1
                                         Remote SQL: SELECT C_1 FROM T_1
                           ->  Sort
                                 Output: t2.c2, t2.c1
                                 Sort Key: t2.c1
                                 ->  Foreign Scan on public.ft2_a t2
                                       Output: t2.c2, t2.c1
                                         Remote SQL: SELECT C_1, c2 FROM T_1
(32 rows)

--Testcase 147:
SELECT t1.c1, t2.c2, t3.c3 FROM ft2 t1 LEFT JOIN ft2 t2 ON (t1.c1 = t2.c1) FULL JOIN ft4 t3 ON (t2.c1 = t3.c1) ORDER BY t1.c1 OFFSET 10 LIMIT 10;
 c1 | c2 |   c3   
----+----+--------
 11 |  1 | 
 12 |  2 | AAA012
 13 |  3 | 
 14 |  4 | AAA014
 15 |  5 | 
 16 |  6 | AAA016
 17 |  7 | 
 18 |  8 | AAA018
 19 |  9 | 
 20 |  0 | AAA020
(10 rows)

-- right outer join + left outer join
--Testcase 148:
EXPLAIN (VERBOSE, COSTS OFF)
SELECT t1.c1, t2.c2, t3.c3 FROM ft2 t1 RIGHT JOIN ft2 t2 ON (t1.c1 = t2.c1) LEFT JOIN ft4 t3 ON (t2.c1 = t3.c1) ORDER BY t1.c1 OFFSET 10 LIMIT 10;
                                    QUERY PLAN                                     
-----------------------------------------------------------------------------------
 Limit
   Output: t1.c1, t2.c2, t3.c3
   ->  Nested Loop Left Join
         Output: t1.c1, t2.c2, t3.c3
         Join Filter: (t2.c1 = t3.c1)
         ->  Gather Merge
               Output: t2.c2, t2.c1, t1.c1
               Workers Planned: 1
               ->  Sort
                     Output: t2.c2, t2.c1, t1.c1
                     Sort Key: t1.c1
                     ->  Merge Left Join
                           Output: t2.c2, t2.c1, t1.c1
                           Merge Cond: (t2.c1 = t1.c1)
                           ->  Sort
                                 Output: t2.c2, t2.c1
                                 Sort Key: t2.c1
                                 ->  Parallel Append
                                       ->  Foreign Scan on public.ft2_a t2_1
                                             Output: t2_1.c2, t2_1.c1
                                               Remote SQL: SELECT C_1, c2 FROM T_1
                           ->  Sort
                                 Output: t1.c1
                                 Sort Key: t1.c1
                                 ->  Foreign Scan on public.ft2_a t1
                                       Output: t1.c1
                                         Remote SQL: SELECT C_1 FROM T_1
         ->  Materialize
               Output: t3.c3, t3.c1
               ->  Foreign Scan on public.ft4_a t3
                     Output: t3.c3, t3.c1
                       Remote SQL: SELECT c1, c3 FROM T_3
(32 rows)

--Testcase 149:
SELECT t1.c1, t2.c2, t3.c3 FROM ft2 t1 RIGHT JOIN ft2 t2 ON (t1.c1 = t2.c1) LEFT JOIN ft4 t3 ON (t2.c1 = t3.c1) ORDER BY t1.c1 OFFSET 10 LIMIT 10;
 c1 | c2 |   c3   
----+----+--------
 11 |  1 | 
 12 |  2 | AAA012
 13 |  3 | 
 14 |  4 | AAA014
 15 |  5 | 
 16 |  6 | AAA016
 17 |  7 | 
 18 |  8 | AAA018
 19 |  9 | 
 20 |  0 | AAA020
(10 rows)

-- left outer join + right outer join
--Testcase 150:
EXPLAIN (VERBOSE, COSTS OFF)
SELECT t1.c1, t2.c2, t3.c3 FROM ft2 t1 LEFT JOIN ft2 t2 ON (t1.c1 = t2.c1) RIGHT JOIN ft4 t3 ON (t2.c1 = t3.c1) ORDER BY 1 OFFSET 10 LIMIT 10;
                                 QUERY PLAN                                  
-----------------------------------------------------------------------------
 Limit
   Output: t1.c1, t2.c2, t3.c3
   ->  Sort
         Output: t1.c1, t2.c2, t3.c3
         Sort Key: t1.c1
         ->  Merge Left Join
               Output: t1.c1, t2.c2, t3.c3
               Merge Cond: (t3.c1 = t2.c1)
               ->  Sort
                     Output: t3.c3, t3.c1
                     Sort Key: t3.c1
                     ->  Foreign Scan on public.ft4_a t3
                           Output: t3.c3, t3.c1
                             Remote SQL: SELECT c1, c3 FROM T_3
               ->  Materialize
                     Output: t1.c1, t2.c2, t2.c1
                     ->  Merge Join
                           Output: t1.c1, t2.c2, t2.c1
                           Merge Cond: (t1.c1 = t2.c1)
                           ->  Sort
                                 Output: t1.c1
                                 Sort Key: t1.c1
                                 ->  Foreign Scan on public.ft2_a t1
                                       Output: t1.c1
                                         Remote SQL: SELECT C_1 FROM T_1
                           ->  Sort
                                 Output: t2.c2, t2.c1
                                 Sort Key: t2.c1
                                 ->  Foreign Scan on public.ft2_a t2
                                       Output: t2.c2, t2.c1
                                         Remote SQL: SELECT C_1, c2 FROM T_1
(31 rows)

--Testcase 151:
SELECT t1.c1, t2.c2, t3.c3 FROM ft2 t1 LEFT JOIN ft2 t2 ON (t1.c1 = t2.c1) RIGHT JOIN ft4 t3 ON (t2.c1 = t3.c1) ORDER BY 1 OFFSET 10 LIMIT 10;
 c1 | c2 |   c3   
----+----+--------
 22 |  2 | AAA022
 24 |  4 | AAA024
 26 |  6 | AAA026
 28 |  8 | AAA028
 30 |  0 | AAA030
 32 |  2 | AAA032
 34 |  4 | AAA034
 36 |  6 | AAA036
 38 |  8 | AAA038
 40 |  0 | AAA040
(10 rows)

-- full outer join + WHERE clause, only matched rows
--Testcase 152:
EXPLAIN (VERBOSE, COSTS OFF)
SELECT t1.c1, t2.c1 FROM ft4 t1 FULL JOIN ft5 t2 ON (t1.c1 = t2.c1) WHERE (t1.c1 = t2.c1 OR t1.c1 IS NULL) ORDER BY t1.c1, t2.c1 OFFSET 10 LIMIT 10;
                         QUERY PLAN                         
------------------------------------------------------------
 Limit
   Output: t1.c1, t2.c1
   ->  Sort
         Output: t1.c1, t2.c1
         Sort Key: t1.c1, t2.c1
         ->  Merge Full Join
               Output: t1.c1, t2.c1
               Merge Cond: (t1.c1 = t2.c1)
               Filter: ((t1.c1 = t2.c1) OR (t1.c1 IS NULL))
               ->  Sort
                     Output: t1.c1
                     Sort Key: t1.c1
                     ->  Foreign Scan on public.ft4_a t1
                           Output: t1.c1
                             Remote SQL: SELECT c1 FROM T_3
               ->  Sort
                     Output: t2.c1
                     Sort Key: t2.c1
                     ->  Foreign Scan on public.ft5_a t2
                           Output: t2.c1
                             Remote SQL: SELECT c1 FROM T_4
(21 rows)

--Testcase 153:
SELECT t1.c1, t2.c1 FROM ft4 t1 FULL JOIN ft5 t2 ON (t1.c1 = t2.c1) WHERE (t1.c1 = t2.c1 OR t1.c1 IS NULL) ORDER BY t1.c1, t2.c1 OFFSET 10 LIMIT 10;
 c1 | c1 
----+----
 66 | 66
 72 | 72
 78 | 78
 84 | 84
 90 | 90
 96 | 96
    |  3
    |  9
    | 15
    | 21
(10 rows)

-- full outer join + WHERE clause with shippable extensions set
--Testcase 154:
EXPLAIN (VERBOSE, COSTS OFF)
SELECT t1.c1, t2.c2, t1.c3 FROM ft1 t1 FULL JOIN ft2 t2 ON (t1.c1 = t2.c1) WHERE dynamodb_fdw_abs(t1.c1) > 0 OFFSET 10 LIMIT 10;
                        QUERY PLAN                         
-----------------------------------------------------------
 Limit
   Output: t1.c1, t2.c2, t1.c3
   ->  Hash Full Join
         Output: t1.c1, t2.c2, t1.c3
         Hash Cond: (t1.c1 = t2.c1)
         Filter: (dynamodb_fdw_abs(t1.c1) > 0)
         ->  Foreign Scan on public.ft1_a t1
               Output: t1.c1, t1.c3
                 Remote SQL: SELECT C_1, c3 FROM T_1
         ->  Hash
               Output: t2.c2, t2.c1
               ->  Foreign Scan on public.ft2_a t2
                     Output: t2.c2, t2.c1
                       Remote SQL: SELECT C_1, c2 FROM T_1
(14 rows)

-- ALTER SERVER loopback OPTIONS (DROP extensions);
-- full outer join + WHERE clause with shippable extensions not set
--Testcase 155:
EXPLAIN (VERBOSE, COSTS OFF)
SELECT t1.c1, t2.c2, t1.c3 FROM ft1 t1 FULL JOIN ft2 t2 ON (t1.c1 = t2.c1) WHERE dynamodb_fdw_abs(t1.c1) > 0 OFFSET 10 LIMIT 10;
                        QUERY PLAN                         
-----------------------------------------------------------
 Limit
   Output: t1.c1, t2.c2, t1.c3
   ->  Hash Full Join
         Output: t1.c1, t2.c2, t1.c3
         Hash Cond: (t1.c1 = t2.c1)
         Filter: (dynamodb_fdw_abs(t1.c1) > 0)
         ->  Foreign Scan on public.ft1_a t1
               Output: t1.c1, t1.c3
                 Remote SQL: SELECT C_1, c3 FROM T_1
         ->  Hash
               Output: t2.c2, t2.c1
               ->  Foreign Scan on public.ft2_a t2
                     Output: t2.c2, t2.c1
                       Remote SQL: SELECT C_1, c2 FROM T_1
(14 rows)

-- ALTER SERVER loopback OPTIONS (ADD extensions 'postgres_fdw');
-- join two tables with FOR UPDATE clause
-- tests whole-row reference for row marks
--Testcase 156:
EXPLAIN (VERBOSE, COSTS OFF)
SELECT t1.c1, t2.c1 FROM ft1 t1 JOIN ft2 t2 ON (t1.c1 = t2.c1) ORDER BY t1.c3, t1.c1 OFFSET 100 LIMIT 10 FOR UPDATE OF t1;
                                                        QUERY PLAN                                                         
---------------------------------------------------------------------------------------------------------------------------
 Limit
   Output: t1.c1, t2.c1, t1.c3, t1.ctid, t2.ctid, ((t1.*)::ft1), t1.tableoid, ((t2.*)::ft2), t2.tableoid
   ->  LockRows
         Output: t1.c1, t2.c1, t1.c3, t1.ctid, t2.ctid, ((t1.*)::ft1), t1.tableoid, ((t2.*)::ft2), t2.tableoid
         ->  Sort
               Output: t1.c1, t2.c1, t1.c3, t1.ctid, t2.ctid, ((t1.*)::ft1), t1.tableoid, ((t2.*)::ft2), t2.tableoid
               Sort Key: t1.c3, t1.c1
               ->  Merge Join
                     Output: t1.c1, t2.c1, t1.c3, t1.ctid, t2.ctid, ((t1.*)::ft1), t1.tableoid, ((t2.*)::ft2), t2.tableoid
                     Merge Cond: (t1.c1 = t2.c1)
                     ->  Sort
                           Output: t1.c1, t1.c3, t1.ctid, ((t1.*)::ft1), t1.tableoid
                           Sort Key: t1.c1
                           ->  Foreign Scan on public.ft1_a t1
                                 Output: t1.c1, t1.c3, t1.ctid, t1.*, t1.tableoid
                                   Remote SQL: SELECT C_1, c2, c3, c4, c5, c6, c7, c8 FROM T_1
                     ->  Sort
                           Output: t2.c1, t2.ctid, ((t2.*)::ft2), t2.tableoid
                           Sort Key: t2.c1
                           ->  Foreign Scan on public.ft2_a t2
                                 Output: t2.c1, t2.ctid, t2.*, t2.tableoid
                                   Remote SQL: SELECT C_1, c2, c3, c4, c5, c6, c7, c8 FROM T_1
(22 rows)

--Testcase 157:
SELECT t1.c1, t2.c1 FROM ft1 t1 JOIN ft2 t2 ON (t1.c1 = t2.c1) ORDER BY t1.c3, t1.c1 OFFSET 100 LIMIT 10 FOR UPDATE OF t1;
 c1  | c1  
-----+-----
 101 | 101
 102 | 102
 103 | 103
 104 | 104
 105 | 105
 106 | 106
 107 | 107
 108 | 108
 109 | 109
 110 | 110
(10 rows)

--Testcase 158:
EXPLAIN (VERBOSE, COSTS OFF)
SELECT t1.c1, t2.c1 FROM ft1 t1 JOIN ft2 t2 ON (t1.c1 = t2.c1) ORDER BY t1.c3, t1.c1 OFFSET 100 LIMIT 10 FOR UPDATE;
                                                        QUERY PLAN                                                         
---------------------------------------------------------------------------------------------------------------------------
 Limit
   Output: t1.c1, t2.c1, t1.c3, t1.ctid, t2.ctid, ((t1.*)::ft1), t1.tableoid, ((t2.*)::ft2), t2.tableoid
   ->  LockRows
         Output: t1.c1, t2.c1, t1.c3, t1.ctid, t2.ctid, ((t1.*)::ft1), t1.tableoid, ((t2.*)::ft2), t2.tableoid
         ->  Sort
               Output: t1.c1, t2.c1, t1.c3, t1.ctid, t2.ctid, ((t1.*)::ft1), t1.tableoid, ((t2.*)::ft2), t2.tableoid
               Sort Key: t1.c3, t1.c1
               ->  Merge Join
                     Output: t1.c1, t2.c1, t1.c3, t1.ctid, t2.ctid, ((t1.*)::ft1), t1.tableoid, ((t2.*)::ft2), t2.tableoid
                     Merge Cond: (t1.c1 = t2.c1)
                     ->  Sort
                           Output: t1.c1, t1.c3, t1.ctid, ((t1.*)::ft1), t1.tableoid
                           Sort Key: t1.c1
                           ->  Foreign Scan on public.ft1_a t1
                                 Output: t1.c1, t1.c3, t1.ctid, t1.*, t1.tableoid
                                   Remote SQL: SELECT C_1, c2, c3, c4, c5, c6, c7, c8 FROM T_1
                     ->  Sort
                           Output: t2.c1, t2.ctid, ((t2.*)::ft2), t2.tableoid
                           Sort Key: t2.c1
                           ->  Foreign Scan on public.ft2_a t2
                                 Output: t2.c1, t2.ctid, t2.*, t2.tableoid
                                   Remote SQL: SELECT C_1, c2, c3, c4, c5, c6, c7, c8 FROM T_1
(22 rows)

--Testcase 159:
SELECT t1.c1, t2.c1 FROM ft1 t1 JOIN ft2 t2 ON (t1.c1 = t2.c1) ORDER BY t1.c3, t1.c1 OFFSET 100 LIMIT 10 FOR UPDATE;
 c1  | c1  
-----+-----
 101 | 101
 102 | 102
 103 | 103
 104 | 104
 105 | 105
 106 | 106
 107 | 107
 108 | 108
 109 | 109
 110 | 110
(10 rows)

-- join two tables with FOR SHARE clause
--Testcase 160:
EXPLAIN (VERBOSE, COSTS OFF)
SELECT t1.c1, t2.c1 FROM ft1 t1 JOIN ft2 t2 ON (t1.c1 = t2.c1) ORDER BY t1.c3, t1.c1 OFFSET 100 LIMIT 10 FOR SHARE OF t1;
                                                        QUERY PLAN                                                         
---------------------------------------------------------------------------------------------------------------------------
 Limit
   Output: t1.c1, t2.c1, t1.c3, t1.ctid, t2.ctid, ((t1.*)::ft1), t1.tableoid, ((t2.*)::ft2), t2.tableoid
   ->  LockRows
         Output: t1.c1, t2.c1, t1.c3, t1.ctid, t2.ctid, ((t1.*)::ft1), t1.tableoid, ((t2.*)::ft2), t2.tableoid
         ->  Sort
               Output: t1.c1, t2.c1, t1.c3, t1.ctid, t2.ctid, ((t1.*)::ft1), t1.tableoid, ((t2.*)::ft2), t2.tableoid
               Sort Key: t1.c3, t1.c1
               ->  Merge Join
                     Output: t1.c1, t2.c1, t1.c3, t1.ctid, t2.ctid, ((t1.*)::ft1), t1.tableoid, ((t2.*)::ft2), t2.tableoid
                     Merge Cond: (t1.c1 = t2.c1)
                     ->  Sort
                           Output: t1.c1, t1.c3, t1.ctid, ((t1.*)::ft1), t1.tableoid
                           Sort Key: t1.c1
                           ->  Foreign Scan on public.ft1_a t1
                                 Output: t1.c1, t1.c3, t1.ctid, t1.*, t1.tableoid
                                   Remote SQL: SELECT C_1, c2, c3, c4, c5, c6, c7, c8 FROM T_1
                     ->  Sort
                           Output: t2.c1, t2.ctid, ((t2.*)::ft2), t2.tableoid
                           Sort Key: t2.c1
                           ->  Foreign Scan on public.ft2_a t2
                                 Output: t2.c1, t2.ctid, t2.*, t2.tableoid
                                   Remote SQL: SELECT C_1, c2, c3, c4, c5, c6, c7, c8 FROM T_1
(22 rows)

--Testcase 161:
SELECT t1.c1, t2.c1 FROM ft1 t1 JOIN ft2 t2 ON (t1.c1 = t2.c1) ORDER BY t1.c3, t1.c1 OFFSET 100 LIMIT 10 FOR SHARE OF t1;
 c1  | c1  
-----+-----
 101 | 101
 102 | 102
 103 | 103
 104 | 104
 105 | 105
 106 | 106
 107 | 107
 108 | 108
 109 | 109
 110 | 110
(10 rows)

--Testcase 162:
EXPLAIN (VERBOSE, COSTS OFF)
SELECT t1.c1, t2.c1 FROM ft1 t1 JOIN ft2 t2 ON (t1.c1 = t2.c1) ORDER BY t1.c3, t1.c1 OFFSET 100 LIMIT 10 FOR SHARE;
                                                        QUERY PLAN                                                         
---------------------------------------------------------------------------------------------------------------------------
 Limit
   Output: t1.c1, t2.c1, t1.c3, t1.ctid, t2.ctid, ((t1.*)::ft1), t1.tableoid, ((t2.*)::ft2), t2.tableoid
   ->  LockRows
         Output: t1.c1, t2.c1, t1.c3, t1.ctid, t2.ctid, ((t1.*)::ft1), t1.tableoid, ((t2.*)::ft2), t2.tableoid
         ->  Sort
               Output: t1.c1, t2.c1, t1.c3, t1.ctid, t2.ctid, ((t1.*)::ft1), t1.tableoid, ((t2.*)::ft2), t2.tableoid
               Sort Key: t1.c3, t1.c1
               ->  Merge Join
                     Output: t1.c1, t2.c1, t1.c3, t1.ctid, t2.ctid, ((t1.*)::ft1), t1.tableoid, ((t2.*)::ft2), t2.tableoid
                     Merge Cond: (t1.c1 = t2.c1)
                     ->  Sort
                           Output: t1.c1, t1.c3, t1.ctid, ((t1.*)::ft1), t1.tableoid
                           Sort Key: t1.c1
                           ->  Foreign Scan on public.ft1_a t1
                                 Output: t1.c1, t1.c3, t1.ctid, t1.*, t1.tableoid
                                   Remote SQL: SELECT C_1, c2, c3, c4, c5, c6, c7, c8 FROM T_1
                     ->  Sort
                           Output: t2.c1, t2.ctid, ((t2.*)::ft2), t2.tableoid
                           Sort Key: t2.c1
                           ->  Foreign Scan on public.ft2_a t2
                                 Output: t2.c1, t2.ctid, t2.*, t2.tableoid
                                   Remote SQL: SELECT C_1, c2, c3, c4, c5, c6, c7, c8 FROM T_1
(22 rows)

--Testcase 163:
SELECT t1.c1, t2.c1 FROM ft1 t1 JOIN ft2 t2 ON (t1.c1 = t2.c1) ORDER BY t1.c3, t1.c1 OFFSET 100 LIMIT 10 FOR SHARE;
 c1  | c1  
-----+-----
 101 | 101
 102 | 102
 103 | 103
 104 | 104
 105 | 105
 106 | 106
 107 | 107
 108 | 108
 109 | 109
 110 | 110
(10 rows)

-- join in CTE
--Testcase 164:
EXPLAIN (VERBOSE, COSTS OFF)
WITH t (c1_1, c1_3, c2_1) AS MATERIALIZED (SELECT t1.c1, t1.c3, t2.c1 FROM ft1 t1 JOIN ft2 t2 ON (t1.c1 = t2.c1)) SELECT c1_1, c2_1 FROM t ORDER BY c1_3, c1_1 OFFSET 100 LIMIT 10;
                         QUERY PLAN                          
-------------------------------------------------------------
 Limit
   Output: t.c1_1, t.c2_1, t.c1_3
   CTE t
     ->  Merge Join
           Output: t1.c1, t1.c3, t2.c1
           Merge Cond: (t1.c1 = t2.c1)
           ->  Sort
                 Output: t1.c1, t1.c3
                 Sort Key: t1.c1
                 ->  Foreign Scan on public.ft1_a t1
                       Output: t1.c1, t1.c3
                         Remote SQL: SELECT C_1, c3 FROM T_1
           ->  Sort
                 Output: t2.c1
                 Sort Key: t2.c1
                 ->  Foreign Scan on public.ft2_a t2
                       Output: t2.c1
                         Remote SQL: SELECT C_1 FROM T_1
   ->  Sort
         Output: t.c1_1, t.c2_1, t.c1_3
         Sort Key: t.c1_3, t.c1_1
         ->  CTE Scan on t
               Output: t.c1_1, t.c2_1, t.c1_3
(23 rows)

--Testcase 165:
WITH t (c1_1, c1_3, c2_1) AS MATERIALIZED (SELECT t1.c1, t1.c3, t2.c1 FROM ft1 t1 JOIN ft2 t2 ON (t1.c1 = t2.c1)) SELECT c1_1, c2_1 FROM t ORDER BY c1_3, c1_1 OFFSET 100 LIMIT 10;
 c1_1 | c2_1 
------+------
  101 |  101
  102 |  102
  103 |  103
  104 |  104
  105 |  105
  106 |  106
  107 |  107
  108 |  108
  109 |  109
  110 |  110
(10 rows)

-- ctid with whole-row reference
--Testcase 166:
EXPLAIN (VERBOSE, COSTS OFF)
SELECT t1.ctid, t1, t2, t1.c1 FROM ft1 t1 JOIN ft2 t2 ON (t1.c1 = t2.c1) ORDER BY t1.c3, t1.c1 OFFSET 100 LIMIT 10;
                                          QUERY PLAN                                           
-----------------------------------------------------------------------------------------------
 Limit
   Output: t1.ctid, ((t1.*)::ft1), ((t2.*)::ft2), t1.c1, t1.c3
   ->  Nested Loop
         Output: t1.ctid, ((t1.*)::ft1), ((t2.*)::ft2), t1.c1, t1.c3
         Join Filter: (t1.c1 = t2.c1)
         ->  Gather Merge
               Output: t1.ctid, ((t1.*)::ft1), t1.c1, t1.c3
               Workers Planned: 1
               ->  Sort
                     Output: t1.ctid, ((t1.*)::ft1), t1.c1, t1.c3
                     Sort Key: t1.c3, t1.c1
                     ->  Parallel Append
                           ->  Foreign Scan on public.ft1_a t1_1
                                 Output: t1_1.ctid, t1_1.*, t1_1.c1, t1_1.c3
                                   Remote SQL: SELECT C_1, c2, c3, c4, c5, c6, c7, c8 FROM T_1
         ->  Materialize
               Output: ((t2.*)::ft2), t2.c1
               ->  Foreign Scan on public.ft2_a t2
                     Output: t2.*, t2.c1
                       Remote SQL: SELECT C_1, c2, c3, c4, c5, c6, c7, c8 FROM T_1
(20 rows)

-- SEMI JOIN, not pushed down
--Testcase 167:
EXPLAIN (VERBOSE, COSTS OFF)
SELECT t1.c1 FROM ft1 t1 WHERE EXISTS (SELECT 1 FROM ft2 t2 WHERE t1.c1 = t2.c1) ORDER BY t1.c1 OFFSET 100 LIMIT 10;
                            QUERY PLAN                             
-------------------------------------------------------------------
 Limit
   Output: t1.c1
   ->  Sort
         Output: t1.c1
         Sort Key: t1.c1
         ->  Hash Join
               Output: t1.c1
               Inner Unique: true
               Hash Cond: (t1.c1 = t2.c1)
               ->  Foreign Scan on public.ft1_a t1
                     Output: t1.c1
                       Remote SQL: SELECT C_1 FROM T_1
               ->  Hash
                     Output: t2.c1
                     ->  HashAggregate
                           Output: t2.c1
                           Group Key: t2.c1
                           ->  Foreign Scan on public.ft2_a t2
                                 Output: t2.c1
                                   Remote SQL: SELECT C_1 FROM T_1
(20 rows)

--Testcase 168:
SELECT t1.c1 FROM ft1 t1 WHERE EXISTS (SELECT 1 FROM ft2 t2 WHERE t1.c1 = t2.c1) ORDER BY t1.c1 OFFSET 100 LIMIT 10;
 c1  
-----
 101
 102
 103
 104
 105
 106
 107
 108
 109
 110
(10 rows)

-- ANTI JOIN, not pushed down
--Testcase 169:
EXPLAIN (VERBOSE, COSTS OFF)
SELECT t1.c1 FROM ft1 t1 WHERE NOT EXISTS (SELECT 1 FROM ft2 t2 WHERE t1.c1 = t2.c2) ORDER BY t1.c1 OFFSET 100 LIMIT 10;
                         QUERY PLAN                         
------------------------------------------------------------
 Limit
   Output: t1.c1
   ->  Sort
         Output: t1.c1
         Sort Key: t1.c1
         ->  Hash Anti Join
               Output: t1.c1
               Hash Cond: (t1.c1 = t2.c2)
               ->  Foreign Scan on public.ft1_a t1
                     Output: t1.c1
                       Remote SQL: SELECT C_1 FROM T_1
               ->  Hash
                     Output: t2.c2
                     ->  Foreign Scan on public.ft2_a t2
                           Output: t2.c2
                             Remote SQL: SELECT c2 FROM T_1
(16 rows)

--Testcase 170:
SELECT t1.c1 FROM ft1 t1 WHERE NOT EXISTS (SELECT 1 FROM ft2 t2 WHERE t1.c1 = t2.c2) ORDER BY t1.c1 OFFSET 100 LIMIT 10;
 c1  
-----
 110
 111
 112
 113
 114
 115
 116
 117
 118
 119
(10 rows)

-- CROSS JOIN can be pushed down
--Testcase 171:
EXPLAIN (VERBOSE, COSTS OFF)
SELECT t1.c1, t2.c1 FROM ft1 t1 CROSS JOIN ft2 t2 ORDER BY t1.c1, t2.c1 OFFSET 100 LIMIT 10;
                               QUERY PLAN                                
-------------------------------------------------------------------------
 Limit
   Output: t1.c1, t2.c1
   ->  Incremental Sort
         Output: t1.c1, t2.c1
         Sort Key: t1.c1, t2.c1
         Presorted Key: t1.c1
         ->  Nested Loop
               Output: t1.c1, t2.c1
               ->  Gather Merge
                     Output: t1.c1
                     Workers Planned: 1
                     ->  Sort
                           Output: t1.c1
                           Sort Key: t1.c1
                           ->  Parallel Append
                                 ->  Foreign Scan on public.ft1_a t1_1
                                       Output: t1_1.c1
                                         Remote SQL: SELECT C_1 FROM T_1
               ->  Materialize
                     Output: t2.c1
                     ->  Foreign Scan on public.ft2_a t2
                           Output: t2.c1
                             Remote SQL: SELECT C_1 FROM T_1
(23 rows)

--Testcase 172:
SELECT t1.c1, t2.c1 FROM ft1 t1 CROSS JOIN ft2 t2 ORDER BY t1.c1, t2.c1 OFFSET 100 LIMIT 10;
 c1 | c1  
----+-----
  1 | 101
  1 | 102
  1 | 103
  1 | 104
  1 | 105
  1 | 106
  1 | 107
  1 | 108
  1 | 109
  1 | 110
(10 rows)

-- different server, not pushed down. No result expected.
--Testcase 173:
EXPLAIN (VERBOSE, COSTS OFF)
SELECT t1.c1, t2.c1 FROM ft5 t1 JOIN ft6 t2 ON (t1.c1 = t2.c1) ORDER BY t1.c1, t2.c1 OFFSET 100 LIMIT 10;
                      QUERY PLAN                      
------------------------------------------------------
 Limit
   Output: t1.c1, t2.c1
   ->  Merge Join
         Output: t1.c1, t2.c1
         Merge Cond: (t1.c1 = t2.c1)
         ->  Sort
               Output: t1.c1
               Sort Key: t1.c1
               ->  Foreign Scan on public.ft5_a t1
                     Output: t1.c1
                       Remote SQL: SELECT c1 FROM T_4
         ->  Sort
               Output: t2.c1
               Sort Key: t2.c1
               ->  Foreign Scan on public.ft6_a t2
                     Output: t2.c1
                       Remote SQL: SELECT c1 FROM T_4
(17 rows)

--Testcase 174:
SELECT t1.c1, t2.c1 FROM ft5 t1 JOIN ft6 t2 ON (t1.c1 = t2.c1) ORDER BY t1.c1, t2.c1 OFFSET 100 LIMIT 10;
 c1 | c1 
----+----
(0 rows)

-- unsafe join conditions (c8 has a UDT), not pushed down. Practically a CROSS
-- JOIN since c8 in both tables has same value.
--Testcase 175:
EXPLAIN (VERBOSE, COSTS OFF)
SELECT t1.c1, t2.c1 FROM ft1 t1 LEFT JOIN ft2 t2 ON (t1.c8 = t2.c8) ORDER BY t1.c1, t2.c1 OFFSET 100 LIMIT 10;
                                 QUERY PLAN                                  
-----------------------------------------------------------------------------
 Limit
   Output: t1.c1, t2.c1
   ->  Incremental Sort
         Output: t1.c1, t2.c1
         Sort Key: t1.c1, t2.c1
         Presorted Key: t1.c1
         ->  Nested Loop Left Join
               Output: t1.c1, t2.c1
               Join Filter: (t1.c8 = t2.c8)
               ->  Gather Merge
                     Output: t1.c1, t1.c8
                     Workers Planned: 1
                     ->  Sort
                           Output: t1.c1, t1.c8
                           Sort Key: t1.c1
                           ->  Parallel Append
                                 ->  Foreign Scan on public.ft1_a t1_1
                                       Output: t1_1.c1, t1_1.c8
                                         Remote SQL: SELECT C_1, c8 FROM T_1
               ->  Materialize
                     Output: t2.c1, t2.c8
                     ->  Foreign Scan on public.ft2_a t2
                           Output: t2.c1, t2.c8
                             Remote SQL: SELECT C_1, c8 FROM T_1
(24 rows)

--Testcase 176:
SELECT t1.c1, t2.c1 FROM ft1 t1 LEFT JOIN ft2 t2 ON (t1.c8 = t2.c8) ORDER BY t1.c1, t2.c1 OFFSET 100 LIMIT 10;
 c1 | c1  
----+-----
  1 | 101
  1 | 102
  1 | 103
  1 | 104
  1 | 105
  1 | 106
  1 | 107
  1 | 108
  1 | 109
  1 | 110
(10 rows)

-- unsafe conditions on one side (c8 has a UDT), not pushed down.
--Testcase 177:
EXPLAIN (VERBOSE, COSTS OFF)
SELECT t1.c1, t2.c1 FROM ft1 t1 LEFT JOIN ft2 t2 ON (t1.c1 = t2.c1) WHERE t1.c8 = 'foo' ORDER BY t1.c3, t1.c1 OFFSET 100 LIMIT 10;
                                     QUERY PLAN                                     
------------------------------------------------------------------------------------
 Limit
   Output: t1.c1, t2.c1, t1.c3
   ->  Sort
         Output: t1.c1, t2.c1, t1.c3
         Sort Key: t1.c3, t1.c1
         ->  Hash Right Join
               Output: t1.c1, t2.c1, t1.c3
               Hash Cond: (t2.c1 = t1.c1)
               ->  Foreign Scan on public.ft2_a t2
                     Output: t2.c1
                       Remote SQL: SELECT C_1 FROM T_1
               ->  Hash
                     Output: t1.c1, t1.c3
                     ->  Foreign Scan on public.ft1_a t1
                           Output: t1.c1, t1.c3
                             Remote SQL: SELECT C_1, c3 FROM T_1 WHERE (c8 = 'foo')
(16 rows)

--Testcase 178:
SELECT t1.c1, t2.c1 FROM ft1 t1 LEFT JOIN ft2 t2 ON (t1.c1 = t2.c1) WHERE t1.c8 = 'foo' ORDER BY t1.c3, t1.c1 OFFSET 100 LIMIT 10;
 c1  | c1  
-----+-----
 101 | 101
 102 | 102
 103 | 103
 104 | 104
 105 | 105
 106 | 106
 107 | 107
 108 | 108
 109 | 109
 110 | 110
(10 rows)

-- join where unsafe to pushdown condition in WHERE clause has a column not
-- in the SELECT clause. In this test unsafe clause needs to have column
-- references from both joining sides so that the clause is not pushed down
-- into one of the joining sides.
--Testcase 179:
EXPLAIN (VERBOSE, COSTS OFF)
SELECT t1.c1, t2.c1 FROM ft1 t1 JOIN ft2 t2 ON (t1.c1 = t2.c1) WHERE t1.c8 = t2.c8 ORDER BY t1.c3, t1.c1 OFFSET 100 LIMIT 10;
                             QUERY PLAN                              
---------------------------------------------------------------------
 Limit
   Output: t1.c1, t2.c1, t1.c3
   ->  Sort
         Output: t1.c1, t2.c1, t1.c3
         Sort Key: t1.c3, t1.c1
         ->  Merge Join
               Output: t1.c1, t2.c1, t1.c3
               Merge Cond: ((t1.c1 = t2.c1) AND (t1.c8 = t2.c8))
               ->  Sort
                     Output: t1.c1, t1.c3, t1.c8
                     Sort Key: t1.c1, t1.c8
                     ->  Foreign Scan on public.ft1_a t1
                           Output: t1.c1, t1.c3, t1.c8
                             Remote SQL: SELECT C_1, c3, c8 FROM T_1
               ->  Sort
                     Output: t2.c1, t2.c8
                     Sort Key: t2.c1, t2.c8
                     ->  Foreign Scan on public.ft2_a t2
                           Output: t2.c1, t2.c8
                             Remote SQL: SELECT C_1, c8 FROM T_1
(20 rows)

--Testcase 180:
SELECT t1.c1, t2.c1 FROM ft1 t1 JOIN ft2 t2 ON (t1.c1 = t2.c1) WHERE t1.c8 = t2.c8 ORDER BY t1.c3, t1.c1 OFFSET 100 LIMIT 10;
 c1  | c1  
-----+-----
 101 | 101
 102 | 102
 103 | 103
 104 | 104
 105 | 105
 106 | 106
 107 | 107
 108 | 108
 109 | 109
 110 | 110
(10 rows)

-- Aggregate after UNION, for testing setrefs
--Testcase 181:
EXPLAIN (VERBOSE, COSTS OFF)
SELECT t1c1, avg(t1c1 + t2c1) FROM (SELECT t1.c1, t2.c1 FROM ft1 t1 JOIN ft2 t2 ON (t1.c1 = t2.c1) UNION SELECT t1.c1, t2.c1 FROM ft1 t1 JOIN ft2 t2 ON (t1.c1 = t2.c1)) AS t (t1c1, t2c1) GROUP BY t1c1 ORDER BY t1c1 OFFSET 100 LIMIT 10;
                                  QUERY PLAN                                   
-------------------------------------------------------------------------------
 Limit
   Output: t1.c1, (avg((t1.c1 + t2.c1)))
   ->  Sort
         Output: t1.c1, (avg((t1.c1 + t2.c1)))
         Sort Key: t1.c1
         ->  HashAggregate
               Output: t1.c1, avg((t1.c1 + t2.c1))
               Group Key: t1.c1
               ->  HashAggregate
                     Output: t1.c1, t2.c1
                     Group Key: t1.c1, t2.c1
                     ->  Append
                           ->  Merge Join
                                 Output: t1.c1, t2.c1
                                 Merge Cond: (t1.c1 = t2.c1)
                                 ->  Sort
                                       Output: t1.c1
                                       Sort Key: t1.c1
                                       ->  Foreign Scan on public.ft1_a t1
                                             Output: t1.c1
                                               Remote SQL: SELECT C_1 FROM T_1
                                 ->  Sort
                                       Output: t2.c1
                                       Sort Key: t2.c1
                                       ->  Foreign Scan on public.ft2_a t2
                                             Output: t2.c1
                                               Remote SQL: SELECT C_1 FROM T_1
                           ->  Merge Join
                                 Output: t1_1.c1, t2_1.c1
                                 Merge Cond: (t1_1.c1 = t2_1.c1)
                                 ->  Sort
                                       Output: t1_1.c1
                                       Sort Key: t1_1.c1
                                       ->  Foreign Scan on public.ft1_a t1_1
                                             Output: t1_1.c1
                                               Remote SQL: SELECT C_1 FROM T_1
                                 ->  Sort
                                       Output: t2_1.c1
                                       Sort Key: t2_1.c1
                                       ->  Foreign Scan on public.ft2_a t2_1
                                             Output: t2_1.c1
                                               Remote SQL: SELECT C_1 FROM T_1
(42 rows)

--Testcase 182:
SELECT t1c1, avg(t1c1 + t2c1) FROM (SELECT t1.c1, t2.c1 FROM ft1 t1 JOIN ft2 t2 ON (t1.c1 = t2.c1) UNION SELECT t1.c1, t2.c1 FROM ft1 t1 JOIN ft2 t2 ON (t1.c1 = t2.c1)) AS t (t1c1, t2c1) GROUP BY t1c1 ORDER BY t1c1 OFFSET 100 LIMIT 10;
 t1c1 |         avg          
------+----------------------
  101 | 202.0000000000000000
  102 | 204.0000000000000000
  103 | 206.0000000000000000
  104 | 208.0000000000000000
  105 | 210.0000000000000000
  106 | 212.0000000000000000
  107 | 214.0000000000000000
  108 | 216.0000000000000000
  109 | 218.0000000000000000
  110 | 220.0000000000000000
(10 rows)

-- join with lateral reference
--Testcase 183:
EXPLAIN (VERBOSE, COSTS OFF)
SELECT t1."C 1" FROM "S 1"."T 1" t1, LATERAL (SELECT DISTINCT t2.c1, t3.c1 FROM ft1 t2, ft2 t3 WHERE t2.c1 = t3.c1 AND t2.c2 = t1.c2) q ORDER BY t1."C 1" OFFSET 10 LIMIT 10;
                                      QUERY PLAN                                       
---------------------------------------------------------------------------------------
 Limit
   Output: t1."C 1"
   ->  Sort
         Output: t1."C 1"
         Sort Key: t1."C 1"
         ->  Nested Loop
               Output: t1."C 1"
               ->  Foreign Scan on "S 1"."T 1" t1
                     Output: t1."C 1", t1.c2, t1.c3, t1.c4, t1.c5, t1.c6, t1.c7, t1.c8
                     Remote SQL: SELECT C_1, c2 FROM T_1
               ->  HashAggregate
                     Output: t2.c1, t3.c1
                     Group Key: t2.c1, t3.c1
                     ->  Hash Join
                           Output: t2.c1, t3.c1
                           Hash Cond: (t3.c1 = t2.c1)
                           ->  Foreign Scan on public.ft2_a t3
                                 Output: t3.c1
                                   Remote SQL: SELECT C_1 FROM T_1
                           ->  Hash
                                 Output: t2.c1
                                 ->  Foreign Scan on public.ft1_a t2
                                       Output: t2.c1
                                       Filter: (t2.c2 = t1.c2)
                                         Remote SQL: SELECT C_1, c2 FROM T_1
(25 rows)

--Testcase 184:
SELECT t1."C 1" FROM "S 1"."T 1" t1, LATERAL (SELECT DISTINCT t2.c1, t3.c1 FROM ft1 t2, ft2 t3 WHERE t2.c1 = t3.c1 AND t2.c2 = t1.c2) q ORDER BY t1."C 1" OFFSET 10 LIMIT 10;
 C 1 
-----
   1
   1
   1
   1
   1
   1
   1
   1
   1
   1
(10 rows)

-- non-Var items in targetlist of the nullable rel of a join preventing
-- push-down in some cases
-- unable to push {ft1, ft2}
--Testcase 185:
EXPLAIN (VERBOSE, COSTS OFF)
SELECT q.a, ft2.c1 FROM (SELECT 13 FROM ft1 WHERE c1 = 13) q(a) RIGHT JOIN ft2 ON (q.a = ft2.c1) WHERE ft2.c1 BETWEEN 10 AND 15 ORDER BY c1;
                                    QUERY PLAN                                     
-----------------------------------------------------------------------------------
 Sort
   Output: (13), ft2.c1
   Sort Key: ft2.c1
   ->  Nested Loop Left Join
         Output: (13), ft2.c1
         Join Filter: (13 = ft2.c1)
         ->  Foreign Scan on public.ft2_a ft2
               Output: ft2.c1
                 Remote SQL: SELECT C_1 FROM T_1 WHERE (C_1 >= 10) AND (C_1 <= 15)
         ->  Materialize
               Output: (13)
               ->  Foreign Scan on public.ft1_a ft1
                     Output: 13
                       Remote SQL: SELECT * FROM T_1 WHERE (C_1 = 13)
(14 rows)

--Testcase 186:
SELECT q.a, ft2.c1 FROM (SELECT 13 FROM ft1 WHERE c1 = 13) q(a) RIGHT JOIN ft2 ON (q.a = ft2.c1) WHERE ft2.c1 BETWEEN 10 AND 15 ORDER BY c1;
 a  | c1 
----+----
    | 10
    | 11
    | 12
 13 | 13
    | 14
    | 15
(6 rows)

-- ok to push {ft1, ft2} but not {ft1, ft2, ft4}
--Testcase 187:
EXPLAIN (VERBOSE, COSTS OFF)
SELECT ft4.c1, q.* FROM ft4 LEFT JOIN (SELECT 13, ft1.c1, ft2.c1 FROM ft1 RIGHT JOIN ft2 ON (ft1.c1 = ft2.c1) WHERE ft1.c1 = 12) q(a, b, c) ON (ft4.c1 = q.b) WHERE ft4.c1 BETWEEN 10 AND 15;
                                   QUERY PLAN                                   
--------------------------------------------------------------------------------
 Hash Right Join
   Output: ft4.c1, (13), ft1.c1, ft2.c1
   Hash Cond: (ft1.c1 = ft4.c1)
   ->  Nested Loop
         Output: ft1.c1, ft2.c1, 13
         ->  Foreign Scan on public.ft1_a ft1
               Output: ft1.c1
                 Remote SQL: SELECT C_1 FROM T_1 WHERE (C_1 = 12)
         ->  Materialize
               Output: ft2.c1
               ->  Foreign Scan on public.ft2_a ft2
                     Output: ft2.c1
                       Remote SQL: SELECT C_1 FROM T_1 WHERE (C_1 = 12)
   ->  Hash
         Output: ft4.c1
         ->  Foreign Scan on public.ft4_a ft4
               Output: ft4.c1
                 Remote SQL: SELECT c1 FROM T_3 WHERE (c1 >= 10) AND (c1 <= 15)
(18 rows)

--Testcase 188:
SELECT ft4.c1, q.* FROM ft4 LEFT JOIN (SELECT 13, ft1.c1, ft2.c1 FROM ft1 RIGHT JOIN ft2 ON (ft1.c1 = ft2.c1) WHERE ft1.c1 = 12) q(a, b, c) ON (ft4.c1 = q.b) WHERE ft4.c1 BETWEEN 10 AND 15 ORDER BY 1;
 c1 | a  | b  | c  
----+----+----+----
 10 |    |    |   
 12 | 13 | 12 | 12
 14 |    |    |   
(3 rows)

-- join with nullable side with some columns with null values
--Testcase 189:
UPDATE ft5_a_child SET c3 = null where c1 % 9 = 0;
--Testcase 190:
EXPLAIN (VERBOSE, COSTS OFF)
SELECT ft5, ft5.c1, ft5.c2, ft5.c3, ft4.c1, ft4.c2 FROM ft5 left join ft4 on ft5.c1 = ft4.c1 WHERE ft4.c1 BETWEEN 10 and 30 ORDER BY ft5.c1, ft4.c1;
                                        QUERY PLAN                                        
------------------------------------------------------------------------------------------
 Sort
   Output: ((ft5.*)::ft5), ft5.c1, ft5.c2, ft5.c3, ft4.c1, ft4.c2
   Sort Key: ft5.c1
   ->  Hash Join
         Output: ((ft5.*)::ft5), ft5.c1, ft5.c2, ft5.c3, ft4.c1, ft4.c2
         Hash Cond: (ft5.c1 = ft4.c1)
         ->  Foreign Scan on public.ft5_a ft5
               Output: ft5.*, ft5.c1, ft5.c2, ft5.c3
                 Remote SQL: SELECT c1, c2, c3 FROM T_4
         ->  Hash
               Output: ft4.c1, ft4.c2
               ->  Foreign Scan on public.ft4_a ft4
                     Output: ft4.c1, ft4.c2
                       Remote SQL: SELECT c1, c2 FROM T_3 WHERE (c1 >= 10) AND (c1 <= 30)
(14 rows)

--Testcase 191:
SELECT ft5, ft5.c1, ft5.c2, ft5.c3, ft4.c1, ft4.c2 FROM ft5 left join ft4 on ft5.c1 = ft4.c1 WHERE ft4.c1 BETWEEN 10 and 30 ORDER BY ft5.c1, ft4.c1;
          ft5           | c1 | c2 |   c3   | c1 | c2 
------------------------+----+----+--------+----+----
 (12,13,AAA012,/node1/) | 12 | 13 | AAA012 | 12 | 13
 (18,19,,/node1/)       | 18 | 19 |        | 18 | 19
 (24,25,AAA024,/node1/) | 24 | 25 | AAA024 | 24 | 25
 (30,31,AAA030,/node1/) | 30 | 31 | AAA030 | 30 | 31
(4 rows)

-- multi-way join involving multiple merge joins
-- (this case used to have EPQ-related planning problems)
-- CREATE TABLE local_tbl (c1 int NOT NULL, c2 int NOT NULL, c3 text, CONSTRAINT local_tbl_pkey PRIMARY KEY (c1));
--Testcase 192:
CREATE FOREIGN TABLE local_tbl_a_child (c1 int, c2 int, c3 text) SERVER dynamodb_server OPTIONS (table_name 'local_tbl', partition_key 'c1');
--Testcase 193:
CREATE TABLE local_tbl (c1 int, c2 int, c3 text, spdurl text) PARTITION BY LIST (spdurl);
--Testcase 194:
CREATE FOREIGN TABLE local_tbl_a PARTITION OF local_tbl FOR VALUES IN ('/node1/') SERVER spdsrv;
--Testcase 195:
INSERT INTO local_tbl_a_child SELECT id, id % 10, to_char(id, 'FM0000') FROM generate_series(1, 1000) id;
-- ANALYZE local_tbl;
SET enable_nestloop TO false;
SET enable_hashjoin TO false;
--Testcase 196:
EXPLAIN (VERBOSE, COSTS OFF)
SELECT * FROM ft1, ft2, ft4, ft5, local_tbl WHERE ft1.c1 = ft2.c1 AND ft1.c2 = ft4.c1
    AND ft1.c2 = ft5.c1 AND ft1.c2 = local_tbl.c1 AND ft1.c1 < 100 AND ft2.c1 < 100 ORDER BY 1 FOR UPDATE;
                                                                                                                                                                                                                                                                 QUERY PLAN                                                                                                                                                                                                                                                                 
--------------------------------------------------------------------------------------------------------------------------------------------------------------------------------------------------------------------------------------------------------------------------------------------------------------------------------------------------------------------------------------------------------------------------------------------------------------------------------------------------------------------------------------------
 LockRows
   Output: ft1.c1, ft1.c2, ft1.c3, ft1.c4, ft1.c5, ft1.c6, ft1.c7, ft1.c8, ft1.spdurl, ft2.c1, ft2.c2, ft2.c3, ft2.c4, ft2.c5, ft2.c6, ft2.c7, ft2.c8, ft2.spdurl, ft4.c1, ft4.c2, ft4.c3, ft4.spdurl, ft5.c1, ft5.c2, ft5.c3, ft5.spdurl, local_tbl.c1, local_tbl.c2, local_tbl.c3, local_tbl.spdurl, ft1.ctid, ft2.ctid, ft4.ctid, ft5.ctid, local_tbl.ctid, ((ft1.*)::ft1), ft1.tableoid, ((ft2.*)::ft2), ft2.tableoid, ((ft4.*)::ft4), ft4.tableoid, ((ft5.*)::ft5), ft5.tableoid, ((local_tbl.*)::local_tbl), local_tbl.tableoid
   ->  Merge Join
         Output: ft1.c1, ft1.c2, ft1.c3, ft1.c4, ft1.c5, ft1.c6, ft1.c7, ft1.c8, ft1.spdurl, ft2.c1, ft2.c2, ft2.c3, ft2.c4, ft2.c5, ft2.c6, ft2.c7, ft2.c8, ft2.spdurl, ft4.c1, ft4.c2, ft4.c3, ft4.spdurl, ft5.c1, ft5.c2, ft5.c3, ft5.spdurl, local_tbl.c1, local_tbl.c2, local_tbl.c3, local_tbl.spdurl, ft1.ctid, ft2.ctid, ft4.ctid, ft5.ctid, local_tbl.ctid, ((ft1.*)::ft1), ft1.tableoid, ((ft2.*)::ft2), ft2.tableoid, ((ft4.*)::ft4), ft4.tableoid, ((ft5.*)::ft5), ft5.tableoid, ((local_tbl.*)::local_tbl), local_tbl.tableoid
         Merge Cond: (ft2.c1 = ft1.c1)
         ->  Sort
               Output: ft2.c1, ft2.c2, ft2.c3, ft2.c4, ft2.c5, ft2.c6, ft2.c7, ft2.c8, ft2.spdurl, ft2.ctid, ((ft2.*)::ft2), ft2.tableoid
               Sort Key: ft2.c1
               ->  Foreign Scan on public.ft2_a ft2
                     Output: ft2.c1, ft2.c2, ft2.c3, ft2.c4, ft2.c5, ft2.c6, ft2.c7, ft2.c8, ft2.spdurl, ft2.ctid, ft2.*, ft2.tableoid
                       Remote SQL: SELECT C_1, c2, c3, c4, c5, c6, c7, c8 FROM T_1 WHERE (C_1 < 100)
         ->  Materialize
               Output: ft1.c1, ft1.c2, ft1.c3, ft1.c4, ft1.c5, ft1.c6, ft1.c7, ft1.c8, ft1.spdurl, ft1.ctid, ((ft1.*)::ft1), ft1.tableoid, ft4.c1, ft4.c2, ft4.c3, ft4.spdurl, ft4.ctid, ((ft4.*)::ft4), ft4.tableoid, ft5.c1, ft5.c2, ft5.c3, ft5.spdurl, ft5.ctid, ((ft5.*)::ft5), ft5.tableoid, local_tbl.c1, local_tbl.c2, local_tbl.c3, local_tbl.spdurl, local_tbl.ctid, ((local_tbl.*)::local_tbl), local_tbl.tableoid
               ->  Sort
                     Output: ft1.c1, ft1.c2, ft1.c3, ft1.c4, ft1.c5, ft1.c6, ft1.c7, ft1.c8, ft1.spdurl, ft1.ctid, ((ft1.*)::ft1), ft1.tableoid, ft4.c1, ft4.c2, ft4.c3, ft4.spdurl, ft4.ctid, ((ft4.*)::ft4), ft4.tableoid, ft5.c1, ft5.c2, ft5.c3, ft5.spdurl, ft5.ctid, ((ft5.*)::ft5), ft5.tableoid, local_tbl.c1, local_tbl.c2, local_tbl.c3, local_tbl.spdurl, local_tbl.ctid, ((local_tbl.*)::local_tbl), local_tbl.tableoid
                     Sort Key: ft1.c1
                     ->  Merge Join
                           Output: ft1.c1, ft1.c2, ft1.c3, ft1.c4, ft1.c5, ft1.c6, ft1.c7, ft1.c8, ft1.spdurl, ft1.ctid, ((ft1.*)::ft1), ft1.tableoid, ft4.c1, ft4.c2, ft4.c3, ft4.spdurl, ft4.ctid, ((ft4.*)::ft4), ft4.tableoid, ft5.c1, ft5.c2, ft5.c3, ft5.spdurl, ft5.ctid, ((ft5.*)::ft5), ft5.tableoid, local_tbl.c1, local_tbl.c2, local_tbl.c3, local_tbl.spdurl, local_tbl.ctid, ((local_tbl.*)::local_tbl), local_tbl.tableoid
                           Merge Cond: (ft1.c2 = ft5.c1)
                           ->  Merge Join
                                 Output: ft1.c1, ft1.c2, ft1.c3, ft1.c4, ft1.c5, ft1.c6, ft1.c7, ft1.c8, ft1.spdurl, ft1.ctid, ((ft1.*)::ft1), ft1.tableoid, ft4.c1, ft4.c2, ft4.c3, ft4.spdurl, ft4.ctid, ((ft4.*)::ft4), ft4.tableoid
                                 Merge Cond: (ft1.c2 = ft4.c1)
                                 ->  Sort
                                       Output: ft1.c1, ft1.c2, ft1.c3, ft1.c4, ft1.c5, ft1.c6, ft1.c7, ft1.c8, ft1.spdurl, ft1.ctid, ((ft1.*)::ft1), ft1.tableoid
                                       Sort Key: ft1.c2
                                       ->  Foreign Scan on public.ft1_a ft1
                                             Output: ft1.c1, ft1.c2, ft1.c3, ft1.c4, ft1.c5, ft1.c6, ft1.c7, ft1.c8, ft1.spdurl, ft1.ctid, ft1.*, ft1.tableoid
                                               Remote SQL: SELECT C_1, c2, c3, c4, c5, c6, c7, c8 FROM T_1 WHERE (C_1 < 100)
                                 ->  Sort
                                       Output: ft4.c1, ft4.c2, ft4.c3, ft4.spdurl, ft4.ctid, ((ft4.*)::ft4), ft4.tableoid
                                       Sort Key: ft4.c1
                                       ->  Foreign Scan on public.ft4_a ft4
                                             Output: ft4.c1, ft4.c2, ft4.c3, ft4.spdurl, ft4.ctid, ft4.*, ft4.tableoid
                                               Remote SQL: SELECT c1, c2, c3 FROM T_3
                           ->  Materialize
                                 Output: ft5.c1, ft5.c2, ft5.c3, ft5.spdurl, ft5.ctid, ((ft5.*)::ft5), ft5.tableoid, local_tbl.c1, local_tbl.c2, local_tbl.c3, local_tbl.spdurl, local_tbl.ctid, ((local_tbl.*)::local_tbl), local_tbl.tableoid
                                 ->  Merge Join
                                       Output: ft5.c1, ft5.c2, ft5.c3, ft5.spdurl, ft5.ctid, ((ft5.*)::ft5), ft5.tableoid, local_tbl.c1, local_tbl.c2, local_tbl.c3, local_tbl.spdurl, local_tbl.ctid, ((local_tbl.*)::local_tbl), local_tbl.tableoid
                                       Merge Cond: (ft5.c1 = local_tbl.c1)
                                       ->  Sort
                                             Output: ft5.c1, ft5.c2, ft5.c3, ft5.spdurl, ft5.ctid, ((ft5.*)::ft5), ft5.tableoid
                                             Sort Key: ft5.c1
                                             ->  Foreign Scan on public.ft5_a ft5
                                                   Output: ft5.c1, ft5.c2, ft5.c3, ft5.spdurl, ft5.ctid, ft5.*, ft5.tableoid
                                                     Remote SQL: SELECT c1, c2, c3 FROM T_4
                                       ->  Sort
                                             Output: local_tbl.c1, local_tbl.c2, local_tbl.c3, local_tbl.spdurl, local_tbl.ctid, ((local_tbl.*)::local_tbl), local_tbl.tableoid
                                             Sort Key: local_tbl.c1
                                             ->  Foreign Scan on public.local_tbl_a local_tbl
                                                   Output: local_tbl.c1, local_tbl.c2, local_tbl.c3, local_tbl.spdurl, local_tbl.ctid, local_tbl.*, local_tbl.tableoid
                                                     Remote SQL: SELECT c1, c2, c3 FROM local_tbl
(51 rows)

--Testcase 197:
SELECT * FROM ft1, ft2, ft4, ft5, local_tbl WHERE ft1.c1 = ft2.c1 AND ft1.c2 = ft4.c1
    AND ft1.c2 = ft5.c1 AND ft1.c2 = local_tbl.c1 AND ft1.c1 < 100 AND ft2.c1 < 100 ORDER BY 1 FOR UPDATE;
 c1 | c2 |  c3   |              c4              |            c5            | c6 |     c7     | c8  | spdurl  | c1 | c2 |  c3   |              c4              |            c5            | c6 |     c7     | c8  | spdurl  | c1 | c2 |   c3   | spdurl  | c1 | c2 |   c3   | spdurl  | c1 | c2 |  c3  | spdurl  
----+----+-------+------------------------------+--------------------------+----+------------+-----+---------+----+----+-------+------------------------------+--------------------------+----+------------+-----+---------+----+----+--------+---------+----+----+--------+---------+----+----+------+---------
  6 |  6 | 00006 | Wed Jan 07 00:00:00 1970 PST | Wed Jan 07 00:00:00 1970 | 6  | 6          | foo | /node1/ |  6 |  6 | 00006 | Wed Jan 07 00:00:00 1970 PST | Wed Jan 07 00:00:00 1970 | 6  | 6          | foo | /node1/ |  6 |  7 | AAA006 | /node1/ |  6 |  7 | AAA006 | /node1/ |  6 |  6 | 0006 | /node1/
 16 |  6 | 00016 | Sat Jan 17 00:00:00 1970 PST | Sat Jan 17 00:00:00 1970 | 6  | 6          | foo | /node1/ | 16 |  6 | 00016 | Sat Jan 17 00:00:00 1970 PST | Sat Jan 17 00:00:00 1970 | 6  | 6          | foo | /node1/ |  6 |  7 | AAA006 | /node1/ |  6 |  7 | AAA006 | /node1/ |  6 |  6 | 0006 | /node1/
 26 |  6 | 00026 | Tue Jan 27 00:00:00 1970 PST | Tue Jan 27 00:00:00 1970 | 6  | 6          | foo | /node1/ | 26 |  6 | 00026 | Tue Jan 27 00:00:00 1970 PST | Tue Jan 27 00:00:00 1970 | 6  | 6          | foo | /node1/ |  6 |  7 | AAA006 | /node1/ |  6 |  7 | AAA006 | /node1/ |  6 |  6 | 0006 | /node1/
 36 |  6 | 00036 | Fri Feb 06 00:00:00 1970 PST | Fri Feb 06 00:00:00 1970 | 6  | 6          | foo | /node1/ | 36 |  6 | 00036 | Fri Feb 06 00:00:00 1970 PST | Fri Feb 06 00:00:00 1970 | 6  | 6          | foo | /node1/ |  6 |  7 | AAA006 | /node1/ |  6 |  7 | AAA006 | /node1/ |  6 |  6 | 0006 | /node1/
 46 |  6 | 00046 | Mon Feb 16 00:00:00 1970 PST | Mon Feb 16 00:00:00 1970 | 6  | 6          | foo | /node1/ | 46 |  6 | 00046 | Mon Feb 16 00:00:00 1970 PST | Mon Feb 16 00:00:00 1970 | 6  | 6          | foo | /node1/ |  6 |  7 | AAA006 | /node1/ |  6 |  7 | AAA006 | /node1/ |  6 |  6 | 0006 | /node1/
 56 |  6 | 00056 | Thu Feb 26 00:00:00 1970 PST | Thu Feb 26 00:00:00 1970 | 6  | 6          | foo | /node1/ | 56 |  6 | 00056 | Thu Feb 26 00:00:00 1970 PST | Thu Feb 26 00:00:00 1970 | 6  | 6          | foo | /node1/ |  6 |  7 | AAA006 | /node1/ |  6 |  7 | AAA006 | /node1/ |  6 |  6 | 0006 | /node1/
 66 |  6 | 00066 | Sun Mar 08 00:00:00 1970 PST | Sun Mar 08 00:00:00 1970 | 6  | 6          | foo | /node1/ | 66 |  6 | 00066 | Sun Mar 08 00:00:00 1970 PST | Sun Mar 08 00:00:00 1970 | 6  | 6          | foo | /node1/ |  6 |  7 | AAA006 | /node1/ |  6 |  7 | AAA006 | /node1/ |  6 |  6 | 0006 | /node1/
 76 |  6 | 00076 | Wed Mar 18 00:00:00 1970 PST | Wed Mar 18 00:00:00 1970 | 6  | 6          | foo | /node1/ | 76 |  6 | 00076 | Wed Mar 18 00:00:00 1970 PST | Wed Mar 18 00:00:00 1970 | 6  | 6          | foo | /node1/ |  6 |  7 | AAA006 | /node1/ |  6 |  7 | AAA006 | /node1/ |  6 |  6 | 0006 | /node1/
 86 |  6 | 00086 | Sat Mar 28 00:00:00 1970 PST | Sat Mar 28 00:00:00 1970 | 6  | 6          | foo | /node1/ | 86 |  6 | 00086 | Sat Mar 28 00:00:00 1970 PST | Sat Mar 28 00:00:00 1970 | 6  | 6          | foo | /node1/ |  6 |  7 | AAA006 | /node1/ |  6 |  7 | AAA006 | /node1/ |  6 |  6 | 0006 | /node1/
 96 |  6 | 00096 | Tue Apr 07 00:00:00 1970 PST | Tue Apr 07 00:00:00 1970 | 6  | 6          | foo | /node1/ | 96 |  6 | 00096 | Tue Apr 07 00:00:00 1970 PST | Tue Apr 07 00:00:00 1970 | 6  | 6          | foo | /node1/ |  6 |  7 | AAA006 | /node1/ |  6 |  7 | AAA006 | /node1/ |  6 |  6 | 0006 | /node1/
(10 rows)

RESET enable_nestloop;
RESET enable_hashjoin;
--Testcase 198:
DROP FOREIGN TABLE local_tbl_a_child;
--Testcase 199:
DROP TABLE local_tbl;
-- check join pushdown in situations where multiple userids are involved
--Testcase 200:
CREATE ROLE regress_view_owner SUPERUSER;
--Testcase 201:
CREATE USER MAPPING FOR regress_view_owner SERVER dynamodb_server 
  OPTIONS (user :DYNAMODB_USER, password :DYNAMODB_PASSWORD);
GRANT SELECT ON ft4 TO regress_view_owner;
GRANT SELECT ON ft5 TO regress_view_owner;
--Testcase 202:
CREATE VIEW v4 AS SELECT * FROM ft4;
--Testcase 203:
CREATE VIEW v5 AS SELECT * FROM ft5;
ALTER VIEW v5 OWNER TO regress_view_owner;
--Testcase 204:
EXPLAIN (VERBOSE, COSTS OFF)
SELECT t1.c1, t2.c2 FROM v4 t1 LEFT JOIN v5 t2 ON (t1.c1 = t2.c1) ORDER BY t1.c1, t2.c1 OFFSET 10 LIMIT 10;  -- can't be pushed down, different view owners
                           QUERY PLAN                           
----------------------------------------------------------------
 Limit
   Output: ft4.c1, ft5.c2, ft5.c1
   ->  Incremental Sort
         Output: ft4.c1, ft5.c2, ft5.c1
         Sort Key: ft4.c1, ft5.c1
         Presorted Key: ft4.c1
         ->  Merge Left Join
               Output: ft4.c1, ft5.c2, ft5.c1
               Merge Cond: (ft4.c1 = ft5.c1)
               ->  Sort
                     Output: ft4.c1
                     Sort Key: ft4.c1
                     ->  Foreign Scan on public.ft4_a ft4
                           Output: ft4.c1
                             Remote SQL: SELECT c1 FROM T_3
               ->  Sort
                     Output: ft5.c2, ft5.c1
                     Sort Key: ft5.c1
                     ->  Foreign Scan on public.ft5_a ft5
                           Output: ft5.c2, ft5.c1
                             Remote SQL: SELECT c1, c2 FROM T_4
(21 rows)

--Testcase 205:
SELECT t1.c1, t2.c2 FROM v4 t1 LEFT JOIN v5 t2 ON (t1.c1 = t2.c1) ORDER BY t1.c1, t2.c1 OFFSET 10 LIMIT 10;
 c1 | c2 
----+----
 22 |   
 24 | 25
 26 |   
 28 |   
 30 | 31
 32 |   
 34 |   
 36 | 37
 38 |   
 40 |   
(10 rows)

ALTER VIEW v4 OWNER TO regress_view_owner;
--Testcase 206:
EXPLAIN (VERBOSE, COSTS OFF)
SELECT t1.c1, t2.c2 FROM v4 t1 LEFT JOIN v5 t2 ON (t1.c1 = t2.c1) ORDER BY t1.c1, t2.c1 OFFSET 10 LIMIT 10;  -- can be pushed down
                           QUERY PLAN                           
----------------------------------------------------------------
 Limit
   Output: ft4.c1, ft5.c2, ft5.c1
   ->  Incremental Sort
         Output: ft4.c1, ft5.c2, ft5.c1
         Sort Key: ft4.c1, ft5.c1
         Presorted Key: ft4.c1
         ->  Merge Left Join
               Output: ft4.c1, ft5.c2, ft5.c1
               Merge Cond: (ft4.c1 = ft5.c1)
               ->  Sort
                     Output: ft4.c1
                     Sort Key: ft4.c1
                     ->  Foreign Scan on public.ft4_a ft4
                           Output: ft4.c1
                             Remote SQL: SELECT c1 FROM T_3
               ->  Sort
                     Output: ft5.c2, ft5.c1
                     Sort Key: ft5.c1
                     ->  Foreign Scan on public.ft5_a ft5
                           Output: ft5.c2, ft5.c1
                             Remote SQL: SELECT c1, c2 FROM T_4
(21 rows)

--Testcase 207:
SELECT t1.c1, t2.c2 FROM v4 t1 LEFT JOIN v5 t2 ON (t1.c1 = t2.c1) ORDER BY t1.c1, t2.c1 OFFSET 10 LIMIT 10;
 c1 | c2 
----+----
 22 |   
 24 | 25
 26 |   
 28 |   
 30 | 31
 32 |   
 34 |   
 36 | 37
 38 |   
 40 |   
(10 rows)

--Testcase 208:
EXPLAIN (VERBOSE, COSTS OFF)
SELECT t1.c1, t2.c2 FROM v4 t1 LEFT JOIN ft5 t2 ON (t1.c1 = t2.c1) ORDER BY t1.c1, t2.c1 OFFSET 10 LIMIT 10;  -- can't be pushed down, view owner not current user
                           QUERY PLAN                           
----------------------------------------------------------------
 Limit
   Output: ft4.c1, t2.c2, t2.c1
   ->  Incremental Sort
         Output: ft4.c1, t2.c2, t2.c1
         Sort Key: ft4.c1, t2.c1
         Presorted Key: ft4.c1
         ->  Merge Left Join
               Output: ft4.c1, t2.c2, t2.c1
               Merge Cond: (ft4.c1 = t2.c1)
               ->  Sort
                     Output: ft4.c1
                     Sort Key: ft4.c1
                     ->  Foreign Scan on public.ft4_a ft4
                           Output: ft4.c1
                             Remote SQL: SELECT c1 FROM T_3
               ->  Sort
                     Output: t2.c2, t2.c1
                     Sort Key: t2.c1
                     ->  Foreign Scan on public.ft5_a t2
                           Output: t2.c2, t2.c1
                             Remote SQL: SELECT c1, c2 FROM T_4
(21 rows)

--Testcase 209:
SELECT t1.c1, t2.c2 FROM v4 t1 LEFT JOIN ft5 t2 ON (t1.c1 = t2.c1) ORDER BY t1.c1, t2.c1 OFFSET 10 LIMIT 10;
 c1 | c2 
----+----
 22 |   
 24 | 25
 26 |   
 28 |   
 30 | 31
 32 |   
 34 |   
 36 | 37
 38 |   
 40 |   
(10 rows)

ALTER VIEW v4 OWNER TO CURRENT_USER;
--Testcase 210:
EXPLAIN (VERBOSE, COSTS OFF)
SELECT t1.c1, t2.c2 FROM v4 t1 LEFT JOIN ft5 t2 ON (t1.c1 = t2.c1) ORDER BY t1.c1, t2.c1 OFFSET 10 LIMIT 10;  -- can be pushed down
                           QUERY PLAN                           
----------------------------------------------------------------
 Limit
   Output: ft4.c1, t2.c2, t2.c1
   ->  Incremental Sort
         Output: ft4.c1, t2.c2, t2.c1
         Sort Key: ft4.c1, t2.c1
         Presorted Key: ft4.c1
         ->  Merge Left Join
               Output: ft4.c1, t2.c2, t2.c1
               Merge Cond: (ft4.c1 = t2.c1)
               ->  Sort
                     Output: ft4.c1
                     Sort Key: ft4.c1
                     ->  Foreign Scan on public.ft4_a ft4
                           Output: ft4.c1
                             Remote SQL: SELECT c1 FROM T_3
               ->  Sort
                     Output: t2.c2, t2.c1
                     Sort Key: t2.c1
                     ->  Foreign Scan on public.ft5_a t2
                           Output: t2.c2, t2.c1
                             Remote SQL: SELECT c1, c2 FROM T_4
(21 rows)

--Testcase 211:
SELECT t1.c1, t2.c2 FROM v4 t1 LEFT JOIN ft5 t2 ON (t1.c1 = t2.c1) ORDER BY t1.c1, t2.c1 OFFSET 10 LIMIT 10;
 c1 | c2 
----+----
 22 |   
 24 | 25
 26 |   
 28 |   
 30 | 31
 32 |   
 34 |   
 36 | 37
 38 |   
 40 |   
(10 rows)

ALTER VIEW v4 OWNER TO regress_view_owner;
-- cleanup
--Testcase 212:
DROP OWNED BY regress_view_owner;
--Testcase 213:
DROP ROLE regress_view_owner;
-- ===================================================================
-- Aggregate and grouping queries
-- ===================================================================
-- DynamoDB FDW does not support any aggregate function => not push down
-- Simple aggregates
--Testcase 214:
explain (verbose, costs off)
select count(c6), sum(c1), avg(c1), min(c2), max(c1), stddev(c2), sum(c1) * (random() <= 1)::int as sum2 from ft1 where c2 < 5 group by c2 order by 1, 2;
                                                                                    QUERY PLAN                                                                                     
-----------------------------------------------------------------------------------------------------------------------------------------------------------------------------------
 Result
   Output: (count(ft1.c6)), (sum(ft1.c1)), (avg(ft1.c1)), (min(ft1.c2)), (max(ft1.c1)), (stddev(ft1.c2)), ((sum(ft1.c1)) * ((random() <= '1'::double precision))::integer), ft1.c2
   ->  Sort
         Output: (count(ft1.c6)), (sum(ft1.c1)), (avg(ft1.c1)), (min(ft1.c2)), (max(ft1.c1)), (stddev(ft1.c2)), ft1.c2
         Sort Key: (count(ft1.c6)), (sum(ft1.c1))
         ->  HashAggregate
               Output: count(ft1.c6), sum(ft1.c1), avg(ft1.c1), min(ft1.c2), max(ft1.c1), stddev(ft1.c2), ft1.c2
               Group Key: ft1.c2
               ->  Foreign Scan on public.ft1_a ft1
                     Output: ft1.c2, ft1.c6, ft1.c1
                       Remote SQL: SELECT C_1, c2, c6 FROM T_1 WHERE (c2 < 5)
(11 rows)

--Testcase 215:
select count(c6), sum(c1), avg(c1), min(c2), max(c1), stddev(c2), sum(c1) * (random() <= 1)::int as sum2 from ft1 where c2 < 5 group by c2 order by 1, 2;
 count |  sum  |         avg          | min | max  | stddev | sum2  
-------+-------+----------------------+-----+------+--------+-------
   100 | 49600 | 496.0000000000000000 |   1 |  991 |      0 | 49600
   100 | 49700 | 497.0000000000000000 |   2 |  992 |      0 | 49700
   100 | 49800 | 498.0000000000000000 |   3 |  993 |      0 | 49800
   100 | 49900 | 499.0000000000000000 |   4 |  994 |      0 | 49900
   100 | 50500 | 505.0000000000000000 |   0 | 1000 |      0 | 50500
(5 rows)

--Testcase 216:
explain (verbose, costs off)
select count(c6), sum(c1), avg(c1), min(c2), max(c1), stddev(c2), sum(c1) * (random() <= 1)::int as sum2 from ft1 where c2 < 5 group by c2 order by 1, 2 limit 1;
                                                                                       QUERY PLAN                                                                                        
-----------------------------------------------------------------------------------------------------------------------------------------------------------------------------------------
 Limit
   Output: (count(ft1.c6)), (sum(ft1.c1)), (avg(ft1.c1)), (min(ft1.c2)), (max(ft1.c1)), (stddev(ft1.c2)), (((sum(ft1.c1)) * ((random() <= '1'::double precision))::integer)), ft1.c2
   ->  Result
         Output: (count(ft1.c6)), (sum(ft1.c1)), (avg(ft1.c1)), (min(ft1.c2)), (max(ft1.c1)), (stddev(ft1.c2)), ((sum(ft1.c1)) * ((random() <= '1'::double precision))::integer), ft1.c2
         ->  Sort
               Output: (count(ft1.c6)), (sum(ft1.c1)), (avg(ft1.c1)), (min(ft1.c2)), (max(ft1.c1)), (stddev(ft1.c2)), ft1.c2
               Sort Key: (count(ft1.c6)), (sum(ft1.c1))
               ->  HashAggregate
                     Output: count(ft1.c6), sum(ft1.c1), avg(ft1.c1), min(ft1.c2), max(ft1.c1), stddev(ft1.c2), ft1.c2
                     Group Key: ft1.c2
                     ->  Foreign Scan on public.ft1_a ft1
                           Output: ft1.c2, ft1.c6, ft1.c1
                             Remote SQL: SELECT C_1, c2, c6 FROM T_1 WHERE (c2 < 5)
(13 rows)

--Testcase 217:
select count(c6), sum(c1), avg(c1), min(c2), max(c1), stddev(c2), sum(c1) * (random() <= 1)::int as sum2 from ft1 where c2 < 5 group by c2 order by 1, 2 limit 1;
 count |  sum  |         avg          | min | max | stddev | sum2  
-------+-------+----------------------+-----+-----+--------+-------
   100 | 49600 | 496.0000000000000000 |   1 | 991 |      0 | 49600
(1 row)

-- Aggregate is not pushed down as aggregation contains random()
--Testcase 218:
explain (verbose, costs off)
select sum(c1 * (random() <= 1)::int) as sum, avg(c1) from ft1;
                                      QUERY PLAN                                       
---------------------------------------------------------------------------------------
 Aggregate
   Output: sum((ft1.c1 * ((random() <= '1'::double precision))::integer)), avg(ft1.c1)
   ->  Foreign Scan on public.ft1_a ft1
         Output: ft1.c1
           Remote SQL: SELECT C_1 FROM T_1
(5 rows)

-- Aggregate over join query
--Testcase 219:
explain (verbose, costs off)
select count(*), sum(t1.c1), avg(t2.c1) from ft1 t1 inner join ft1 t2 on (t1.c2 = t2.c2) where t1.c2 = 6;
                                QUERY PLAN                                
--------------------------------------------------------------------------
 Aggregate
   Output: count(*), sum(t1.c1), avg(t2.c1)
   ->  Nested Loop
         Output: t1.c1, t2.c1
         ->  Foreign Scan on public.ft1_a t1
               Output: t1.c1, t1.c2
                 Remote SQL: SELECT C_1, c2 FROM T_1 WHERE (c2 = 6)
         ->  Materialize
               Output: t2.c1, t2.c2
               ->  Foreign Scan on public.ft1_a t2
                     Output: t2.c1, t2.c2
                       Remote SQL: SELECT C_1, c2 FROM T_1 WHERE (c2 = 6)
(12 rows)

--Testcase 220:
select count(*), sum(t1.c1), avg(t2.c1) from ft1 t1 inner join ft1 t2 on (t1.c2 = t2.c2) where t1.c2 = 6;
 count |   sum   |         avg          
-------+---------+----------------------
 10000 | 5010000 | 501.0000000000000000
(1 row)

-- Not pushed down due to local conditions present in underneath input rel
--Testcase 221:
explain (verbose, costs off)
select sum(t1.c1), count(t2.c1) from ft1 t1 inner join ft2 t2 on (t1.c1 = t2.c1) where ((t1.c1 * t2.c1)/(t1.c1 * t2.c1)) * random() <= 1;
                                                      QUERY PLAN                                                      
----------------------------------------------------------------------------------------------------------------------
 Aggregate
   Output: sum(t1.c1), count(t2.c1)
   ->  Merge Join
         Output: t1.c1, t2.c1
         Merge Cond: (t1.c1 = t2.c1)
         Join Filter: (((((t1.c1 * t2.c1) / (t1.c1 * t2.c1)))::double precision * random()) <= '1'::double precision)
         ->  Sort
               Output: t1.c1
               Sort Key: t1.c1
               ->  Foreign Scan on public.ft1_a t1
                     Output: t1.c1
                       Remote SQL: SELECT C_1 FROM T_1
         ->  Sort
               Output: t2.c1
               Sort Key: t2.c1
               ->  Foreign Scan on public.ft2_a t2
                     Output: t2.c1
                       Remote SQL: SELECT C_1 FROM T_1
(18 rows)

-- GROUP BY clause having expressions
--Testcase 222:
explain (verbose, costs off)
select c2/2, sum(c2) * (c2/2) from ft1 group by c2/2 order by c2/2;
                           QUERY PLAN                           
----------------------------------------------------------------
 Sort
   Output: ((ft1.c2 / 2)), ((sum(ft1.c2) * ((ft1.c2 / 2))))
   Sort Key: ((ft1.c2 / 2))
   ->  HashAggregate
         Output: ((ft1.c2 / 2)), (sum(ft1.c2) * ((ft1.c2 / 2)))
         Group Key: (ft1.c2 / 2)
         ->  Foreign Scan on public.ft1_a ft1
               Output: (ft1.c2 / 2), ft1.c2
                 Remote SQL: SELECT c2 FROM T_1
(9 rows)

--Testcase 223:
select c2/2, sum(c2) * (c2/2) from ft1 group by c2/2 order by c2/2;
 ?column? | ?column? 
----------+----------
        0 |        0
        1 |      500
        2 |     1800
        3 |     3900
        4 |     6800
(5 rows)

-- Aggregates in subquery are pushed down.
--Testcase 224:
explain (verbose, costs off)
select count(x.a), sum(x.a) from (select c2 a, sum(c1) b from ft1 group by c2, sqrt(c1) order by 1, 2) x;
                                  QUERY PLAN                                   
-------------------------------------------------------------------------------
 Aggregate
   Output: count(ft1.c2), sum(ft1.c2)
   ->  Sort
         Output: ft1.c2, (sum(ft1.c1)), (sqrt((ft1.c1)::double precision))
         Sort Key: ft1.c2, (sum(ft1.c1))
         ->  HashAggregate
               Output: ft1.c2, sum(ft1.c1), (sqrt((ft1.c1)::double precision))
               Group Key: ft1.c2, sqrt((ft1.c1)::double precision)
               ->  Foreign Scan on public.ft1_a ft1
                     Output: ft1.c2, sqrt((ft1.c1)::double precision), ft1.c1
                       Remote SQL: SELECT C_1, c2 FROM T_1
(11 rows)

--Testcase 225:
select count(x.a), sum(x.a) from (select c2 a, sum(c1) b from ft1 group by c2, sqrt(c1) order by 1, 2) x;
 count | sum  
-------+------
  1000 | 4500
(1 row)

-- Aggregate is still pushed down by taking unshippable expression out
--Testcase 226:
explain (verbose, costs off)
select c2 * (random() <= 1)::int as sum1, sum(c1) * c2 as sum2 from ft1 group by c2 order by 1, 2;
                                                QUERY PLAN                                                 
-----------------------------------------------------------------------------------------------------------
 Sort
   Output: ((ft1.c2 * ((random() <= '1'::double precision))::integer)), ((sum(ft1.c1) * ft1.c2)), ft1.c2
   Sort Key: ((ft1.c2 * ((random() <= '1'::double precision))::integer)), ((sum(ft1.c1) * ft1.c2))
   ->  HashAggregate
         Output: (ft1.c2 * ((random() <= '1'::double precision))::integer), (sum(ft1.c1) * ft1.c2), ft1.c2
         Group Key: ft1.c2
         ->  Foreign Scan on public.ft1_a ft1
               Output: ft1.c2, ft1.c1
                 Remote SQL: SELECT C_1, c2 FROM T_1
(9 rows)

--Testcase 227:
select c2 * (random() <= 1)::int as sum1, sum(c1) * c2 as sum2 from ft1 group by c2 order by 1, 2;
 sum1 |  sum2  
------+--------
    0 |      0
    1 |  49600
    2 |  99400
    3 | 149400
    4 | 199600
    5 | 250000
    6 | 300600
    7 | 351400
    8 | 402400
    9 | 453600
(10 rows)

-- Aggregate with unshippable GROUP BY clause are not pushed
--Testcase 228:
explain (verbose, costs off)
select c2 * (random() <= 1)::int as c2 from ft2 group by c2 * (random() <= 1)::int order by 1;
                                   QUERY PLAN                                    
---------------------------------------------------------------------------------
 Sort
   Output: ((ft2.c2 * ((random() <= '1'::double precision))::integer))
   Sort Key: ((ft2.c2 * ((random() <= '1'::double precision))::integer))
   ->  HashAggregate
         Output: ((ft2.c2 * ((random() <= '1'::double precision))::integer))
         Group Key: (ft2.c2 * ((random() <= '1'::double precision))::integer)
         ->  Foreign Scan on public.ft2_a ft2
               Output: (ft2.c2 * ((random() <= '1'::double precision))::integer)
                 Remote SQL: SELECT c2 FROM T_1
(9 rows)

-- GROUP BY clause in various forms, cardinal, alias and constant expression
--Testcase 229:
explain (verbose, costs off)
select count(c2) w, c2 x, 5 y, 7.0 z from ft1 group by 2, y, 9.0::int order by 2;
                      QUERY PLAN                      
------------------------------------------------------
 Sort
   Output: (count(ft1.c2)), ft1.c2, 5, 7.0, 9
   Sort Key: ft1.c2
   ->  HashAggregate
         Output: count(ft1.c2), ft1.c2, (5), 7.0, (9)
         Group Key: ft1.c2, 5, 9
         ->  Foreign Scan on public.ft1_a ft1
               Output: ft1.c2, 5, 9
                 Remote SQL: SELECT c2 FROM T_1
(9 rows)

--Testcase 230:
select count(c2) w, c2 x, 5 y, 7.0 z from ft1 group by 2, y, 9.0::int order by 2;
  w  | x | y |  z  
-----+---+---+-----
 100 | 0 | 5 | 7.0
 100 | 1 | 5 | 7.0
 100 | 2 | 5 | 7.0
 100 | 3 | 5 | 7.0
 100 | 4 | 5 | 7.0
 100 | 5 | 5 | 7.0
 100 | 6 | 5 | 7.0
 100 | 7 | 5 | 7.0
 100 | 8 | 5 | 7.0
 100 | 9 | 5 | 7.0
(10 rows)

-- GROUP BY clause referring to same column multiple times
-- Also, ORDER BY contains an aggregate function
--Testcase 231:
explain (verbose, costs off)
select c2, c2 from ft1 where c2 > 6 group by 1, 2 order by sum(c1);
                             QUERY PLAN                             
--------------------------------------------------------------------
 Sort
   Output: ft1.c2, ft1.c2, (sum(ft1.c1))
   Sort Key: (sum(ft1.c1))
   ->  HashAggregate
         Output: ft1.c2, ft1.c2, sum(ft1.c1)
         Group Key: ft1.c2, ft1.c2
         ->  Foreign Scan on public.ft1_a ft1
               Output: ft1.c2, ft1.c2, ft1.c1
                 Remote SQL: SELECT C_1, c2 FROM T_1 WHERE (c2 > 6)
(9 rows)

--Testcase 232:
select c2, c2 from ft1 where c2 > 6 group by 1, 2 order by sum(c1);
 c2 | c2 
----+----
  7 |  7
  8 |  8
  9 |  9
(3 rows)

-- Testing HAVING clause shippability
--Testcase 233:
explain (verbose, costs off)
select c2, sum(c1) from ft2 group by c2 having avg(c1) < 500 and sum(c1) < 49800 order by c2;
                                 QUERY PLAN                                 
----------------------------------------------------------------------------
 Sort
   Output: ft2.c2, (sum(ft2.c1))
   Sort Key: ft2.c2
   ->  Finalize HashAggregate
         Output: ft2.c2, sum(ft2.c1)
         Group Key: ft2.c2
         Filter: ((avg(ft2.c1) < '500'::numeric) AND (sum(ft2.c1) < 49800))
         ->  Partial HashAggregate
               Output: ft2.c2, PARTIAL sum(ft2.c1), PARTIAL avg(ft2.c1)
               Group Key: ft2.c2
               ->  Foreign Scan on public.ft2_a ft2
                     Output: ft2.c2, ft2.c1
                       Remote SQL: SELECT C_1, c2 FROM T_1
(13 rows)

--Testcase 234:
select c2, sum(c1) from ft2 group by c2 having avg(c1) < 500 and sum(c1) < 49800 order by c2;
 c2 |  sum  
----+-------
  1 | 49600
  2 | 49700
(2 rows)

-- Unshippable HAVING clause will be evaluated locally, and other qual in HAVING clause is pushed down
--Testcase 235:
explain (verbose, costs off)
select count(*) from (select c5, count(c1) from ft1 group by c5, sqrt(c2) having (avg(c1) / avg(c1)) * random() <= 1 and avg(c1) < 500) x;
                                                                  QUERY PLAN                                                                  
----------------------------------------------------------------------------------------------------------------------------------------------
 Aggregate
   Output: count(*)
   ->  Finalize HashAggregate
         Output: ft1.c5, NULL::bigint, (sqrt((ft1.c2)::double precision))
         Group Key: ft1.c5, (sqrt((ft1.c2)::double precision))
         Filter: ((avg(ft1.c1) < '500'::numeric) AND ((((avg(ft1.c1) / avg(ft1.c1)))::double precision * random()) <= '1'::double precision))
         ->  Partial HashAggregate
               Output: ft1.c5, (sqrt((ft1.c2)::double precision)), PARTIAL avg(ft1.c1)
               Group Key: ft1.c5, sqrt((ft1.c2)::double precision)
               ->  Foreign Scan on public.ft1_a ft1
                     Output: ft1.c5, sqrt((ft1.c2)::double precision), ft1.c1
                       Remote SQL: SELECT C_1, c2, c5 FROM T_1
(12 rows)

--Testcase 236:
select count(*) from (select c5, count(c1) from ft1 group by c5, sqrt(c2) having (avg(c1) / avg(c1)) * random() <= 1 and avg(c1) < 500) x;
 count 
-------
    49
(1 row)

-- Aggregate in HAVING clause is not pushable, and thus aggregation is not pushed down
--Testcase 237:
explain (verbose, costs off)
select sum(c1) from ft1 group by c2 having avg(c1 * (random() <= 1)::int) > 100 order by 1;
                                            QUERY PLAN                                             
---------------------------------------------------------------------------------------------------
 Sort
   Output: (sum(ft1.c1)), ft1.c2
   Sort Key: (sum(ft1.c1))
   ->  HashAggregate
         Output: sum(ft1.c1), ft1.c2
         Group Key: ft1.c2
         Filter: (avg((ft1.c1 * ((random() <= '1'::double precision))::integer)) > '100'::numeric)
         ->  Foreign Scan on public.ft1_a ft1
               Output: ft1.c2, ft1.c1
                 Remote SQL: SELECT C_1, c2 FROM T_1
(10 rows)

-- Remote aggregate in combination with a local Param (for the output
-- of an initplan) can be trouble, per bug #15781
--Testcase 238:
explain (verbose, costs off)
select exists(select 1 from pg_enum), sum(c1) from ft1;
                QUERY PLAN                 
-------------------------------------------
 Aggregate
   Output: $0, sum(ft1.c1)
   InitPlan 1 (returns $0)
     ->  Seq Scan on pg_catalog.pg_enum
   ->  Foreign Scan on public.ft1_a ft1
         Output: ft1.c1
           Remote SQL: SELECT C_1 FROM T_1
(7 rows)

--Testcase 239:
select exists(select 1 from pg_enum), sum(c1) from ft1;
 exists |  sum   
--------+--------
 t      | 500500
(1 row)

--Testcase 240:
explain (verbose, costs off)
select exists(select 1 from pg_enum), sum(c1) from ft1 group by 1;
                QUERY PLAN                 
-------------------------------------------
 GroupAggregate
   Output: ($0), sum(ft1.c1)
   Group Key: $0
   InitPlan 1 (returns $0)
     ->  Seq Scan on pg_catalog.pg_enum
   ->  Foreign Scan on public.ft1_a ft1
         Output: $0, ft1.c1
           Remote SQL: SELECT C_1 FROM T_1
(8 rows)

--Testcase 241:
select exists(select 1 from pg_enum), sum(c1) from ft1 group by 1;
 exists |  sum   
--------+--------
 t      | 500500
(1 row)

-- Testing ORDER BY, DISTINCT, FILTER, Ordered-sets and VARIADIC within aggregates
-- ORDER BY within aggregate, same column used to order
--Testcase 242:
explain (verbose, costs off)
select array_agg(c1 order by c1) from ft1 where c1 < 100 group by c2 order by 1;
                                 QUERY PLAN                                  
-----------------------------------------------------------------------------
 Sort
   Output: (array_agg(ft1.c1 ORDER BY ft1.c1)), ft1.c2
   Sort Key: (array_agg(ft1.c1 ORDER BY ft1.c1))
   ->  GroupAggregate
         Output: array_agg(ft1.c1 ORDER BY ft1.c1), ft1.c2
         Group Key: ft1.c2
         ->  Sort
               Output: ft1.c2, ft1.c1
               Sort Key: ft1.c2
               ->  Foreign Scan on public.ft1_a ft1
                     Output: ft1.c2, ft1.c1
                       Remote SQL: SELECT C_1, c2 FROM T_1 WHERE (C_1 < 100)
(12 rows)

--Testcase 243:
select array_agg(c1 order by c1) from ft1 where c1 < 100 group by c2 order by 1;
           array_agg            
--------------------------------
 {1,11,21,31,41,51,61,71,81,91}
 {2,12,22,32,42,52,62,72,82,92}
 {3,13,23,33,43,53,63,73,83,93}
 {4,14,24,34,44,54,64,74,84,94}
 {5,15,25,35,45,55,65,75,85,95}
 {6,16,26,36,46,56,66,76,86,96}
 {7,17,27,37,47,57,67,77,87,97}
 {8,18,28,38,48,58,68,78,88,98}
 {9,19,29,39,49,59,69,79,89,99}
 {10,20,30,40,50,60,70,80,90}
(10 rows)

-- ORDER BY within aggregate, different column used to order also using DESC
--Testcase 244:
explain (verbose, costs off)
select array_agg(c5 order by c1 desc) from ft2 where c2 = 6 and c1 < 50;
                                 QUERY PLAN                                  
-----------------------------------------------------------------------------
 Aggregate
   Output: array_agg(ft2.c5 ORDER BY ft2.c1 DESC)
   ->  Foreign Scan on public.ft2_a ft2
         Output: ft2.c5, ft2.c1
           Remote SQL: SELECT C_1, c5 FROM T_1 WHERE (C_1 < 50) AND (c2 = 6)
(5 rows)

--Testcase 245:
select array_agg(c5 order by c1 desc) from ft2 where c2 = 6 and c1 < 50;
                                                                array_agg                                                                 
------------------------------------------------------------------------------------------------------------------------------------------
 {"Mon Feb 16 00:00:00 1970","Fri Feb 06 00:00:00 1970","Tue Jan 27 00:00:00 1970","Sat Jan 17 00:00:00 1970","Wed Jan 07 00:00:00 1970"}
(1 row)

-- DISTINCT within aggregate
--Testcase 246:
explain (verbose, costs off)
select array_agg(distinct (t1.c1)%5) from ft4 t1 full join ft5 t2 on (t1.c1 = t2.c1) where t1.c1 < 20 or (t1.c1 is null and t2.c1 < 5) group by (t2.c1)%3 order by 1;
                                   QUERY PLAN                                    
---------------------------------------------------------------------------------
 Sort
   Output: (array_agg(DISTINCT (t1.c1 % 5))), ((t2.c1 % 3))
   Sort Key: (array_agg(DISTINCT (t1.c1 % 5)))
   ->  GroupAggregate
         Output: array_agg(DISTINCT (t1.c1 % 5)), ((t2.c1 % 3))
         Group Key: ((t2.c1 % 3))
         ->  Sort
               Output: ((t2.c1 % 3)), t1.c1
               Sort Key: ((t2.c1 % 3))
               ->  Merge Full Join
                     Output: (t2.c1 % 3), t1.c1
                     Merge Cond: (t1.c1 = t2.c1)
                     Filter: ((t1.c1 < 20) OR ((t1.c1 IS NULL) AND (t2.c1 < 5)))
                     ->  Sort
                           Output: t1.c1
                           Sort Key: t1.c1
                           ->  Foreign Scan on public.ft4_a t1
                                 Output: t1.c1
                                   Remote SQL: SELECT c1 FROM T_3
                     ->  Sort
                           Output: t2.c1
                           Sort Key: t2.c1
                           ->  Foreign Scan on public.ft5_a t2
                                 Output: t2.c1
                                   Remote SQL: SELECT c1 FROM T_4
(25 rows)

--Testcase 247:
select array_agg(distinct (t1.c1)%5) from ft4 t1 full join ft5 t2 on (t1.c1 = t2.c1) where t1.c1 < 20 or (t1.c1 is null and t2.c1 < 5) group by (t2.c1)%3 order by 1;
  array_agg   
--------------
 {0,1,2,3,4}
 {1,2,3,NULL}
(2 rows)

-- DISTINCT combined with ORDER BY within aggregate
--Testcase 248:
explain (verbose, costs off)
select array_agg(distinct (t1.c1)%5 order by (t1.c1)%5) from ft4 t1 full join ft5 t2 on (t1.c1 = t2.c1) where t1.c1 < 20 or (t1.c1 is null and t2.c1 < 5) group by (t2.c1)%3 order by 1;
                                     QUERY PLAN                                      
-------------------------------------------------------------------------------------
 Sort
   Output: (array_agg(DISTINCT (t1.c1 % 5) ORDER BY (t1.c1 % 5))), ((t2.c1 % 3))
   Sort Key: (array_agg(DISTINCT (t1.c1 % 5) ORDER BY (t1.c1 % 5)))
   ->  GroupAggregate
         Output: array_agg(DISTINCT (t1.c1 % 5) ORDER BY (t1.c1 % 5)), ((t2.c1 % 3))
         Group Key: ((t2.c1 % 3))
         ->  Sort
               Output: ((t2.c1 % 3)), t1.c1
               Sort Key: ((t2.c1 % 3))
               ->  Merge Full Join
                     Output: (t2.c1 % 3), t1.c1
                     Merge Cond: (t1.c1 = t2.c1)
                     Filter: ((t1.c1 < 20) OR ((t1.c1 IS NULL) AND (t2.c1 < 5)))
                     ->  Sort
                           Output: t1.c1
                           Sort Key: t1.c1
                           ->  Foreign Scan on public.ft4_a t1
                                 Output: t1.c1
                                   Remote SQL: SELECT c1 FROM T_3
                     ->  Sort
                           Output: t2.c1
                           Sort Key: t2.c1
                           ->  Foreign Scan on public.ft5_a t2
                                 Output: t2.c1
                                   Remote SQL: SELECT c1 FROM T_4
(25 rows)

--Testcase 249:
select array_agg(distinct (t1.c1)%5 order by (t1.c1)%5) from ft4 t1 full join ft5 t2 on (t1.c1 = t2.c1) where t1.c1 < 20 or (t1.c1 is null and t2.c1 < 5) group by (t2.c1)%3 order by 1;
  array_agg   
--------------
 {0,1,2,3,4}
 {1,2,3,NULL}
(2 rows)

--Testcase 250:
explain (verbose, costs off)
select array_agg(distinct (t1.c1)%5 order by (t1.c1)%5 desc nulls last) from ft4 t1 full join ft5 t2 on (t1.c1 = t2.c1) where t1.c1 < 20 or (t1.c1 is null and t2.c1 < 5) group by (t2.c1)%3 order by 1;
                                             QUERY PLAN                                              
-----------------------------------------------------------------------------------------------------
 Sort
   Output: (array_agg(DISTINCT (t1.c1 % 5) ORDER BY (t1.c1 % 5) DESC NULLS LAST)), ((t2.c1 % 3))
   Sort Key: (array_agg(DISTINCT (t1.c1 % 5) ORDER BY (t1.c1 % 5) DESC NULLS LAST))
   ->  GroupAggregate
         Output: array_agg(DISTINCT (t1.c1 % 5) ORDER BY (t1.c1 % 5) DESC NULLS LAST), ((t2.c1 % 3))
         Group Key: ((t2.c1 % 3))
         ->  Sort
               Output: ((t2.c1 % 3)), t1.c1
               Sort Key: ((t2.c1 % 3))
               ->  Merge Full Join
                     Output: (t2.c1 % 3), t1.c1
                     Merge Cond: (t1.c1 = t2.c1)
                     Filter: ((t1.c1 < 20) OR ((t1.c1 IS NULL) AND (t2.c1 < 5)))
                     ->  Sort
                           Output: t1.c1
                           Sort Key: t1.c1
                           ->  Foreign Scan on public.ft4_a t1
                                 Output: t1.c1
                                   Remote SQL: SELECT c1 FROM T_3
                     ->  Sort
                           Output: t2.c1
                           Sort Key: t2.c1
                           ->  Foreign Scan on public.ft5_a t2
                                 Output: t2.c1
                                   Remote SQL: SELECT c1 FROM T_4
(25 rows)

--Testcase 251:
select array_agg(distinct (t1.c1)%5 order by (t1.c1)%5 desc nulls last) from ft4 t1 full join ft5 t2 on (t1.c1 = t2.c1) where t1.c1 < 20 or (t1.c1 is null and t2.c1 < 5) group by (t2.c1)%3 order by 1;
  array_agg   
--------------
 {3,2,1,NULL}
 {4,3,2,1,0}
(2 rows)

-- FILTER within aggregate
--Testcase 252:
explain (verbose, costs off)
select sum(c1) filter (where c1 < 100 and c2 > 5) from ft1 group by c2 order by 1 nulls last;
                                      QUERY PLAN                                      
--------------------------------------------------------------------------------------
 Sort
   Output: (sum(ft1.c1) FILTER (WHERE ((ft1.c1 < 100) AND (ft1.c2 > 5)))), ft1.c2
   Sort Key: (sum(ft1.c1) FILTER (WHERE ((ft1.c1 < 100) AND (ft1.c2 > 5))))
   ->  HashAggregate
         Output: sum(ft1.c1) FILTER (WHERE ((ft1.c1 < 100) AND (ft1.c2 > 5))), ft1.c2
         Group Key: ft1.c2
         ->  Foreign Scan on public.ft1_a ft1
               Output: ft1.c2, ft1.c1
                 Remote SQL: SELECT C_1, c2 FROM T_1
(9 rows)

--Testcase 253:
select sum(c1) filter (where c1 < 100 and c2 > 5) from ft1 group by c2 order by 1 nulls last;
 sum 
-----
 510
 520
 530
 540
    
    
    
    
    
    
(10 rows)

-- DISTINCT, ORDER BY and FILTER within aggregate
--Testcase 254:
explain (verbose, costs off)
select sum(c1%3), sum(distinct c1%3 order by c1%3) filter (where c1%3 < 2), c2 from ft1 where c2 = 6 group by c2;
                                                       QUERY PLAN                                                        
-------------------------------------------------------------------------------------------------------------------------
 GroupAggregate
   Output: sum((ft1.c1 % 3)), sum(DISTINCT (ft1.c1 % 3) ORDER BY (ft1.c1 % 3)) FILTER (WHERE ((ft1.c1 % 3) < 2)), ft1.c2
   Group Key: ft1.c2
   ->  Foreign Scan on public.ft1_a ft1
         Output: ft1.c2, ft1.c1
           Remote SQL: SELECT C_1, c2 FROM T_1 WHERE (c2 = 6)
(6 rows)

--Testcase 255:
select sum(c1%3), sum(distinct c1%3 order by c1%3) filter (where c1%3 < 2), c2 from ft1 where c2 = 6 group by c2;
 sum | sum | c2 
-----+-----+----
  99 |   1 |  6
(1 row)

-- Outer query is aggregation query
--Testcase 256:
explain (verbose, costs off)
select distinct (select count(*) filter (where t2.c2 = 6 and t2.c1 < 10) from ft1 t1 where t1.c1 = 6) from ft2 t2 where t2.c2 % 6 = 0 order by 1;
                                      QUERY PLAN                                      
--------------------------------------------------------------------------------------
 Unique
   Output: ((SubPlan 1))
   ->  Sort
         Output: ((SubPlan 1))
         Sort Key: ((SubPlan 1))
         ->  Aggregate
               Output: (SubPlan 1)
               ->  Foreign Scan on public.ft2_a t2
                     Output: t2.c2, t2.c1
                     Filter: ((t2.c2 % 6) = 0)
                       Remote SQL: SELECT C_1, c2 FROM T_1
               SubPlan 1
                 ->  Foreign Scan on public.ft1_a t1
                       Output: count(*) FILTER (WHERE ((t2.c2 = 6) AND (t2.c1 < 10)))
                         Remote SQL: SELECT * FROM T_1 WHERE (C_1 = 6)
(15 rows)

--Testcase 257:
select distinct (select count(*) filter (where t2.c2 = 6 and t2.c1 < 10) from ft1 t1 where t1.c1 = 6) from ft2 t2 where t2.c2 % 6 = 0 order by 1;
 count 
-------
     1
(1 row)

-- Inner query is aggregation query
--Testcase 258:
explain (verbose, costs off)
select distinct (select count(t1.c1) filter (where t2.c2 = 6 and t2.c1 < 10) from ft1 t1 where t1.c1 = 6) from ft2 t2 where t2.c2 % 6 = 0 order by 1;
                                        QUERY PLAN                                        
------------------------------------------------------------------------------------------
 Unique
   Output: ((SubPlan 1))
   ->  Sort
         Output: ((SubPlan 1))
         Sort Key: ((SubPlan 1))
         ->  Foreign Scan on public.ft2_a t2
               Output: (SubPlan 1)
               Filter: ((t2.c2 % 6) = 0)
                 Remote SQL: SELECT C_1, c2 FROM T_1
               SubPlan 1
                 ->  Aggregate
                       Output: count(t1.c1) FILTER (WHERE ((t2.c2 = 6) AND (t2.c1 < 10)))
                       ->  Foreign Scan on public.ft1_a t1
                             Output: t1.c1
                               Remote SQL: SELECT C_1 FROM T_1 WHERE (C_1 = 6)
(15 rows)

--Testcase 259:
select distinct (select count(t1.c1) filter (where t2.c2 = 6 and t2.c1 < 10) from ft1 t1 where t1.c1 = 6) from ft2 t2 where t2.c2 % 6 = 0 order by 1;
 count 
-------
     0
     1
(2 rows)

-- Aggregate not pushed down as FILTER condition is not pushable
--Testcase 260:
explain (verbose, costs off)
select sum(c1) filter (where (c1 / c1) * random() <= 1) from ft1 group by c2 order by 1;
                                                            QUERY PLAN                                                            
----------------------------------------------------------------------------------------------------------------------------------
 Sort
   Output: (sum(ft1.c1) FILTER (WHERE ((((ft1.c1 / ft1.c1))::double precision * random()) <= '1'::double precision))), ft1.c2
   Sort Key: (sum(ft1.c1) FILTER (WHERE ((((ft1.c1 / ft1.c1))::double precision * random()) <= '1'::double precision)))
   ->  HashAggregate
         Output: sum(ft1.c1) FILTER (WHERE ((((ft1.c1 / ft1.c1))::double precision * random()) <= '1'::double precision)), ft1.c2
         Group Key: ft1.c2
         ->  Foreign Scan on public.ft1_a ft1
               Output: ft1.c2, ft1.c1
                 Remote SQL: SELECT C_1, c2 FROM T_1
(9 rows)

--Testcase 261:
explain (verbose, costs off)
select sum(c2) filter (where c2 in (select c2 from ft1 where c2 < 5)) from ft1;
                        QUERY PLAN                         
-----------------------------------------------------------
 Aggregate
   Output: sum(ft1.c2) FILTER (WHERE (hashed SubPlan 1))
   ->  Foreign Scan on public.ft1_a ft1
         Output: ft1.c2
           Remote SQL: SELECT c2 FROM T_1
   SubPlan 1
     ->  Foreign Scan on public.ft1_a ft1_1
           Output: ft1_1.c2
             Remote SQL: SELECT c2 FROM T_1 WHERE (c2 < 5)
(9 rows)

-- Ordered-sets within aggregate
--Testcase 262:
explain (verbose, costs off)
select c2, rank('10'::varchar) within group (order by c6), percentile_cont(c2/10::numeric) within group (order by c1) from ft1 where c2 < 10 group by c2 having percentile_cont(c2/10::numeric) within group (order by c1) < 500 order by c2;
                                                                                            QUERY PLAN                                                                                            
--------------------------------------------------------------------------------------------------------------------------------------------------------------------------------------------------
 GroupAggregate
   Output: ft1.c2, rank('10'::text) WITHIN GROUP (ORDER BY ft1.c6), percentile_cont((((ft1.c2)::numeric / '10'::numeric))::double precision) WITHIN GROUP (ORDER BY ((ft1.c1)::double precision))
   Group Key: ft1.c2
   Filter: (percentile_cont((((ft1.c2)::numeric / '10'::numeric))::double precision) WITHIN GROUP (ORDER BY ((ft1.c1)::double precision)) < '500'::double precision)
   ->  Sort
         Output: ft1.c2, ft1.c6, ft1.c1
         Sort Key: ft1.c2
         ->  Foreign Scan on public.ft1_a ft1
               Output: ft1.c2, ft1.c6, ft1.c1
                 Remote SQL: SELECT C_1, c2, c6 FROM T_1 WHERE (c2 < 10)
(10 rows)

--Testcase 263:
select c2, rank('10'::varchar) within group (order by c6), percentile_cont(c2/10::numeric) within group (order by c1) from ft1 where c2 < 10 group by c2 having percentile_cont(c2/10::numeric) within group (order by c1) < 500 order by c2;
 c2 | rank | percentile_cont 
----+------+-----------------
  0 |  101 |              10
  1 |  101 |             100
  2 |    1 |             200
  3 |    1 |             300
  4 |    1 |             400
(5 rows)

-- Using multiple arguments within aggregates
--Testcase 264:
explain (verbose, costs off)
select c1, rank(c1, c2) within group (order by c1, c2) from ft1 group by c1, c2 having c1 = 6 order by 1;
                                      QUERY PLAN                                       
---------------------------------------------------------------------------------------
 GroupAggregate
   Output: ft1.c1, rank(ft1.c1, ft1.c2) WITHIN GROUP (ORDER BY ft1.c1, ft1.c2), ft1.c2
   Group Key: ft1.c1, ft1.c2
   ->  Sort
         Output: ft1.c1, ft1.c2
         Sort Key: ft1.c2
         ->  Foreign Scan on public.ft1_a ft1
               Output: ft1.c1, ft1.c2
                 Remote SQL: SELECT C_1, c2 FROM T_1 WHERE (C_1 = 6)
(9 rows)

--Testcase 265:
select c1, rank(c1, c2) within group (order by c1, c2) from ft1 group by c1, c2 having c1 = 6 order by 1;
 c1 | rank 
----+------
  6 |    1
(1 row)

-- User defined function for user defined aggregate, VARIADIC
--Testcase 266:
create function least_accum(anyelement, variadic anyarray)
returns anyelement language sql as
  'select least($1, min($2[i])) from generate_subscripts($2,1) g(i)';
--Testcase 267:
create aggregate least_agg(variadic items anyarray) (
  stype = anyelement, sfunc = least_accum
);
-- Disable hash aggregation for plan stability.
set enable_hashagg to false;
-- Not pushed down due to user defined aggregate
--Testcase 268:
explain (verbose, costs off)
select c2, least_agg(c1) from ft1 group by c2 order by c2;
                     QUERY PLAN                      
-----------------------------------------------------
 GroupAggregate
   Output: ft1.c2, least_agg(VARIADIC ARRAY[ft1.c1])
   Group Key: ft1.c2
   ->  Sort
         Output: ft1.c2, ft1.c1
         Sort Key: ft1.c2
         ->  Foreign Scan on public.ft1_a ft1
               Output: ft1.c2, ft1.c1
                 Remote SQL: SELECT C_1, c2 FROM T_1
(9 rows)

-- Add function and aggregate into extension
alter extension dynamodb_fdw add function least_accum(anyelement, variadic anyarray);
alter extension dynamodb_fdw add aggregate least_agg(variadic items anyarray);
-- alter server loopback options (set extensions 'postgres_fdw');
-- Now aggregate will be pushed.  Aggregate will display VARIADIC argument.
--Testcase 269:
explain (verbose, costs off)
select c2, least_agg(c1) from ft1 where c2 < 100 group by c2 order by c2;
                              QUERY PLAN                              
----------------------------------------------------------------------
 GroupAggregate
   Output: ft1.c2, least_agg(VARIADIC ARRAY[ft1.c1])
   Group Key: ft1.c2
   ->  Sort
         Output: ft1.c2, ft1.c1
         Sort Key: ft1.c2
         ->  Foreign Scan on public.ft1_a ft1
               Output: ft1.c2, ft1.c1
                 Remote SQL: SELECT C_1, c2 FROM T_1 WHERE (c2 < 100)
(9 rows)

--Testcase 270:
select c2, least_agg(c1) from ft1 where c2 < 100 group by c2 order by c2;
 c2 | least_agg 
----+-----------
  0 |        10
  1 |         1
  2 |         2
  3 |         3
  4 |         4
  5 |         5
  6 |         6
  7 |         7
  8 |         8
  9 |         9
(10 rows)

-- Remove function and aggregate from extension
alter extension dynamodb_fdw drop function least_accum(anyelement, variadic anyarray);
alter extension dynamodb_fdw drop aggregate least_agg(variadic items anyarray);
-- alter server loopback options (set extensions 'postgres_fdw');
-- Not pushed down as we have dropped objects from extension.
--Testcase 271:
explain (verbose, costs off)
select c2, least_agg(c1) from ft1 group by c2 order by c2;
                     QUERY PLAN                      
-----------------------------------------------------
 GroupAggregate
   Output: ft1.c2, least_agg(VARIADIC ARRAY[ft1.c1])
   Group Key: ft1.c2
   ->  Sort
         Output: ft1.c2, ft1.c1
         Sort Key: ft1.c2
         ->  Foreign Scan on public.ft1_a ft1
               Output: ft1.c2, ft1.c1
                 Remote SQL: SELECT C_1, c2 FROM T_1
(9 rows)

-- Cleanup
reset enable_hashagg;
--Testcase 272:
drop aggregate least_agg(variadic items anyarray);
--Testcase 273:
drop function least_accum(anyelement, variadic anyarray);
-- Testing USING OPERATOR() in ORDER BY within aggregate.
-- For this, we need user defined operators along with operator family and
-- operator class.  Create those and then add them in extension.  Note that
-- user defined objects are considered unshippable unless they are part of
-- the extension.
--Testcase 274:
create operator public.<^ (
 leftarg = int4,
 rightarg = int4,
 procedure = int4eq
);
--Testcase 275:
create operator public.=^ (
 leftarg = int4,
 rightarg = int4,
 procedure = int4lt
);
--Testcase 276:
create operator public.>^ (
 leftarg = int4,
 rightarg = int4,
 procedure = int4gt
);
--Testcase 277:
create operator family my_op_family using btree;
--Testcase 278:
create function my_op_cmp(a int, b int) returns int as
  $$begin return btint4cmp(a, b); end $$ language plpgsql;
--Testcase 279:
create operator class my_op_class for type int using btree family my_op_family as
 operator 1 public.<^,
 operator 3 public.=^,
 operator 5 public.>^,
 function 1 my_op_cmp(int, int);
-- This will not be pushed as user defined sort operator is not part of the
-- extension yet.
--Testcase 280:
explain (verbose, costs off)
select array_agg(c1 order by c1 using operator(public.<^)) from ft2 where c2 = 6 and c1 < 100 group by c2;
                                  QUERY PLAN                                  
------------------------------------------------------------------------------
 GroupAggregate
   Output: array_agg(ft2.c1 ORDER BY ft2.c1 USING <^ NULLS LAST), ft2.c2
   Group Key: ft2.c2
   ->  Foreign Scan on public.ft2_a ft2
         Output: ft2.c2, ft2.c1
           Remote SQL: SELECT C_1, c2 FROM T_1 WHERE (C_1 < 100) AND (c2 = 6)
(6 rows)

-- This should not be pushed either.
explain (verbose, costs off)
select * from ft2 order by c1 using operator(public.<^);
                                         QUERY PLAN                                         
--------------------------------------------------------------------------------------------
 Sort
   Output: ft2.c1, ft2.c2, ft2.c3, ft2.c4, ft2.c5, ft2.c6, ft2.c7, ft2.c8, ft2.spdurl
   Sort Key: ft2.c1 USING <^
   ->  Foreign Scan on public.ft2_a ft2
         Output: ft2.c1, ft2.c2, ft2.c3, ft2.c4, ft2.c5, ft2.c6, ft2.c7, ft2.c8, ft2.spdurl
           Remote SQL: SELECT C_1, c2, c3, c4, c5, c6, c7, c8 FROM T_1
(6 rows)

-- Update local stats on ft2
-- ANALYZE ft2;
-- Add into extension
alter extension dynamodb_fdw add operator class my_op_class using btree;
alter extension dynamodb_fdw add function my_op_cmp(a int, b int);
alter extension dynamodb_fdw add operator family my_op_family using btree;
alter extension dynamodb_fdw add operator public.<^(int, int);
alter extension dynamodb_fdw add operator public.=^(int, int);
alter extension dynamodb_fdw add operator public.>^(int, int);
-- alter server dynamodb_server options (set extensions 'dynamodb_fdw');
-- Now this will be pushed as sort operator is part of the extension.
--Testcase 281:
explain (verbose, costs off)
select array_agg(c1 order by c1 using operator(public.<^)) from ft2 where c2 = 6 and c1 < 100 group by c2;
                                  QUERY PLAN                                  
------------------------------------------------------------------------------
 GroupAggregate
   Output: array_agg(ft2.c1 ORDER BY ft2.c1 USING <^ NULLS LAST), ft2.c2
   Group Key: ft2.c2
   ->  Foreign Scan on public.ft2_a ft2
         Output: ft2.c2, ft2.c1
           Remote SQL: SELECT C_1, c2 FROM T_1 WHERE (C_1 < 100) AND (c2 = 6)
(6 rows)

--Testcase 282:
select array_agg(c1 order by c1 using operator(public.<^)) from ft2 where c2 = 6 and c1 < 100 group by c2;
           array_agg            
--------------------------------
 {6,16,26,36,46,56,66,76,86,96}
(1 row)

-- This should be pushed too.
explain (verbose, costs off)
select * from ft2 order by c1 using operator(public.<^);
                                         QUERY PLAN                                         
--------------------------------------------------------------------------------------------
 Sort
   Output: ft2.c1, ft2.c2, ft2.c3, ft2.c4, ft2.c5, ft2.c6, ft2.c7, ft2.c8, ft2.spdurl
   Sort Key: ft2.c1 USING <^
   ->  Foreign Scan on public.ft2_a ft2
         Output: ft2.c1, ft2.c2, ft2.c3, ft2.c4, ft2.c5, ft2.c6, ft2.c7, ft2.c8, ft2.spdurl
           Remote SQL: SELECT C_1, c2, c3, c4, c5, c6, c7, c8 FROM T_1
(6 rows)

-- Remove from extension
alter extension dynamodb_fdw drop operator class my_op_class using btree;
alter extension dynamodb_fdw drop function my_op_cmp(a int, b int);
alter extension dynamodb_fdw drop operator family my_op_family using btree;
alter extension dynamodb_fdw drop operator public.<^(int, int);
alter extension dynamodb_fdw drop operator public.=^(int, int);
alter extension dynamodb_fdw drop operator public.>^(int, int);
-- alter server dynamodb_server options (set extensions 'dynamodb_fdw');
-- This will not be pushed as sort operator is now removed from the extension.
--Testcase 283:
explain (verbose, costs off)
select array_agg(c1 order by c1 using operator(public.<^)) from ft2 where c2 = 6 and c1 < 100 group by c2;
                                  QUERY PLAN                                  
------------------------------------------------------------------------------
 GroupAggregate
   Output: array_agg(ft2.c1 ORDER BY ft2.c1 USING <^ NULLS LAST), ft2.c2
   Group Key: ft2.c2
   ->  Foreign Scan on public.ft2_a ft2
         Output: ft2.c2, ft2.c1
           Remote SQL: SELECT C_1, c2 FROM T_1 WHERE (C_1 < 100) AND (c2 = 6)
(6 rows)

-- Cleanup
--Testcase 284:
drop operator class my_op_class using btree;
--Testcase 285:
drop function my_op_cmp(a int, b int);
--Testcase 286:
drop operator family my_op_family using btree;
--Testcase 287:
drop operator public.>^(int, int);
--Testcase 288:
drop operator public.=^(int, int);
--Testcase 289:
drop operator public.<^(int, int);
-- Input relation to aggregate push down hook is not safe to pushdown and thus
-- the aggregate cannot be pushed down to foreign server.
--Testcase 290:
explain (verbose, costs off)
select count(t1.c3) from ft2 t1 left join ft2 t2 on (t1.c1 = random() * t2.c2);
                                        QUERY PLAN                                         
-------------------------------------------------------------------------------------------
 Aggregate
   Output: count(t1.c3)
   ->  Nested Loop Left Join
         Output: t1.c3
         Join Filter: ((t1.c1)::double precision = (random() * (t2.c2)::double precision))
         ->  Foreign Scan on public.ft2_a t1
               Output: t1.c3, t1.c1
                 Remote SQL: SELECT C_1, c3 FROM T_1
         ->  Materialize
               Output: t2.c2
               ->  Foreign Scan on public.ft2_a t2
                     Output: t2.c2
                       Remote SQL: SELECT c2 FROM T_1
(13 rows)

-- Subquery in FROM clause having aggregate
--Testcase 291:
explain (verbose, costs off)
select count(*), x.b from ft1, (select c2 a, sum(c1) b from ft1 group by c2) x where ft1.c2 = x.a group by x.b order by 1, 2;
                                 QUERY PLAN                                  
-----------------------------------------------------------------------------
 Sort
   Output: (count(*)), x.b
   Sort Key: (count(*)), x.b
   ->  HashAggregate
         Output: count(*), x.b
         Group Key: x.b
         ->  Hash Join
               Output: x.b
               Inner Unique: true
               Hash Cond: (ft1.c2 = x.a)
               ->  Foreign Scan on public.ft1_a ft1
                     Output: ft1.c2
                       Remote SQL: SELECT c2 FROM T_1
               ->  Hash
                     Output: x.b, x.a
                     ->  Subquery Scan on x
                           Output: x.b, x.a
                           ->  HashAggregate
                                 Output: ft1_1.c2, sum(ft1_1.c1)
                                 Group Key: ft1_1.c2
                                 ->  Foreign Scan on public.ft1_a ft1_1
                                       Output: ft1_1.c2, ft1_1.c1
                                         Remote SQL: SELECT C_1, c2 FROM T_1
(23 rows)

--Testcase 292:
select count(*), x.b from ft1, (select c2 a, sum(c1) b from ft1 group by c2) x where ft1.c2 = x.a group by x.b order by 1, 2;
 count |   b   
-------+-------
   100 | 49600
   100 | 49700
   100 | 49800
   100 | 49900
   100 | 50000
   100 | 50100
   100 | 50200
   100 | 50300
   100 | 50400
   100 | 50500
(10 rows)

-- FULL join with IS NULL check in HAVING
--Testcase 293:
explain (verbose, costs off)
select avg(t1.c1), sum(t2.c1) from ft4 t1 full join ft5 t2 on (t1.c1 = t2.c1) group by t2.c1 having (avg(t1.c1) is null and sum(t2.c1) < 10) or sum(t2.c1) is null order by 1 nulls last, 2;
                                       QUERY PLAN                                       
----------------------------------------------------------------------------------------
 Sort
   Output: (avg(t1.c1)), (sum(t2.c1)), t2.c1
   Sort Key: (avg(t1.c1)), (sum(t2.c1))
   ->  HashAggregate
         Output: avg(t1.c1), sum(t2.c1), t2.c1
         Group Key: t2.c1
         Filter: (((avg(t1.c1) IS NULL) AND (sum(t2.c1) < 10)) OR (sum(t2.c1) IS NULL))
         ->  Merge Full Join
               Output: t2.c1, t1.c1
               Merge Cond: (t1.c1 = t2.c1)
               ->  Sort
                     Output: t1.c1
                     Sort Key: t1.c1
                     ->  Foreign Scan on public.ft4_a t1
                           Output: t1.c1
                             Remote SQL: SELECT c1 FROM T_3
               ->  Sort
                     Output: t2.c1
                     Sort Key: t2.c1
                     ->  Foreign Scan on public.ft5_a t2
                           Output: t2.c1
                             Remote SQL: SELECT c1 FROM T_4
(22 rows)

--Testcase 294:
select avg(t1.c1), sum(t2.c1) from ft4 t1 full join ft5 t2 on (t1.c1 = t2.c1) group by t2.c1 having (avg(t1.c1) is null and sum(t2.c1) < 10) or sum(t2.c1) is null order by 1 nulls last, 2;
         avg         | sum 
---------------------+-----
 51.0000000000000000 |    
                     |   3
                     |   9
(3 rows)

-- Aggregate over FULL join needing to deparse the joining relations as
-- subqueries.
--Testcase 295:
explain (verbose, costs off)
select count(*), sum(t1.c1), avg(t2.c1) from (select c1 from ft4 where c1 between 50 and 60) t1 full join (select c1 from ft5 where c1 between 50 and 60) t2 on (t1.c1 = t2.c1);
                                      QUERY PLAN                                      
--------------------------------------------------------------------------------------
 Aggregate
   Output: count(*), sum(ft4.c1), avg(ft5.c1)
   ->  Hash Full Join
         Output: ft4.c1, ft5.c1
         Hash Cond: (ft4.c1 = ft5.c1)
         ->  Foreign Scan on public.ft4_a ft4
               Output: ft4.c1
                 Remote SQL: SELECT c1 FROM T_3 WHERE (c1 >= 50) AND (c1 <= 60)
         ->  Hash
               Output: ft5.c1
               ->  Foreign Scan on public.ft5_a ft5
                     Output: ft5.c1
                       Remote SQL: SELECT c1 FROM T_4 WHERE (c1 >= 50) AND (c1 <= 60)
(13 rows)

--Testcase 296:
select count(*), sum(t1.c1), avg(t2.c1) from (select c1 from ft4 where c1 between 50 and 60) t1 full join (select c1 from ft5 where c1 between 50 and 60) t2 on (t1.c1 = t2.c1);
 count | sum |         avg         
-------+-----+---------------------
     8 | 330 | 55.5000000000000000
(1 row)

-- ORDER BY expression is part of the target list but not pushed down to
-- foreign server.
--Testcase 297:
explain (verbose, costs off)
select sum(c2) * (random() <= 1)::int as sum from ft1 order by 1;
                                   QUERY PLAN                                   
--------------------------------------------------------------------------------
 Sort
   Output: ((sum(ft1.c2) * ((random() <= '1'::double precision))::integer))
   Sort Key: ((sum(ft1.c2) * ((random() <= '1'::double precision))::integer))
   ->  Aggregate
         Output: (sum(ft1.c2) * ((random() <= '1'::double precision))::integer)
         ->  Foreign Scan on public.ft1_a ft1
               Output: ft1.c2
                 Remote SQL: SELECT c2 FROM T_1
(8 rows)

--Testcase 298:
select sum(c2) * (random() <= 1)::int as sum from ft1 order by 1;
 sum  
------
 4500
(1 row)

-- LATERAL join, with parameterization
set enable_hashagg to false;
--Testcase 299:
explain (verbose, costs off)
select c2, sum from "S 1"."T 1" t1, lateral (select sum(t2.c1 + t1."C 1") sum from ft2 t2 group by t2.c1) qry where t1.c2 * 2 = qry.sum and t1.c2 < 3 and t1."C 1" < 100 order by 1;
                                    QUERY PLAN                                    
----------------------------------------------------------------------------------
 Sort
   Output: t1.c2, qry.sum
   Sort Key: t1.c2
   ->  Nested Loop
         Output: t1.c2, qry.sum
         ->  Foreign Scan on "S 1"."T 1" t1
               Output: t1."C 1", t1.c2, t1.c3, t1.c4, t1.c5, t1.c6, t1.c7, t1.c8
               Remote SQL: SELECT C_1, c2 FROM T_1 WHERE (c2 < 3) AND (C_1 < 100)
         ->  Subquery Scan on qry
               Output: qry.sum, t2.c1
               Filter: ((t1.c2 * 2) = qry.sum)
               ->  GroupAggregate
                     Output: sum((t2.c1 + t1."C 1")), t2.c1
                     Group Key: t2.c1
                     ->  Sort
                           Output: t2.c1
                           Sort Key: t2.c1
                           ->  Foreign Scan on public.ft2_a t2
                                 Output: t2.c1
                                   Remote SQL: SELECT C_1 FROM T_1
(20 rows)

--Testcase 300:
select c2, sum from "S 1"."T 1" t1, lateral (select sum(t2.c1 + t1."C 1") sum from ft2 t2 group by t2.c1) qry where t1.c2 * 2 = qry.sum and t1.c2 < 3 and t1."C 1" < 100 order by 1;
 c2 | sum 
----+-----
  1 |   2
  2 |   4
(2 rows)

reset enable_hashagg;
-- bug #15613: bad plan for foreign table scan with lateral reference
--Testcase 301:
EXPLAIN (VERBOSE, COSTS OFF)
SELECT ref_0.c2, subq_1.*
FROM
    "S 1"."T 1" AS ref_0,
    LATERAL (
        SELECT ref_0."C 1" c1, subq_0.*
        FROM (SELECT ref_0.c2, ref_1.c3
              FROM ft1 AS ref_1) AS subq_0
             RIGHT JOIN ft2 AS ref_3 ON (subq_0.c3 = ref_3.c3)
    ) AS subq_1
WHERE ref_0."C 1" < 10 AND subq_1.c3 = '00001'
ORDER BY ref_0."C 1";
                                                  QUERY PLAN                                                   
---------------------------------------------------------------------------------------------------------------
 Sort
   Output: ref_0.c2, ref_0."C 1", (ref_0.c2), ref_1.c3, ref_0."C 1"
   Sort Key: ref_0."C 1"
   ->  Nested Loop
         Output: ref_0.c2, ref_0."C 1", (ref_0.c2), ref_1.c3, ref_0."C 1"
         ->  Nested Loop
               Output: ref_0.c2, ref_0."C 1", ref_1.c3, (ref_0.c2)
               ->  Foreign Scan on "S 1"."T 1" ref_0
                     Output: ref_0."C 1", ref_0.c2, ref_0.c3, ref_0.c4, ref_0.c5, ref_0.c6, ref_0.c7, ref_0.c8
                     Remote SQL: SELECT C_1, c2 FROM T_1 WHERE (C_1 < 10)
               ->  Foreign Scan on public.ft1_a ref_1
                     Output: ref_1.c3, ref_0.c2
                       Remote SQL: SELECT c3 FROM T_1 WHERE (c3 = '00001')
         ->  Materialize
               Output: ref_3.c3
               ->  Foreign Scan on public.ft2_a ref_3
                     Output: ref_3.c3
                       Remote SQL: SELECT c3 FROM T_1 WHERE (c3 = '00001')
(18 rows)

--Testcase 302:
SELECT ref_0.c2, subq_1.*
FROM
    "S 1"."T 1" AS ref_0,
    LATERAL (
        SELECT ref_0."C 1" c1, subq_0.*
        FROM (SELECT ref_0.c2, ref_1.c3
              FROM ft1 AS ref_1) AS subq_0
             RIGHT JOIN ft2 AS ref_3 ON (subq_0.c3 = ref_3.c3)
    ) AS subq_1
WHERE ref_0."C 1" < 10 AND subq_1.c3 = '00001'
ORDER BY ref_0."C 1";
 c2 | c1 | c2 |  c3   
----+----+----+-------
  1 |  1 |  1 | 00001
  2 |  2 |  2 | 00001
  3 |  3 |  3 | 00001
  4 |  4 |  4 | 00001
  5 |  5 |  5 | 00001
  6 |  6 |  6 | 00001
  7 |  7 |  7 | 00001
  8 |  8 |  8 | 00001
  9 |  9 |  9 | 00001
(9 rows)

-- Check with placeHolderVars
--Testcase 303:
explain (verbose, costs off)
select sum(q.a), count(q.b) from ft4 left join (select 13, avg(ft1.c1), sum(ft2.c1) from ft1 right join ft2 on (ft1.c1 = ft2.c1)) q(a, b, c) on (ft4.c1 <= q.b);
                                  QUERY PLAN                                   
-------------------------------------------------------------------------------
 Aggregate
   Output: sum(q.a), count(q.b)
   ->  Nested Loop Left Join
         Output: q.a, q.b
         Inner Unique: true
         Join Filter: ((ft4.c1)::numeric <= q.b)
         ->  Foreign Scan on public.ft4_a ft4
               Output: ft4.c1
                 Remote SQL: SELECT c1 FROM T_3
         ->  Materialize
               Output: q.a, q.b
               ->  Subquery Scan on q
                     Output: q.a, q.b
                     ->  Aggregate
                           Output: 13, avg(ft1.c1), NULL::bigint
                           ->  Merge Left Join
                                 Output: ft1.c1
                                 Merge Cond: (ft2.c1 = ft1.c1)
                                 ->  Sort
                                       Output: ft2.c1
                                       Sort Key: ft2.c1
                                       ->  Foreign Scan on public.ft2_a ft2
                                             Output: ft2.c1
                                               Remote SQL: SELECT C_1 FROM T_1
                                 ->  Sort
                                       Output: ft1.c1
                                       Sort Key: ft1.c1
                                       ->  Foreign Scan on public.ft1_a ft1
                                             Output: ft1.c1
                                               Remote SQL: SELECT C_1 FROM T_1
(30 rows)

--Testcase 304:
select sum(q.a), count(q.b) from ft4 left join (select 13, avg(ft1.c1), sum(ft2.c1) from ft1 right join ft2 on (ft1.c1 = ft2.c1)) q(a, b, c) on (ft4.c1 <= q.b);
 sum | count 
-----+-------
 650 |    50
(1 row)

-- Not supported cases
-- Grouping sets
--Testcase 305:
explain (verbose, costs off)
select c2, sum(c1) from ft1 where c2 < 3 group by rollup(c2) order by 1 nulls last;
                             QUERY PLAN                             
--------------------------------------------------------------------
 Sort
   Output: ft1.c2, (sum(ft1.c1))
   Sort Key: ft1.c2
   ->  MixedAggregate
         Output: ft1.c2, sum(ft1.c1)
         Hash Key: ft1.c2
         Group Key: ()
         ->  Foreign Scan on public.ft1_a ft1
               Output: ft1.c2, ft1.c1
                 Remote SQL: SELECT C_1, c2 FROM T_1 WHERE (c2 < 3)
(10 rows)

--Testcase 306:
select c2, sum(c1) from ft1 where c2 < 3 group by rollup(c2) order by 1 nulls last;
 c2 |  sum   
----+--------
  0 |  50500
  1 |  49600
  2 |  49700
    | 149800
(4 rows)

--Testcase 307:
explain (verbose, costs off)
select c2, sum(c1) from ft1 where c2 < 3 group by cube(c2) order by 1 nulls last;
                             QUERY PLAN                             
--------------------------------------------------------------------
 Sort
   Output: ft1.c2, (sum(ft1.c1))
   Sort Key: ft1.c2
   ->  MixedAggregate
         Output: ft1.c2, sum(ft1.c1)
         Hash Key: ft1.c2
         Group Key: ()
         ->  Foreign Scan on public.ft1_a ft1
               Output: ft1.c2, ft1.c1
                 Remote SQL: SELECT C_1, c2 FROM T_1 WHERE (c2 < 3)
(10 rows)

--Testcase 308:
select c2, sum(c1) from ft1 where c2 < 3 group by cube(c2) order by 1 nulls last;
 c2 |  sum   
----+--------
  0 |  50500
  1 |  49600
  2 |  49700
    | 149800
(4 rows)

--Testcase 309:
explain (verbose, costs off)
select c2, c6, sum(c1) from ft1 where c2 < 3 group by grouping sets(c2, c6) order by 1 nulls last, 2 nulls last;
                               QUERY PLAN                               
------------------------------------------------------------------------
 Sort
   Output: ft1.c2, ft1.c6, (sum(ft1.c1))
   Sort Key: ft1.c2, ft1.c6
   ->  HashAggregate
         Output: ft1.c2, ft1.c6, sum(ft1.c1)
         Hash Key: ft1.c2
         Hash Key: ft1.c6
         ->  Foreign Scan on public.ft1_a ft1
               Output: ft1.c2, ft1.c6, ft1.c1
                 Remote SQL: SELECT C_1, c2, c6 FROM T_1 WHERE (c2 < 3)
(10 rows)

--Testcase 310:
select c2, c6, sum(c1) from ft1 where c2 < 3 group by grouping sets(c2, c6) order by 1 nulls last, 2 nulls last;
 c2 | c6 |  sum  
----+----+-------
  0 |    | 50500
  1 |    | 49600
  2 |    | 49700
    | 0  | 50500
    | 1  | 49600
    | 2  | 49700
(6 rows)

--Testcase 311:
explain (verbose, costs off)
select c2, sum(c1), grouping(c2) from ft1 where c2 < 3 group by c2 order by 1 nulls last;
                             QUERY PLAN                             
--------------------------------------------------------------------
 Sort
   Output: ft1.c2, (sum(ft1.c1)), (GROUPING(ft1.c2))
   Sort Key: ft1.c2
   ->  HashAggregate
         Output: ft1.c2, sum(ft1.c1), GROUPING(ft1.c2)
         Group Key: ft1.c2
         ->  Foreign Scan on public.ft1_a ft1
               Output: ft1.c2, ft1.c1
                 Remote SQL: SELECT C_1, c2 FROM T_1 WHERE (c2 < 3)
(9 rows)

--Testcase 312:
select c2, sum(c1), grouping(c2) from ft1 where c2 < 3 group by c2 order by 1 nulls last;
 c2 |  sum  | grouping 
----+-------+----------
  0 | 50500 |        0
  1 | 49600 |        0
  2 | 49700 |        0
(3 rows)

-- DISTINCT itself is not pushed down, whereas underneath aggregate is pushed
--Testcase 313:
explain (verbose, costs off)
select distinct sum(c1)/1000 s from ft2 where c2 < 6 group by c2 order by 1;
                                QUERY PLAN                                
--------------------------------------------------------------------------
 Unique
   Output: ((sum(ft2.c1) / 1000)), ft2.c2
   ->  Sort
         Output: ((sum(ft2.c1) / 1000)), ft2.c2
         Sort Key: ((sum(ft2.c1) / 1000))
         ->  HashAggregate
               Output: (sum(ft2.c1) / 1000), ft2.c2
               Group Key: ft2.c2
               ->  Foreign Scan on public.ft2_a ft2
                     Output: ft2.c2, ft2.c1
                       Remote SQL: SELECT C_1, c2 FROM T_1 WHERE (c2 < 6)
(11 rows)

--Testcase 314:
select distinct sum(c1)/1000 s from ft2 where c2 < 6 group by c2 order by 1;
 s  
----
 49
 50
(2 rows)

-- WindowAgg
--Testcase 315:
explain (verbose, costs off)
select c2, sum(c2), count(c2) over (partition by c2%2) from ft2 where c2 < 10 group by c2 order by 1;
                                  QUERY PLAN                                   
-------------------------------------------------------------------------------
 Sort
   Output: ft2.c2, (sum(ft2.c2)), (count(ft2.c2) OVER (?)), ((ft2.c2 % 2))
   Sort Key: ft2.c2
   ->  WindowAgg
         Output: ft2.c2, (sum(ft2.c2)), count(ft2.c2) OVER (?), ((ft2.c2 % 2))
         ->  Sort
               Output: ft2.c2, ((ft2.c2 % 2)), (sum(ft2.c2))
               Sort Key: ((ft2.c2 % 2))
               ->  HashAggregate
                     Output: ft2.c2, (ft2.c2 % 2), sum(ft2.c2)
                     Group Key: ft2.c2
                     ->  Foreign Scan on public.ft2_a ft2
                           Output: ft2.c2
                             Remote SQL: SELECT c2 FROM T_1 WHERE (c2 < 10)
(14 rows)

--Testcase 316:
select c2, sum(c2), count(c2) over (partition by c2%2) from ft2 where c2 < 10 group by c2 order by 1;
 c2 | sum | count 
----+-----+-------
  0 |   0 |     5
  1 | 100 |     5
  2 | 200 |     5
  3 | 300 |     5
  4 | 400 |     5
  5 | 500 |     5
  6 | 600 |     5
  7 | 700 |     5
  8 | 800 |     5
  9 | 900 |     5
(10 rows)

--Testcase 317:
explain (verbose, costs off)
select c2, array_agg(c2) over (partition by c2%2 order by c2 desc) from ft1 where c2 < 10 group by c2 order by 1;
                                 QUERY PLAN                                 
----------------------------------------------------------------------------
 Sort
   Output: ft1.c2, (array_agg(ft1.c2) OVER (?)), ((ft1.c2 % 2))
   Sort Key: ft1.c2
   ->  WindowAgg
         Output: ft1.c2, array_agg(ft1.c2) OVER (?), ((ft1.c2 % 2))
         ->  Sort
               Output: ft1.c2, ((ft1.c2 % 2))
               Sort Key: ((ft1.c2 % 2)), ft1.c2 DESC
               ->  HashAggregate
                     Output: ft1.c2, (ft1.c2 % 2)
                     Group Key: ft1.c2
                     ->  Foreign Scan on public.ft1_a ft1
                           Output: ft1.c2
                             Remote SQL: SELECT c2 FROM T_1 WHERE (c2 < 10)
(14 rows)

--Testcase 318:
select c2, array_agg(c2) over (partition by c2%2 order by c2 desc) from ft1 where c2 < 10 group by c2 order by 1;
 c2 |  array_agg  
----+-------------
  0 | {8,6,4,2,0}
  1 | {9,7,5,3,1}
  2 | {8,6,4,2}
  3 | {9,7,5,3}
  4 | {8,6,4}
  5 | {9,7,5}
  6 | {8,6}
  7 | {9,7}
  8 | {8}
  9 | {9}
(10 rows)

--Testcase 319:
explain (verbose, costs off)
select c2, array_agg(c2) over (partition by c2%2 order by c2 range between current row and unbounded following) from ft1 where c2 < 10 group by c2 order by 1;
                                 QUERY PLAN                                 
----------------------------------------------------------------------------
 Sort
   Output: ft1.c2, (array_agg(ft1.c2) OVER (?)), ((ft1.c2 % 2))
   Sort Key: ft1.c2
   ->  WindowAgg
         Output: ft1.c2, array_agg(ft1.c2) OVER (?), ((ft1.c2 % 2))
         ->  Sort
               Output: ft1.c2, ((ft1.c2 % 2))
               Sort Key: ((ft1.c2 % 2)), ft1.c2
               ->  HashAggregate
                     Output: ft1.c2, (ft1.c2 % 2)
                     Group Key: ft1.c2
                     ->  Foreign Scan on public.ft1_a ft1
                           Output: ft1.c2
                             Remote SQL: SELECT c2 FROM T_1 WHERE (c2 < 10)
(14 rows)

--Testcase 320:
select c2, array_agg(c2) over (partition by c2%2 order by c2 range between current row and unbounded following) from ft1 where c2 < 10 group by c2 order by 1;
 c2 |  array_agg  
----+-------------
  0 | {0,2,4,6,8}
  1 | {1,3,5,7,9}
  2 | {2,4,6,8}
  3 | {3,5,7,9}
  4 | {4,6,8}
  5 | {5,7,9}
  6 | {6,8}
  7 | {7,9}
  8 | {8}
  9 | {9}
(10 rows)

-- ===================================================================
-- parameterized queries
-- ===================================================================
-- simple join
--Testcase 321:
PREPARE st1(int, int) AS SELECT t1.c3, t2.c3 FROM ft1 t1, ft2 t2 WHERE t1.c1 = $1 AND t2.c1 = $2;
--Testcase 322:
EXPLAIN (VERBOSE, COSTS OFF) EXECUTE st1(1, 2);
                           QUERY PLAN                           
----------------------------------------------------------------
 Nested Loop
   Output: t1.c3, t2.c3
   ->  Foreign Scan on public.ft1_a t1
         Output: t1.c3
           Remote SQL: SELECT c3 FROM T_1 WHERE (C_1 = 1)
   ->  Materialize
         Output: t2.c3
         ->  Foreign Scan on public.ft2_a t2
               Output: t2.c3
                 Remote SQL: SELECT c3 FROM T_1 WHERE (C_1 = 2)
(10 rows)

--Testcase 323:
EXECUTE st1(1, 1);
  c3   |  c3   
-------+-------
 00001 | 00001
(1 row)

--Testcase 324:
EXECUTE st1(101, 101);
  c3   |  c3   
-------+-------
 00101 | 00101
(1 row)

-- subquery using stable function (can't be sent to remote)
--Testcase 325:
PREPARE st2(int) AS SELECT * FROM ft1 t1 WHERE t1.c1 < $2 AND t1.c3 IN (SELECT c3 FROM ft2 t2 WHERE c1 > $1 AND date(c4) = '1970-01-17'::date) ORDER BY c1;
--Testcase 326:
EXPLAIN (VERBOSE, COSTS OFF) EXECUTE st2(10, 20);
                                          QUERY PLAN                                          
----------------------------------------------------------------------------------------------
 Sort
   Output: t1.c1, t1.c2, t1.c3, t1.c4, t1.c5, t1.c6, t1.c7, t1.c8, t1.spdurl
   Sort Key: t1.c1
   ->  Hash Semi Join
         Output: t1.c1, t1.c2, t1.c3, t1.c4, t1.c5, t1.c6, t1.c7, t1.c8, t1.spdurl
         Hash Cond: (t1.c3 = t2.c3)
         ->  Foreign Scan on public.ft1_a t1
               Output: t1.c1, t1.c2, t1.c3, t1.c4, t1.c5, t1.c6, t1.c7, t1.c8, t1.spdurl
                 Remote SQL: SELECT C_1, c2, c3, c4, c5, c6, c7, c8 FROM T_1 WHERE (C_1 < 20)
         ->  Hash
               Output: t2.c3
               ->  Foreign Scan on public.ft2_a t2
                     Output: t2.c3
                     Filter: ((t2.c4)::date = '01-17-1970'::date)
                       Remote SQL: SELECT c3, c4 FROM T_1 WHERE (C_1 > 10)
(15 rows)

--Testcase 327:
EXECUTE st2(10, 20);
 c1 | c2 |  c3   |              c4              |            c5            | c6 |     c7     | c8  | spdurl  
----+----+-------+------------------------------+--------------------------+----+------------+-----+---------
 16 |  6 | 00016 | Sat Jan 17 00:00:00 1970 PST | Sat Jan 17 00:00:00 1970 | 6  | 6          | foo | /node1/
(1 row)

--Testcase 328:
EXECUTE st2(101, 121);
 c1  | c2 |  c3   |              c4              |            c5            | c6 |     c7     | c8  | spdurl  
-----+----+-------+------------------------------+--------------------------+----+------------+-----+---------
 116 |  6 | 00116 | Sat Jan 17 00:00:00 1970 PST | Sat Jan 17 00:00:00 1970 | 6  | 6          | foo | /node1/
(1 row)

-- subquery using immutable function (can be sent to remote)
--Testcase 329:
PREPARE st3(int) AS SELECT * FROM ft1 t1 WHERE t1.c1 < $2 AND t1.c3 IN (SELECT c3 FROM ft2 t2 WHERE c1 > $1 AND date(c5) = '1970-01-17'::date) ORDER BY c1;
--Testcase 330:
EXPLAIN (VERBOSE, COSTS OFF) EXECUTE st3(10, 20);
                                          QUERY PLAN                                          
----------------------------------------------------------------------------------------------
 Sort
   Output: t1.c1, t1.c2, t1.c3, t1.c4, t1.c5, t1.c6, t1.c7, t1.c8, t1.spdurl
   Sort Key: t1.c1
   ->  Hash Semi Join
         Output: t1.c1, t1.c2, t1.c3, t1.c4, t1.c5, t1.c6, t1.c7, t1.c8, t1.spdurl
         Hash Cond: (t1.c3 = t2.c3)
         ->  Foreign Scan on public.ft1_a t1
               Output: t1.c1, t1.c2, t1.c3, t1.c4, t1.c5, t1.c6, t1.c7, t1.c8, t1.spdurl
                 Remote SQL: SELECT C_1, c2, c3, c4, c5, c6, c7, c8 FROM T_1 WHERE (C_1 < 20)
         ->  Hash
               Output: t2.c3
               ->  Foreign Scan on public.ft2_a t2
                     Output: t2.c3
                     Filter: ((t2.c5)::date = '01-17-1970'::date)
                       Remote SQL: SELECT c3, c5 FROM T_1 WHERE (C_1 > 10)
(15 rows)

--Testcase 331:
EXECUTE st3(10, 20);
 c1 | c2 |  c3   |              c4              |            c5            | c6 |     c7     | c8  | spdurl  
----+----+-------+------------------------------+--------------------------+----+------------+-----+---------
 16 |  6 | 00016 | Sat Jan 17 00:00:00 1970 PST | Sat Jan 17 00:00:00 1970 | 6  | 6          | foo | /node1/
(1 row)

--Testcase 332:
EXECUTE st3(20, 30);
 c1 | c2 | c3 | c4 | c5 | c6 | c7 | c8 | spdurl 
----+----+----+----+----+----+----+----+--------
(0 rows)

-- custom plan should be chosen initially
--Testcase 333:
PREPARE st4(int) AS SELECT * FROM ft1 t1 WHERE t1.c1 = $1;
--Testcase 334:
EXPLAIN (VERBOSE, COSTS OFF) EXECUTE st4(1);
                                   QUERY PLAN                                    
---------------------------------------------------------------------------------
 Foreign Scan on public.ft1_a t1
   Output: t1.c1, t1.c2, t1.c3, t1.c4, t1.c5, t1.c6, t1.c7, t1.c8, t1.spdurl
     Remote SQL: SELECT C_1, c2, c3, c4, c5, c6, c7, c8 FROM T_1 WHERE (C_1 = 1)
(3 rows)

--Testcase 335:
EXPLAIN (VERBOSE, COSTS OFF) EXECUTE st4(1);
                                   QUERY PLAN                                    
---------------------------------------------------------------------------------
 Foreign Scan on public.ft1_a t1
   Output: t1.c1, t1.c2, t1.c3, t1.c4, t1.c5, t1.c6, t1.c7, t1.c8, t1.spdurl
     Remote SQL: SELECT C_1, c2, c3, c4, c5, c6, c7, c8 FROM T_1 WHERE (C_1 = 1)
(3 rows)

--Testcase 336:
EXPLAIN (VERBOSE, COSTS OFF) EXECUTE st4(1);
                                   QUERY PLAN                                    
---------------------------------------------------------------------------------
 Foreign Scan on public.ft1_a t1
   Output: t1.c1, t1.c2, t1.c3, t1.c4, t1.c5, t1.c6, t1.c7, t1.c8, t1.spdurl
     Remote SQL: SELECT C_1, c2, c3, c4, c5, c6, c7, c8 FROM T_1 WHERE (C_1 = 1)
(3 rows)

--Testcase 337:
EXPLAIN (VERBOSE, COSTS OFF) EXECUTE st4(1);
                                   QUERY PLAN                                    
---------------------------------------------------------------------------------
 Foreign Scan on public.ft1_a t1
   Output: t1.c1, t1.c2, t1.c3, t1.c4, t1.c5, t1.c6, t1.c7, t1.c8, t1.spdurl
     Remote SQL: SELECT C_1, c2, c3, c4, c5, c6, c7, c8 FROM T_1 WHERE (C_1 = 1)
(3 rows)

--Testcase 338:
EXPLAIN (VERBOSE, COSTS OFF) EXECUTE st4(1);
                                   QUERY PLAN                                    
---------------------------------------------------------------------------------
 Foreign Scan on public.ft1_a t1
   Output: t1.c1, t1.c2, t1.c3, t1.c4, t1.c5, t1.c6, t1.c7, t1.c8, t1.spdurl
     Remote SQL: SELECT C_1, c2, c3, c4, c5, c6, c7, c8 FROM T_1 WHERE (C_1 = 1)
(3 rows)

-- once we try it enough times, should switch to generic plan
--Testcase 339:
EXPLAIN (VERBOSE, COSTS OFF) EXECUTE st4(1);
                                   QUERY PLAN                                    
---------------------------------------------------------------------------------
 Foreign Scan on public.ft1_a t1
   Output: t1.c1, t1.c2, t1.c3, t1.c4, t1.c5, t1.c6, t1.c7, t1.c8, t1.spdurl
     Remote SQL: SELECT C_1, c2, c3, c4, c5, c6, c7, c8 FROM T_1 WHERE (C_1 = 1)
(3 rows)

-- value of $1 should not be sent to remote
--Testcase 340:
PREPARE st5(text,int) AS SELECT * FROM ft1 t1 WHERE c8 = $1 and c1 = $2;
--Testcase 341:
EXPLAIN (VERBOSE, COSTS OFF) EXECUTE st5('foo', 1);
                                            QUERY PLAN                                            
--------------------------------------------------------------------------------------------------
 Foreign Scan on public.ft1_a t1
   Output: t1.c1, t1.c2, t1.c3, t1.c4, t1.c5, t1.c6, t1.c7, t1.c8, t1.spdurl
     Remote SQL: SELECT C_1, c2, c3, c4, c5, c6, c7, c8 FROM T_1 WHERE (c8 = 'foo') AND (C_1 = 1)
(3 rows)

--Testcase 342:
EXPLAIN (VERBOSE, COSTS OFF) EXECUTE st5('foo', 1);
                                            QUERY PLAN                                            
--------------------------------------------------------------------------------------------------
 Foreign Scan on public.ft1_a t1
   Output: t1.c1, t1.c2, t1.c3, t1.c4, t1.c5, t1.c6, t1.c7, t1.c8, t1.spdurl
     Remote SQL: SELECT C_1, c2, c3, c4, c5, c6, c7, c8 FROM T_1 WHERE (c8 = 'foo') AND (C_1 = 1)
(3 rows)

--Testcase 343:
EXPLAIN (VERBOSE, COSTS OFF) EXECUTE st5('foo', 1);
                                            QUERY PLAN                                            
--------------------------------------------------------------------------------------------------
 Foreign Scan on public.ft1_a t1
   Output: t1.c1, t1.c2, t1.c3, t1.c4, t1.c5, t1.c6, t1.c7, t1.c8, t1.spdurl
     Remote SQL: SELECT C_1, c2, c3, c4, c5, c6, c7, c8 FROM T_1 WHERE (c8 = 'foo') AND (C_1 = 1)
(3 rows)

--Testcase 344:
EXPLAIN (VERBOSE, COSTS OFF) EXECUTE st5('foo', 1);
                                            QUERY PLAN                                            
--------------------------------------------------------------------------------------------------
 Foreign Scan on public.ft1_a t1
   Output: t1.c1, t1.c2, t1.c3, t1.c4, t1.c5, t1.c6, t1.c7, t1.c8, t1.spdurl
     Remote SQL: SELECT C_1, c2, c3, c4, c5, c6, c7, c8 FROM T_1 WHERE (c8 = 'foo') AND (C_1 = 1)
(3 rows)

--Testcase 345:
EXPLAIN (VERBOSE, COSTS OFF) EXECUTE st5('foo', 1);
                                            QUERY PLAN                                            
--------------------------------------------------------------------------------------------------
 Foreign Scan on public.ft1_a t1
   Output: t1.c1, t1.c2, t1.c3, t1.c4, t1.c5, t1.c6, t1.c7, t1.c8, t1.spdurl
     Remote SQL: SELECT C_1, c2, c3, c4, c5, c6, c7, c8 FROM T_1 WHERE (c8 = 'foo') AND (C_1 = 1)
(3 rows)

--Testcase 346:
EXPLAIN (VERBOSE, COSTS OFF) EXECUTE st5('foo', 1);
                                            QUERY PLAN                                            
--------------------------------------------------------------------------------------------------
 Foreign Scan on public.ft1_a t1
   Output: t1.c1, t1.c2, t1.c3, t1.c4, t1.c5, t1.c6, t1.c7, t1.c8, t1.spdurl
     Remote SQL: SELECT C_1, c2, c3, c4, c5, c6, c7, c8 FROM T_1 WHERE (c8 = 'foo') AND (C_1 = 1)
(3 rows)

--Testcase 347:
EXECUTE st5('foo', 1);
 c1 | c2 |  c3   |              c4              |            c5            | c6 |     c7     | c8  | spdurl  
----+----+-------+------------------------------+--------------------------+----+------------+-----+---------
  1 |  1 | 00001 | Fri Jan 02 00:00:00 1970 PST | Fri Jan 02 00:00:00 1970 | 1  | 1          | foo | /node1/
(1 row)

-- altering FDW options requires replanning
--Testcase 348:
PREPARE st6 AS SELECT * FROM ft1 t1 WHERE t1.c1 = t1.c2 ORDER BY t1.c1;
--Testcase 349:
EXPLAIN (VERBOSE, COSTS OFF) EXECUTE st6;
                                       QUERY PLAN                                       
----------------------------------------------------------------------------------------
 Sort
   Output: t1.c1, t1.c2, t1.c3, t1.c4, t1.c5, t1.c6, t1.c7, t1.c8, t1.spdurl
   Sort Key: t1.c1
   ->  Foreign Scan on public.ft1_a t1
         Output: t1.c1, t1.c2, t1.c3, t1.c4, t1.c5, t1.c6, t1.c7, t1.c8, t1.spdurl
           Remote SQL: SELECT C_1, c2, c3, c4, c5, c6, c7, c8 FROM T_1 WHERE (C_1 = c2)
(6 rows)

--Testcase 350:
PREPARE st7 AS INSERT INTO ft1_a_child (c1,c2,c3) VALUES (1001,101,'foo');
--Testcase 351:
EXPLAIN (VERBOSE, COSTS OFF) EXECUTE st7;
                                                       QUERY PLAN                                                       
------------------------------------------------------------------------------------------------------------------------
 Insert on public.ft1_a_child
   Remote SQL: INSERT INTO T_1 VALUE {'C_1' : ?, 'c2' : ?, 'c3' : ?, 'c4' : ?, 'c5' : ?, 'c6' : ?, 'c7' : ?, 'c8' : ?};
   ->  Result
         Output: NULL::integer, 1001, 101, 'foo'::text, NULL::text, NULL::text, NULL::text, 'ft1'::text, NULL::text
(4 rows)

ALTER TABLE "S 1"."T 1" RENAME TO "T 0";
ALTER FOREIGN TABLE ft1_a_child OPTIONS (SET table_name 'T 0');
--Testcase 352:
EXPLAIN (VERBOSE, COSTS OFF) EXECUTE st6;
                                       QUERY PLAN                                       
----------------------------------------------------------------------------------------
 Sort
   Output: t1.c1, t1.c2, t1.c3, t1.c4, t1.c5, t1.c6, t1.c7, t1.c8, t1.spdurl
   Sort Key: t1.c1
   ->  Foreign Scan on public.ft1_a t1
         Output: t1.c1, t1.c2, t1.c3, t1.c4, t1.c5, t1.c6, t1.c7, t1.c8, t1.spdurl
           Remote SQL: SELECT C_1, c2, c3, c4, c5, c6, c7, c8 FROM T_1 WHERE (C_1 = c2)
(6 rows)

--Testcase 353:
EXECUTE st6;
 c1 | c2 |  c3   |              c4              |            c5            | c6 |     c7     | c8  | spdurl  
----+----+-------+------------------------------+--------------------------+----+------------+-----+---------
  1 |  1 | 00001 | Fri Jan 02 00:00:00 1970 PST | Fri Jan 02 00:00:00 1970 | 1  | 1          | foo | /node1/
  2 |  2 | 00002 | Sat Jan 03 00:00:00 1970 PST | Sat Jan 03 00:00:00 1970 | 2  | 2          | foo | /node1/
  3 |  3 | 00003 | Sun Jan 04 00:00:00 1970 PST | Sun Jan 04 00:00:00 1970 | 3  | 3          | foo | /node1/
  4 |  4 | 00004 | Mon Jan 05 00:00:00 1970 PST | Mon Jan 05 00:00:00 1970 | 4  | 4          | foo | /node1/
  5 |  5 | 00005 | Tue Jan 06 00:00:00 1970 PST | Tue Jan 06 00:00:00 1970 | 5  | 5          | foo | /node1/
  6 |  6 | 00006 | Wed Jan 07 00:00:00 1970 PST | Wed Jan 07 00:00:00 1970 | 6  | 6          | foo | /node1/
  7 |  7 | 00007 | Thu Jan 08 00:00:00 1970 PST | Thu Jan 08 00:00:00 1970 | 7  | 7          | foo | /node1/
  8 |  8 | 00008 | Fri Jan 09 00:00:00 1970 PST | Fri Jan 09 00:00:00 1970 | 8  | 8          | foo | /node1/
  9 |  9 | 00009 | Sat Jan 10 00:00:00 1970 PST | Sat Jan 10 00:00:00 1970 | 9  | 9          | foo | /node1/
(9 rows)

--Testcase 354:
EXPLAIN (VERBOSE, COSTS OFF) EXECUTE st7;
                                                        QUERY PLAN                                                        
--------------------------------------------------------------------------------------------------------------------------
 Insert on public.ft1_a_child
   Remote SQL: INSERT INTO "T 0" VALUE {'C_1' : ?, 'c2' : ?, 'c3' : ?, 'c4' : ?, 'c5' : ?, 'c6' : ?, 'c7' : ?, 'c8' : ?};
   ->  Result
         Output: NULL::integer, 1001, 101, 'foo'::text, NULL::text, NULL::text, NULL::text, 'ft1'::text, NULL::text
(4 rows)

ALTER TABLE "S 1"."T 0" RENAME TO "T 1";
ALTER FOREIGN TABLE ft1_a_child OPTIONS (SET table_name 'T_1');
--Testcase 355:
PREPARE st8 AS SELECT count(c3) FROM ft1 t1 WHERE t1.c1 === t1.c2;
--Testcase 356:
EXPLAIN (VERBOSE, COSTS OFF) EXECUTE st8;
                    QUERY PLAN                     
---------------------------------------------------
 Aggregate
   Output: count(t1.c3)
   ->  Foreign Scan on public.ft1_a t1
         Output: t1.c3
         Filter: (t1.c1 === t1.c2)
           Remote SQL: SELECT C_1, c2, c3 FROM T_1
(6 rows)

-- ALTER SERVER loopback OPTIONS (DROP extensions);
--Testcase 357:
EXPLAIN (VERBOSE, COSTS OFF) EXECUTE st8;
                    QUERY PLAN                     
---------------------------------------------------
 Aggregate
   Output: count(t1.c3)
   ->  Foreign Scan on public.ft1_a t1
         Output: t1.c3
         Filter: (t1.c1 === t1.c2)
           Remote SQL: SELECT C_1, c2, c3 FROM T_1
(6 rows)

--Testcase 358:
EXECUTE st8;
 count 
-------
     9
(1 row)

-- ALTER SERVER loopback OPTIONS (ADD extensions 'postgres_fdw');
-- cleanup
DEALLOCATE st1;
DEALLOCATE st2;
DEALLOCATE st3;
DEALLOCATE st4;
DEALLOCATE st5;
DEALLOCATE st6;
DEALLOCATE st7;
DEALLOCATE st8;
-- System columns, except ctid and oid, should not be sent to remote
--Testcase 359:
EXPLAIN (VERBOSE, COSTS OFF)
SELECT * FROM ft1 t1 WHERE t1.tableoid = 'pg_class'::regclass ORDER BY 1 LIMIT 1;
                                       QUERY PLAN                                        
-----------------------------------------------------------------------------------------
 Limit
   Output: t1.c1, t1.c2, t1.c3, t1.c4, t1.c5, t1.c6, t1.c7, t1.c8, t1.spdurl
   ->  Sort
         Output: t1.c1, t1.c2, t1.c3, t1.c4, t1.c5, t1.c6, t1.c7, t1.c8, t1.spdurl
         Sort Key: t1.c1
         ->  Foreign Scan on public.ft1_a t1
               Output: t1.c1, t1.c2, t1.c3, t1.c4, t1.c5, t1.c6, t1.c7, t1.c8, t1.spdurl
               Filter: (t1.tableoid = '1259'::oid)
                 Remote SQL: SELECT C_1, c2, c3, c4, c5, c6, c7, c8 FROM T_1
(9 rows)

--Testcase 360:
SELECT * FROM ft1 t1 WHERE t1.tableoid = 'ft1_a'::regclass ORDER BY 1 LIMIT 1;
 c1 | c2 |  c3   |              c4              |            c5            | c6 |     c7     | c8  | spdurl  
----+----+-------+------------------------------+--------------------------+----+------------+-----+---------
  1 |  1 | 00001 | Fri Jan 02 00:00:00 1970 PST | Fri Jan 02 00:00:00 1970 | 1  | 1          | foo | /node1/
(1 row)

--Testcase 361:
EXPLAIN (VERBOSE, COSTS OFF)
SELECT tableoid::regclass, * FROM ft1 t1 LIMIT 1;
                                                 QUERY PLAN                                                 
------------------------------------------------------------------------------------------------------------
 Limit
   Output: ((t1.tableoid)::regclass), t1.c1, t1.c2, t1.c3, t1.c4, t1.c5, t1.c6, t1.c7, t1.c8, t1.spdurl
   ->  Foreign Scan on public.ft1_a t1
         Output: (t1.tableoid)::regclass, t1.c1, t1.c2, t1.c3, t1.c4, t1.c5, t1.c6, t1.c7, t1.c8, t1.spdurl
           Remote SQL: SELECT C_1, c2, c3, c4, c5, c6, c7, c8 FROM T_1
(5 rows)

--Testcase 362:
SELECT tableoid::regclass, * FROM ft1 t1 ORDER BY t1.c1 LIMIT 1;
 tableoid | c1 | c2 |  c3   |              c4              |            c5            | c6 |     c7     | c8  | spdurl  
----------+----+----+-------+------------------------------+--------------------------+----+------------+-----+---------
 ft1_a    |  1 |  1 | 00001 | Fri Jan 02 00:00:00 1970 PST | Fri Jan 02 00:00:00 1970 | 1  | 1          | foo | /node1/
(1 row)

--Testcase 363:
EXPLAIN (VERBOSE, COSTS OFF)
SELECT * FROM ft1 t1 WHERE t1.ctid = '(0,2)';
                                       QUERY PLAN                                       
----------------------------------------------------------------------------------------
 Foreign Scan on public.ft1_a t1
   Output: t1.c1, t1.c2, t1.c3, t1.c4, t1.c5, t1.c6, t1.c7, t1.c8, t1.spdurl
     Remote SQL: SELECT C_1, c2, c3, c4, c5, c6, c7, c8 FROM T_1 WHERE (ctid = '(0,2)')
(3 rows)

-- ctid cannot be pushed down, so the result is empty
--Testcase 364:
SELECT * FROM ft1 t1 WHERE t1.ctid = '(0,2)';
 c1 | c2 | c3 | c4 | c5 | c6 | c7 | c8 | spdurl 
----+----+----+----+----+----+----+----+--------
(0 rows)

--Testcase 365:
EXPLAIN (VERBOSE, COSTS OFF)
SELECT ctid, * FROM ft1 t1 LIMIT 1;
                                         QUERY PLAN                                         
--------------------------------------------------------------------------------------------
 Limit
   Output: t1.ctid, t1.c1, t1.c2, t1.c3, t1.c4, t1.c5, t1.c6, t1.c7, t1.c8, t1.spdurl
   ->  Foreign Scan on public.ft1_a t1
         Output: t1.ctid, t1.c1, t1.c2, t1.c3, t1.c4, t1.c5, t1.c6, t1.c7, t1.c8, t1.spdurl
           Remote SQL: SELECT C_1, c2, c3, c4, c5, c6, c7, c8 FROM T_1
(5 rows)

--Testcase 366:
SELECT ctid, * FROM ft1 t1 ORDER BY t1.c1 LIMIT 1;
      ctid      | c1 | c2 |  c3   |              c4              |            c5            | c6 |     c7     | c8  | spdurl  
----------------+----+----+-------+------------------------------+--------------------------+----+------------+-----+---------
 (4294967295,0) |  1 |  1 | 00001 | Fri Jan 02 00:00:00 1970 PST | Fri Jan 02 00:00:00 1970 | 1  | 1          | foo | /node1/
(1 row)

-- ===================================================================
-- used in PL/pgSQL function
-- ===================================================================
--Testcase 367:
CREATE OR REPLACE FUNCTION f_test(p_c1 int) RETURNS int AS $$
DECLARE
	v_c1 int;
BEGIN
--Testcase 368:
    SELECT c1 INTO v_c1 FROM ft1 WHERE c1 = p_c1 LIMIT 1;
    PERFORM c1 FROM ft1 WHERE c1 = p_c1 AND p_c1 = v_c1 LIMIT 1;
    RETURN v_c1;
END;
$$ LANGUAGE plpgsql;
--Testcase 369:
SELECT f_test(100);
 f_test 
--------
    100
(1 row)

--Testcase 370:
DROP FUNCTION f_test(int);
-- ===================================================================
-- conversion error
-- ===================================================================
ALTER FOREIGN TABLE ft1_a_child ALTER COLUMN c8 TYPE int;
--Testcase 371:
SELECT * FROM ft1 ftx(x1,x2,x3,x4,x5,x6,x7,x8) WHERE x1 = 1;  -- ERROR
ERROR:  invalid input syntax for type integer: ""foo""
--Testcase 372:
SELECT ftx.x1, ft2.c2, ftx.x8 FROM ft1 ftx(x1,x2,x3,x4,x5,x6,x7,x8), ft2
  WHERE ftx.x1 = ft2.c1 AND ftx.x1 = 1; -- ERROR
ERROR:  invalid input syntax for type integer: ""foo""
--Testcase 373:
SELECT ftx.x1, ft2.c2, ftx FROM ft1 ftx(x1,x2,x3,x4,x5,x6,x7,x8), ft2
  WHERE ftx.x1 = ft2.c1 AND ftx.x1 = 1; -- ERROR
ERROR:  invalid input syntax for type integer: ""foo""
--Testcase 374:
SELECT sum(c2), array_agg(c8) FROM ft1 GROUP BY c8; -- ERROR
ERROR:  invalid input syntax for type integer: ""foo""
-- ANALYZE ft1; -- ERROR
ALTER FOREIGN TABLE ft1_a_child ALTER COLUMN c8 TYPE text;
-- ===================================================================
-- subtransaction
--  + local/remote error doesn't break cursor
-- ===================================================================
BEGIN;
DECLARE c CURSOR FOR SELECT * FROM ft1 ORDER BY c1;
--Testcase 375:
FETCH c;
 c1 | c2 |  c3   |              c4              |            c5            | c6 |     c7     | c8  | spdurl  
----+----+-------+------------------------------+--------------------------+----+------------+-----+---------
  1 |  1 | 00001 | Fri Jan 02 00:00:00 1970 PST | Fri Jan 02 00:00:00 1970 | 1  | 1          | foo | /node1/
(1 row)

SAVEPOINT s;
ERROR OUT;          -- ERROR
ERROR:  syntax error at or near "ERROR"
LINE 1: ERROR OUT;
        ^
ROLLBACK TO s;
--Testcase 376:
FETCH c;
 c1 | c2 |  c3   |              c4              |            c5            | c6 |     c7     | c8  | spdurl  
----+----+-------+------------------------------+--------------------------+----+------------+-----+---------
  2 |  2 | 00002 | Sat Jan 03 00:00:00 1970 PST | Sat Jan 03 00:00:00 1970 | 2  | 2          | foo | /node1/
(1 row)

SAVEPOINT s;
--Testcase 377:
SELECT * FROM ft1 WHERE 1 / (c1 - 1) > 0;  -- ERROR
ERROR:  division by zero
ROLLBACK TO s;
--Testcase 378:
FETCH c;
 c1 | c2 |  c3   |              c4              |            c5            | c6 |     c7     | c8  | spdurl  
----+----+-------+------------------------------+--------------------------+----+------------+-----+---------
  3 |  3 | 00003 | Sun Jan 04 00:00:00 1970 PST | Sun Jan 04 00:00:00 1970 | 3  | 3          | foo | /node1/
(1 row)

--Testcase 379:
SELECT * FROM ft1 ORDER BY c1 LIMIT 1;
 c1 | c2 |  c3   |              c4              |            c5            | c6 |     c7     | c8  | spdurl  
----+----+-------+------------------------------+--------------------------+----+------------+-----+---------
  1 |  1 | 00001 | Fri Jan 02 00:00:00 1970 PST | Fri Jan 02 00:00:00 1970 | 1  | 1          | foo | /node1/
(1 row)

COMMIT;
-- ===================================================================
-- test handling of collations
-- ===================================================================
-- create table loct3 (f1 text collate "C" unique, f2 text, f3 varchar(10) unique);
--Testcase 380:
create foreign table loct3_a_child (
	f1 text, 
	f2 text, 
	f3 text
) server dynamodb_server options (table_name 'loct3', partition_key 'f1');
--Testcase 381:
create table loct3 (
	f1 text, 
	f2 text, 
	f3 text,
	spdurl text
) PARTITION BY LIST (spdurl);
--Testcase 382:
CREATE FOREIGN TABLE loct3_a PARTITION OF loct3 FOR VALUES IN ('/node1/') SERVER spdsrv;
-- create foreign table ft3 (f1 text collate "C", f2 text, f3 varchar(10))
--   server loopback options (table_name 'loct3', use_remote_estimate 'true');
--Testcase 383:
create foreign table ft3_a_child (
	f1 text, 
	f2 text, 
	f3 text
) server dynamodb_server options (table_name 'loct3', partition_key 'f1');
--Testcase 384:
create table ft3 (
	f1 text, 
	f2 text, 
	f3 text,
	spdurl text
) PARTITION BY LIST (spdurl);
--Testcase 385:
CREATE FOREIGN TABLE ft3_a PARTITION OF ft3 FOR VALUES IN ('/node1/') SERVER spdsrv;
-- can be sent to remote
--Testcase 386:
explain (verbose, costs off) select * from ft3 where f1 = 'foo';
                           QUERY PLAN                            
-----------------------------------------------------------------
 Foreign Scan on public.ft3_a ft3
   Output: ft3.f1, ft3.f2, ft3.f3, ft3.spdurl
     Remote SQL: SELECT f1, f2, f3 FROM loct3 WHERE (f1 = 'foo')
(3 rows)

--Testcase 387:
explain (verbose, costs off) select * from ft3 where f1 COLLATE "C" = 'foo';
                  QUERY PLAN                  
----------------------------------------------
 Foreign Scan on public.ft3_a ft3
   Output: ft3.f1, ft3.f2, ft3.f3, ft3.spdurl
   Filter: ((ft3.f1)::text = 'foo'::text)
     Remote SQL: SELECT f1, f2, f3 FROM loct3
(4 rows)

--Testcase 388:
explain (verbose, costs off) select * from ft3 where f2 = 'foo';
                           QUERY PLAN                            
-----------------------------------------------------------------
 Foreign Scan on public.ft3_a ft3
   Output: ft3.f1, ft3.f2, ft3.f3, ft3.spdurl
     Remote SQL: SELECT f1, f2, f3 FROM loct3 WHERE (f2 = 'foo')
(3 rows)

--Testcase 389:
explain (verbose, costs off) select * from ft3 where f3 = 'foo';
                           QUERY PLAN                            
-----------------------------------------------------------------
 Foreign Scan on public.ft3_a ft3
   Output: ft3.f1, ft3.f2, ft3.f3, ft3.spdurl
     Remote SQL: SELECT f1, f2, f3 FROM loct3 WHERE (f3 = 'foo')
(3 rows)

--Testcase 390:
explain (verbose, costs off) select * from ft3 f, loct3 l
  where f.f3 = l.f3 and l.f1 = 'foo';
                                 QUERY PLAN                                  
-----------------------------------------------------------------------------
 Hash Join
   Output: f.f1, f.f2, f.f3, f.spdurl, l.f1, l.f2, l.f3, l.spdurl
   Hash Cond: (f.f3 = l.f3)
   ->  Foreign Scan on public.ft3_a f
         Output: f.f1, f.f2, f.f3, f.spdurl
           Remote SQL: SELECT f1, f2, f3 FROM loct3
   ->  Hash
         Output: l.f1, l.f2, l.f3, l.spdurl
         ->  Foreign Scan on public.loct3_a l
               Output: l.f1, l.f2, l.f3, l.spdurl
                 Remote SQL: SELECT f1, f2, f3 FROM loct3 WHERE (f1 = 'foo')
(11 rows)

-- can't be sent to remote
--Testcase 391:
explain (verbose, costs off) select * from ft3 where f1 COLLATE "POSIX" = 'foo';
                  QUERY PLAN                  
----------------------------------------------
 Foreign Scan on public.ft3_a ft3
   Output: ft3.f1, ft3.f2, ft3.f3, ft3.spdurl
   Filter: ((ft3.f1)::text = 'foo'::text)
     Remote SQL: SELECT f1, f2, f3 FROM loct3
(4 rows)

--Testcase 392:
explain (verbose, costs off) select * from ft3 where f1 = 'foo' COLLATE "C";
                  QUERY PLAN                  
----------------------------------------------
 Foreign Scan on public.ft3_a ft3
   Output: ft3.f1, ft3.f2, ft3.f3, ft3.spdurl
   Filter: (ft3.f1 = 'foo'::text COLLATE "C")
     Remote SQL: SELECT f1, f2, f3 FROM loct3
(4 rows)

--Testcase 393:
explain (verbose, costs off) select * from ft3 where f2 COLLATE "C" = 'foo';
                  QUERY PLAN                  
----------------------------------------------
 Foreign Scan on public.ft3_a ft3
   Output: ft3.f1, ft3.f2, ft3.f3, ft3.spdurl
   Filter: ((ft3.f2)::text = 'foo'::text)
     Remote SQL: SELECT f1, f2, f3 FROM loct3
(4 rows)

--Testcase 394:
explain (verbose, costs off) select * from ft3 where f2 = 'foo' COLLATE "C";
                  QUERY PLAN                  
----------------------------------------------
 Foreign Scan on public.ft3_a ft3
   Output: ft3.f1, ft3.f2, ft3.f3, ft3.spdurl
   Filter: (ft3.f2 = 'foo'::text COLLATE "C")
     Remote SQL: SELECT f1, f2, f3 FROM loct3
(4 rows)

--Testcase 395:
explain (verbose, costs off) select * from ft3 f, loct3 l
  where f.f3 = l.f3 COLLATE "POSIX" and l.f1 = 'foo';
                                 QUERY PLAN                                  
-----------------------------------------------------------------------------
 Hash Join
   Output: f.f1, f.f2, f.f3, f.spdurl, l.f1, l.f2, l.f3, l.spdurl
   Hash Cond: ((f.f3)::text = (l.f3)::text)
   ->  Foreign Scan on public.ft3_a f
         Output: f.f1, f.f2, f.f3, f.spdurl
           Remote SQL: SELECT f1, f2, f3 FROM loct3
   ->  Hash
         Output: l.f1, l.f2, l.f3, l.spdurl
         ->  Foreign Scan on public.loct3_a l
               Output: l.f1, l.f2, l.f3, l.spdurl
                 Remote SQL: SELECT f1, f2, f3 FROM loct3 WHERE (f1 = 'foo')
(11 rows)

-- ===================================================================
-- test writable foreign table stuff
-- ===================================================================
--Testcase 396:
EXPLAIN (verbose, costs off)
INSERT INTO ft2_a_child (c1,c2,c3) SELECT c1+1000,c2+100, c3 || c3 FROM ft2 ORDER BY c1 LIMIT 20;
                                                                                            QUERY PLAN                                                                                            
--------------------------------------------------------------------------------------------------------------------------------------------------------------------------------------------------
 Insert on public.ft2_a_child
   Remote SQL: INSERT INTO T_1 VALUE {'C_1' : ?, 'c2' : ?, 'c3' : ?, 'c4' : ?, 'c5' : ?, 'c6' : ?, 'c7' : ?, 'c8' : ?};
   ->  Subquery Scan on "*SELECT*"
         Output: "*SELECT*"."?column?", "*SELECT*"."?column?_1", NULL::integer, "*SELECT*"."?column?_2", NULL::text, NULL::text, NULL::character varying, 'ft2       '::character(10), NULL::text
         ->  Limit
               Output: ((ft2.c1 + 1000)), ((ft2.c2 + 100)), ((ft2.c3 || ft2.c3)), ft2.c1
               ->  Sort
                     Output: ((ft2.c1 + 1000)), ((ft2.c2 + 100)), ((ft2.c3 || ft2.c3)), ft2.c1
                     Sort Key: ft2.c1
                     ->  Foreign Scan on public.ft2_a ft2
                           Output: (ft2.c1 + 1000), (ft2.c2 + 100), (ft2.c3 || ft2.c3), ft2.c1
                             Remote SQL: SELECT C_1, c2, c3 FROM T_1
(12 rows)

--Testcase 397:
INSERT INTO ft2_a_child (c1,c2,c3) SELECT c1+1000,c2+100, c3 || c3 FROM ft2 ORDER BY c1 LIMIT 20;
-- DynamoDB does not support RETURNING in INSERT query => remove RETURNING
--Testcase 398:
INSERT INTO ft2_a_child (c1,c2,c3)
  VALUES (1101,201,'aaa'), (1102,202,'bbb'), (1103,203,'ccc');
--Testcase 399:
INSERT INTO ft2_a_child (c1,c2,c3) VALUES (1104,204,'ddd'), (1105,205,'eee');
--Testcase 400:
EXPLAIN (verbose, costs off)
UPDATE ft2_a_child SET c2 = c2 + 300, c3 = c3 || '_update3' WHERE c1 % 10 = 3;              -- can be pushed down
                                           QUERY PLAN                                            
-------------------------------------------------------------------------------------------------
 Update on public.ft2_a_child
   Remote SQL: UPDATE T_1 SET c2 = ? SET c3 = ? WHERE C_1 = ?
   ->  Foreign Scan on public.ft2_a_child
         Output: c1, (c2 + 300), NULL::integer, (c3 || '_update3'::text), c4, c5, c6, c7, c8, c1
         Filter: ((ft2_a_child.c1 % 10) = 3)
         Remote SQL: SELECT C_1, c2, c3, c4, c5, c6, c7, c8 FROM T_1
(6 rows)

--Testcase 401:
UPDATE ft2_a_child SET c2 = c2 + 300, c3 = c3 || '_update3' WHERE c1 % 10 = 3;
--Testcase 402:
EXPLAIN (verbose, costs off)
UPDATE ft2_a_child SET c2 = c2 + 400, c3 = c3 || '_update7' WHERE c1 % 10 = 7 RETURNING *;  -- can be pushed down
                                           QUERY PLAN                                            
-------------------------------------------------------------------------------------------------
 Update on public.ft2_a_child
   Output: c1, c2, c3, c4, c5, c6, c7, c8
   Remote SQL: UPDATE T_1 SET c2 = ? SET c3 = ? WHERE C_1 = ? RETURNING ALL NEW *
   ->  Foreign Scan on public.ft2_a_child
         Output: c1, (c2 + 400), NULL::integer, (c3 || '_update7'::text), c4, c5, c6, c7, c8, c1
         Filter: ((ft2_a_child.c1 % 10) = 7)
         Remote SQL: SELECT C_1, c2, c3, c4, c5, c6, c7, c8 FROM T_1
(7 rows)

--Testcase 403:
UPDATE ft2_a_child SET c2 = c2 + 400, c3 = c3 || '_update7' WHERE c1 % 10 = 7 RETURNING *;
  c1  | c2  |         c3         |              c4              |            c5            | c6 |     c7     | c8  
------+-----+--------------------+------------------------------+--------------------------+----+------------+-----
  517 | 407 | 00517_update7      | Sun Jan 18 00:00:00 1970 PST | Sun Jan 18 00:00:00 1970 | 7  | 7          | foo
  157 | 407 | 00157_update7      | Fri Feb 27 00:00:00 1970 PST | Fri Feb 27 00:00:00 1970 | 7  | 7          | foo
  567 | 407 | 00567_update7      | Mon Mar 09 00:00:00 1970 PST | Mon Mar 09 00:00:00 1970 | 7  | 7          | foo
  917 | 407 | 00917_update7      | Sun Jan 18 00:00:00 1970 PST | Sun Jan 18 00:00:00 1970 | 7  | 7          | foo
  447 | 407 | 00447_update7      | Tue Feb 17 00:00:00 1970 PST | Tue Feb 17 00:00:00 1970 | 7  | 7          | foo
  387 | 407 | 00387_update7      | Sun Mar 29 00:00:00 1970 PST | Sun Mar 29 00:00:00 1970 | 7  | 7          | foo
   57 | 407 | 00057_update7      | Fri Feb 27 00:00:00 1970 PST | Fri Feb 27 00:00:00 1970 | 7  | 7          | foo
 1007 | 507 | 0000700007_update7 |                              |                          |    | ft2        | 
  967 | 407 | 00967_update7      | Mon Mar 09 00:00:00 1970 PST | Mon Mar 09 00:00:00 1970 | 7  | 7          | foo
  817 | 407 | 00817_update7      | Sun Jan 18 00:00:00 1970 PST | Sun Jan 18 00:00:00 1970 | 7  | 7          | foo
  257 | 407 | 00257_update7      | Fri Feb 27 00:00:00 1970 PST | Fri Feb 27 00:00:00 1970 | 7  | 7          | foo
  667 | 407 | 00667_update7      | Mon Mar 09 00:00:00 1970 PST | Mon Mar 09 00:00:00 1970 | 7  | 7          | foo
  597 | 407 | 00597_update7      | Wed Apr 08 00:00:00 1970 PST | Wed Apr 08 00:00:00 1970 | 7  | 7          | foo
   97 | 407 | 00097_update7      | Wed Apr 08 00:00:00 1970 PST | Wed Apr 08 00:00:00 1970 | 7  | 7          | foo
  347 | 407 | 00347_update7      | Tue Feb 17 00:00:00 1970 PST | Tue Feb 17 00:00:00 1970 | 7  | 7          | foo
  137 | 407 | 00137_update7      | Sat Feb 07 00:00:00 1970 PST | Sat Feb 07 00:00:00 1970 | 7  | 7          | foo
  457 | 407 | 00457_update7      | Fri Feb 27 00:00:00 1970 PST | Fri Feb 27 00:00:00 1970 | 7  | 7          | foo
  287 | 407 | 00287_update7      | Sun Mar 29 00:00:00 1970 PST | Sun Mar 29 00:00:00 1970 | 7  | 7          | foo
  427 | 407 | 00427_update7      | Wed Jan 28 00:00:00 1970 PST | Wed Jan 28 00:00:00 1970 | 7  | 7          | foo
  797 | 407 | 00797_update7      | Wed Apr 08 00:00:00 1970 PST | Wed Apr 08 00:00:00 1970 | 7  | 7          | foo
  987 | 407 | 00987_update7      | Sun Mar 29 00:00:00 1970 PST | Sun Mar 29 00:00:00 1970 | 7  | 7          | foo
  627 | 407 | 00627_update7      | Wed Jan 28 00:00:00 1970 PST | Wed Jan 28 00:00:00 1970 | 7  | 7          | foo
  717 | 407 | 00717_update7      | Sun Jan 18 00:00:00 1970 PST | Sun Jan 18 00:00:00 1970 | 7  | 7          | foo
  827 | 407 | 00827_update7      | Wed Jan 28 00:00:00 1970 PST | Wed Jan 28 00:00:00 1970 | 7  | 7          | foo
  317 | 407 | 00317_update7      | Sun Jan 18 00:00:00 1970 PST | Sun Jan 18 00:00:00 1970 | 7  | 7          | foo
  867 | 407 | 00867_update7      | Mon Mar 09 00:00:00 1970 PST | Mon Mar 09 00:00:00 1970 | 7  | 7          | foo
   67 | 407 | 00067_update7      | Mon Mar 09 00:00:00 1970 PST | Mon Mar 09 00:00:00 1970 | 7  | 7          | foo
  637 | 407 | 00637_update7      | Sat Feb 07 00:00:00 1970 PST | Sat Feb 07 00:00:00 1970 | 7  | 7          | foo
  327 | 407 | 00327_update7      | Wed Jan 28 00:00:00 1970 PST | Wed Jan 28 00:00:00 1970 | 7  | 7          | foo
  267 | 407 | 00267_update7      | Mon Mar 09 00:00:00 1970 PST | Mon Mar 09 00:00:00 1970 | 7  | 7          | foo
  707 | 407 | 00707_update7      | Thu Jan 08 00:00:00 1970 PST | Thu Jan 08 00:00:00 1970 | 7  | 7          | foo
  577 | 407 | 00577_update7      | Thu Mar 19 00:00:00 1970 PST | Thu Mar 19 00:00:00 1970 | 7  | 7          | foo
  727 | 407 | 00727_update7      | Wed Jan 28 00:00:00 1970 PST | Wed Jan 28 00:00:00 1970 | 7  | 7          | foo
  397 | 407 | 00397_update7      | Wed Apr 08 00:00:00 1970 PST | Wed Apr 08 00:00:00 1970 | 7  | 7          | foo
  497 | 407 | 00497_update7      | Wed Apr 08 00:00:00 1970 PST | Wed Apr 08 00:00:00 1970 | 7  | 7          | foo
  587 | 407 | 00587_update7      | Sun Mar 29 00:00:00 1970 PST | Sun Mar 29 00:00:00 1970 | 7  | 7          | foo
  107 | 407 | 00107_update7      | Thu Jan 08 00:00:00 1970 PST | Thu Jan 08 00:00:00 1970 | 7  | 7          | foo
  677 | 407 | 00677_update7      | Thu Mar 19 00:00:00 1970 PST | Thu Mar 19 00:00:00 1970 | 7  | 7          | foo
  147 | 407 | 00147_update7      | Tue Feb 17 00:00:00 1970 PST | Tue Feb 17 00:00:00 1970 | 7  | 7          | foo
  937 | 407 | 00937_update7      | Sat Feb 07 00:00:00 1970 PST | Sat Feb 07 00:00:00 1970 | 7  | 7          | foo
    7 | 407 | 00007_update7      | Thu Jan 08 00:00:00 1970 PST | Thu Jan 08 00:00:00 1970 | 7  | 7          | foo
  237 | 407 | 00237_update7      | Sat Feb 07 00:00:00 1970 PST | Sat Feb 07 00:00:00 1970 | 7  | 7          | foo
  377 | 407 | 00377_update7      | Thu Mar 19 00:00:00 1970 PST | Thu Mar 19 00:00:00 1970 | 7  | 7          | foo
  207 | 407 | 00207_update7      | Thu Jan 08 00:00:00 1970 PST | Thu Jan 08 00:00:00 1970 | 7  | 7          | foo
   47 | 407 | 00047_update7      | Tue Feb 17 00:00:00 1970 PST | Tue Feb 17 00:00:00 1970 | 7  | 7          | foo
  607 | 407 | 00607_update7      | Thu Jan 08 00:00:00 1970 PST | Thu Jan 08 00:00:00 1970 | 7  | 7          | foo
  547 | 407 | 00547_update7      | Tue Feb 17 00:00:00 1970 PST | Tue Feb 17 00:00:00 1970 | 7  | 7          | foo
  117 | 407 | 00117_update7      | Sun Jan 18 00:00:00 1970 PST | Sun Jan 18 00:00:00 1970 | 7  | 7          | foo
  187 | 407 | 00187_update7      | Sun Mar 29 00:00:00 1970 PST | Sun Mar 29 00:00:00 1970 | 7  | 7          | foo
  177 | 407 | 00177_update7      | Thu Mar 19 00:00:00 1970 PST | Thu Mar 19 00:00:00 1970 | 7  | 7          | foo
  847 | 407 | 00847_update7      | Tue Feb 17 00:00:00 1970 PST | Tue Feb 17 00:00:00 1970 | 7  | 7          | foo
  217 | 407 | 00217_update7      | Sun Jan 18 00:00:00 1970 PST | Sun Jan 18 00:00:00 1970 | 7  | 7          | foo
  297 | 407 | 00297_update7      | Wed Apr 08 00:00:00 1970 PST | Wed Apr 08 00:00:00 1970 | 7  | 7          | foo
  837 | 407 | 00837_update7      | Sat Feb 07 00:00:00 1970 PST | Sat Feb 07 00:00:00 1970 | 7  | 7          | foo
  757 | 407 | 00757_update7      | Fri Feb 27 00:00:00 1970 PST | Fri Feb 27 00:00:00 1970 | 7  | 7          | foo
  357 | 407 | 00357_update7      | Fri Feb 27 00:00:00 1970 PST | Fri Feb 27 00:00:00 1970 | 7  | 7          | foo
  407 | 407 | 00407_update7      | Thu Jan 08 00:00:00 1970 PST | Thu Jan 08 00:00:00 1970 | 7  | 7          | foo
  947 | 407 | 00947_update7      | Tue Feb 17 00:00:00 1970 PST | Tue Feb 17 00:00:00 1970 | 7  | 7          | foo
   87 | 407 | 00087_update7      | Sun Mar 29 00:00:00 1970 PST | Sun Mar 29 00:00:00 1970 | 7  | 7          | foo
  927 | 407 | 00927_update7      | Wed Jan 28 00:00:00 1970 PST | Wed Jan 28 00:00:00 1970 | 7  | 7          | foo
  127 | 407 | 00127_update7      | Wed Jan 28 00:00:00 1970 PST | Wed Jan 28 00:00:00 1970 | 7  | 7          | foo
  957 | 407 | 00957_update7      | Fri Feb 27 00:00:00 1970 PST | Fri Feb 27 00:00:00 1970 | 7  | 7          | foo
  477 | 407 | 00477_update7      | Thu Mar 19 00:00:00 1970 PST | Thu Mar 19 00:00:00 1970 | 7  | 7          | foo
  197 | 407 | 00197_update7      | Wed Apr 08 00:00:00 1970 PST | Wed Apr 08 00:00:00 1970 | 7  | 7          | foo
  657 | 407 | 00657_update7      | Fri Feb 27 00:00:00 1970 PST | Fri Feb 27 00:00:00 1970 | 7  | 7          | foo
   27 | 407 | 00027_update7      | Wed Jan 28 00:00:00 1970 PST | Wed Jan 28 00:00:00 1970 | 7  | 7          | foo
   17 | 407 | 00017_update7      | Sun Jan 18 00:00:00 1970 PST | Sun Jan 18 00:00:00 1970 | 7  | 7          | foo
  687 | 407 | 00687_update7      | Sun Mar 29 00:00:00 1970 PST | Sun Mar 29 00:00:00 1970 | 7  | 7          | foo
  527 | 407 | 00527_update7      | Wed Jan 28 00:00:00 1970 PST | Wed Jan 28 00:00:00 1970 | 7  | 7          | foo
  227 | 407 | 00227_update7      | Wed Jan 28 00:00:00 1970 PST | Wed Jan 28 00:00:00 1970 | 7  | 7          | foo
  337 | 407 | 00337_update7      | Sat Feb 07 00:00:00 1970 PST | Sat Feb 07 00:00:00 1970 | 7  | 7          | foo
  617 | 407 | 00617_update7      | Sun Jan 18 00:00:00 1970 PST | Sun Jan 18 00:00:00 1970 | 7  | 7          | foo
  897 | 407 | 00897_update7      | Wed Apr 08 00:00:00 1970 PST | Wed Apr 08 00:00:00 1970 | 7  | 7          | foo
  647 | 407 | 00647_update7      | Tue Feb 17 00:00:00 1970 PST | Tue Feb 17 00:00:00 1970 | 7  | 7          | foo
  807 | 407 | 00807_update7      | Thu Jan 08 00:00:00 1970 PST | Thu Jan 08 00:00:00 1970 | 7  | 7          | foo
  247 | 407 | 00247_update7      | Tue Feb 17 00:00:00 1970 PST | Tue Feb 17 00:00:00 1970 | 7  | 7          | foo
   77 | 407 | 00077_update7      | Thu Mar 19 00:00:00 1970 PST | Thu Mar 19 00:00:00 1970 | 7  | 7          | foo
  977 | 407 | 00977_update7      | Thu Mar 19 00:00:00 1970 PST | Thu Mar 19 00:00:00 1970 | 7  | 7          | foo
  887 | 407 | 00887_update7      | Sun Mar 29 00:00:00 1970 PST | Sun Mar 29 00:00:00 1970 | 7  | 7          | foo
  537 | 407 | 00537_update7      | Sat Feb 07 00:00:00 1970 PST | Sat Feb 07 00:00:00 1970 | 7  | 7          | foo
 1017 | 507 | 0001700017_update7 |                              |                          |    | ft2        | 
  507 | 407 | 00507_update7      | Thu Jan 08 00:00:00 1970 PST | Thu Jan 08 00:00:00 1970 | 7  | 7          | foo
  787 | 407 | 00787_update7      | Sun Mar 29 00:00:00 1970 PST | Sun Mar 29 00:00:00 1970 | 7  | 7          | foo
  417 | 407 | 00417_update7      | Sun Jan 18 00:00:00 1970 PST | Sun Jan 18 00:00:00 1970 | 7  | 7          | foo
  777 | 407 | 00777_update7      | Thu Mar 19 00:00:00 1970 PST | Thu Mar 19 00:00:00 1970 | 7  | 7          | foo
  367 | 407 | 00367_update7      | Mon Mar 09 00:00:00 1970 PST | Mon Mar 09 00:00:00 1970 | 7  | 7          | foo
  857 | 407 | 00857_update7      | Fri Feb 27 00:00:00 1970 PST | Fri Feb 27 00:00:00 1970 | 7  | 7          | foo
  467 | 407 | 00467_update7      | Mon Mar 09 00:00:00 1970 PST | Mon Mar 09 00:00:00 1970 | 7  | 7          | foo
  437 | 407 | 00437_update7      | Sat Feb 07 00:00:00 1970 PST | Sat Feb 07 00:00:00 1970 | 7  | 7          | foo
  747 | 407 | 00747_update7      | Tue Feb 17 00:00:00 1970 PST | Tue Feb 17 00:00:00 1970 | 7  | 7          | foo
  307 | 407 | 00307_update7      | Thu Jan 08 00:00:00 1970 PST | Thu Jan 08 00:00:00 1970 | 7  | 7          | foo
  487 | 407 | 00487_update7      | Sun Mar 29 00:00:00 1970 PST | Sun Mar 29 00:00:00 1970 | 7  | 7          | foo
  767 | 407 | 00767_update7      | Mon Mar 09 00:00:00 1970 PST | Mon Mar 09 00:00:00 1970 | 7  | 7          | foo
  997 | 407 | 00997_update7      | Wed Apr 08 00:00:00 1970 PST | Wed Apr 08 00:00:00 1970 | 7  | 7          | foo
  557 | 407 | 00557_update7      | Fri Feb 27 00:00:00 1970 PST | Fri Feb 27 00:00:00 1970 | 7  | 7          | foo
  737 | 407 | 00737_update7      | Sat Feb 07 00:00:00 1970 PST | Sat Feb 07 00:00:00 1970 | 7  | 7          | foo
  697 | 407 | 00697_update7      | Wed Apr 08 00:00:00 1970 PST | Wed Apr 08 00:00:00 1970 | 7  | 7          | foo
  907 | 407 | 00907_update7      | Thu Jan 08 00:00:00 1970 PST | Thu Jan 08 00:00:00 1970 | 7  | 7          | foo
  877 | 407 | 00877_update7      | Thu Mar 19 00:00:00 1970 PST | Thu Mar 19 00:00:00 1970 | 7  | 7          | foo
  277 | 407 | 00277_update7      | Thu Mar 19 00:00:00 1970 PST | Thu Mar 19 00:00:00 1970 | 7  | 7          | foo
  167 | 407 | 00167_update7      | Mon Mar 09 00:00:00 1970 PST | Mon Mar 09 00:00:00 1970 | 7  | 7          | foo
   37 | 407 | 00037_update7      | Sat Feb 07 00:00:00 1970 PST | Sat Feb 07 00:00:00 1970 | 7  | 7          | foo
(102 rows)

--Testcase 404:
EXPLAIN (verbose, costs off)
UPDATE ft2_a_child SET c2 = ft2_a_child.c2 + 500, c3 = ft2_a_child.c3 || '_update9', c7 = DEFAULT
  FROM ft1 WHERE ft1.c1 = ft2_a_child.c2 AND ft1.c1 % 10 = 9;                               -- can be pushed down
                                                                                                                            QUERY PLAN                                                                                                                            
------------------------------------------------------------------------------------------------------------------------------------------------------------------------------------------------------------------------------------------------------------------
 Update on public.ft2_a_child
   Remote SQL: UPDATE T_1 SET c2 = ? SET c3 = ? SET c7 = ? WHERE C_1 = ?
   ->  Hash Join
         Output: ft2_a_child.c1, (ft2_a_child.c2 + 500), NULL::integer, (ft2_a_child.c3 || '_update9'::text), ft2_a_child.c4, ft2_a_child.c5, ft2_a_child.c6, 'ft2       '::character(10), ft2_a_child.c8, ft2_a_child.c1, ft1.ctid, ((ft1.*)::ft1), ft1.tableoid
         Hash Cond: (ft2_a_child.c2 = ft1.c1)
         ->  Foreign Scan on public.ft2_a_child
               Output: ft2_a_child.c1, ft2_a_child.c2, ft2_a_child.c3, ft2_a_child.c4, ft2_a_child.c5, ft2_a_child.c6, ft2_a_child.c8
               Remote SQL: SELECT C_1, c2, c3, c4, c5, c6, c8 FROM T_1
         ->  Hash
               Output: ft1.ctid, ft1.c1, ((ft1.*)::ft1), ft1.tableoid
               ->  Foreign Scan on public.ft1_a ft1
                     Output: ft1.ctid, ft1.c1, ft1.*, ft1.tableoid
                     Filter: ((ft1.c1 % 10) = 9)
                       Remote SQL: SELECT C_1, c2, c3, c4, c5, c6, c7, c8 FROM T_1
(14 rows)

--Testcase 405:
UPDATE ft2_a_child SET c2 = ft2_a_child.c2 + 500, c3 = ft2_a_child.c3 || '_update9', c7 = DEFAULT
  FROM ft1 WHERE ft1.c1 = ft2_a_child.c2 AND ft1.c1 % 10 = 9;
--Testcase 406:
EXPLAIN (verbose, costs off)
  DELETE FROM ft2_a_child WHERE c1 % 10 = 5 RETURNING c1, c4;                               -- can be pushed down
                           QUERY PLAN                            
-----------------------------------------------------------------
 Delete on public.ft2_a_child
   Output: c1, c4
   Remote SQL: DELETE FROM T_1 WHERE C_1 = ? RETURNING ALL OLD *
   ->  Foreign Scan on public.ft2_a_child
         Output: c1
         Filter: ((ft2_a_child.c1 % 10) = 5)
         Remote SQL: SELECT C_1 FROM T_1
(7 rows)

--Testcase 407:
DELETE FROM ft2_a_child WHERE c1 % 10 = 5 RETURNING c1, c4;
  c1  |              c4              
------+------------------------------
  435 | Thu Feb 05 00:00:00 1970 PST
  985 | Fri Mar 27 00:00:00 1970 PST
  615 | Fri Jan 16 00:00:00 1970 PST
   45 | Sun Feb 15 00:00:00 1970 PST
  935 | Thu Feb 05 00:00:00 1970 PST
  875 | Tue Mar 17 00:00:00 1970 PST
  905 | Tue Jan 06 00:00:00 1970 PST
  455 | Wed Feb 25 00:00:00 1970 PST
 1015 | 
  675 | Tue Mar 17 00:00:00 1970 PST
   85 | Fri Mar 27 00:00:00 1970 PST
  445 | Sun Feb 15 00:00:00 1970 PST
  805 | Tue Jan 06 00:00:00 1970 PST
 1005 | 
  995 | Mon Apr 06 00:00:00 1970 PST
   15 | Fri Jan 16 00:00:00 1970 PST
  275 | Tue Mar 17 00:00:00 1970 PST
  645 | Sun Feb 15 00:00:00 1970 PST
  755 | Wed Feb 25 00:00:00 1970 PST
  625 | Mon Jan 26 00:00:00 1970 PST
  295 | Mon Apr 06 00:00:00 1970 PST
  945 | Sun Feb 15 00:00:00 1970 PST
    5 | Tue Jan 06 00:00:00 1970 PST
  865 | Sat Mar 07 00:00:00 1970 PST
  515 | Fri Jan 16 00:00:00 1970 PST
  425 | Mon Jan 26 00:00:00 1970 PST
  175 | Tue Mar 17 00:00:00 1970 PST
   35 | Thu Feb 05 00:00:00 1970 PST
 1105 | 
  575 | Tue Mar 17 00:00:00 1970 PST
  655 | Wed Feb 25 00:00:00 1970 PST
  205 | Tue Jan 06 00:00:00 1970 PST
  555 | Wed Feb 25 00:00:00 1970 PST
  285 | Fri Mar 27 00:00:00 1970 PST
  145 | Sun Feb 15 00:00:00 1970 PST
  735 | Thu Feb 05 00:00:00 1970 PST
  815 | Fri Jan 16 00:00:00 1970 PST
  745 | Sun Feb 15 00:00:00 1970 PST
  245 | Sun Feb 15 00:00:00 1970 PST
  265 | Sat Mar 07 00:00:00 1970 PST
  195 | Mon Apr 06 00:00:00 1970 PST
  565 | Sat Mar 07 00:00:00 1970 PST
  405 | Tue Jan 06 00:00:00 1970 PST
  115 | Fri Jan 16 00:00:00 1970 PST
  785 | Fri Mar 27 00:00:00 1970 PST
  255 | Wed Feb 25 00:00:00 1970 PST
   65 | Sat Mar 07 00:00:00 1970 PST
  235 | Thu Feb 05 00:00:00 1970 PST
  485 | Fri Mar 27 00:00:00 1970 PST
  885 | Fri Mar 27 00:00:00 1970 PST
  155 | Wed Feb 25 00:00:00 1970 PST
  505 | Tue Jan 06 00:00:00 1970 PST
   25 | Mon Jan 26 00:00:00 1970 PST
  135 | Thu Feb 05 00:00:00 1970 PST
  795 | Mon Apr 06 00:00:00 1970 PST
  955 | Wed Feb 25 00:00:00 1970 PST
   55 | Wed Feb 25 00:00:00 1970 PST
  835 | Thu Feb 05 00:00:00 1970 PST
  895 | Mon Apr 06 00:00:00 1970 PST
  535 | Thu Feb 05 00:00:00 1970 PST
  665 | Sat Mar 07 00:00:00 1970 PST
  225 | Mon Jan 26 00:00:00 1970 PST
  845 | Sun Feb 15 00:00:00 1970 PST
  365 | Sat Mar 07 00:00:00 1970 PST
  965 | Sat Mar 07 00:00:00 1970 PST
  725 | Mon Jan 26 00:00:00 1970 PST
  385 | Fri Mar 27 00:00:00 1970 PST
  525 | Mon Jan 26 00:00:00 1970 PST
  695 | Mon Apr 06 00:00:00 1970 PST
   75 | Tue Mar 17 00:00:00 1970 PST
  495 | Mon Apr 06 00:00:00 1970 PST
  545 | Sun Feb 15 00:00:00 1970 PST
  305 | Tue Jan 06 00:00:00 1970 PST
  465 | Sat Mar 07 00:00:00 1970 PST
  345 | Sun Feb 15 00:00:00 1970 PST
  635 | Thu Feb 05 00:00:00 1970 PST
  855 | Wed Feb 25 00:00:00 1970 PST
  595 | Mon Apr 06 00:00:00 1970 PST
  335 | Thu Feb 05 00:00:00 1970 PST
  395 | Mon Apr 06 00:00:00 1970 PST
  705 | Tue Jan 06 00:00:00 1970 PST
  105 | Tue Jan 06 00:00:00 1970 PST
  125 | Mon Jan 26 00:00:00 1970 PST
  685 | Fri Mar 27 00:00:00 1970 PST
  325 | Mon Jan 26 00:00:00 1970 PST
  315 | Fri Jan 16 00:00:00 1970 PST
  605 | Tue Jan 06 00:00:00 1970 PST
  585 | Fri Mar 27 00:00:00 1970 PST
  765 | Sat Mar 07 00:00:00 1970 PST
  415 | Fri Jan 16 00:00:00 1970 PST
  775 | Tue Mar 17 00:00:00 1970 PST
  915 | Fri Jan 16 00:00:00 1970 PST
   95 | Mon Apr 06 00:00:00 1970 PST
  355 | Wed Feb 25 00:00:00 1970 PST
  475 | Tue Mar 17 00:00:00 1970 PST
  925 | Mon Jan 26 00:00:00 1970 PST
  975 | Tue Mar 17 00:00:00 1970 PST
  185 | Fri Mar 27 00:00:00 1970 PST
  825 | Mon Jan 26 00:00:00 1970 PST
  215 | Fri Jan 16 00:00:00 1970 PST
  715 | Fri Jan 16 00:00:00 1970 PST
  375 | Tue Mar 17 00:00:00 1970 PST
  165 | Sat Mar 07 00:00:00 1970 PST
(103 rows)

--Testcase 408:
EXPLAIN (verbose, costs off)
DELETE FROM ft2_a_child USING ft1 WHERE ft1.c1 = ft2_a_child.c2 AND ft1.c1 % 10 = 2;                -- can be pushed down
                                    QUERY PLAN                                     
-----------------------------------------------------------------------------------
 Delete on public.ft2_a_child
   Remote SQL: DELETE FROM T_1 WHERE C_1 = ?
   ->  Hash Join
         Output: ft2_a_child.c1, ft1.ctid, ((ft1.*)::ft1), ft1.tableoid
         Hash Cond: (ft2_a_child.c2 = ft1.c1)
         ->  Foreign Scan on public.ft2_a_child
               Output: ft2_a_child.c1, ft2_a_child.c2
               Remote SQL: SELECT C_1, c2 FROM T_1
         ->  Hash
               Output: ft1.ctid, ft1.c1, ((ft1.*)::ft1), ft1.tableoid
               ->  Foreign Scan on public.ft1_a ft1
                     Output: ft1.ctid, ft1.c1, ft1.*, ft1.tableoid
                     Filter: ((ft1.c1 % 10) = 2)
                       Remote SQL: SELECT C_1, c2, c3, c4, c5, c6, c7, c8 FROM T_1
(14 rows)

--Testcase 409:
DELETE FROM ft2_a_child USING ft1 WHERE ft1.c1 = ft2_a_child.c2 AND ft1.c1 % 10 = 2;
--Testcase 410:
SELECT c1,c2,c3,c4 FROM ft2 ORDER BY c1;
  c1  | c2  |         c3         |              c4              
------+-----+--------------------+------------------------------
    1 |   1 | 00001              | Fri Jan 02 00:00:00 1970 PST
    3 | 303 | 00003_update3      | Sun Jan 04 00:00:00 1970 PST
    4 |   4 | 00004              | Mon Jan 05 00:00:00 1970 PST
    6 |   6 | 00006              | Wed Jan 07 00:00:00 1970 PST
    7 | 407 | 00007_update7      | Thu Jan 08 00:00:00 1970 PST
    8 |   8 | 00008              | Fri Jan 09 00:00:00 1970 PST
    9 | 509 | 00009_update9      | Sat Jan 10 00:00:00 1970 PST
   10 |   0 | 00010              | Sun Jan 11 00:00:00 1970 PST
   11 |   1 | 00011              | Mon Jan 12 00:00:00 1970 PST
   13 | 303 | 00013_update3      | Wed Jan 14 00:00:00 1970 PST
   14 |   4 | 00014              | Thu Jan 15 00:00:00 1970 PST
   16 |   6 | 00016              | Sat Jan 17 00:00:00 1970 PST
   17 | 407 | 00017_update7      | Sun Jan 18 00:00:00 1970 PST
   18 |   8 | 00018              | Mon Jan 19 00:00:00 1970 PST
   19 | 509 | 00019_update9      | Tue Jan 20 00:00:00 1970 PST
   20 |   0 | 00020              | Wed Jan 21 00:00:00 1970 PST
   21 |   1 | 00021              | Thu Jan 22 00:00:00 1970 PST
   23 | 303 | 00023_update3      | Sat Jan 24 00:00:00 1970 PST
   24 |   4 | 00024              | Sun Jan 25 00:00:00 1970 PST
   26 |   6 | 00026              | Tue Jan 27 00:00:00 1970 PST
   27 | 407 | 00027_update7      | Wed Jan 28 00:00:00 1970 PST
   28 |   8 | 00028              | Thu Jan 29 00:00:00 1970 PST
   29 | 509 | 00029_update9      | Fri Jan 30 00:00:00 1970 PST
   30 |   0 | 00030              | Sat Jan 31 00:00:00 1970 PST
   31 |   1 | 00031              | Sun Feb 01 00:00:00 1970 PST
   33 | 303 | 00033_update3      | Tue Feb 03 00:00:00 1970 PST
   34 |   4 | 00034              | Wed Feb 04 00:00:00 1970 PST
   36 |   6 | 00036              | Fri Feb 06 00:00:00 1970 PST
   37 | 407 | 00037_update7      | Sat Feb 07 00:00:00 1970 PST
   38 |   8 | 00038              | Sun Feb 08 00:00:00 1970 PST
   39 | 509 | 00039_update9      | Mon Feb 09 00:00:00 1970 PST
   40 |   0 | 00040              | Tue Feb 10 00:00:00 1970 PST
   41 |   1 | 00041              | Wed Feb 11 00:00:00 1970 PST
   43 | 303 | 00043_update3      | Fri Feb 13 00:00:00 1970 PST
   44 |   4 | 00044              | Sat Feb 14 00:00:00 1970 PST
   46 |   6 | 00046              | Mon Feb 16 00:00:00 1970 PST
   47 | 407 | 00047_update7      | Tue Feb 17 00:00:00 1970 PST
   48 |   8 | 00048              | Wed Feb 18 00:00:00 1970 PST
   49 | 509 | 00049_update9      | Thu Feb 19 00:00:00 1970 PST
   50 |   0 | 00050              | Fri Feb 20 00:00:00 1970 PST
   51 |   1 | 00051              | Sat Feb 21 00:00:00 1970 PST
   53 | 303 | 00053_update3      | Mon Feb 23 00:00:00 1970 PST
   54 |   4 | 00054              | Tue Feb 24 00:00:00 1970 PST
   56 |   6 | 00056              | Thu Feb 26 00:00:00 1970 PST
   57 | 407 | 00057_update7      | Fri Feb 27 00:00:00 1970 PST
   58 |   8 | 00058              | Sat Feb 28 00:00:00 1970 PST
   59 | 509 | 00059_update9      | Sun Mar 01 00:00:00 1970 PST
   60 |   0 | 00060              | Mon Mar 02 00:00:00 1970 PST
   61 |   1 | 00061              | Tue Mar 03 00:00:00 1970 PST
   63 | 303 | 00063_update3      | Thu Mar 05 00:00:00 1970 PST
   64 |   4 | 00064              | Fri Mar 06 00:00:00 1970 PST
   66 |   6 | 00066              | Sun Mar 08 00:00:00 1970 PST
   67 | 407 | 00067_update7      | Mon Mar 09 00:00:00 1970 PST
   68 |   8 | 00068              | Tue Mar 10 00:00:00 1970 PST
   69 | 509 | 00069_update9      | Wed Mar 11 00:00:00 1970 PST
   70 |   0 | 00070              | Thu Mar 12 00:00:00 1970 PST
   71 |   1 | 00071              | Fri Mar 13 00:00:00 1970 PST
   73 | 303 | 00073_update3      | Sun Mar 15 00:00:00 1970 PST
   74 |   4 | 00074              | Mon Mar 16 00:00:00 1970 PST
   76 |   6 | 00076              | Wed Mar 18 00:00:00 1970 PST
   77 | 407 | 00077_update7      | Thu Mar 19 00:00:00 1970 PST
   78 |   8 | 00078              | Fri Mar 20 00:00:00 1970 PST
   79 | 509 | 00079_update9      | Sat Mar 21 00:00:00 1970 PST
   80 |   0 | 00080              | Sun Mar 22 00:00:00 1970 PST
   81 |   1 | 00081              | Mon Mar 23 00:00:00 1970 PST
   83 | 303 | 00083_update3      | Wed Mar 25 00:00:00 1970 PST
   84 |   4 | 00084              | Thu Mar 26 00:00:00 1970 PST
   86 |   6 | 00086              | Sat Mar 28 00:00:00 1970 PST
   87 | 407 | 00087_update7      | Sun Mar 29 00:00:00 1970 PST
   88 |   8 | 00088              | Mon Mar 30 00:00:00 1970 PST
   89 | 509 | 00089_update9      | Tue Mar 31 00:00:00 1970 PST
   90 |   0 | 00090              | Wed Apr 01 00:00:00 1970 PST
   91 |   1 | 00091              | Thu Apr 02 00:00:00 1970 PST
   93 | 303 | 00093_update3      | Sat Apr 04 00:00:00 1970 PST
   94 |   4 | 00094              | Sun Apr 05 00:00:00 1970 PST
   96 |   6 | 00096              | Tue Apr 07 00:00:00 1970 PST
   97 | 407 | 00097_update7      | Wed Apr 08 00:00:00 1970 PST
   98 |   8 | 00098              | Thu Apr 09 00:00:00 1970 PST
   99 | 509 | 00099_update9      | Fri Apr 10 00:00:00 1970 PST
  100 |   0 | 00100              | Thu Jan 01 00:00:00 1970 PST
  101 |   1 | 00101              | Fri Jan 02 00:00:00 1970 PST
  103 | 303 | 00103_update3      | Sun Jan 04 00:00:00 1970 PST
  104 |   4 | 00104              | Mon Jan 05 00:00:00 1970 PST
  106 |   6 | 00106              | Wed Jan 07 00:00:00 1970 PST
  107 | 407 | 00107_update7      | Thu Jan 08 00:00:00 1970 PST
  108 |   8 | 00108              | Fri Jan 09 00:00:00 1970 PST
  109 | 509 | 00109_update9      | Sat Jan 10 00:00:00 1970 PST
  110 |   0 | 00110              | Sun Jan 11 00:00:00 1970 PST
  111 |   1 | 00111              | Mon Jan 12 00:00:00 1970 PST
  113 | 303 | 00113_update3      | Wed Jan 14 00:00:00 1970 PST
  114 |   4 | 00114              | Thu Jan 15 00:00:00 1970 PST
  116 |   6 | 00116              | Sat Jan 17 00:00:00 1970 PST
  117 | 407 | 00117_update7      | Sun Jan 18 00:00:00 1970 PST
  118 |   8 | 00118              | Mon Jan 19 00:00:00 1970 PST
  119 | 509 | 00119_update9      | Tue Jan 20 00:00:00 1970 PST
  120 |   0 | 00120              | Wed Jan 21 00:00:00 1970 PST
  121 |   1 | 00121              | Thu Jan 22 00:00:00 1970 PST
  123 | 303 | 00123_update3      | Sat Jan 24 00:00:00 1970 PST
  124 |   4 | 00124              | Sun Jan 25 00:00:00 1970 PST
  126 |   6 | 00126              | Tue Jan 27 00:00:00 1970 PST
  127 | 407 | 00127_update7      | Wed Jan 28 00:00:00 1970 PST
  128 |   8 | 00128              | Thu Jan 29 00:00:00 1970 PST
  129 | 509 | 00129_update9      | Fri Jan 30 00:00:00 1970 PST
  130 |   0 | 00130              | Sat Jan 31 00:00:00 1970 PST
  131 |   1 | 00131              | Sun Feb 01 00:00:00 1970 PST
  133 | 303 | 00133_update3      | Tue Feb 03 00:00:00 1970 PST
  134 |   4 | 00134              | Wed Feb 04 00:00:00 1970 PST
  136 |   6 | 00136              | Fri Feb 06 00:00:00 1970 PST
  137 | 407 | 00137_update7      | Sat Feb 07 00:00:00 1970 PST
  138 |   8 | 00138              | Sun Feb 08 00:00:00 1970 PST
  139 | 509 | 00139_update9      | Mon Feb 09 00:00:00 1970 PST
  140 |   0 | 00140              | Tue Feb 10 00:00:00 1970 PST
  141 |   1 | 00141              | Wed Feb 11 00:00:00 1970 PST
  143 | 303 | 00143_update3      | Fri Feb 13 00:00:00 1970 PST
  144 |   4 | 00144              | Sat Feb 14 00:00:00 1970 PST
  146 |   6 | 00146              | Mon Feb 16 00:00:00 1970 PST
  147 | 407 | 00147_update7      | Tue Feb 17 00:00:00 1970 PST
  148 |   8 | 00148              | Wed Feb 18 00:00:00 1970 PST
  149 | 509 | 00149_update9      | Thu Feb 19 00:00:00 1970 PST
  150 |   0 | 00150              | Fri Feb 20 00:00:00 1970 PST
  151 |   1 | 00151              | Sat Feb 21 00:00:00 1970 PST
  153 | 303 | 00153_update3      | Mon Feb 23 00:00:00 1970 PST
  154 |   4 | 00154              | Tue Feb 24 00:00:00 1970 PST
  156 |   6 | 00156              | Thu Feb 26 00:00:00 1970 PST
  157 | 407 | 00157_update7      | Fri Feb 27 00:00:00 1970 PST
  158 |   8 | 00158              | Sat Feb 28 00:00:00 1970 PST
  159 | 509 | 00159_update9      | Sun Mar 01 00:00:00 1970 PST
  160 |   0 | 00160              | Mon Mar 02 00:00:00 1970 PST
  161 |   1 | 00161              | Tue Mar 03 00:00:00 1970 PST
  163 | 303 | 00163_update3      | Thu Mar 05 00:00:00 1970 PST
  164 |   4 | 00164              | Fri Mar 06 00:00:00 1970 PST
  166 |   6 | 00166              | Sun Mar 08 00:00:00 1970 PST
  167 | 407 | 00167_update7      | Mon Mar 09 00:00:00 1970 PST
  168 |   8 | 00168              | Tue Mar 10 00:00:00 1970 PST
  169 | 509 | 00169_update9      | Wed Mar 11 00:00:00 1970 PST
  170 |   0 | 00170              | Thu Mar 12 00:00:00 1970 PST
  171 |   1 | 00171              | Fri Mar 13 00:00:00 1970 PST
  173 | 303 | 00173_update3      | Sun Mar 15 00:00:00 1970 PST
  174 |   4 | 00174              | Mon Mar 16 00:00:00 1970 PST
  176 |   6 | 00176              | Wed Mar 18 00:00:00 1970 PST
  177 | 407 | 00177_update7      | Thu Mar 19 00:00:00 1970 PST
  178 |   8 | 00178              | Fri Mar 20 00:00:00 1970 PST
  179 | 509 | 00179_update9      | Sat Mar 21 00:00:00 1970 PST
  180 |   0 | 00180              | Sun Mar 22 00:00:00 1970 PST
  181 |   1 | 00181              | Mon Mar 23 00:00:00 1970 PST
  183 | 303 | 00183_update3      | Wed Mar 25 00:00:00 1970 PST
  184 |   4 | 00184              | Thu Mar 26 00:00:00 1970 PST
  186 |   6 | 00186              | Sat Mar 28 00:00:00 1970 PST
  187 | 407 | 00187_update7      | Sun Mar 29 00:00:00 1970 PST
  188 |   8 | 00188              | Mon Mar 30 00:00:00 1970 PST
  189 | 509 | 00189_update9      | Tue Mar 31 00:00:00 1970 PST
  190 |   0 | 00190              | Wed Apr 01 00:00:00 1970 PST
  191 |   1 | 00191              | Thu Apr 02 00:00:00 1970 PST
  193 | 303 | 00193_update3      | Sat Apr 04 00:00:00 1970 PST
  194 |   4 | 00194              | Sun Apr 05 00:00:00 1970 PST
  196 |   6 | 00196              | Tue Apr 07 00:00:00 1970 PST
  197 | 407 | 00197_update7      | Wed Apr 08 00:00:00 1970 PST
  198 |   8 | 00198              | Thu Apr 09 00:00:00 1970 PST
  199 | 509 | 00199_update9      | Fri Apr 10 00:00:00 1970 PST
  200 |   0 | 00200              | Thu Jan 01 00:00:00 1970 PST
  201 |   1 | 00201              | Fri Jan 02 00:00:00 1970 PST
  203 | 303 | 00203_update3      | Sun Jan 04 00:00:00 1970 PST
  204 |   4 | 00204              | Mon Jan 05 00:00:00 1970 PST
  206 |   6 | 00206              | Wed Jan 07 00:00:00 1970 PST
  207 | 407 | 00207_update7      | Thu Jan 08 00:00:00 1970 PST
  208 |   8 | 00208              | Fri Jan 09 00:00:00 1970 PST
  209 | 509 | 00209_update9      | Sat Jan 10 00:00:00 1970 PST
  210 |   0 | 00210              | Sun Jan 11 00:00:00 1970 PST
  211 |   1 | 00211              | Mon Jan 12 00:00:00 1970 PST
  213 | 303 | 00213_update3      | Wed Jan 14 00:00:00 1970 PST
  214 |   4 | 00214              | Thu Jan 15 00:00:00 1970 PST
  216 |   6 | 00216              | Sat Jan 17 00:00:00 1970 PST
  217 | 407 | 00217_update7      | Sun Jan 18 00:00:00 1970 PST
  218 |   8 | 00218              | Mon Jan 19 00:00:00 1970 PST
  219 | 509 | 00219_update9      | Tue Jan 20 00:00:00 1970 PST
  220 |   0 | 00220              | Wed Jan 21 00:00:00 1970 PST
  221 |   1 | 00221              | Thu Jan 22 00:00:00 1970 PST
  223 | 303 | 00223_update3      | Sat Jan 24 00:00:00 1970 PST
  224 |   4 | 00224              | Sun Jan 25 00:00:00 1970 PST
  226 |   6 | 00226              | Tue Jan 27 00:00:00 1970 PST
  227 | 407 | 00227_update7      | Wed Jan 28 00:00:00 1970 PST
  228 |   8 | 00228              | Thu Jan 29 00:00:00 1970 PST
  229 | 509 | 00229_update9      | Fri Jan 30 00:00:00 1970 PST
  230 |   0 | 00230              | Sat Jan 31 00:00:00 1970 PST
  231 |   1 | 00231              | Sun Feb 01 00:00:00 1970 PST
  233 | 303 | 00233_update3      | Tue Feb 03 00:00:00 1970 PST
  234 |   4 | 00234              | Wed Feb 04 00:00:00 1970 PST
  236 |   6 | 00236              | Fri Feb 06 00:00:00 1970 PST
  237 | 407 | 00237_update7      | Sat Feb 07 00:00:00 1970 PST
  238 |   8 | 00238              | Sun Feb 08 00:00:00 1970 PST
  239 | 509 | 00239_update9      | Mon Feb 09 00:00:00 1970 PST
  240 |   0 | 00240              | Tue Feb 10 00:00:00 1970 PST
  241 |   1 | 00241              | Wed Feb 11 00:00:00 1970 PST
  243 | 303 | 00243_update3      | Fri Feb 13 00:00:00 1970 PST
  244 |   4 | 00244              | Sat Feb 14 00:00:00 1970 PST
  246 |   6 | 00246              | Mon Feb 16 00:00:00 1970 PST
  247 | 407 | 00247_update7      | Tue Feb 17 00:00:00 1970 PST
  248 |   8 | 00248              | Wed Feb 18 00:00:00 1970 PST
  249 | 509 | 00249_update9      | Thu Feb 19 00:00:00 1970 PST
  250 |   0 | 00250              | Fri Feb 20 00:00:00 1970 PST
  251 |   1 | 00251              | Sat Feb 21 00:00:00 1970 PST
  253 | 303 | 00253_update3      | Mon Feb 23 00:00:00 1970 PST
  254 |   4 | 00254              | Tue Feb 24 00:00:00 1970 PST
  256 |   6 | 00256              | Thu Feb 26 00:00:00 1970 PST
  257 | 407 | 00257_update7      | Fri Feb 27 00:00:00 1970 PST
  258 |   8 | 00258              | Sat Feb 28 00:00:00 1970 PST
  259 | 509 | 00259_update9      | Sun Mar 01 00:00:00 1970 PST
  260 |   0 | 00260              | Mon Mar 02 00:00:00 1970 PST
  261 |   1 | 00261              | Tue Mar 03 00:00:00 1970 PST
  263 | 303 | 00263_update3      | Thu Mar 05 00:00:00 1970 PST
  264 |   4 | 00264              | Fri Mar 06 00:00:00 1970 PST
  266 |   6 | 00266              | Sun Mar 08 00:00:00 1970 PST
  267 | 407 | 00267_update7      | Mon Mar 09 00:00:00 1970 PST
  268 |   8 | 00268              | Tue Mar 10 00:00:00 1970 PST
  269 | 509 | 00269_update9      | Wed Mar 11 00:00:00 1970 PST
  270 |   0 | 00270              | Thu Mar 12 00:00:00 1970 PST
  271 |   1 | 00271              | Fri Mar 13 00:00:00 1970 PST
  273 | 303 | 00273_update3      | Sun Mar 15 00:00:00 1970 PST
  274 |   4 | 00274              | Mon Mar 16 00:00:00 1970 PST
  276 |   6 | 00276              | Wed Mar 18 00:00:00 1970 PST
  277 | 407 | 00277_update7      | Thu Mar 19 00:00:00 1970 PST
  278 |   8 | 00278              | Fri Mar 20 00:00:00 1970 PST
  279 | 509 | 00279_update9      | Sat Mar 21 00:00:00 1970 PST
  280 |   0 | 00280              | Sun Mar 22 00:00:00 1970 PST
  281 |   1 | 00281              | Mon Mar 23 00:00:00 1970 PST
  283 | 303 | 00283_update3      | Wed Mar 25 00:00:00 1970 PST
  284 |   4 | 00284              | Thu Mar 26 00:00:00 1970 PST
  286 |   6 | 00286              | Sat Mar 28 00:00:00 1970 PST
  287 | 407 | 00287_update7      | Sun Mar 29 00:00:00 1970 PST
  288 |   8 | 00288              | Mon Mar 30 00:00:00 1970 PST
  289 | 509 | 00289_update9      | Tue Mar 31 00:00:00 1970 PST
  290 |   0 | 00290              | Wed Apr 01 00:00:00 1970 PST
  291 |   1 | 00291              | Thu Apr 02 00:00:00 1970 PST
  293 | 303 | 00293_update3      | Sat Apr 04 00:00:00 1970 PST
  294 |   4 | 00294              | Sun Apr 05 00:00:00 1970 PST
  296 |   6 | 00296              | Tue Apr 07 00:00:00 1970 PST
  297 | 407 | 00297_update7      | Wed Apr 08 00:00:00 1970 PST
  298 |   8 | 00298              | Thu Apr 09 00:00:00 1970 PST
  299 | 509 | 00299_update9      | Fri Apr 10 00:00:00 1970 PST
  300 |   0 | 00300              | Thu Jan 01 00:00:00 1970 PST
  301 |   1 | 00301              | Fri Jan 02 00:00:00 1970 PST
  303 | 303 | 00303_update3      | Sun Jan 04 00:00:00 1970 PST
  304 |   4 | 00304              | Mon Jan 05 00:00:00 1970 PST
  306 |   6 | 00306              | Wed Jan 07 00:00:00 1970 PST
  307 | 407 | 00307_update7      | Thu Jan 08 00:00:00 1970 PST
  308 |   8 | 00308              | Fri Jan 09 00:00:00 1970 PST
  309 | 509 | 00309_update9      | Sat Jan 10 00:00:00 1970 PST
  310 |   0 | 00310              | Sun Jan 11 00:00:00 1970 PST
  311 |   1 | 00311              | Mon Jan 12 00:00:00 1970 PST
  313 | 303 | 00313_update3      | Wed Jan 14 00:00:00 1970 PST
  314 |   4 | 00314              | Thu Jan 15 00:00:00 1970 PST
  316 |   6 | 00316              | Sat Jan 17 00:00:00 1970 PST
  317 | 407 | 00317_update7      | Sun Jan 18 00:00:00 1970 PST
  318 |   8 | 00318              | Mon Jan 19 00:00:00 1970 PST
  319 | 509 | 00319_update9      | Tue Jan 20 00:00:00 1970 PST
  320 |   0 | 00320              | Wed Jan 21 00:00:00 1970 PST
  321 |   1 | 00321              | Thu Jan 22 00:00:00 1970 PST
  323 | 303 | 00323_update3      | Sat Jan 24 00:00:00 1970 PST
  324 |   4 | 00324              | Sun Jan 25 00:00:00 1970 PST
  326 |   6 | 00326              | Tue Jan 27 00:00:00 1970 PST
  327 | 407 | 00327_update7      | Wed Jan 28 00:00:00 1970 PST
  328 |   8 | 00328              | Thu Jan 29 00:00:00 1970 PST
  329 | 509 | 00329_update9      | Fri Jan 30 00:00:00 1970 PST
  330 |   0 | 00330              | Sat Jan 31 00:00:00 1970 PST
  331 |   1 | 00331              | Sun Feb 01 00:00:00 1970 PST
  333 | 303 | 00333_update3      | Tue Feb 03 00:00:00 1970 PST
  334 |   4 | 00334              | Wed Feb 04 00:00:00 1970 PST
  336 |   6 | 00336              | Fri Feb 06 00:00:00 1970 PST
  337 | 407 | 00337_update7      | Sat Feb 07 00:00:00 1970 PST
  338 |   8 | 00338              | Sun Feb 08 00:00:00 1970 PST
  339 | 509 | 00339_update9      | Mon Feb 09 00:00:00 1970 PST
  340 |   0 | 00340              | Tue Feb 10 00:00:00 1970 PST
  341 |   1 | 00341              | Wed Feb 11 00:00:00 1970 PST
  343 | 303 | 00343_update3      | Fri Feb 13 00:00:00 1970 PST
  344 |   4 | 00344              | Sat Feb 14 00:00:00 1970 PST
  346 |   6 | 00346              | Mon Feb 16 00:00:00 1970 PST
  347 | 407 | 00347_update7      | Tue Feb 17 00:00:00 1970 PST
  348 |   8 | 00348              | Wed Feb 18 00:00:00 1970 PST
  349 | 509 | 00349_update9      | Thu Feb 19 00:00:00 1970 PST
  350 |   0 | 00350              | Fri Feb 20 00:00:00 1970 PST
  351 |   1 | 00351              | Sat Feb 21 00:00:00 1970 PST
  353 | 303 | 00353_update3      | Mon Feb 23 00:00:00 1970 PST
  354 |   4 | 00354              | Tue Feb 24 00:00:00 1970 PST
  356 |   6 | 00356              | Thu Feb 26 00:00:00 1970 PST
  357 | 407 | 00357_update7      | Fri Feb 27 00:00:00 1970 PST
  358 |   8 | 00358              | Sat Feb 28 00:00:00 1970 PST
  359 | 509 | 00359_update9      | Sun Mar 01 00:00:00 1970 PST
  360 |   0 | 00360              | Mon Mar 02 00:00:00 1970 PST
  361 |   1 | 00361              | Tue Mar 03 00:00:00 1970 PST
  363 | 303 | 00363_update3      | Thu Mar 05 00:00:00 1970 PST
  364 |   4 | 00364              | Fri Mar 06 00:00:00 1970 PST
  366 |   6 | 00366              | Sun Mar 08 00:00:00 1970 PST
  367 | 407 | 00367_update7      | Mon Mar 09 00:00:00 1970 PST
  368 |   8 | 00368              | Tue Mar 10 00:00:00 1970 PST
  369 | 509 | 00369_update9      | Wed Mar 11 00:00:00 1970 PST
  370 |   0 | 00370              | Thu Mar 12 00:00:00 1970 PST
  371 |   1 | 00371              | Fri Mar 13 00:00:00 1970 PST
  373 | 303 | 00373_update3      | Sun Mar 15 00:00:00 1970 PST
  374 |   4 | 00374              | Mon Mar 16 00:00:00 1970 PST
  376 |   6 | 00376              | Wed Mar 18 00:00:00 1970 PST
  377 | 407 | 00377_update7      | Thu Mar 19 00:00:00 1970 PST
  378 |   8 | 00378              | Fri Mar 20 00:00:00 1970 PST
  379 | 509 | 00379_update9      | Sat Mar 21 00:00:00 1970 PST
  380 |   0 | 00380              | Sun Mar 22 00:00:00 1970 PST
  381 |   1 | 00381              | Mon Mar 23 00:00:00 1970 PST
  383 | 303 | 00383_update3      | Wed Mar 25 00:00:00 1970 PST
  384 |   4 | 00384              | Thu Mar 26 00:00:00 1970 PST
  386 |   6 | 00386              | Sat Mar 28 00:00:00 1970 PST
  387 | 407 | 00387_update7      | Sun Mar 29 00:00:00 1970 PST
  388 |   8 | 00388              | Mon Mar 30 00:00:00 1970 PST
  389 | 509 | 00389_update9      | Tue Mar 31 00:00:00 1970 PST
  390 |   0 | 00390              | Wed Apr 01 00:00:00 1970 PST
  391 |   1 | 00391              | Thu Apr 02 00:00:00 1970 PST
  393 | 303 | 00393_update3      | Sat Apr 04 00:00:00 1970 PST
  394 |   4 | 00394              | Sun Apr 05 00:00:00 1970 PST
  396 |   6 | 00396              | Tue Apr 07 00:00:00 1970 PST
  397 | 407 | 00397_update7      | Wed Apr 08 00:00:00 1970 PST
  398 |   8 | 00398              | Thu Apr 09 00:00:00 1970 PST
  399 | 509 | 00399_update9      | Fri Apr 10 00:00:00 1970 PST
  400 |   0 | 00400              | Thu Jan 01 00:00:00 1970 PST
  401 |   1 | 00401              | Fri Jan 02 00:00:00 1970 PST
  403 | 303 | 00403_update3      | Sun Jan 04 00:00:00 1970 PST
  404 |   4 | 00404              | Mon Jan 05 00:00:00 1970 PST
  406 |   6 | 00406              | Wed Jan 07 00:00:00 1970 PST
  407 | 407 | 00407_update7      | Thu Jan 08 00:00:00 1970 PST
  408 |   8 | 00408              | Fri Jan 09 00:00:00 1970 PST
  409 | 509 | 00409_update9      | Sat Jan 10 00:00:00 1970 PST
  410 |   0 | 00410              | Sun Jan 11 00:00:00 1970 PST
  411 |   1 | 00411              | Mon Jan 12 00:00:00 1970 PST
  413 | 303 | 00413_update3      | Wed Jan 14 00:00:00 1970 PST
  414 |   4 | 00414              | Thu Jan 15 00:00:00 1970 PST
  416 |   6 | 00416              | Sat Jan 17 00:00:00 1970 PST
  417 | 407 | 00417_update7      | Sun Jan 18 00:00:00 1970 PST
  418 |   8 | 00418              | Mon Jan 19 00:00:00 1970 PST
  419 | 509 | 00419_update9      | Tue Jan 20 00:00:00 1970 PST
  420 |   0 | 00420              | Wed Jan 21 00:00:00 1970 PST
  421 |   1 | 00421              | Thu Jan 22 00:00:00 1970 PST
  423 | 303 | 00423_update3      | Sat Jan 24 00:00:00 1970 PST
  424 |   4 | 00424              | Sun Jan 25 00:00:00 1970 PST
  426 |   6 | 00426              | Tue Jan 27 00:00:00 1970 PST
  427 | 407 | 00427_update7      | Wed Jan 28 00:00:00 1970 PST
  428 |   8 | 00428              | Thu Jan 29 00:00:00 1970 PST
  429 | 509 | 00429_update9      | Fri Jan 30 00:00:00 1970 PST
  430 |   0 | 00430              | Sat Jan 31 00:00:00 1970 PST
  431 |   1 | 00431              | Sun Feb 01 00:00:00 1970 PST
  433 | 303 | 00433_update3      | Tue Feb 03 00:00:00 1970 PST
  434 |   4 | 00434              | Wed Feb 04 00:00:00 1970 PST
  436 |   6 | 00436              | Fri Feb 06 00:00:00 1970 PST
  437 | 407 | 00437_update7      | Sat Feb 07 00:00:00 1970 PST
  438 |   8 | 00438              | Sun Feb 08 00:00:00 1970 PST
  439 | 509 | 00439_update9      | Mon Feb 09 00:00:00 1970 PST
  440 |   0 | 00440              | Tue Feb 10 00:00:00 1970 PST
  441 |   1 | 00441              | Wed Feb 11 00:00:00 1970 PST
  443 | 303 | 00443_update3      | Fri Feb 13 00:00:00 1970 PST
  444 |   4 | 00444              | Sat Feb 14 00:00:00 1970 PST
  446 |   6 | 00446              | Mon Feb 16 00:00:00 1970 PST
  447 | 407 | 00447_update7      | Tue Feb 17 00:00:00 1970 PST
  448 |   8 | 00448              | Wed Feb 18 00:00:00 1970 PST
  449 | 509 | 00449_update9      | Thu Feb 19 00:00:00 1970 PST
  450 |   0 | 00450              | Fri Feb 20 00:00:00 1970 PST
  451 |   1 | 00451              | Sat Feb 21 00:00:00 1970 PST
  453 | 303 | 00453_update3      | Mon Feb 23 00:00:00 1970 PST
  454 |   4 | 00454              | Tue Feb 24 00:00:00 1970 PST
  456 |   6 | 00456              | Thu Feb 26 00:00:00 1970 PST
  457 | 407 | 00457_update7      | Fri Feb 27 00:00:00 1970 PST
  458 |   8 | 00458              | Sat Feb 28 00:00:00 1970 PST
  459 | 509 | 00459_update9      | Sun Mar 01 00:00:00 1970 PST
  460 |   0 | 00460              | Mon Mar 02 00:00:00 1970 PST
  461 |   1 | 00461              | Tue Mar 03 00:00:00 1970 PST
  463 | 303 | 00463_update3      | Thu Mar 05 00:00:00 1970 PST
  464 |   4 | 00464              | Fri Mar 06 00:00:00 1970 PST
  466 |   6 | 00466              | Sun Mar 08 00:00:00 1970 PST
  467 | 407 | 00467_update7      | Mon Mar 09 00:00:00 1970 PST
  468 |   8 | 00468              | Tue Mar 10 00:00:00 1970 PST
  469 | 509 | 00469_update9      | Wed Mar 11 00:00:00 1970 PST
  470 |   0 | 00470              | Thu Mar 12 00:00:00 1970 PST
  471 |   1 | 00471              | Fri Mar 13 00:00:00 1970 PST
  473 | 303 | 00473_update3      | Sun Mar 15 00:00:00 1970 PST
  474 |   4 | 00474              | Mon Mar 16 00:00:00 1970 PST
  476 |   6 | 00476              | Wed Mar 18 00:00:00 1970 PST
  477 | 407 | 00477_update7      | Thu Mar 19 00:00:00 1970 PST
  478 |   8 | 00478              | Fri Mar 20 00:00:00 1970 PST
  479 | 509 | 00479_update9      | Sat Mar 21 00:00:00 1970 PST
  480 |   0 | 00480              | Sun Mar 22 00:00:00 1970 PST
  481 |   1 | 00481              | Mon Mar 23 00:00:00 1970 PST
  483 | 303 | 00483_update3      | Wed Mar 25 00:00:00 1970 PST
  484 |   4 | 00484              | Thu Mar 26 00:00:00 1970 PST
  486 |   6 | 00486              | Sat Mar 28 00:00:00 1970 PST
  487 | 407 | 00487_update7      | Sun Mar 29 00:00:00 1970 PST
  488 |   8 | 00488              | Mon Mar 30 00:00:00 1970 PST
  489 | 509 | 00489_update9      | Tue Mar 31 00:00:00 1970 PST
  490 |   0 | 00490              | Wed Apr 01 00:00:00 1970 PST
  491 |   1 | 00491              | Thu Apr 02 00:00:00 1970 PST
  493 | 303 | 00493_update3      | Sat Apr 04 00:00:00 1970 PST
  494 |   4 | 00494              | Sun Apr 05 00:00:00 1970 PST
  496 |   6 | 00496              | Tue Apr 07 00:00:00 1970 PST
  497 | 407 | 00497_update7      | Wed Apr 08 00:00:00 1970 PST
  498 |   8 | 00498              | Thu Apr 09 00:00:00 1970 PST
  499 | 509 | 00499_update9      | Fri Apr 10 00:00:00 1970 PST
  500 |   0 | 00500              | Thu Jan 01 00:00:00 1970 PST
  501 |   1 | 00501              | Fri Jan 02 00:00:00 1970 PST
  503 | 303 | 00503_update3      | Sun Jan 04 00:00:00 1970 PST
  504 |   4 | 00504              | Mon Jan 05 00:00:00 1970 PST
  506 |   6 | 00506              | Wed Jan 07 00:00:00 1970 PST
  507 | 407 | 00507_update7      | Thu Jan 08 00:00:00 1970 PST
  508 |   8 | 00508              | Fri Jan 09 00:00:00 1970 PST
  509 | 509 | 00509_update9      | Sat Jan 10 00:00:00 1970 PST
  510 |   0 | 00510              | Sun Jan 11 00:00:00 1970 PST
  511 |   1 | 00511              | Mon Jan 12 00:00:00 1970 PST
  513 | 303 | 00513_update3      | Wed Jan 14 00:00:00 1970 PST
  514 |   4 | 00514              | Thu Jan 15 00:00:00 1970 PST
  516 |   6 | 00516              | Sat Jan 17 00:00:00 1970 PST
  517 | 407 | 00517_update7      | Sun Jan 18 00:00:00 1970 PST
  518 |   8 | 00518              | Mon Jan 19 00:00:00 1970 PST
  519 | 509 | 00519_update9      | Tue Jan 20 00:00:00 1970 PST
  520 |   0 | 00520              | Wed Jan 21 00:00:00 1970 PST
  521 |   1 | 00521              | Thu Jan 22 00:00:00 1970 PST
  523 | 303 | 00523_update3      | Sat Jan 24 00:00:00 1970 PST
  524 |   4 | 00524              | Sun Jan 25 00:00:00 1970 PST
  526 |   6 | 00526              | Tue Jan 27 00:00:00 1970 PST
  527 | 407 | 00527_update7      | Wed Jan 28 00:00:00 1970 PST
  528 |   8 | 00528              | Thu Jan 29 00:00:00 1970 PST
  529 | 509 | 00529_update9      | Fri Jan 30 00:00:00 1970 PST
  530 |   0 | 00530              | Sat Jan 31 00:00:00 1970 PST
  531 |   1 | 00531              | Sun Feb 01 00:00:00 1970 PST
  533 | 303 | 00533_update3      | Tue Feb 03 00:00:00 1970 PST
  534 |   4 | 00534              | Wed Feb 04 00:00:00 1970 PST
  536 |   6 | 00536              | Fri Feb 06 00:00:00 1970 PST
  537 | 407 | 00537_update7      | Sat Feb 07 00:00:00 1970 PST
  538 |   8 | 00538              | Sun Feb 08 00:00:00 1970 PST
  539 | 509 | 00539_update9      | Mon Feb 09 00:00:00 1970 PST
  540 |   0 | 00540              | Tue Feb 10 00:00:00 1970 PST
  541 |   1 | 00541              | Wed Feb 11 00:00:00 1970 PST
  543 | 303 | 00543_update3      | Fri Feb 13 00:00:00 1970 PST
  544 |   4 | 00544              | Sat Feb 14 00:00:00 1970 PST
  546 |   6 | 00546              | Mon Feb 16 00:00:00 1970 PST
  547 | 407 | 00547_update7      | Tue Feb 17 00:00:00 1970 PST
  548 |   8 | 00548              | Wed Feb 18 00:00:00 1970 PST
  549 | 509 | 00549_update9      | Thu Feb 19 00:00:00 1970 PST
  550 |   0 | 00550              | Fri Feb 20 00:00:00 1970 PST
  551 |   1 | 00551              | Sat Feb 21 00:00:00 1970 PST
  553 | 303 | 00553_update3      | Mon Feb 23 00:00:00 1970 PST
  554 |   4 | 00554              | Tue Feb 24 00:00:00 1970 PST
  556 |   6 | 00556              | Thu Feb 26 00:00:00 1970 PST
  557 | 407 | 00557_update7      | Fri Feb 27 00:00:00 1970 PST
  558 |   8 | 00558              | Sat Feb 28 00:00:00 1970 PST
  559 | 509 | 00559_update9      | Sun Mar 01 00:00:00 1970 PST
  560 |   0 | 00560              | Mon Mar 02 00:00:00 1970 PST
  561 |   1 | 00561              | Tue Mar 03 00:00:00 1970 PST
  563 | 303 | 00563_update3      | Thu Mar 05 00:00:00 1970 PST
  564 |   4 | 00564              | Fri Mar 06 00:00:00 1970 PST
  566 |   6 | 00566              | Sun Mar 08 00:00:00 1970 PST
  567 | 407 | 00567_update7      | Mon Mar 09 00:00:00 1970 PST
  568 |   8 | 00568              | Tue Mar 10 00:00:00 1970 PST
  569 | 509 | 00569_update9      | Wed Mar 11 00:00:00 1970 PST
  570 |   0 | 00570              | Thu Mar 12 00:00:00 1970 PST
  571 |   1 | 00571              | Fri Mar 13 00:00:00 1970 PST
  573 | 303 | 00573_update3      | Sun Mar 15 00:00:00 1970 PST
  574 |   4 | 00574              | Mon Mar 16 00:00:00 1970 PST
  576 |   6 | 00576              | Wed Mar 18 00:00:00 1970 PST
  577 | 407 | 00577_update7      | Thu Mar 19 00:00:00 1970 PST
  578 |   8 | 00578              | Fri Mar 20 00:00:00 1970 PST
  579 | 509 | 00579_update9      | Sat Mar 21 00:00:00 1970 PST
  580 |   0 | 00580              | Sun Mar 22 00:00:00 1970 PST
  581 |   1 | 00581              | Mon Mar 23 00:00:00 1970 PST
  583 | 303 | 00583_update3      | Wed Mar 25 00:00:00 1970 PST
  584 |   4 | 00584              | Thu Mar 26 00:00:00 1970 PST
  586 |   6 | 00586              | Sat Mar 28 00:00:00 1970 PST
  587 | 407 | 00587_update7      | Sun Mar 29 00:00:00 1970 PST
  588 |   8 | 00588              | Mon Mar 30 00:00:00 1970 PST
  589 | 509 | 00589_update9      | Tue Mar 31 00:00:00 1970 PST
  590 |   0 | 00590              | Wed Apr 01 00:00:00 1970 PST
  591 |   1 | 00591              | Thu Apr 02 00:00:00 1970 PST
  593 | 303 | 00593_update3      | Sat Apr 04 00:00:00 1970 PST
  594 |   4 | 00594              | Sun Apr 05 00:00:00 1970 PST
  596 |   6 | 00596              | Tue Apr 07 00:00:00 1970 PST
  597 | 407 | 00597_update7      | Wed Apr 08 00:00:00 1970 PST
  598 |   8 | 00598              | Thu Apr 09 00:00:00 1970 PST
  599 | 509 | 00599_update9      | Fri Apr 10 00:00:00 1970 PST
  600 |   0 | 00600              | Thu Jan 01 00:00:00 1970 PST
  601 |   1 | 00601              | Fri Jan 02 00:00:00 1970 PST
  603 | 303 | 00603_update3      | Sun Jan 04 00:00:00 1970 PST
  604 |   4 | 00604              | Mon Jan 05 00:00:00 1970 PST
  606 |   6 | 00606              | Wed Jan 07 00:00:00 1970 PST
  607 | 407 | 00607_update7      | Thu Jan 08 00:00:00 1970 PST
  608 |   8 | 00608              | Fri Jan 09 00:00:00 1970 PST
  609 | 509 | 00609_update9      | Sat Jan 10 00:00:00 1970 PST
  610 |   0 | 00610              | Sun Jan 11 00:00:00 1970 PST
  611 |   1 | 00611              | Mon Jan 12 00:00:00 1970 PST
  613 | 303 | 00613_update3      | Wed Jan 14 00:00:00 1970 PST
  614 |   4 | 00614              | Thu Jan 15 00:00:00 1970 PST
  616 |   6 | 00616              | Sat Jan 17 00:00:00 1970 PST
  617 | 407 | 00617_update7      | Sun Jan 18 00:00:00 1970 PST
  618 |   8 | 00618              | Mon Jan 19 00:00:00 1970 PST
  619 | 509 | 00619_update9      | Tue Jan 20 00:00:00 1970 PST
  620 |   0 | 00620              | Wed Jan 21 00:00:00 1970 PST
  621 |   1 | 00621              | Thu Jan 22 00:00:00 1970 PST
  623 | 303 | 00623_update3      | Sat Jan 24 00:00:00 1970 PST
  624 |   4 | 00624              | Sun Jan 25 00:00:00 1970 PST
  626 |   6 | 00626              | Tue Jan 27 00:00:00 1970 PST
  627 | 407 | 00627_update7      | Wed Jan 28 00:00:00 1970 PST
  628 |   8 | 00628              | Thu Jan 29 00:00:00 1970 PST
  629 | 509 | 00629_update9      | Fri Jan 30 00:00:00 1970 PST
  630 |   0 | 00630              | Sat Jan 31 00:00:00 1970 PST
  631 |   1 | 00631              | Sun Feb 01 00:00:00 1970 PST
  633 | 303 | 00633_update3      | Tue Feb 03 00:00:00 1970 PST
  634 |   4 | 00634              | Wed Feb 04 00:00:00 1970 PST
  636 |   6 | 00636              | Fri Feb 06 00:00:00 1970 PST
  637 | 407 | 00637_update7      | Sat Feb 07 00:00:00 1970 PST
  638 |   8 | 00638              | Sun Feb 08 00:00:00 1970 PST
  639 | 509 | 00639_update9      | Mon Feb 09 00:00:00 1970 PST
  640 |   0 | 00640              | Tue Feb 10 00:00:00 1970 PST
  641 |   1 | 00641              | Wed Feb 11 00:00:00 1970 PST
  643 | 303 | 00643_update3      | Fri Feb 13 00:00:00 1970 PST
  644 |   4 | 00644              | Sat Feb 14 00:00:00 1970 PST
  646 |   6 | 00646              | Mon Feb 16 00:00:00 1970 PST
  647 | 407 | 00647_update7      | Tue Feb 17 00:00:00 1970 PST
  648 |   8 | 00648              | Wed Feb 18 00:00:00 1970 PST
  649 | 509 | 00649_update9      | Thu Feb 19 00:00:00 1970 PST
  650 |   0 | 00650              | Fri Feb 20 00:00:00 1970 PST
  651 |   1 | 00651              | Sat Feb 21 00:00:00 1970 PST
  653 | 303 | 00653_update3      | Mon Feb 23 00:00:00 1970 PST
  654 |   4 | 00654              | Tue Feb 24 00:00:00 1970 PST
  656 |   6 | 00656              | Thu Feb 26 00:00:00 1970 PST
  657 | 407 | 00657_update7      | Fri Feb 27 00:00:00 1970 PST
  658 |   8 | 00658              | Sat Feb 28 00:00:00 1970 PST
  659 | 509 | 00659_update9      | Sun Mar 01 00:00:00 1970 PST
  660 |   0 | 00660              | Mon Mar 02 00:00:00 1970 PST
  661 |   1 | 00661              | Tue Mar 03 00:00:00 1970 PST
  663 | 303 | 00663_update3      | Thu Mar 05 00:00:00 1970 PST
  664 |   4 | 00664              | Fri Mar 06 00:00:00 1970 PST
  666 |   6 | 00666              | Sun Mar 08 00:00:00 1970 PST
  667 | 407 | 00667_update7      | Mon Mar 09 00:00:00 1970 PST
  668 |   8 | 00668              | Tue Mar 10 00:00:00 1970 PST
  669 | 509 | 00669_update9      | Wed Mar 11 00:00:00 1970 PST
  670 |   0 | 00670              | Thu Mar 12 00:00:00 1970 PST
  671 |   1 | 00671              | Fri Mar 13 00:00:00 1970 PST
  673 | 303 | 00673_update3      | Sun Mar 15 00:00:00 1970 PST
  674 |   4 | 00674              | Mon Mar 16 00:00:00 1970 PST
  676 |   6 | 00676              | Wed Mar 18 00:00:00 1970 PST
  677 | 407 | 00677_update7      | Thu Mar 19 00:00:00 1970 PST
  678 |   8 | 00678              | Fri Mar 20 00:00:00 1970 PST
  679 | 509 | 00679_update9      | Sat Mar 21 00:00:00 1970 PST
  680 |   0 | 00680              | Sun Mar 22 00:00:00 1970 PST
  681 |   1 | 00681              | Mon Mar 23 00:00:00 1970 PST
  683 | 303 | 00683_update3      | Wed Mar 25 00:00:00 1970 PST
  684 |   4 | 00684              | Thu Mar 26 00:00:00 1970 PST
  686 |   6 | 00686              | Sat Mar 28 00:00:00 1970 PST
  687 | 407 | 00687_update7      | Sun Mar 29 00:00:00 1970 PST
  688 |   8 | 00688              | Mon Mar 30 00:00:00 1970 PST
  689 | 509 | 00689_update9      | Tue Mar 31 00:00:00 1970 PST
  690 |   0 | 00690              | Wed Apr 01 00:00:00 1970 PST
  691 |   1 | 00691              | Thu Apr 02 00:00:00 1970 PST
  693 | 303 | 00693_update3      | Sat Apr 04 00:00:00 1970 PST
  694 |   4 | 00694              | Sun Apr 05 00:00:00 1970 PST
  696 |   6 | 00696              | Tue Apr 07 00:00:00 1970 PST
  697 | 407 | 00697_update7      | Wed Apr 08 00:00:00 1970 PST
  698 |   8 | 00698              | Thu Apr 09 00:00:00 1970 PST
  699 | 509 | 00699_update9      | Fri Apr 10 00:00:00 1970 PST
  700 |   0 | 00700              | Thu Jan 01 00:00:00 1970 PST
  701 |   1 | 00701              | Fri Jan 02 00:00:00 1970 PST
  703 | 303 | 00703_update3      | Sun Jan 04 00:00:00 1970 PST
  704 |   4 | 00704              | Mon Jan 05 00:00:00 1970 PST
  706 |   6 | 00706              | Wed Jan 07 00:00:00 1970 PST
  707 | 407 | 00707_update7      | Thu Jan 08 00:00:00 1970 PST
  708 |   8 | 00708              | Fri Jan 09 00:00:00 1970 PST
  709 | 509 | 00709_update9      | Sat Jan 10 00:00:00 1970 PST
  710 |   0 | 00710              | Sun Jan 11 00:00:00 1970 PST
  711 |   1 | 00711              | Mon Jan 12 00:00:00 1970 PST
  713 | 303 | 00713_update3      | Wed Jan 14 00:00:00 1970 PST
  714 |   4 | 00714              | Thu Jan 15 00:00:00 1970 PST
  716 |   6 | 00716              | Sat Jan 17 00:00:00 1970 PST
  717 | 407 | 00717_update7      | Sun Jan 18 00:00:00 1970 PST
  718 |   8 | 00718              | Mon Jan 19 00:00:00 1970 PST
  719 | 509 | 00719_update9      | Tue Jan 20 00:00:00 1970 PST
  720 |   0 | 00720              | Wed Jan 21 00:00:00 1970 PST
  721 |   1 | 00721              | Thu Jan 22 00:00:00 1970 PST
  723 | 303 | 00723_update3      | Sat Jan 24 00:00:00 1970 PST
  724 |   4 | 00724              | Sun Jan 25 00:00:00 1970 PST
  726 |   6 | 00726              | Tue Jan 27 00:00:00 1970 PST
  727 | 407 | 00727_update7      | Wed Jan 28 00:00:00 1970 PST
  728 |   8 | 00728              | Thu Jan 29 00:00:00 1970 PST
  729 | 509 | 00729_update9      | Fri Jan 30 00:00:00 1970 PST
  730 |   0 | 00730              | Sat Jan 31 00:00:00 1970 PST
  731 |   1 | 00731              | Sun Feb 01 00:00:00 1970 PST
  733 | 303 | 00733_update3      | Tue Feb 03 00:00:00 1970 PST
  734 |   4 | 00734              | Wed Feb 04 00:00:00 1970 PST
  736 |   6 | 00736              | Fri Feb 06 00:00:00 1970 PST
  737 | 407 | 00737_update7      | Sat Feb 07 00:00:00 1970 PST
  738 |   8 | 00738              | Sun Feb 08 00:00:00 1970 PST
  739 | 509 | 00739_update9      | Mon Feb 09 00:00:00 1970 PST
  740 |   0 | 00740              | Tue Feb 10 00:00:00 1970 PST
  741 |   1 | 00741              | Wed Feb 11 00:00:00 1970 PST
  743 | 303 | 00743_update3      | Fri Feb 13 00:00:00 1970 PST
  744 |   4 | 00744              | Sat Feb 14 00:00:00 1970 PST
  746 |   6 | 00746              | Mon Feb 16 00:00:00 1970 PST
  747 | 407 | 00747_update7      | Tue Feb 17 00:00:00 1970 PST
  748 |   8 | 00748              | Wed Feb 18 00:00:00 1970 PST
  749 | 509 | 00749_update9      | Thu Feb 19 00:00:00 1970 PST
  750 |   0 | 00750              | Fri Feb 20 00:00:00 1970 PST
  751 |   1 | 00751              | Sat Feb 21 00:00:00 1970 PST
  753 | 303 | 00753_update3      | Mon Feb 23 00:00:00 1970 PST
  754 |   4 | 00754              | Tue Feb 24 00:00:00 1970 PST
  756 |   6 | 00756              | Thu Feb 26 00:00:00 1970 PST
  757 | 407 | 00757_update7      | Fri Feb 27 00:00:00 1970 PST
  758 |   8 | 00758              | Sat Feb 28 00:00:00 1970 PST
  759 | 509 | 00759_update9      | Sun Mar 01 00:00:00 1970 PST
  760 |   0 | 00760              | Mon Mar 02 00:00:00 1970 PST
  761 |   1 | 00761              | Tue Mar 03 00:00:00 1970 PST
  763 | 303 | 00763_update3      | Thu Mar 05 00:00:00 1970 PST
  764 |   4 | 00764              | Fri Mar 06 00:00:00 1970 PST
  766 |   6 | 00766              | Sun Mar 08 00:00:00 1970 PST
  767 | 407 | 00767_update7      | Mon Mar 09 00:00:00 1970 PST
  768 |   8 | 00768              | Tue Mar 10 00:00:00 1970 PST
  769 | 509 | 00769_update9      | Wed Mar 11 00:00:00 1970 PST
  770 |   0 | 00770              | Thu Mar 12 00:00:00 1970 PST
  771 |   1 | 00771              | Fri Mar 13 00:00:00 1970 PST
  773 | 303 | 00773_update3      | Sun Mar 15 00:00:00 1970 PST
  774 |   4 | 00774              | Mon Mar 16 00:00:00 1970 PST
  776 |   6 | 00776              | Wed Mar 18 00:00:00 1970 PST
  777 | 407 | 00777_update7      | Thu Mar 19 00:00:00 1970 PST
  778 |   8 | 00778              | Fri Mar 20 00:00:00 1970 PST
  779 | 509 | 00779_update9      | Sat Mar 21 00:00:00 1970 PST
  780 |   0 | 00780              | Sun Mar 22 00:00:00 1970 PST
  781 |   1 | 00781              | Mon Mar 23 00:00:00 1970 PST
  783 | 303 | 00783_update3      | Wed Mar 25 00:00:00 1970 PST
  784 |   4 | 00784              | Thu Mar 26 00:00:00 1970 PST
  786 |   6 | 00786              | Sat Mar 28 00:00:00 1970 PST
  787 | 407 | 00787_update7      | Sun Mar 29 00:00:00 1970 PST
  788 |   8 | 00788              | Mon Mar 30 00:00:00 1970 PST
  789 | 509 | 00789_update9      | Tue Mar 31 00:00:00 1970 PST
  790 |   0 | 00790              | Wed Apr 01 00:00:00 1970 PST
  791 |   1 | 00791              | Thu Apr 02 00:00:00 1970 PST
  793 | 303 | 00793_update3      | Sat Apr 04 00:00:00 1970 PST
  794 |   4 | 00794              | Sun Apr 05 00:00:00 1970 PST
  796 |   6 | 00796              | Tue Apr 07 00:00:00 1970 PST
  797 | 407 | 00797_update7      | Wed Apr 08 00:00:00 1970 PST
  798 |   8 | 00798              | Thu Apr 09 00:00:00 1970 PST
  799 | 509 | 00799_update9      | Fri Apr 10 00:00:00 1970 PST
  800 |   0 | 00800              | Thu Jan 01 00:00:00 1970 PST
  801 |   1 | 00801              | Fri Jan 02 00:00:00 1970 PST
  803 | 303 | 00803_update3      | Sun Jan 04 00:00:00 1970 PST
  804 |   4 | 00804              | Mon Jan 05 00:00:00 1970 PST
  806 |   6 | 00806              | Wed Jan 07 00:00:00 1970 PST
  807 | 407 | 00807_update7      | Thu Jan 08 00:00:00 1970 PST
  808 |   8 | 00808              | Fri Jan 09 00:00:00 1970 PST
  809 | 509 | 00809_update9      | Sat Jan 10 00:00:00 1970 PST
  810 |   0 | 00810              | Sun Jan 11 00:00:00 1970 PST
  811 |   1 | 00811              | Mon Jan 12 00:00:00 1970 PST
  813 | 303 | 00813_update3      | Wed Jan 14 00:00:00 1970 PST
  814 |   4 | 00814              | Thu Jan 15 00:00:00 1970 PST
  816 |   6 | 00816              | Sat Jan 17 00:00:00 1970 PST
  817 | 407 | 00817_update7      | Sun Jan 18 00:00:00 1970 PST
  818 |   8 | 00818              | Mon Jan 19 00:00:00 1970 PST
  819 | 509 | 00819_update9      | Tue Jan 20 00:00:00 1970 PST
  820 |   0 | 00820              | Wed Jan 21 00:00:00 1970 PST
  821 |   1 | 00821              | Thu Jan 22 00:00:00 1970 PST
  823 | 303 | 00823_update3      | Sat Jan 24 00:00:00 1970 PST
  824 |   4 | 00824              | Sun Jan 25 00:00:00 1970 PST
  826 |   6 | 00826              | Tue Jan 27 00:00:00 1970 PST
  827 | 407 | 00827_update7      | Wed Jan 28 00:00:00 1970 PST
  828 |   8 | 00828              | Thu Jan 29 00:00:00 1970 PST
  829 | 509 | 00829_update9      | Fri Jan 30 00:00:00 1970 PST
  830 |   0 | 00830              | Sat Jan 31 00:00:00 1970 PST
  831 |   1 | 00831              | Sun Feb 01 00:00:00 1970 PST
  833 | 303 | 00833_update3      | Tue Feb 03 00:00:00 1970 PST
  834 |   4 | 00834              | Wed Feb 04 00:00:00 1970 PST
  836 |   6 | 00836              | Fri Feb 06 00:00:00 1970 PST
  837 | 407 | 00837_update7      | Sat Feb 07 00:00:00 1970 PST
  838 |   8 | 00838              | Sun Feb 08 00:00:00 1970 PST
  839 | 509 | 00839_update9      | Mon Feb 09 00:00:00 1970 PST
  840 |   0 | 00840              | Tue Feb 10 00:00:00 1970 PST
  841 |   1 | 00841              | Wed Feb 11 00:00:00 1970 PST
  843 | 303 | 00843_update3      | Fri Feb 13 00:00:00 1970 PST
  844 |   4 | 00844              | Sat Feb 14 00:00:00 1970 PST
  846 |   6 | 00846              | Mon Feb 16 00:00:00 1970 PST
  847 | 407 | 00847_update7      | Tue Feb 17 00:00:00 1970 PST
  848 |   8 | 00848              | Wed Feb 18 00:00:00 1970 PST
  849 | 509 | 00849_update9      | Thu Feb 19 00:00:00 1970 PST
  850 |   0 | 00850              | Fri Feb 20 00:00:00 1970 PST
  851 |   1 | 00851              | Sat Feb 21 00:00:00 1970 PST
  853 | 303 | 00853_update3      | Mon Feb 23 00:00:00 1970 PST
  854 |   4 | 00854              | Tue Feb 24 00:00:00 1970 PST
  856 |   6 | 00856              | Thu Feb 26 00:00:00 1970 PST
  857 | 407 | 00857_update7      | Fri Feb 27 00:00:00 1970 PST
  858 |   8 | 00858              | Sat Feb 28 00:00:00 1970 PST
  859 | 509 | 00859_update9      | Sun Mar 01 00:00:00 1970 PST
  860 |   0 | 00860              | Mon Mar 02 00:00:00 1970 PST
  861 |   1 | 00861              | Tue Mar 03 00:00:00 1970 PST
  863 | 303 | 00863_update3      | Thu Mar 05 00:00:00 1970 PST
  864 |   4 | 00864              | Fri Mar 06 00:00:00 1970 PST
  866 |   6 | 00866              | Sun Mar 08 00:00:00 1970 PST
  867 | 407 | 00867_update7      | Mon Mar 09 00:00:00 1970 PST
  868 |   8 | 00868              | Tue Mar 10 00:00:00 1970 PST
  869 | 509 | 00869_update9      | Wed Mar 11 00:00:00 1970 PST
  870 |   0 | 00870              | Thu Mar 12 00:00:00 1970 PST
  871 |   1 | 00871              | Fri Mar 13 00:00:00 1970 PST
  873 | 303 | 00873_update3      | Sun Mar 15 00:00:00 1970 PST
  874 |   4 | 00874              | Mon Mar 16 00:00:00 1970 PST
  876 |   6 | 00876              | Wed Mar 18 00:00:00 1970 PST
  877 | 407 | 00877_update7      | Thu Mar 19 00:00:00 1970 PST
  878 |   8 | 00878              | Fri Mar 20 00:00:00 1970 PST
  879 | 509 | 00879_update9      | Sat Mar 21 00:00:00 1970 PST
  880 |   0 | 00880              | Sun Mar 22 00:00:00 1970 PST
  881 |   1 | 00881              | Mon Mar 23 00:00:00 1970 PST
  883 | 303 | 00883_update3      | Wed Mar 25 00:00:00 1970 PST
  884 |   4 | 00884              | Thu Mar 26 00:00:00 1970 PST
  886 |   6 | 00886              | Sat Mar 28 00:00:00 1970 PST
  887 | 407 | 00887_update7      | Sun Mar 29 00:00:00 1970 PST
  888 |   8 | 00888              | Mon Mar 30 00:00:00 1970 PST
  889 | 509 | 00889_update9      | Tue Mar 31 00:00:00 1970 PST
  890 |   0 | 00890              | Wed Apr 01 00:00:00 1970 PST
  891 |   1 | 00891              | Thu Apr 02 00:00:00 1970 PST
  893 | 303 | 00893_update3      | Sat Apr 04 00:00:00 1970 PST
  894 |   4 | 00894              | Sun Apr 05 00:00:00 1970 PST
  896 |   6 | 00896              | Tue Apr 07 00:00:00 1970 PST
  897 | 407 | 00897_update7      | Wed Apr 08 00:00:00 1970 PST
  898 |   8 | 00898              | Thu Apr 09 00:00:00 1970 PST
  899 | 509 | 00899_update9      | Fri Apr 10 00:00:00 1970 PST
  900 |   0 | 00900              | Thu Jan 01 00:00:00 1970 PST
  901 |   1 | 00901              | Fri Jan 02 00:00:00 1970 PST
  903 | 303 | 00903_update3      | Sun Jan 04 00:00:00 1970 PST
  904 |   4 | 00904              | Mon Jan 05 00:00:00 1970 PST
  906 |   6 | 00906              | Wed Jan 07 00:00:00 1970 PST
  907 | 407 | 00907_update7      | Thu Jan 08 00:00:00 1970 PST
  908 |   8 | 00908              | Fri Jan 09 00:00:00 1970 PST
  909 | 509 | 00909_update9      | Sat Jan 10 00:00:00 1970 PST
  910 |   0 | 00910              | Sun Jan 11 00:00:00 1970 PST
  911 |   1 | 00911              | Mon Jan 12 00:00:00 1970 PST
  913 | 303 | 00913_update3      | Wed Jan 14 00:00:00 1970 PST
  914 |   4 | 00914              | Thu Jan 15 00:00:00 1970 PST
  916 |   6 | 00916              | Sat Jan 17 00:00:00 1970 PST
  917 | 407 | 00917_update7      | Sun Jan 18 00:00:00 1970 PST
  918 |   8 | 00918              | Mon Jan 19 00:00:00 1970 PST
  919 | 509 | 00919_update9      | Tue Jan 20 00:00:00 1970 PST
  920 |   0 | 00920              | Wed Jan 21 00:00:00 1970 PST
  921 |   1 | 00921              | Thu Jan 22 00:00:00 1970 PST
  923 | 303 | 00923_update3      | Sat Jan 24 00:00:00 1970 PST
  924 |   4 | 00924              | Sun Jan 25 00:00:00 1970 PST
  926 |   6 | 00926              | Tue Jan 27 00:00:00 1970 PST
  927 | 407 | 00927_update7      | Wed Jan 28 00:00:00 1970 PST
  928 |   8 | 00928              | Thu Jan 29 00:00:00 1970 PST
  929 | 509 | 00929_update9      | Fri Jan 30 00:00:00 1970 PST
  930 |   0 | 00930              | Sat Jan 31 00:00:00 1970 PST
  931 |   1 | 00931              | Sun Feb 01 00:00:00 1970 PST
  933 | 303 | 00933_update3      | Tue Feb 03 00:00:00 1970 PST
  934 |   4 | 00934              | Wed Feb 04 00:00:00 1970 PST
  936 |   6 | 00936              | Fri Feb 06 00:00:00 1970 PST
  937 | 407 | 00937_update7      | Sat Feb 07 00:00:00 1970 PST
  938 |   8 | 00938              | Sun Feb 08 00:00:00 1970 PST
  939 | 509 | 00939_update9      | Mon Feb 09 00:00:00 1970 PST
  940 |   0 | 00940              | Tue Feb 10 00:00:00 1970 PST
  941 |   1 | 00941              | Wed Feb 11 00:00:00 1970 PST
  943 | 303 | 00943_update3      | Fri Feb 13 00:00:00 1970 PST
  944 |   4 | 00944              | Sat Feb 14 00:00:00 1970 PST
  946 |   6 | 00946              | Mon Feb 16 00:00:00 1970 PST
  947 | 407 | 00947_update7      | Tue Feb 17 00:00:00 1970 PST
  948 |   8 | 00948              | Wed Feb 18 00:00:00 1970 PST
  949 | 509 | 00949_update9      | Thu Feb 19 00:00:00 1970 PST
  950 |   0 | 00950              | Fri Feb 20 00:00:00 1970 PST
  951 |   1 | 00951              | Sat Feb 21 00:00:00 1970 PST
  953 | 303 | 00953_update3      | Mon Feb 23 00:00:00 1970 PST
  954 |   4 | 00954              | Tue Feb 24 00:00:00 1970 PST
  956 |   6 | 00956              | Thu Feb 26 00:00:00 1970 PST
  957 | 407 | 00957_update7      | Fri Feb 27 00:00:00 1970 PST
  958 |   8 | 00958              | Sat Feb 28 00:00:00 1970 PST
  959 | 509 | 00959_update9      | Sun Mar 01 00:00:00 1970 PST
  960 |   0 | 00960              | Mon Mar 02 00:00:00 1970 PST
  961 |   1 | 00961              | Tue Mar 03 00:00:00 1970 PST
  963 | 303 | 00963_update3      | Thu Mar 05 00:00:00 1970 PST
  964 |   4 | 00964              | Fri Mar 06 00:00:00 1970 PST
  966 |   6 | 00966              | Sun Mar 08 00:00:00 1970 PST
  967 | 407 | 00967_update7      | Mon Mar 09 00:00:00 1970 PST
  968 |   8 | 00968              | Tue Mar 10 00:00:00 1970 PST
  969 | 509 | 00969_update9      | Wed Mar 11 00:00:00 1970 PST
  970 |   0 | 00970              | Thu Mar 12 00:00:00 1970 PST
  971 |   1 | 00971              | Fri Mar 13 00:00:00 1970 PST
  973 | 303 | 00973_update3      | Sun Mar 15 00:00:00 1970 PST
  974 |   4 | 00974              | Mon Mar 16 00:00:00 1970 PST
  976 |   6 | 00976              | Wed Mar 18 00:00:00 1970 PST
  977 | 407 | 00977_update7      | Thu Mar 19 00:00:00 1970 PST
  978 |   8 | 00978              | Fri Mar 20 00:00:00 1970 PST
  979 | 509 | 00979_update9      | Sat Mar 21 00:00:00 1970 PST
  980 |   0 | 00980              | Sun Mar 22 00:00:00 1970 PST
  981 |   1 | 00981              | Mon Mar 23 00:00:00 1970 PST
  983 | 303 | 00983_update3      | Wed Mar 25 00:00:00 1970 PST
  984 |   4 | 00984              | Thu Mar 26 00:00:00 1970 PST
  986 |   6 | 00986              | Sat Mar 28 00:00:00 1970 PST
  987 | 407 | 00987_update7      | Sun Mar 29 00:00:00 1970 PST
  988 |   8 | 00988              | Mon Mar 30 00:00:00 1970 PST
  989 | 509 | 00989_update9      | Tue Mar 31 00:00:00 1970 PST
  990 |   0 | 00990              | Wed Apr 01 00:00:00 1970 PST
  991 |   1 | 00991              | Thu Apr 02 00:00:00 1970 PST
  993 | 303 | 00993_update3      | Sat Apr 04 00:00:00 1970 PST
  994 |   4 | 00994              | Sun Apr 05 00:00:00 1970 PST
  996 |   6 | 00996              | Tue Apr 07 00:00:00 1970 PST
  997 | 407 | 00997_update7      | Wed Apr 08 00:00:00 1970 PST
  998 |   8 | 00998              | Thu Apr 09 00:00:00 1970 PST
  999 | 509 | 00999_update9      | Fri Apr 10 00:00:00 1970 PST
 1000 |   0 | 01000              | Thu Jan 01 00:00:00 1970 PST
 1001 | 101 | 0000100001         | 
 1003 | 403 | 0000300003_update3 | 
 1004 | 104 | 0000400004         | 
 1006 | 106 | 0000600006         | 
 1007 | 507 | 0000700007_update7 | 
 1008 | 108 | 0000800008         | 
 1009 | 609 | 0000900009_update9 | 
 1010 | 100 | 0001000010         | 
 1011 | 101 | 0001100011         | 
 1013 | 403 | 0001300013_update3 | 
 1014 | 104 | 0001400014         | 
 1016 | 106 | 0001600016         | 
 1017 | 507 | 0001700017_update7 | 
 1018 | 108 | 0001800018         | 
 1019 | 609 | 0001900019_update9 | 
 1020 | 100 | 0002000020         | 
 1101 | 201 | aaa                | 
 1103 | 503 | ccc_update3        | 
 1104 | 204 | ddd                | 
(819 rows)

-- DynamoDB does not support RETURNING in INSERT query => remove RETURNING
--Testcase 411:
EXPLAIN (verbose, costs off)
INSERT INTO ft2_a_child (c1,c2,c3) VALUES (1200,999,'foo');
                                                                   QUERY PLAN                                                                    
-------------------------------------------------------------------------------------------------------------------------------------------------
 Insert on public.ft2_a_child
   Remote SQL: INSERT INTO T_1 VALUE {'C_1' : ?, 'c2' : ?, 'c3' : ?, 'c4' : ?, 'c5' : ?, 'c6' : ?, 'c7' : ?, 'c8' : ?};
   ->  Result
         Output: 1200, 999, NULL::integer, 'foo'::text, NULL::text, NULL::text, NULL::character varying, 'ft2       '::character(10), NULL::text
(4 rows)

--Testcase 412:
INSERT INTO ft2_a_child (c1,c2,c3) VALUES (1200,999,'foo');
--Testcase 413:
EXPLAIN (verbose, costs off)
UPDATE ft2_a_child SET c3 = 'bar' WHERE c1 = 1200 RETURNING tableoid::regclass;             -- can be pushed down
                                     QUERY PLAN                                     
------------------------------------------------------------------------------------
 Update on public.ft2_a_child
   Output: (tableoid)::regclass
   Remote SQL: UPDATE T_1 SET c3 = ? WHERE C_1 = ? RETURNING ALL NEW *
   ->  Foreign Scan on public.ft2_a_child
         Output: c1, c2, NULL::integer, 'bar'::text, c4, c5, c6, c7, c8, c1
         Remote SQL: SELECT C_1, c2, c4, c5, c6, c7, c8 FROM T_1 WHERE (C_1 = 1200)
(6 rows)

--Testcase 414:
UPDATE ft2_a_child SET c3 = 'bar' WHERE c1 = 1200 RETURNING tableoid::regclass;
  tableoid   
-------------
 ft2_a_child
(1 row)

--Testcase 415:
EXPLAIN (verbose, costs off)
DELETE FROM ft2_a_child WHERE c1 = 1200 RETURNING tableoid::regclass;                       -- can be pushed down
                           QUERY PLAN                            
-----------------------------------------------------------------
 Delete on public.ft2_a_child
   Output: (tableoid)::regclass
   Remote SQL: DELETE FROM T_1 WHERE C_1 = ? RETURNING ALL OLD *
   ->  Foreign Scan on public.ft2_a_child
         Output: c1
         Remote SQL: SELECT C_1 FROM T_1 WHERE (C_1 = 1200)
(6 rows)

--Testcase 416:
DELETE FROM ft2_a_child WHERE c1 = 1200 RETURNING tableoid::regclass;
  tableoid   
-------------
 ft2_a_child
(1 row)

-- Test UPDATE/DELETE with RETURNING on a three-table join
--Testcase 417:
INSERT INTO ft2_a_child (c1,c2,c3)
  SELECT id, id - 1200, to_char(id, 'FM00000') FROM generate_series(1201, 1300) id;
--Testcase 418:
EXPLAIN (verbose, costs off)
UPDATE ft2_a_child SET c3 = 'foo'
  FROM ft4 INNER JOIN ft5 ON (ft4.c1 = ft5.c1)
  WHERE ft2_a_child.c1 > 1200 AND ft2_a_child.c2 = ft4.c1
  RETURNING ft2_a_child, ft2_a_child.*, ft4, ft4.*;       -- can be pushed down
                                                                                                                                                   QUERY PLAN                                                                                                                                                   
----------------------------------------------------------------------------------------------------------------------------------------------------------------------------------------------------------------------------------------------------------------------------------------------------------------
 Update on public.ft2_a_child
   Output: ft2_a_child.*, ft2_a_child.c1, ft2_a_child.c2, ft2_a_child.c3, ft2_a_child.c4, ft2_a_child.c5, ft2_a_child.c6, ft2_a_child.c7, ft2_a_child.c8, ((ft4.*)::ft4), ft4.c1, ft4.c2, ft4.c3, ft4.spdurl
   Remote SQL: UPDATE T_1 SET c3 = ? WHERE C_1 = ? RETURNING ALL NEW *
   ->  Merge Join
         Output: ft2_a_child.c1, ft2_a_child.c2, NULL::integer, 'foo'::text, ft2_a_child.c4, ft2_a_child.c5, ft2_a_child.c6, ft2_a_child.c7, ft2_a_child.c8, ft2_a_child.c1, ft4.ctid, ft5.ctid, ((ft4.*)::ft4), ft4.c1, ft4.c2, ft4.c3, ft4.spdurl, ((ft4.*)::ft4), ft4.tableoid, ((ft5.*)::ft5), ft5.tableoid
         Merge Cond: (ft4.c1 = ft5.c1)
         ->  Sort
               Output: ft2_a_child.c1, ft2_a_child.c2, ft2_a_child.c4, ft2_a_child.c5, ft2_a_child.c6, ft2_a_child.c7, ft2_a_child.c8, ft4.ctid, ((ft4.*)::ft4), ft4.c1, ft4.c2, ft4.c3, ft4.spdurl, ft4.tableoid
               Sort Key: ft2_a_child.c2
               ->  Hash Join
                     Output: ft2_a_child.c1, ft2_a_child.c2, ft2_a_child.c4, ft2_a_child.c5, ft2_a_child.c6, ft2_a_child.c7, ft2_a_child.c8, ft4.ctid, ((ft4.*)::ft4), ft4.c1, ft4.c2, ft4.c3, ft4.spdurl, ft4.tableoid
                     Hash Cond: (ft4.c1 = ft2_a_child.c2)
                     ->  Foreign Scan on public.ft4_a ft4
                           Output: ft4.ctid, ft4.*, ft4.c1, ft4.c2, ft4.c3, ft4.spdurl, ft4.tableoid
                             Remote SQL: SELECT c1, c2, c3 FROM T_3
                     ->  Hash
                           Output: ft2_a_child.c1, ft2_a_child.c2, ft2_a_child.c4, ft2_a_child.c5, ft2_a_child.c6, ft2_a_child.c7, ft2_a_child.c8
                           ->  Foreign Scan on public.ft2_a_child
                                 Output: ft2_a_child.c1, ft2_a_child.c2, ft2_a_child.c4, ft2_a_child.c5, ft2_a_child.c6, ft2_a_child.c7, ft2_a_child.c8
                                 Remote SQL: SELECT C_1, c2, c4, c5, c6, c7, c8 FROM T_1 WHERE (C_1 > 1200)
         ->  Sort
               Output: ft5.ctid, ft5.c1, ((ft5.*)::ft5), ft5.tableoid
               Sort Key: ft5.c1
               ->  Foreign Scan on public.ft5_a ft5
                     Output: ft5.ctid, ft5.c1, ft5.*, ft5.tableoid
                       Remote SQL: SELECT c1, c2, c3 FROM T_4
(26 rows)

--Testcase 419:
UPDATE ft2_a_child SET c3 = 'foo'
  FROM ft4 INNER JOIN ft5 ON (ft4.c1 = ft5.c1)
  WHERE ft2_a_child.c1 > 1200 AND ft2_a_child.c2 = ft4.c1
  RETURNING ft2_a_child, ft2_a_child.*, ft4, ft4.*;
          ft2_a_child           |  c1  | c2 | c3  | c4 | c5 | c6 |     c7     | c8 |          ft4           | c1 | c2 |   c3   | spdurl  
--------------------------------+------+----+-----+----+----+----+------------+----+------------------------+----+----+--------+---------
 (1206,6,foo,,,,"ft2       ",)  | 1206 |  6 | foo |    |    |    | ft2        |    | (6,7,AAA006,/node1/)   |  6 |  7 | AAA006 | /node1/
 (1212,12,foo,,,,"ft2       ",) | 1212 | 12 | foo |    |    |    | ft2        |    | (12,13,AAA012,/node1/) | 12 | 13 | AAA012 | /node1/
 (1218,18,foo,,,,"ft2       ",) | 1218 | 18 | foo |    |    |    | ft2        |    | (18,19,AAA018,/node1/) | 18 | 19 | AAA018 | /node1/
 (1224,24,foo,,,,"ft2       ",) | 1224 | 24 | foo |    |    |    | ft2        |    | (24,25,AAA024,/node1/) | 24 | 25 | AAA024 | /node1/
 (1230,30,foo,,,,"ft2       ",) | 1230 | 30 | foo |    |    |    | ft2        |    | (30,31,AAA030,/node1/) | 30 | 31 | AAA030 | /node1/
 (1236,36,foo,,,,"ft2       ",) | 1236 | 36 | foo |    |    |    | ft2        |    | (36,37,AAA036,/node1/) | 36 | 37 | AAA036 | /node1/
 (1242,42,foo,,,,"ft2       ",) | 1242 | 42 | foo |    |    |    | ft2        |    | (42,43,AAA042,/node1/) | 42 | 43 | AAA042 | /node1/
 (1248,48,foo,,,,"ft2       ",) | 1248 | 48 | foo |    |    |    | ft2        |    | (48,49,AAA048,/node1/) | 48 | 49 | AAA048 | /node1/
 (1254,54,foo,,,,"ft2       ",) | 1254 | 54 | foo |    |    |    | ft2        |    | (54,55,AAA054,/node1/) | 54 | 55 | AAA054 | /node1/
 (1260,60,foo,,,,"ft2       ",) | 1260 | 60 | foo |    |    |    | ft2        |    | (60,61,AAA060,/node1/) | 60 | 61 | AAA060 | /node1/
 (1266,66,foo,,,,"ft2       ",) | 1266 | 66 | foo |    |    |    | ft2        |    | (66,67,AAA066,/node1/) | 66 | 67 | AAA066 | /node1/
 (1272,72,foo,,,,"ft2       ",) | 1272 | 72 | foo |    |    |    | ft2        |    | (72,73,AAA072,/node1/) | 72 | 73 | AAA072 | /node1/
 (1278,78,foo,,,,"ft2       ",) | 1278 | 78 | foo |    |    |    | ft2        |    | (78,79,AAA078,/node1/) | 78 | 79 | AAA078 | /node1/
 (1284,84,foo,,,,"ft2       ",) | 1284 | 84 | foo |    |    |    | ft2        |    | (84,85,AAA084,/node1/) | 84 | 85 | AAA084 | /node1/
 (1290,90,foo,,,,"ft2       ",) | 1290 | 90 | foo |    |    |    | ft2        |    | (90,91,AAA090,/node1/) | 90 | 91 | AAA090 | /node1/
 (1296,96,foo,,,,"ft2       ",) | 1296 | 96 | foo |    |    |    | ft2        |    | (96,97,AAA096,/node1/) | 96 | 97 | AAA096 | /node1/
(16 rows)

--Testcase 420:
EXPLAIN (verbose, costs off)
DELETE FROM ft2_a_child
  USING ft4 LEFT JOIN ft5 ON (ft4.c1 = ft5.c1)
  WHERE ft2_a_child.c1 > 1200 AND ft2_a_child.c1 % 10 = 0 AND ft2_a_child.c2 = ft4.c1
  RETURNING 100;                          -- can be pushed down
                                                   QUERY PLAN                                                   
----------------------------------------------------------------------------------------------------------------
 Delete on public.ft2_a_child
   Output: 100
   Remote SQL: DELETE FROM T_1 WHERE C_1 = ?
   ->  Hash Right Join
         Output: ft2_a_child.c1, ft4.ctid, ft5.ctid, ((ft4.*)::ft4), ft4.tableoid, ((ft5.*)::ft5), ft5.tableoid
         Hash Cond: (ft5.c1 = ft4.c1)
         ->  Foreign Scan on public.ft5_a ft5
               Output: ft5.ctid, ft5.c1, ft5.*, ft5.tableoid
                 Remote SQL: SELECT c1, c2, c3 FROM T_4
         ->  Hash
               Output: ft2_a_child.c1, ft4.ctid, ft4.c1, ((ft4.*)::ft4), ft4.tableoid
               ->  Hash Join
                     Output: ft2_a_child.c1, ft4.ctid, ft4.c1, ((ft4.*)::ft4), ft4.tableoid
                     Hash Cond: (ft4.c1 = ft2_a_child.c2)
                     ->  Foreign Scan on public.ft4_a ft4
                           Output: ft4.ctid, ft4.c1, ft4.*, ft4.tableoid
                             Remote SQL: SELECT c1, c2, c3 FROM T_3
                     ->  Hash
                           Output: ft2_a_child.c1, ft2_a_child.c2
                           ->  Foreign Scan on public.ft2_a_child
                                 Output: ft2_a_child.c1, ft2_a_child.c2
                                 Filter: ((ft2_a_child.c1 % 10) = 0)
                                 Remote SQL: SELECT C_1, c2 FROM T_1 WHERE (C_1 > 1200)
(23 rows)

--Testcase 421:
DELETE FROM ft2_a_child
  USING ft4 LEFT JOIN ft5 ON (ft4.c1 = ft5.c1)
  WHERE ft2_a_child.c1 > 1200 AND ft2_a_child.c1 % 10 = 0 AND ft2_a_child.c2 = ft4.c1
  RETURNING 100;
 ?column? 
----------
      100
      100
      100
      100
      100
      100
      100
      100
      100
      100
(10 rows)

--Testcase 422:
DELETE FROM ft2_a_child WHERE ft2_a_child.c1 > 1200;
-- Test UPDATE with a MULTIEXPR sub-select
-- (maybe someday this'll be remotely executable, but not today)
--Testcase 423:
EXPLAIN (verbose, costs off)
UPDATE ft2_a_child AS target SET (c2, c7) = (
    SELECT c2 * 10, c7
        FROM ft2 AS src
        WHERE target.c1 = src.c1
) WHERE c1 > 1100;
                                                                   QUERY PLAN                                                                    
-------------------------------------------------------------------------------------------------------------------------------------------------
 Update on public.ft2_a_child target
   Remote SQL: UPDATE T_1 SET c2 = ? SET c7 = ? WHERE C_1 = ?
   ->  Foreign Scan on public.ft2_a_child target
         Output: target.c1, $1, NULL::integer, target.c3, target.c4, target.c5, target.c6, $2, target.c8, (SubPlan 1 (returns $1,$2)), target.c1
         Remote SQL: SELECT C_1, c3, c4, c5, c6, c8 FROM T_1 WHERE (C_1 > 1100)
         SubPlan 1 (returns $1,$2)
           ->  Foreign Scan on public.ft2_a src
                 Output: (src.c2 * 10), src.c7
                 Filter: (target.c1 = src.c1)
                   Remote SQL: SELECT C_1, c2, c7 FROM T_1
(10 rows)

--Testcase 424:
UPDATE ft2_a_child AS target SET (c2, c7) = (
    SELECT c2 * 10, c7
        FROM ft2 AS src
        WHERE target.c1 = src.c1
) WHERE c1 > 1100;
--Testcase 425:
UPDATE ft2_a_child AS target SET (c2) = (
    SELECT c2 / 10
        FROM ft2 AS src
        WHERE target.c1 = src.c1
) WHERE c1 > 1100;
-- Test UPDATE/DELETE with WHERE or JOIN/ON conditions containing
-- user-defined operators/functions
-- ALTER SERVER loopback OPTIONS (DROP extensions);
--Testcase 426:
INSERT INTO ft2_a_child (c1,c2,c3)
  SELECT id, id % 10, to_char(id, 'FM00000') FROM generate_series(2001, 2010) id;
--Testcase 427:
EXPLAIN (verbose, costs off)
UPDATE ft2_a_child SET c3 = 'bar' WHERE dynamodb_fdw_abs(c1) > 2000 RETURNING *;            -- can't be pushed down
                                 QUERY PLAN                                 
----------------------------------------------------------------------------
 Update on public.ft2_a_child
   Output: c1, c2, c3, c4, c5, c6, c7, c8
   Remote SQL: UPDATE T_1 SET c3 = ? WHERE C_1 = ? RETURNING ALL NEW *
   ->  Foreign Scan on public.ft2_a_child
         Output: c1, c2, NULL::integer, 'bar'::text, c4, c5, c6, c7, c8, c1
         Filter: (dynamodb_fdw_abs(ft2_a_child.c1) > 2000)
         Remote SQL: SELECT C_1, c2, c4, c5, c6, c7, c8 FROM T_1
(7 rows)

--Testcase 428:
UPDATE ft2_a_child SET c3 = 'bar' WHERE dynamodb_fdw_abs(c1) > 2000 RETURNING *;
  c1  | c2 | c3  | c4 | c5 | c6 |     c7     | c8 
------+----+-----+----+----+----+------------+----
 2004 |  4 | bar |    |    |    | ft2        | 
 2001 |  1 | bar |    |    |    | ft2        | 
 2008 |  8 | bar |    |    |    | ft2        | 
 2002 |  2 | bar |    |    |    | ft2        | 
 2007 |  7 | bar |    |    |    | ft2        | 
 2010 |  0 | bar |    |    |    | ft2        | 
 2005 |  5 | bar |    |    |    | ft2        | 
 2009 |  9 | bar |    |    |    | ft2        | 
 2003 |  3 | bar |    |    |    | ft2        | 
 2006 |  6 | bar |    |    |    | ft2        | 
(10 rows)

--Testcase 429:
EXPLAIN (verbose, costs off)
UPDATE ft2_a_child SET c3 = 'baz'
  FROM ft4 INNER JOIN ft5 ON (ft4.c1 = ft5.c1)
  WHERE ft2_a_child.c1 > 2000 AND ft2_a_child.c2 === ft4.c1
  RETURNING ft2_a_child.*, ft4.*, ft5.*;                                                    -- can't be pushed down
                                                                                                                                                             QUERY PLAN                                                                                                                                                             
------------------------------------------------------------------------------------------------------------------------------------------------------------------------------------------------------------------------------------------------------------------------------------------------------------------------------------
 Update on public.ft2_a_child
   Output: ft2_a_child.c1, ft2_a_child.c2, ft2_a_child.c3, ft2_a_child.c4, ft2_a_child.c5, ft2_a_child.c6, ft2_a_child.c7, ft2_a_child.c8, ft4.c1, ft4.c2, ft4.c3, ft4.spdurl, ft5.c1, ft5.c2, ft5.c3, ft5.spdurl
   Remote SQL: UPDATE T_1 SET c3 = ? WHERE C_1 = ? RETURNING ALL NEW *
   ->  Nested Loop
         Output: ft2_a_child.c1, ft2_a_child.c2, NULL::integer, 'baz'::text, ft2_a_child.c4, ft2_a_child.c5, ft2_a_child.c6, ft2_a_child.c7, ft2_a_child.c8, ft2_a_child.c1, ft4.ctid, ft5.ctid, ft4.c1, ft4.c2, ft4.c3, ft4.spdurl, ft5.c1, ft5.c2, ft5.c3, ft5.spdurl, ((ft4.*)::ft4), ft4.tableoid, ((ft5.*)::ft5), ft5.tableoid
         Join Filter: (ft2_a_child.c2 === ft4.c1)
         ->  Merge Join
               Output: ft4.ctid, ft4.c1, ft4.c2, ft4.c3, ft4.spdurl, ((ft4.*)::ft4), ft4.tableoid, ft5.ctid, ft5.c1, ft5.c2, ft5.c3, ft5.spdurl, ((ft5.*)::ft5), ft5.tableoid
               Merge Cond: (ft4.c1 = ft5.c1)
               ->  Sort
                     Output: ft4.ctid, ft4.c1, ft4.c2, ft4.c3, ft4.spdurl, ((ft4.*)::ft4), ft4.tableoid
                     Sort Key: ft4.c1
                     ->  Foreign Scan on public.ft4_a ft4
                           Output: ft4.ctid, ft4.c1, ft4.c2, ft4.c3, ft4.spdurl, ft4.*, ft4.tableoid
                             Remote SQL: SELECT c1, c2, c3 FROM T_3
               ->  Sort
                     Output: ft5.ctid, ft5.c1, ft5.c2, ft5.c3, ft5.spdurl, ((ft5.*)::ft5), ft5.tableoid
                     Sort Key: ft5.c1
                     ->  Foreign Scan on public.ft5_a ft5
                           Output: ft5.ctid, ft5.c1, ft5.c2, ft5.c3, ft5.spdurl, ft5.*, ft5.tableoid
                             Remote SQL: SELECT c1, c2, c3 FROM T_4
         ->  Materialize
               Output: ft2_a_child.c1, ft2_a_child.c2, ft2_a_child.c4, ft2_a_child.c5, ft2_a_child.c6, ft2_a_child.c7, ft2_a_child.c8
               ->  Foreign Scan on public.ft2_a_child
                     Output: ft2_a_child.c1, ft2_a_child.c2, ft2_a_child.c4, ft2_a_child.c5, ft2_a_child.c6, ft2_a_child.c7, ft2_a_child.c8
                     Remote SQL: SELECT C_1, c2, c4, c5, c6, c7, c8 FROM T_1 WHERE (C_1 > 2000)
(26 rows)

--Testcase 430:
UPDATE ft2_a_child SET c3 = 'baz'
  FROM ft4 INNER JOIN ft5 ON (ft4.c1 = ft5.c1)
  WHERE ft2_a_child.c1 > 2000 AND ft2_a_child.c2 === ft4.c1
  RETURNING ft2_a_child.*, ft4.*, ft5.*;
  c1  | c2 | c3  | c4 | c5 | c6 |     c7     | c8 | c1 | c2 |   c3   | spdurl  | c1 | c2 |   c3   | spdurl  
------+----+-----+----+----+----+------------+----+----+----+--------+---------+----+----+--------+---------
 2006 |  6 | baz |    |    |    | ft2        |    |  6 |  7 | AAA006 | /node1/ |  6 |  7 | AAA006 | /node1/
(1 row)

--Testcase 431:
EXPLAIN (verbose, costs off)
DELETE FROM ft2_a_child
  USING ft4 INNER JOIN ft5 ON (ft4.c1 === ft5.c1)
  WHERE ft2_a_child.c1 > 2000 AND ft2_a_child.c2 = ft4.c1
  RETURNING ft2_a_child.c1, ft2_a_child.c2, ft2_a_child.c3;       -- can't be pushed down
                                                   QUERY PLAN                                                   
----------------------------------------------------------------------------------------------------------------
 Delete on public.ft2_a_child
   Output: ft2_a_child.c1, ft2_a_child.c2, ft2_a_child.c3
   Remote SQL: DELETE FROM T_1 WHERE C_1 = ? RETURNING ALL OLD *
   ->  Nested Loop
         Output: ft2_a_child.c1, ft4.ctid, ft5.ctid, ((ft4.*)::ft4), ft4.tableoid, ((ft5.*)::ft5), ft5.tableoid
         Join Filter: (ft4.c1 === ft5.c1)
         ->  Merge Join
               Output: ft2_a_child.c1, ft4.ctid, ft4.c1, ((ft4.*)::ft4), ft4.tableoid
               Merge Cond: (ft2_a_child.c2 = ft4.c1)
               ->  Sort
                     Output: ft2_a_child.c1, ft2_a_child.c2
                     Sort Key: ft2_a_child.c2
                     ->  Foreign Scan on public.ft2_a_child
                           Output: ft2_a_child.c1, ft2_a_child.c2
                           Remote SQL: SELECT C_1, c2 FROM T_1 WHERE (C_1 > 2000)
               ->  Sort
                     Output: ft4.ctid, ft4.c1, ((ft4.*)::ft4), ft4.tableoid
                     Sort Key: ft4.c1
                     ->  Foreign Scan on public.ft4_a ft4
                           Output: ft4.ctid, ft4.c1, ft4.*, ft4.tableoid
                             Remote SQL: SELECT c1, c2, c3 FROM T_3
         ->  Materialize
               Output: ft5.ctid, ft5.c1, ((ft5.*)::ft5), ft5.tableoid
               ->  Foreign Scan on public.ft5_a ft5
                     Output: ft5.ctid, ft5.c1, ft5.*, ft5.tableoid
                       Remote SQL: SELECT c1, c2, c3 FROM T_4
(26 rows)

--Testcase 432:
DELETE FROM ft2_a_child
  USING ft4 INNER JOIN ft5 ON (ft4.c1 === ft5.c1)
  WHERE ft2_a_child.c1 > 2000 AND ft2_a_child.c2 = ft4.c1
  RETURNING ft2_a_child.c1, ft2_a_child.c2, ft2_a_child.c3;
  c1  | c2 | c3  
------+----+-----
 2006 |  6 | baz
(1 row)

--Testcase 433:
DELETE FROM ft2_a_child WHERE ft2_a_child.c1 > 2000;
-- ALTER SERVER loopback OPTIONS (ADD extensions 'postgres_fdw');
-- Test that trigger on remote table works as expected
--Testcase 434:
CREATE OR REPLACE FUNCTION "S 1".F_BRTRIG() RETURNS trigger AS $$
BEGIN
    NEW.c3 = NEW.c3 || '_trig_update';
    RETURN NEW;
END;
$$ LANGUAGE plpgsql;
--Testcase 435:
CREATE TRIGGER t1_br_insert BEFORE INSERT OR UPDATE
    ON ft2_a_child FOR EACH ROW EXECUTE PROCEDURE "S 1".F_BRTRIG();
-- DynamoDB does not support RETURNING in INSERT query => remove RETURNING
--Testcase 436:
INSERT INTO ft2_a_child (c1,c2,c3) VALUES (1208, 818, 'fff');
--Testcase 437:
INSERT INTO ft2_a_child (c1,c2,c3,c6) VALUES (1218, 818, 'ggg', '(--;');
--Testcase 438:
UPDATE ft2_a_child SET c2 = c2 + 600 WHERE c1 % 10 = 8 AND c1 < 1200 RETURNING *;
  c1  | c2  |           c3           |              c4              |            c5            | c6 |     c7     | c8  
------+-----+------------------------+------------------------------+--------------------------+----+------------+-----
  578 | 608 | 00578_trig_update      | Fri Mar 20 00:00:00 1970 PST | Fri Mar 20 00:00:00 1970 | 8  | 8          | foo
  958 | 608 | 00958_trig_update      | Sat Feb 28 00:00:00 1970 PST | Sat Feb 28 00:00:00 1970 | 8  | 8          | foo
  178 | 608 | 00178_trig_update      | Fri Mar 20 00:00:00 1970 PST | Fri Mar 20 00:00:00 1970 | 8  | 8          | foo
  658 | 608 | 00658_trig_update      | Sat Feb 28 00:00:00 1970 PST | Sat Feb 28 00:00:00 1970 | 8  | 8          | foo
  488 | 608 | 00488_trig_update      | Mon Mar 30 00:00:00 1970 PST | Mon Mar 30 00:00:00 1970 | 8  | 8          | foo
  558 | 608 | 00558_trig_update      | Sat Feb 28 00:00:00 1970 PST | Sat Feb 28 00:00:00 1970 | 8  | 8          | foo
   58 | 608 | 00058_trig_update      | Sat Feb 28 00:00:00 1970 PST | Sat Feb 28 00:00:00 1970 | 8  | 8          | foo
  678 | 608 | 00678_trig_update      | Fri Mar 20 00:00:00 1970 PST | Fri Mar 20 00:00:00 1970 | 8  | 8          | foo
  288 | 608 | 00288_trig_update      | Mon Mar 30 00:00:00 1970 PST | Mon Mar 30 00:00:00 1970 | 8  | 8          | foo
  598 | 608 | 00598_trig_update      | Thu Apr 09 00:00:00 1970 PST | Thu Apr 09 00:00:00 1970 | 8  | 8          | foo
  348 | 608 | 00348_trig_update      | Wed Feb 18 00:00:00 1970 PST | Wed Feb 18 00:00:00 1970 | 8  | 8          | foo
  798 | 608 | 00798_trig_update      | Thu Apr 09 00:00:00 1970 PST | Thu Apr 09 00:00:00 1970 | 8  | 8          | foo
  788 | 608 | 00788_trig_update      | Mon Mar 30 00:00:00 1970 PST | Mon Mar 30 00:00:00 1970 | 8  | 8          | foo
  728 | 608 | 00728_trig_update      | Thu Jan 29 00:00:00 1970 PST | Thu Jan 29 00:00:00 1970 | 8  | 8          | foo
  638 | 608 | 00638_trig_update      | Sun Feb 08 00:00:00 1970 PST | Sun Feb 08 00:00:00 1970 | 8  | 8          | foo
  988 | 608 | 00988_trig_update      | Mon Mar 30 00:00:00 1970 PST | Mon Mar 30 00:00:00 1970 | 8  | 8          | foo
  998 | 608 | 00998_trig_update      | Thu Apr 09 00:00:00 1970 PST | Thu Apr 09 00:00:00 1970 | 8  | 8          | foo
  938 | 608 | 00938_trig_update      | Sun Feb 08 00:00:00 1970 PST | Sun Feb 08 00:00:00 1970 | 8  | 8          | foo
  478 | 608 | 00478_trig_update      | Fri Mar 20 00:00:00 1970 PST | Fri Mar 20 00:00:00 1970 | 8  | 8          | foo
  338 | 608 | 00338_trig_update      | Sun Feb 08 00:00:00 1970 PST | Sun Feb 08 00:00:00 1970 | 8  | 8          | foo
  138 | 608 | 00138_trig_update      | Sun Feb 08 00:00:00 1970 PST | Sun Feb 08 00:00:00 1970 | 8  | 8          | foo
  668 | 608 | 00668_trig_update      | Tue Mar 10 00:00:00 1970 PST | Tue Mar 10 00:00:00 1970 | 8  | 8          | foo
  238 | 608 | 00238_trig_update      | Sun Feb 08 00:00:00 1970 PST | Sun Feb 08 00:00:00 1970 | 8  | 8          | foo
   28 | 608 | 00028_trig_update      | Thu Jan 29 00:00:00 1970 PST | Thu Jan 29 00:00:00 1970 | 8  | 8          | foo
  408 | 608 | 00408_trig_update      | Fri Jan 09 00:00:00 1970 PST | Fri Jan 09 00:00:00 1970 | 8  | 8          | foo
 1018 | 708 | 0001800018_trig_update |                              |                          |    | ft2        | 
  448 | 608 | 00448_trig_update      | Wed Feb 18 00:00:00 1970 PST | Wed Feb 18 00:00:00 1970 | 8  | 8          | foo
  368 | 608 | 00368_trig_update      | Tue Mar 10 00:00:00 1970 PST | Tue Mar 10 00:00:00 1970 | 8  | 8          | foo
    8 | 608 | 00008_trig_update      | Fri Jan 09 00:00:00 1970 PST | Fri Jan 09 00:00:00 1970 | 8  | 8          | foo
  168 | 608 | 00168_trig_update      | Tue Mar 10 00:00:00 1970 PST | Tue Mar 10 00:00:00 1970 | 8  | 8          | foo
  308 | 608 | 00308_trig_update      | Fri Jan 09 00:00:00 1970 PST | Fri Jan 09 00:00:00 1970 | 8  | 8          | foo
   68 | 608 | 00068_trig_update      | Tue Mar 10 00:00:00 1970 PST | Tue Mar 10 00:00:00 1970 | 8  | 8          | foo
  218 | 608 | 00218_trig_update      | Mon Jan 19 00:00:00 1970 PST | Mon Jan 19 00:00:00 1970 | 8  | 8          | foo
  838 | 608 | 00838_trig_update      | Sun Feb 08 00:00:00 1970 PST | Sun Feb 08 00:00:00 1970 | 8  | 8          | foo
  888 | 608 | 00888_trig_update      | Mon Mar 30 00:00:00 1970 PST | Mon Mar 30 00:00:00 1970 | 8  | 8          | foo
  778 | 608 | 00778_trig_update      | Fri Mar 20 00:00:00 1970 PST | Fri Mar 20 00:00:00 1970 | 8  | 8          | foo
 1008 | 708 | 0000800008_trig_update |                              |                          |    | ft2        | 
  948 | 608 | 00948_trig_update      | Wed Feb 18 00:00:00 1970 PST | Wed Feb 18 00:00:00 1970 | 8  | 8          | foo
  208 | 608 | 00208_trig_update      | Fri Jan 09 00:00:00 1970 PST | Fri Jan 09 00:00:00 1970 | 8  | 8          | foo
  148 | 608 | 00148_trig_update      | Wed Feb 18 00:00:00 1970 PST | Wed Feb 18 00:00:00 1970 | 8  | 8          | foo
  198 | 608 | 00198_trig_update      | Thu Apr 09 00:00:00 1970 PST | Thu Apr 09 00:00:00 1970 | 8  | 8          | foo
   98 | 608 | 00098_trig_update      | Thu Apr 09 00:00:00 1970 PST | Thu Apr 09 00:00:00 1970 | 8  | 8          | foo
  648 | 608 | 00648_trig_update      | Wed Feb 18 00:00:00 1970 PST | Wed Feb 18 00:00:00 1970 | 8  | 8          | foo
  438 | 608 | 00438_trig_update      | Sun Feb 08 00:00:00 1970 PST | Sun Feb 08 00:00:00 1970 | 8  | 8          | foo
  818 | 608 | 00818_trig_update      | Mon Jan 19 00:00:00 1970 PST | Mon Jan 19 00:00:00 1970 | 8  | 8          | foo
  418 | 608 | 00418_trig_update      | Mon Jan 19 00:00:00 1970 PST | Mon Jan 19 00:00:00 1970 | 8  | 8          | foo
  508 | 608 | 00508_trig_update      | Fri Jan 09 00:00:00 1970 PST | Fri Jan 09 00:00:00 1970 | 8  | 8          | foo
   48 | 608 | 00048_trig_update      | Wed Feb 18 00:00:00 1970 PST | Wed Feb 18 00:00:00 1970 | 8  | 8          | foo
  738 | 608 | 00738_trig_update      | Sun Feb 08 00:00:00 1970 PST | Sun Feb 08 00:00:00 1970 | 8  | 8          | foo
  568 | 608 | 00568_trig_update      | Tue Mar 10 00:00:00 1970 PST | Tue Mar 10 00:00:00 1970 | 8  | 8          | foo
  228 | 608 | 00228_trig_update      | Thu Jan 29 00:00:00 1970 PST | Thu Jan 29 00:00:00 1970 | 8  | 8          | foo
  398 | 608 | 00398_trig_update      | Thu Apr 09 00:00:00 1970 PST | Thu Apr 09 00:00:00 1970 | 8  | 8          | foo
  698 | 608 | 00698_trig_update      | Thu Apr 09 00:00:00 1970 PST | Thu Apr 09 00:00:00 1970 | 8  | 8          | foo
  628 | 608 | 00628_trig_update      | Thu Jan 29 00:00:00 1970 PST | Thu Jan 29 00:00:00 1970 | 8  | 8          | foo
  748 | 608 | 00748_trig_update      | Wed Feb 18 00:00:00 1970 PST | Wed Feb 18 00:00:00 1970 | 8  | 8          | foo
  588 | 608 | 00588_trig_update      | Mon Mar 30 00:00:00 1970 PST | Mon Mar 30 00:00:00 1970 | 8  | 8          | foo
  968 | 608 | 00968_trig_update      | Tue Mar 10 00:00:00 1970 PST | Tue Mar 10 00:00:00 1970 | 8  | 8          | foo
  548 | 608 | 00548_trig_update      | Wed Feb 18 00:00:00 1970 PST | Wed Feb 18 00:00:00 1970 | 8  | 8          | foo
  248 | 608 | 00248_trig_update      | Wed Feb 18 00:00:00 1970 PST | Wed Feb 18 00:00:00 1970 | 8  | 8          | foo
  258 | 608 | 00258_trig_update      | Sat Feb 28 00:00:00 1970 PST | Sat Feb 28 00:00:00 1970 | 8  | 8          | foo
  828 | 608 | 00828_trig_update      | Thu Jan 29 00:00:00 1970 PST | Thu Jan 29 00:00:00 1970 | 8  | 8          | foo
  498 | 608 | 00498_trig_update      | Thu Apr 09 00:00:00 1970 PST | Thu Apr 09 00:00:00 1970 | 8  | 8          | foo
  128 | 608 | 00128_trig_update      | Thu Jan 29 00:00:00 1970 PST | Thu Jan 29 00:00:00 1970 | 8  | 8          | foo
  758 | 608 | 00758_trig_update      | Sat Feb 28 00:00:00 1970 PST | Sat Feb 28 00:00:00 1970 | 8  | 8          | foo
   38 | 608 | 00038_trig_update      | Sun Feb 08 00:00:00 1970 PST | Sun Feb 08 00:00:00 1970 | 8  | 8          | foo
  928 | 608 | 00928_trig_update      | Thu Jan 29 00:00:00 1970 PST | Thu Jan 29 00:00:00 1970 | 8  | 8          | foo
  108 | 608 | 00108_trig_update      | Fri Jan 09 00:00:00 1970 PST | Fri Jan 09 00:00:00 1970 | 8  | 8          | foo
  868 | 608 | 00868_trig_update      | Tue Mar 10 00:00:00 1970 PST | Tue Mar 10 00:00:00 1970 | 8  | 8          | foo
  898 | 608 | 00898_trig_update      | Thu Apr 09 00:00:00 1970 PST | Thu Apr 09 00:00:00 1970 | 8  | 8          | foo
  188 | 608 | 00188_trig_update      | Mon Mar 30 00:00:00 1970 PST | Mon Mar 30 00:00:00 1970 | 8  | 8          | foo
  618 | 608 | 00618_trig_update      | Mon Jan 19 00:00:00 1970 PST | Mon Jan 19 00:00:00 1970 | 8  | 8          | foo
  768 | 608 | 00768_trig_update      | Tue Mar 10 00:00:00 1970 PST | Tue Mar 10 00:00:00 1970 | 8  | 8          | foo
  378 | 608 | 00378_trig_update      | Fri Mar 20 00:00:00 1970 PST | Fri Mar 20 00:00:00 1970 | 8  | 8          | foo
  878 | 608 | 00878_trig_update      | Fri Mar 20 00:00:00 1970 PST | Fri Mar 20 00:00:00 1970 | 8  | 8          | foo
  428 | 608 | 00428_trig_update      | Thu Jan 29 00:00:00 1970 PST | Thu Jan 29 00:00:00 1970 | 8  | 8          | foo
  388 | 608 | 00388_trig_update      | Mon Mar 30 00:00:00 1970 PST | Mon Mar 30 00:00:00 1970 | 8  | 8          | foo
  318 | 608 | 00318_trig_update      | Mon Jan 19 00:00:00 1970 PST | Mon Jan 19 00:00:00 1970 | 8  | 8          | foo
   88 | 608 | 00088_trig_update      | Mon Mar 30 00:00:00 1970 PST | Mon Mar 30 00:00:00 1970 | 8  | 8          | foo
  908 | 608 | 00908_trig_update      | Fri Jan 09 00:00:00 1970 PST | Fri Jan 09 00:00:00 1970 | 8  | 8          | foo
  978 | 608 | 00978_trig_update      | Fri Mar 20 00:00:00 1970 PST | Fri Mar 20 00:00:00 1970 | 8  | 8          | foo
  918 | 608 | 00918_trig_update      | Mon Jan 19 00:00:00 1970 PST | Mon Jan 19 00:00:00 1970 | 8  | 8          | foo
  808 | 608 | 00808_trig_update      | Fri Jan 09 00:00:00 1970 PST | Fri Jan 09 00:00:00 1970 | 8  | 8          | foo
  458 | 608 | 00458_trig_update      | Sat Feb 28 00:00:00 1970 PST | Sat Feb 28 00:00:00 1970 | 8  | 8          | foo
  268 | 608 | 00268_trig_update      | Tue Mar 10 00:00:00 1970 PST | Tue Mar 10 00:00:00 1970 | 8  | 8          | foo
  528 | 608 | 00528_trig_update      | Thu Jan 29 00:00:00 1970 PST | Thu Jan 29 00:00:00 1970 | 8  | 8          | foo
  278 | 608 | 00278_trig_update      | Fri Mar 20 00:00:00 1970 PST | Fri Mar 20 00:00:00 1970 | 8  | 8          | foo
  538 | 608 | 00538_trig_update      | Sun Feb 08 00:00:00 1970 PST | Sun Feb 08 00:00:00 1970 | 8  | 8          | foo
  158 | 608 | 00158_trig_update      | Sat Feb 28 00:00:00 1970 PST | Sat Feb 28 00:00:00 1970 | 8  | 8          | foo
  718 | 608 | 00718_trig_update      | Mon Jan 19 00:00:00 1970 PST | Mon Jan 19 00:00:00 1970 | 8  | 8          | foo
  688 | 608 | 00688_trig_update      | Mon Mar 30 00:00:00 1970 PST | Mon Mar 30 00:00:00 1970 | 8  | 8          | foo
   78 | 608 | 00078_trig_update      | Fri Mar 20 00:00:00 1970 PST | Fri Mar 20 00:00:00 1970 | 8  | 8          | foo
  858 | 608 | 00858_trig_update      | Sat Feb 28 00:00:00 1970 PST | Sat Feb 28 00:00:00 1970 | 8  | 8          | foo
  608 | 608 | 00608_trig_update      | Fri Jan 09 00:00:00 1970 PST | Fri Jan 09 00:00:00 1970 | 8  | 8          | foo
  468 | 608 | 00468_trig_update      | Tue Mar 10 00:00:00 1970 PST | Tue Mar 10 00:00:00 1970 | 8  | 8          | foo
  118 | 608 | 00118_trig_update      | Mon Jan 19 00:00:00 1970 PST | Mon Jan 19 00:00:00 1970 | 8  | 8          | foo
  708 | 608 | 00708_trig_update      | Fri Jan 09 00:00:00 1970 PST | Fri Jan 09 00:00:00 1970 | 8  | 8          | foo
  848 | 608 | 00848_trig_update      | Wed Feb 18 00:00:00 1970 PST | Wed Feb 18 00:00:00 1970 | 8  | 8          | foo
  358 | 608 | 00358_trig_update      | Sat Feb 28 00:00:00 1970 PST | Sat Feb 28 00:00:00 1970 | 8  | 8          | foo
   18 | 608 | 00018_trig_update      | Mon Jan 19 00:00:00 1970 PST | Mon Jan 19 00:00:00 1970 | 8  | 8          | foo
  298 | 608 | 00298_trig_update      | Thu Apr 09 00:00:00 1970 PST | Thu Apr 09 00:00:00 1970 | 8  | 8          | foo
  328 | 608 | 00328_trig_update      | Thu Jan 29 00:00:00 1970 PST | Thu Jan 29 00:00:00 1970 | 8  | 8          | foo
  518 | 608 | 00518_trig_update      | Mon Jan 19 00:00:00 1970 PST | Mon Jan 19 00:00:00 1970 | 8  | 8          | foo
(102 rows)

-- Test errors thrown on remote side during update
ALTER TABLE "S 1"."T 1" ADD CONSTRAINT c2positive CHECK (c2 >= 0);
--Testcase 439:
INSERT INTO ft1_a_child(c1, c2) VALUES(11, 12);  -- duplicate key
ERROR:  dynamodb_fdw: failed to execute remote SQL: Unable to parse ExceptionName: com.amazonaws.dynamodb.v20120810#DuplicateItem Message: Duplicate primary key exists in table 
   sql=INSERT INTO T_1 VALUE {'C_1' : ?, 'c2' : ?, 'c3' : ?, 'c4' : ?, 'c5' : ?, 'c6' : ?, 'c7' : ?, 'c8' : ?};
--Testcase 440:
INSERT INTO ft1_a_child(c1, c2) VALUES(11, 12) ON CONFLICT DO NOTHING; -- unsupported
ERROR:  dynamodb_fdw: unsupported feature ON CONFLICT
--Testcase 441:
INSERT INTO ft1_a_child(c1, c2) VALUES(11, 12) ON CONFLICT (c1, c2) DO NOTHING; -- unsupported
ERROR:  there is no unique or exclusion constraint matching the ON CONFLICT specification
--Testcase 442:
INSERT INTO ft1_a_child(c1, c2) VALUES(11, 12) ON CONFLICT (c1, c2) DO UPDATE SET c3 = 'ffg'; -- unsupported
ERROR:  there is no unique or exclusion constraint matching the ON CONFLICT specification
-- DynamoDB not support constraints
-- --Testcase 443:
-- INSERT INTO ft1_a_child(c1, c2) VALUES(1111, -2);  -- c2positive
-- --Testcase 444:
-- UPDATE ft1_a_child SET c2 = -c2 WHERE c1 = 1;  -- c2positive
-- Test savepoint/rollback behavior
-- DynamoDB FDW does not support transaction, so the savepoint/rollback does not have any effect
--Testcase 445:
select c2, count(*) from ft2 where c2 < 500 group by 1 order by 1;
 c2  | count 
-----+-------
   0 |   100
   1 |   100
   4 |   100
   6 |   100
 100 |     2
 101 |     2
 104 |     2
 106 |     2
 201 |     1
 204 |     1
 303 |   100
 403 |     2
 407 |   100
(13 rows)

--Testcase 446:
select c2, count(*) from "S 1"."T 1" where c2 < 500 group by 1 order by 1;
 c2  | count 
-----+-------
   0 |   100
   1 |   100
   4 |   100
   6 |   100
 100 |     2
 101 |     2
 104 |     2
 106 |     2
 201 |     1
 204 |     1
 303 |   100
 403 |     2
 407 |   100
(13 rows)

begin;
--Testcase 447:
update ft2_a_child set c2 = 42 where c2 = 0;
--Testcase 448:
select c2, count(*) from ft2 where c2 < 500 group by 1 order by 1;
 c2  | count 
-----+-------
   1 |   100
   4 |   100
   6 |   100
  42 |   100
 100 |     2
 101 |     2
 104 |     2
 106 |     2
 201 |     1
 204 |     1
 303 |   100
 403 |     2
 407 |   100
(13 rows)

savepoint s1;
--Testcase 449:
update ft2_a_child set c2 = 44 where c2 = 4;
--Testcase 450:
select c2, count(*) from ft2 where c2 < 500 group by 1 order by 1;
 c2  | count 
-----+-------
   1 |   100
   6 |   100
  42 |   100
  44 |   100
 100 |     2
 101 |     2
 104 |     2
 106 |     2
 201 |     1
 204 |     1
 303 |   100
 403 |     2
 407 |   100
(13 rows)

release savepoint s1;
--Testcase 451:
select c2, count(*) from ft2 where c2 < 500 group by 1 order by 1;
 c2  | count 
-----+-------
   1 |   100
   6 |   100
  42 |   100
  44 |   100
 100 |     2
 101 |     2
 104 |     2
 106 |     2
 201 |     1
 204 |     1
 303 |   100
 403 |     2
 407 |   100
(13 rows)

savepoint s2;
--Testcase 452:
update ft2_a_child set c2 = 46 where c2 = 6;
--Testcase 453:
select c2, count(*) from ft2 where c2 < 500 group by 1 order by 1;
 c2  | count 
-----+-------
   1 |   100
  42 |   100
  44 |   100
  46 |   100
 100 |     2
 101 |     2
 104 |     2
 106 |     2
 201 |     1
 204 |     1
 303 |   100
 403 |     2
 407 |   100
(13 rows)

rollback to savepoint s2;
--Testcase 454:
select c2, count(*) from ft2 where c2 < 500 group by 1 order by 1;
 c2  | count 
-----+-------
   1 |   100
  42 |   100
  44 |   100
  46 |   100
 100 |     2
 101 |     2
 104 |     2
 106 |     2
 201 |     1
 204 |     1
 303 |   100
 403 |     2
 407 |   100
(13 rows)

release savepoint s2;
--Testcase 455:
select c2, count(*) from ft2 where c2 < 500 group by 1 order by 1;
 c2  | count 
-----+-------
   1 |   100
  42 |   100
  44 |   100
  46 |   100
 100 |     2
 101 |     2
 104 |     2
 106 |     2
 201 |     1
 204 |     1
 303 |   100
 403 |     2
 407 |   100
(13 rows)

savepoint s3;
-- DynamoDB not support constraints
-- --Testcase 456:
-- update ft2_a_child set c2 = -2 where c2 = 42 and c1 = 10; -- fail on remote side
rollback to savepoint s3;
--Testcase 457:
select c2, count(*) from ft2 where c2 < 500 group by 1 order by 1;
 c2  | count 
-----+-------
   1 |   100
  42 |   100
  44 |   100
  46 |   100
 100 |     2
 101 |     2
 104 |     2
 106 |     2
 201 |     1
 204 |     1
 303 |   100
 403 |     2
 407 |   100
(13 rows)

release savepoint s3;
--Testcase 458:
select c2, count(*) from ft2 where c2 < 500 group by 1 order by 1;
 c2  | count 
-----+-------
   1 |   100
  42 |   100
  44 |   100
  46 |   100
 100 |     2
 101 |     2
 104 |     2
 106 |     2
 201 |     1
 204 |     1
 303 |   100
 403 |     2
 407 |   100
(13 rows)

-- none of the above is committed yet remotely
--Testcase 459:
select c2, count(*) from "S 1"."T 1" where c2 < 500 group by 1 order by 1;
 c2  | count 
-----+-------
   1 |   100
  42 |   100
  44 |   100
  46 |   100
 100 |     2
 101 |     2
 104 |     2
 106 |     2
 201 |     1
 204 |     1
 303 |   100
 403 |     2
 407 |   100
(13 rows)

commit;
--Testcase 460:
select c2, count(*) from ft2 where c2 < 500 group by 1 order by 1;
 c2  | count 
-----+-------
   1 |   100
  42 |   100
  44 |   100
  46 |   100
 100 |     2
 101 |     2
 104 |     2
 106 |     2
 201 |     1
 204 |     1
 303 |   100
 403 |     2
 407 |   100
(13 rows)

--Testcase 461:
select c2, count(*) from "S 1"."T 1" where c2 < 500 group by 1 order by 1;
 c2  | count 
-----+-------
   1 |   100
  42 |   100
  44 |   100
  46 |   100
 100 |     2
 101 |     2
 104 |     2
 106 |     2
 201 |     1
 204 |     1
 303 |   100
 403 |     2
 407 |   100
(13 rows)

-- VACUUM ANALYZE "S 1"."T 1";
-- Above DMLs add data with c6 as NULL in ft1, so test ORDER BY NULLS LAST and NULLs
-- FIRST behavior here.
-- ORDER BY DESC NULLS LAST options
--Testcase 462:
EXPLAIN (VERBOSE, COSTS OFF) SELECT * FROM ft1 ORDER BY c6 DESC NULLS LAST, c1 OFFSET 795 LIMIT 10;
                                            QUERY PLAN                                            
--------------------------------------------------------------------------------------------------
 Limit
   Output: ft1.c1, ft1.c2, ft1.c3, ft1.c4, ft1.c5, ft1.c6, ft1.c7, ft1.c8, ft1.spdurl
   ->  Sort
         Output: ft1.c1, ft1.c2, ft1.c3, ft1.c4, ft1.c5, ft1.c6, ft1.c7, ft1.c8, ft1.spdurl
         Sort Key: ft1.c6 DESC NULLS LAST, ft1.c1
         ->  Foreign Scan on public.ft1_a ft1
               Output: ft1.c1, ft1.c2, ft1.c3, ft1.c4, ft1.c5, ft1.c6, ft1.c7, ft1.c8, ft1.spdurl
                 Remote SQL: SELECT C_1, c2, c3, c4, c5, c6, c7, c8 FROM T_1
(8 rows)

--Testcase 463:
SELECT * FROM ft1 ORDER BY c6 DESC NULLS LAST, c1 OFFSET 795  LIMIT 10;
  c1  | c2  |         c3         |              c4              |            c5            |  c6  |     c7     | c8  | spdurl  
------+-----+--------------------+------------------------------+--------------------------+------+------------+-----+---------
  960 |  42 | 00960_trig_update  | Mon Mar 02 00:00:00 1970 PST | Mon Mar 02 00:00:00 1970 | 0    | 0          | foo | /node1/
  970 |  42 | 00970_trig_update  | Thu Mar 12 00:00:00 1970 PST | Thu Mar 12 00:00:00 1970 | 0    | 0          | foo | /node1/
  980 |  42 | 00980_trig_update  | Sun Mar 22 00:00:00 1970 PST | Sun Mar 22 00:00:00 1970 | 0    | 0          | foo | /node1/
  990 |  42 | 00990_trig_update  | Wed Apr 01 00:00:00 1970 PST | Wed Apr 01 00:00:00 1970 | 0    | 0          | foo | /node1/
 1000 |  42 | 01000_trig_update  | Thu Jan 01 00:00:00 1970 PST | Thu Jan 01 00:00:00 1970 | 0    | 0          | foo | /node1/
 1218 | 818 | ggg_trig_update    |                              |                          | (--; | ft2        |     | /node1/
 1001 | 101 | 0000100001         |                              |                          |      | ft2        |     | /node1/
 1003 | 403 | 0000300003_update3 |                              |                          |      | ft2        |     | /node1/
 1004 | 104 | 0000400004         |                              |                          |      | ft2        |     | /node1/
 1006 | 106 | 0000600006         |                              |                          |      | ft2        |     | /node1/
(10 rows)

-- ORDER BY DESC NULLS FIRST options
--Testcase 464:
EXPLAIN (VERBOSE, COSTS OFF) SELECT * FROM ft1 ORDER BY c6 DESC NULLS FIRST, c1 OFFSET 15 LIMIT 10;
                                            QUERY PLAN                                            
--------------------------------------------------------------------------------------------------
 Limit
   Output: ft1.c1, ft1.c2, ft1.c3, ft1.c4, ft1.c5, ft1.c6, ft1.c7, ft1.c8, ft1.spdurl
   ->  Sort
         Output: ft1.c1, ft1.c2, ft1.c3, ft1.c4, ft1.c5, ft1.c6, ft1.c7, ft1.c8, ft1.spdurl
         Sort Key: ft1.c6 DESC, ft1.c1
         ->  Foreign Scan on public.ft1_a ft1
               Output: ft1.c1, ft1.c2, ft1.c3, ft1.c4, ft1.c5, ft1.c6, ft1.c7, ft1.c8, ft1.spdurl
                 Remote SQL: SELECT C_1, c2, c3, c4, c5, c6, c7, c8 FROM T_1
(8 rows)

--Testcase 465:
SELECT * FROM ft1 ORDER BY c6 DESC NULLS FIRST, c1 OFFSET 15 LIMIT 10;
  c1  | c2  |       c3        |              c4              |            c5            | c6 |     c7     | c8  | spdurl  
------+-----+-----------------+------------------------------+--------------------------+----+------------+-----+---------
 1020 | 100 | 0002000020      |                              |                          |    | ft2        |     | /node1/
 1101 | 201 | aaa             |                              |                          |    | ft2        |     | /node1/
 1103 | 503 | ccc_update3     |                              |                          |    | ft2        |     | /node1/
 1104 | 204 | ddd             |                              |                          |    | ft2        |     | /node1/
 1208 | 818 | fff_trig_update |                              |                          |    | ft2        |     | /node1/
    9 | 509 | 00009_update9   | Sat Jan 10 00:00:00 1970 PST | Sat Jan 10 00:00:00 1970 | 9  | ft2        | foo | /node1/
   19 | 509 | 00019_update9   | Tue Jan 20 00:00:00 1970 PST | Tue Jan 20 00:00:00 1970 | 9  | ft2        | foo | /node1/
   29 | 509 | 00029_update9   | Fri Jan 30 00:00:00 1970 PST | Fri Jan 30 00:00:00 1970 | 9  | ft2        | foo | /node1/
   39 | 509 | 00039_update9   | Mon Feb 09 00:00:00 1970 PST | Mon Feb 09 00:00:00 1970 | 9  | ft2        | foo | /node1/
   49 | 509 | 00049_update9   | Thu Feb 19 00:00:00 1970 PST | Thu Feb 19 00:00:00 1970 | 9  | ft2        | foo | /node1/
(10 rows)

-- ORDER BY ASC NULLS FIRST options
--Testcase 466:
EXPLAIN (VERBOSE, COSTS OFF) SELECT * FROM ft1 ORDER BY c6 ASC NULLS FIRST, c1 OFFSET 15 LIMIT 10;
                                            QUERY PLAN                                            
--------------------------------------------------------------------------------------------------
 Limit
   Output: ft1.c1, ft1.c2, ft1.c3, ft1.c4, ft1.c5, ft1.c6, ft1.c7, ft1.c8, ft1.spdurl
   ->  Sort
         Output: ft1.c1, ft1.c2, ft1.c3, ft1.c4, ft1.c5, ft1.c6, ft1.c7, ft1.c8, ft1.spdurl
         Sort Key: ft1.c6 NULLS FIRST, ft1.c1
         ->  Foreign Scan on public.ft1_a ft1
               Output: ft1.c1, ft1.c2, ft1.c3, ft1.c4, ft1.c5, ft1.c6, ft1.c7, ft1.c8, ft1.spdurl
                 Remote SQL: SELECT C_1, c2, c3, c4, c5, c6, c7, c8 FROM T_1
(8 rows)

--Testcase 467:
SELECT * FROM ft1 ORDER BY c6 ASC NULLS FIRST, c1 OFFSET 15 LIMIT 10;
  c1  | c2  |        c3         |              c4              |            c5            |  c6  |     c7     | c8  | spdurl  
------+-----+-------------------+------------------------------+--------------------------+------+------------+-----+---------
 1020 | 100 | 0002000020        |                              |                          |      | ft2        |     | /node1/
 1101 | 201 | aaa               |                              |                          |      | ft2        |     | /node1/
 1103 | 503 | ccc_update3       |                              |                          |      | ft2        |     | /node1/
 1104 | 204 | ddd               |                              |                          |      | ft2        |     | /node1/
 1208 | 818 | fff_trig_update   |                              |                          |      | ft2        |     | /node1/
 1218 | 818 | ggg_trig_update   |                              |                          | (--; | ft2        |     | /node1/
   10 |  42 | 00010_trig_update | Sun Jan 11 00:00:00 1970 PST | Sun Jan 11 00:00:00 1970 | 0    | 0          | foo | /node1/
   20 |  42 | 00020_trig_update | Wed Jan 21 00:00:00 1970 PST | Wed Jan 21 00:00:00 1970 | 0    | 0          | foo | /node1/
   30 |  42 | 00030_trig_update | Sat Jan 31 00:00:00 1970 PST | Sat Jan 31 00:00:00 1970 | 0    | 0          | foo | /node1/
   40 |  42 | 00040_trig_update | Tue Feb 10 00:00:00 1970 PST | Tue Feb 10 00:00:00 1970 | 0    | 0          | foo | /node1/
(10 rows)

/*
-- DynamoDB does not support constraint
-- ===================================================================
-- test check constraints
-- ===================================================================

-- Consistent check constraints provide consistent results
ALTER FOREIGN TABLE ft1 ADD CONSTRAINT ft1_c2positive CHECK (c2 >= 0);
EXPLAIN (VERBOSE, COSTS OFF) SELECT count(*) FROM ft1 WHERE c2 < 0;
SELECT count(*) FROM ft1 WHERE c2 < 0;
SET constraint_exclusion = 'on';
EXPLAIN (VERBOSE, COSTS OFF) SELECT count(*) FROM ft1 WHERE c2 < 0;
SELECT count(*) FROM ft1 WHERE c2 < 0;
RESET constraint_exclusion;
-- check constraint is enforced on the remote side, not locally
INSERT INTO ft1(c1, c2) VALUES(1111, -2);  -- c2positive
UPDATE ft1 SET c2 = -c2 WHERE c1 = 1;  -- c2positive
ALTER FOREIGN TABLE ft1 DROP CONSTRAINT ft1_c2positive;

-- But inconsistent check constraints provide inconsistent results
ALTER FOREIGN TABLE ft1 ADD CONSTRAINT ft1_c2negative CHECK (c2 < 0);
EXPLAIN (VERBOSE, COSTS OFF) SELECT count(*) FROM ft1 WHERE c2 >= 0;
SELECT count(*) FROM ft1 WHERE c2 >= 0;
SET constraint_exclusion = 'on';
EXPLAIN (VERBOSE, COSTS OFF) SELECT count(*) FROM ft1 WHERE c2 >= 0;
SELECT count(*) FROM ft1 WHERE c2 >= 0;
RESET constraint_exclusion;
-- local check constraint is not actually enforced
INSERT INTO ft1(c1, c2) VALUES(1111, 2);
UPDATE ft1 SET c2 = c2 + 1 WHERE c1 = 1;
ALTER FOREIGN TABLE ft1 DROP CONSTRAINT ft1_c2negative;
*/
/*
-- DynamoDB FDW does not support WITH CHECK OPTION
-- ===================================================================
-- test WITH CHECK OPTION constraints
-- ===================================================================

CREATE FUNCTION row_before_insupd_trigfunc() RETURNS trigger AS $$BEGIN NEW.a := NEW.a + 10; RETURN NEW; END$$ LANGUAGE plpgsql;

CREATE TABLE base_tbl (a int, b int);
ALTER TABLE base_tbl SET (autovacuum_enabled = 'false');
CREATE TRIGGER row_before_insupd_trigger BEFORE INSERT OR UPDATE ON base_tbl FOR EACH ROW EXECUTE PROCEDURE row_before_insupd_trigfunc();
CREATE FOREIGN TABLE foreign_tbl (a int, b int)
  SERVER loopback OPTIONS (table_name 'base_tbl');
CREATE VIEW rw_view AS SELECT * FROM foreign_tbl
  WHERE a < b WITH CHECK OPTION;
\d+ rw_view

EXPLAIN (VERBOSE, COSTS OFF)
INSERT INTO rw_view VALUES (0, 5);
INSERT INTO rw_view VALUES (0, 5); -- should fail
EXPLAIN (VERBOSE, COSTS OFF)
INSERT INTO rw_view VALUES (0, 15);
INSERT INTO rw_view VALUES (0, 15); -- ok
SELECT * FROM foreign_tbl;

EXPLAIN (VERBOSE, COSTS OFF)
UPDATE rw_view SET b = b + 5;
UPDATE rw_view SET b = b + 5; -- should fail
EXPLAIN (VERBOSE, COSTS OFF)
UPDATE rw_view SET b = b + 15;
UPDATE rw_view SET b = b + 15; -- ok
SELECT * FROM foreign_tbl;

DROP FOREIGN TABLE foreign_tbl CASCADE;
DROP TRIGGER row_before_insupd_trigger ON base_tbl;
DROP TABLE base_tbl;

-- test WCO for partitions

CREATE TABLE child_tbl (a int, b int);
ALTER TABLE child_tbl SET (autovacuum_enabled = 'false');
CREATE TRIGGER row_before_insupd_trigger BEFORE INSERT OR UPDATE ON child_tbl FOR EACH ROW EXECUTE PROCEDURE row_before_insupd_trigfunc();
CREATE FOREIGN TABLE foreign_tbl (a int, b int)
  SERVER loopback OPTIONS (table_name 'child_tbl');

CREATE TABLE parent_tbl (a int, b int) PARTITION BY RANGE(a);
ALTER TABLE parent_tbl ATTACH PARTITION foreign_tbl FOR VALUES FROM (0) TO (100);

CREATE VIEW rw_view AS SELECT * FROM parent_tbl
  WHERE a < b WITH CHECK OPTION;
\d+ rw_view

EXPLAIN (VERBOSE, COSTS OFF)
INSERT INTO rw_view VALUES (0, 5);
INSERT INTO rw_view VALUES (0, 5); -- should fail
EXPLAIN (VERBOSE, COSTS OFF)
INSERT INTO rw_view VALUES (0, 15);
INSERT INTO rw_view VALUES (0, 15); -- ok
SELECT * FROM foreign_tbl;

EXPLAIN (VERBOSE, COSTS OFF)
UPDATE rw_view SET b = b + 5;
UPDATE rw_view SET b = b + 5; -- should fail
EXPLAIN (VERBOSE, COSTS OFF)
UPDATE rw_view SET b = b + 15;
UPDATE rw_view SET b = b + 15; -- ok
SELECT * FROM foreign_tbl;

DROP FOREIGN TABLE foreign_tbl CASCADE;
DROP TRIGGER row_before_insupd_trigger ON child_tbl;
DROP TABLE parent_tbl CASCADE;

DROP FUNCTION row_before_insupd_trigfunc;
*/
-- ===================================================================
-- test serial columns (ie, sequence-based defaults)
-- ===================================================================
--Testcase 468:
create foreign table rem1_a_child (id serial, f1 serial, f2 text)
  server dynamodb_server options(table_name 'loct13', partition_key 'id');
--Testcase 469:
create table rem1 (id serial, f1 serial, f2 text, spdurl text) PARTITION BY LIST (spdurl);
--Testcase 470:
CREATE FOREIGN TABLE rem1_a PARTITION OF rem1 FOR VALUES IN ('/node1/') SERVER spdsrv;
--Testcase 471:
insert into rem1_a_child(f2) values('hi');
--Testcase 472:
insert into rem1_a_child(f2) values('bye');
--Testcase 473:
select pg_catalog.setval('rem1_a_child_f1_seq', 10, false);
 setval 
--------
     10
(1 row)

--Testcase 474:
insert into rem1_a_child(f2) values('hi remote');
--Testcase 475:
insert into rem1_a_child(f2) values('bye remote');
--Testcase 476:
select f1, f2 from rem1;
 f1 |     f2     
----+------------
  2 | bye
  1 | hi
 10 | hi remote
 11 | bye remote
(4 rows)

-- ===================================================================
-- test generated columns
-- ===================================================================
--Testcase 477:
create foreign table grem1_a_child (
  id serial,
  a int,
  b int generated always as (a * 2) stored)
  server dynamodb_server options(table_name 'gloc1', partition_key 'id');
--Testcase 478:
create table grem1 (
  id serial,
  a int,
  b int generated always as (a * 2) stored,
  spdurl text
) PARTITION BY LIST (spdurl);
--Testcase 479:
CREATE FOREIGN TABLE grem1_a PARTITION OF grem1 FOR VALUES IN ('/node1/') SERVER spdsrv;
--Testcase 480:
explain (verbose, costs off)
insert into grem1_a_child (a) values (1), (2);
                                          QUERY PLAN                                          
----------------------------------------------------------------------------------------------
 Insert on public.grem1_a_child
   Remote SQL: INSERT INTO gloc1 VALUE {'id' : ?, 'a' : ?, 'b' : ?};
   ->  Values Scan on "*VALUES*"
         Output: nextval('grem1_a_child_id_seq'::regclass), "*VALUES*".column1, NULL::integer
(4 rows)

--Testcase 481:
insert into grem1_a_child (a) values (1), (2);
--Testcase 482:
explain (verbose, costs off)
update grem1_a_child set a = 22 where a = 2;
                         QUERY PLAN                          
-------------------------------------------------------------
 Update on public.grem1_a_child
   Remote SQL: UPDATE gloc1 SET a = ? SET b = ? WHERE id = ?
   ->  Foreign Scan on public.grem1_a_child
         Output: id, 22, b, id
         Remote SQL: SELECT id, b FROM gloc1 WHERE (a = 2)
(5 rows)

--Testcase 483:
update grem1_a_child set a = 22 where a = 2;
--Testcase 484:
select a, b from grem1;
 a  | b  
----+----
 22 | 44
  1 |  2
(2 rows)

--Testcase 485:
delete from grem1_a_child;
-- DynamoDB FDW does not support COPY FROM, only keep 1 test case to
-- test error message
-- test copy from
copy grem1_a_child (a) from stdin;
ERROR:  COPY and foreign partition routing not supported in dynamodb_fdw
-- --Testcase 486:
-- select * from grem1;
-- --Testcase 487:
-- delete from grem1_a_child;
-- ===================================================================
-- test local triggers
-- ===================================================================
-- Trigger functions "borrowed" from triggers regress test.
--Testcase 488:
CREATE FUNCTION trigger_func() RETURNS trigger LANGUAGE plpgsql AS $$
BEGIN
	RAISE NOTICE 'trigger_func(%) called: action = %, when = %, level = %',
		TG_ARGV[0], TG_OP, TG_WHEN, TG_LEVEL;
	RETURN NULL;
END;$$;
--Testcase 489:
CREATE TRIGGER trig_stmt_before BEFORE DELETE OR INSERT OR UPDATE ON rem1_a_child
	FOR EACH STATEMENT EXECUTE PROCEDURE trigger_func();
--Testcase 490:
CREATE TRIGGER trig_stmt_after AFTER DELETE OR INSERT OR UPDATE ON rem1_a_child
	FOR EACH STATEMENT EXECUTE PROCEDURE trigger_func();
--Testcase 491:
CREATE OR REPLACE FUNCTION trigger_data()  RETURNS trigger
LANGUAGE plpgsql AS $$

declare
	oldnew text[];
	relid text;
    argstr text;
begin

	relid := TG_relid::regclass;
	argstr := '';
	for i in 0 .. TG_nargs - 1 loop
		if i > 0 then
			argstr := argstr || ', ';
		end if;
		argstr := argstr || TG_argv[i];
	end loop;

    RAISE NOTICE '%(%) % % % ON %',
		tg_name, argstr, TG_when, TG_level, TG_OP, relid;
    oldnew := '{}'::text[];
	if TG_OP != 'INSERT' then
		oldnew := array_append(oldnew, format('OLD: %s', OLD));
	end if;

	if TG_OP != 'DELETE' then
		oldnew := array_append(oldnew, format('NEW: %s', NEW));
	end if;

    RAISE NOTICE '%', array_to_string(oldnew, ',');

	if TG_OP = 'DELETE' then
		return OLD;
	else
		return NEW;
	end if;
end;
$$;
-- Test basic functionality
--Testcase 492:
CREATE TRIGGER trig_row_before
BEFORE INSERT OR UPDATE OR DELETE ON rem1_a_child
FOR EACH ROW EXECUTE PROCEDURE trigger_data(23,'skidoo');
--Testcase 493:
CREATE TRIGGER trig_row_after
AFTER INSERT OR UPDATE OR DELETE ON rem1_a_child
FOR EACH ROW EXECUTE PROCEDURE trigger_data(23,'skidoo');
--Testcase 494:
delete from rem1_a_child;
NOTICE:  trigger_func(<NULL>) called: action = DELETE, when = BEFORE, level = STATEMENT
NOTICE:  trig_row_before(23, skidoo) BEFORE ROW DELETE ON rem1_a_child
NOTICE:  OLD: (2,2,bye)
NOTICE:  trig_row_before(23, skidoo) BEFORE ROW DELETE ON rem1_a_child
NOTICE:  OLD: (1,1,hi)
NOTICE:  trig_row_before(23, skidoo) BEFORE ROW DELETE ON rem1_a_child
NOTICE:  OLD: (3,10,"hi remote")
NOTICE:  trig_row_before(23, skidoo) BEFORE ROW DELETE ON rem1_a_child
NOTICE:  OLD: (4,11,"bye remote")
NOTICE:  trig_row_after(23, skidoo) AFTER ROW DELETE ON rem1_a_child
NOTICE:  OLD: (2,2,bye)
NOTICE:  trig_row_after(23, skidoo) AFTER ROW DELETE ON rem1_a_child
NOTICE:  OLD: (1,1,hi)
NOTICE:  trig_row_after(23, skidoo) AFTER ROW DELETE ON rem1_a_child
NOTICE:  OLD: (3,10,"hi remote")
NOTICE:  trig_row_after(23, skidoo) AFTER ROW DELETE ON rem1_a_child
NOTICE:  OLD: (4,11,"bye remote")
NOTICE:  trigger_func(<NULL>) called: action = DELETE, when = AFTER, level = STATEMENT
--Testcase 495:
insert into rem1_a_child (f1, f2) values(1,'insert');
NOTICE:  trigger_func(<NULL>) called: action = INSERT, when = BEFORE, level = STATEMENT
NOTICE:  trig_row_before(23, skidoo) BEFORE ROW INSERT ON rem1_a_child
NOTICE:  NEW: (5,1,insert)
NOTICE:  trig_row_after(23, skidoo) AFTER ROW INSERT ON rem1_a_child
NOTICE:  NEW: (5,1,insert)
NOTICE:  trigger_func(<NULL>) called: action = INSERT, when = AFTER, level = STATEMENT
--Testcase 496:
update rem1_a_child set f2  = 'update' where f1 = 1;
NOTICE:  trigger_func(<NULL>) called: action = UPDATE, when = BEFORE, level = STATEMENT
NOTICE:  trig_row_before(23, skidoo) BEFORE ROW UPDATE ON rem1_a_child
NOTICE:  OLD: (5,1,insert),NEW: (5,1,update)
NOTICE:  trig_row_after(23, skidoo) AFTER ROW UPDATE ON rem1_a_child
NOTICE:  OLD: (5,1,insert),NEW: (5,1,update)
NOTICE:  trigger_func(<NULL>) called: action = UPDATE, when = AFTER, level = STATEMENT
--Testcase 497:
update rem1_a_child set f2 = f2 || f2;
NOTICE:  trigger_func(<NULL>) called: action = UPDATE, when = BEFORE, level = STATEMENT
NOTICE:  trig_row_before(23, skidoo) BEFORE ROW UPDATE ON rem1_a_child
NOTICE:  OLD: (5,1,update),NEW: (5,1,updateupdate)
NOTICE:  trig_row_after(23, skidoo) AFTER ROW UPDATE ON rem1_a_child
NOTICE:  OLD: (5,1,update),NEW: (5,1,updateupdate)
NOTICE:  trigger_func(<NULL>) called: action = UPDATE, when = AFTER, level = STATEMENT
-- cleanup
--Testcase 498:
DROP TRIGGER trig_row_before ON rem1_a_child;
--Testcase 499:
DROP TRIGGER trig_row_after ON rem1_a_child;
--Testcase 500:
DROP TRIGGER trig_stmt_before ON rem1_a_child;
--Testcase 501:
DROP TRIGGER trig_stmt_after ON rem1_a_child;
--Testcase 502:
DELETE from rem1_a_child;
-- Test multiple AFTER ROW triggers on a foreign table
--Testcase 503:
CREATE TRIGGER trig_row_after1
AFTER INSERT OR UPDATE OR DELETE ON rem1_a_child
FOR EACH ROW EXECUTE PROCEDURE trigger_data(23,'skidoo');
--Testcase 504:
CREATE TRIGGER trig_row_after2
AFTER INSERT OR UPDATE OR DELETE ON rem1_a_child
FOR EACH ROW EXECUTE PROCEDURE trigger_data(23,'skidoo');
--Testcase 505:
insert into rem1_a_child (f1, f2) values(1,'insert');
NOTICE:  trig_row_after1(23, skidoo) AFTER ROW INSERT ON rem1_a_child
NOTICE:  NEW: (6,1,insert)
NOTICE:  trig_row_after2(23, skidoo) AFTER ROW INSERT ON rem1_a_child
NOTICE:  NEW: (6,1,insert)
--Testcase 506:
update rem1_a_child set f2  = 'update' where f1 = 1;
NOTICE:  trig_row_after1(23, skidoo) AFTER ROW UPDATE ON rem1_a_child
NOTICE:  OLD: (6,1,insert),NEW: (6,1,update)
NOTICE:  trig_row_after2(23, skidoo) AFTER ROW UPDATE ON rem1_a_child
NOTICE:  OLD: (6,1,insert),NEW: (6,1,update)
--Testcase 507:
update rem1_a_child set f2 = f2 || f2;
NOTICE:  trig_row_after1(23, skidoo) AFTER ROW UPDATE ON rem1_a_child
NOTICE:  OLD: (6,1,update),NEW: (6,1,updateupdate)
NOTICE:  trig_row_after2(23, skidoo) AFTER ROW UPDATE ON rem1_a_child
NOTICE:  OLD: (6,1,update),NEW: (6,1,updateupdate)
--Testcase 508:
delete from rem1_a_child;
NOTICE:  trig_row_after1(23, skidoo) AFTER ROW DELETE ON rem1_a_child
NOTICE:  OLD: (6,1,updateupdate)
NOTICE:  trig_row_after2(23, skidoo) AFTER ROW DELETE ON rem1_a_child
NOTICE:  OLD: (6,1,updateupdate)
-- cleanup
--Testcase 509:
DROP TRIGGER trig_row_after1 ON rem1_a_child;
--Testcase 510:
DROP TRIGGER trig_row_after2 ON rem1_a_child;
-- Test WHEN conditions
--Testcase 511:
CREATE TRIGGER trig_row_before_insupd
BEFORE INSERT OR UPDATE ON rem1_a_child
FOR EACH ROW
WHEN (NEW.f2 like '%update%')
EXECUTE PROCEDURE trigger_data(23,'skidoo');
--Testcase 512:
CREATE TRIGGER trig_row_after_insupd
AFTER INSERT OR UPDATE ON rem1_a_child
FOR EACH ROW
WHEN (NEW.f2 like '%update%')
EXECUTE PROCEDURE trigger_data(23,'skidoo');
-- Insert or update not matching: nothing happens
--Testcase 513:
INSERT INTO rem1_a_child (f1, f2) values(1, 'insert');
--Testcase 514:
UPDATE rem1_a_child set f2 = 'test';
-- Insert or update matching: triggers are fired
--Testcase 515:
INSERT INTO rem1_a_child (f1, f2) values(2, 'update');
NOTICE:  trig_row_before_insupd(23, skidoo) BEFORE ROW INSERT ON rem1_a_child
NOTICE:  NEW: (8,2,update)
NOTICE:  trig_row_after_insupd(23, skidoo) AFTER ROW INSERT ON rem1_a_child
NOTICE:  NEW: (8,2,update)
--Testcase 516:
UPDATE rem1_a_child set f2 = 'update update' where f1 = '2';
NOTICE:  trig_row_before_insupd(23, skidoo) BEFORE ROW UPDATE ON rem1_a_child
NOTICE:  OLD: (8,2,update),NEW: (8,2,"update update")
NOTICE:  trig_row_after_insupd(23, skidoo) AFTER ROW UPDATE ON rem1_a_child
NOTICE:  OLD: (8,2,update),NEW: (8,2,"update update")
--Testcase 517:
CREATE TRIGGER trig_row_before_delete
BEFORE DELETE ON rem1_a_child
FOR EACH ROW
WHEN (OLD.f2 like '%update%')
EXECUTE PROCEDURE trigger_data(23,'skidoo');
--Testcase 518:
CREATE TRIGGER trig_row_after_delete
AFTER DELETE ON rem1_a_child
FOR EACH ROW
WHEN (OLD.f2 like '%update%')
EXECUTE PROCEDURE trigger_data(23,'skidoo');
-- Trigger is fired for f1=2, not for f1=1
--Testcase 519:
DELETE FROM rem1_a_child;
NOTICE:  trig_row_before_delete(23, skidoo) BEFORE ROW DELETE ON rem1_a_child
NOTICE:  OLD: (8,2,"update update")
NOTICE:  trig_row_after_delete(23, skidoo) AFTER ROW DELETE ON rem1_a_child
NOTICE:  OLD: (8,2,"update update")
-- cleanup
--Testcase 520:
DROP TRIGGER trig_row_before_insupd ON rem1_a_child;
--Testcase 521:
DROP TRIGGER trig_row_after_insupd ON rem1_a_child;
--Testcase 522:
DROP TRIGGER trig_row_before_delete ON rem1_a_child;
--Testcase 523:
DROP TRIGGER trig_row_after_delete ON rem1_a_child;
-- Test various RETURN statements in BEFORE triggers.
--Testcase 524:
CREATE FUNCTION trig_row_before_insupdate() RETURNS TRIGGER AS $$
  BEGIN
    NEW.f2 := NEW.f2 || ' triggered !';
    RETURN NEW;
  END
$$ language plpgsql;
--Testcase 525:
CREATE TRIGGER trig_row_before_insupd
BEFORE INSERT OR UPDATE ON rem1_a_child
FOR EACH ROW EXECUTE PROCEDURE trig_row_before_insupdate();
-- The new values should have 'triggered' appended
--Testcase 526:
INSERT INTO rem1_a_child (f1, f2) values(1, 'insert');
--Testcase 527:
select f1, f2 from rem1;
 f1 |         f2         
----+--------------------
  1 | insert triggered !
(1 row)

-- DynamoDB does not support RETURNING in INSERT query => remove RETURNING
--Testcase 528:
INSERT INTO rem1_a_child (f1, f2) values(2, 'insert');
--Testcase 529:
select f1, f2 from rem1;
 f1 |         f2         
----+--------------------
  1 | insert triggered !
  2 | insert triggered !
(2 rows)

--Testcase 530:
UPDATE rem1_a_child set f2 = '';
--Testcase 531:
select f1, f2 from rem1;
 f1 |      f2      
----+--------------
  1 |  triggered !
  2 |  triggered !
(2 rows)

--Testcase 532:
UPDATE rem1_a_child set f2 = 'skidoo' RETURNING f2;
         f2         
--------------------
 skidoo triggered !
 skidoo triggered !
(2 rows)

--Testcase 533:
select f1, f2 from rem1;
 f1 |         f2         
----+--------------------
  1 | skidoo triggered !
  2 | skidoo triggered !
(2 rows)

--Testcase 534:
EXPLAIN (verbose, costs off)
UPDATE rem1_a_child set f1 = 10;          -- all columns should be transmitted
                           QUERY PLAN                           
----------------------------------------------------------------
 Update on public.rem1_a_child
   Remote SQL: UPDATE loct13 SET f1 = ? SET f2 = ? WHERE id = ?
   ->  Foreign Scan on public.rem1_a_child
         Output: id, 10, f2, id, rem1_a_child.*
         Remote SQL: SELECT id, f1, f2 FROM loct13
(5 rows)

--Testcase 535:
UPDATE rem1_a_child set f1 = 10;
--Testcase 536:
select f1, f2 from rem1;
 f1 |               f2               
----+--------------------------------
 10 | skidoo triggered ! triggered !
 10 | skidoo triggered ! triggered !
(2 rows)

--Testcase 537:
DELETE FROM rem1_a_child;
-- Add a second trigger, to check that the changes are propagated correctly
-- from trigger to trigger
--Testcase 538:
CREATE TRIGGER trig_row_before_insupd2
BEFORE INSERT OR UPDATE ON rem1_a_child
FOR EACH ROW EXECUTE PROCEDURE trig_row_before_insupdate();
--Testcase 539:
INSERT INTO rem1_a_child (f1, f2) values(1, 'insert');
--Testcase 540:
select f1, f2 from rem1;
 f1 |               f2               
----+--------------------------------
  1 | insert triggered ! triggered !
(1 row)

-- DynamoDB does not support RETURNING in INSERT query => remove RETURNING
--Testcase 541:
INSERT INTO rem1_a_child (f1, f2) values(2, 'insert');
--Testcase 542:
select f1, f2 from rem1 ORDER BY f1;
 f1 |               f2               
----+--------------------------------
  1 | insert triggered ! triggered !
  2 | insert triggered ! triggered !
(2 rows)

--Testcase 543:
UPDATE rem1_a_child set f2 = '';
--Testcase 544:
select f1, f2 from rem1 ORDER BY f1;
 f1 |            f2            
----+--------------------------
  1 |  triggered ! triggered !
  2 |  triggered ! triggered !
(2 rows)

--Testcase 545:
UPDATE rem1_a_child set f2 = 'skidoo' RETURNING f2;
               f2               
--------------------------------
 skidoo triggered ! triggered !
 skidoo triggered ! triggered !
(2 rows)

--Testcase 546:
select f1, f2 from rem1 ORDER BY f1;
 f1 |               f2               
----+--------------------------------
  1 | skidoo triggered ! triggered !
  2 | skidoo triggered ! triggered !
(2 rows)

--Testcase 547:
DROP TRIGGER trig_row_before_insupd ON rem1_a_child;
--Testcase 548:
DROP TRIGGER trig_row_before_insupd2 ON rem1_a_child;
--Testcase 549:
DELETE from rem1_a_child;
--Testcase 550:
INSERT INTO rem1_a_child (f1, f2) VALUES (1, 'test');
-- Test with a trigger returning NULL
--Testcase 551:
CREATE FUNCTION trig_null() RETURNS TRIGGER AS $$
  BEGIN
    RETURN NULL;
  END
$$ language plpgsql;
--Testcase 552:
CREATE TRIGGER trig_null
BEFORE INSERT OR UPDATE OR DELETE ON rem1_a_child
FOR EACH ROW EXECUTE PROCEDURE trig_null();
-- Nothing should have changed.
--Testcase 553:
INSERT INTO rem1_a_child (f1, f2) VALUES (2, 'test2');
--Testcase 554:
select f1, f2 from rem1;
 f1 |  f2  
----+------
  1 | test
(1 row)

--Testcase 555:
UPDATE rem1_a_child SET f2 = 'test2';
--Testcase 556:
select f1, f2 from rem1;
 f1 |  f2  
----+------
  1 | test
(1 row)

--Testcase 557:
DELETE from rem1_a_child;
--Testcase 558:
select f1, f2 from rem1;
 f1 |  f2  
----+------
  1 | test
(1 row)

--Testcase 559:
DROP TRIGGER trig_null ON rem1_a_child;
--Testcase 560:
DELETE from rem1_a_child;
-- Test a combination of local and remote triggers
--Testcase 561:
CREATE TRIGGER trig_row_before
BEFORE INSERT OR UPDATE OR DELETE ON rem1_a_child
FOR EACH ROW EXECUTE PROCEDURE trigger_data(23,'skidoo');
--Testcase 562:
CREATE TRIGGER trig_row_after
AFTER INSERT OR UPDATE OR DELETE ON rem1_a_child
FOR EACH ROW EXECUTE PROCEDURE trigger_data(23,'skidoo');
--Testcase 563:
CREATE TRIGGER trig_local_before BEFORE INSERT OR UPDATE ON rem1_a_child
FOR EACH ROW EXECUTE PROCEDURE trig_row_before_insupdate();
--Testcase 564:
INSERT INTO rem1_a_child(f2) VALUES ('test');
NOTICE:  trig_row_before(23, skidoo) BEFORE ROW INSERT ON rem1_a_child
NOTICE:  NEW: (15,12,"test triggered !")
NOTICE:  trig_row_after(23, skidoo) AFTER ROW INSERT ON rem1_a_child
NOTICE:  NEW: (15,12,"test triggered !")
--Testcase 565:
UPDATE rem1_a_child SET f2 = 'testo';
NOTICE:  trig_row_before(23, skidoo) BEFORE ROW UPDATE ON rem1_a_child
NOTICE:  OLD: (15,12,"test triggered !"),NEW: (15,12,"testo triggered !")
NOTICE:  trig_row_after(23, skidoo) AFTER ROW UPDATE ON rem1_a_child
NOTICE:  OLD: (15,12,"test triggered !"),NEW: (15,12,"testo triggered !")
-- Test returning a system attribute
-- DynamoDB does not support RETURNING in INSERT query => remove RETURNING
--Testcase 566:
INSERT INTO rem1_a_child(f2) VALUES ('test');
NOTICE:  trig_row_before(23, skidoo) BEFORE ROW INSERT ON rem1_a_child
NOTICE:  NEW: (16,13,"test triggered !")
NOTICE:  trig_row_after(23, skidoo) AFTER ROW INSERT ON rem1_a_child
NOTICE:  NEW: (16,13,"test triggered !")
-- cleanup
--Testcase 567:
DROP TRIGGER trig_row_before ON rem1_a_child;
--Testcase 568:
DROP TRIGGER trig_row_after ON rem1_a_child;
--Testcase 569:
DROP TRIGGER trig_local_before ON rem1_a_child;
-- Test direct foreign table modification functionality
-- Test with statement-level triggers
--Testcase 570:
CREATE TRIGGER trig_stmt_before
	BEFORE DELETE OR INSERT OR UPDATE ON rem1_a_child
	FOR EACH STATEMENT EXECUTE PROCEDURE trigger_func();
--Testcase 571:
EXPLAIN (verbose, costs off)
UPDATE rem1_a_child set f2 = '';          -- can be pushed down
                     QUERY PLAN                      
-----------------------------------------------------
 Update on public.rem1_a_child
   Remote SQL: UPDATE loct13 SET f2 = ? WHERE id = ?
   ->  Foreign Scan on public.rem1_a_child
         Output: id, f1, ''::text, id
         Remote SQL: SELECT id, f1 FROM loct13
(5 rows)

--Testcase 572:
EXPLAIN (verbose, costs off)
DELETE FROM rem1_a_child;                 -- can be pushed down
                  QUERY PLAN                   
-----------------------------------------------
 Delete on public.rem1_a_child
   Remote SQL: DELETE FROM loct13 WHERE id = ?
   ->  Foreign Scan on public.rem1_a_child
         Output: id
         Remote SQL: SELECT id FROM loct13
(5 rows)

--Testcase 573:
DROP TRIGGER trig_stmt_before ON rem1_a_child;
--Testcase 574:
CREATE TRIGGER trig_stmt_after
	AFTER DELETE OR INSERT OR UPDATE ON rem1_a_child
	FOR EACH STATEMENT EXECUTE PROCEDURE trigger_func();
--Testcase 575:
EXPLAIN (verbose, costs off)
UPDATE rem1_a_child set f2 = '';          -- can be pushed down
                     QUERY PLAN                      
-----------------------------------------------------
 Update on public.rem1_a_child
   Remote SQL: UPDATE loct13 SET f2 = ? WHERE id = ?
   ->  Foreign Scan on public.rem1_a_child
         Output: id, f1, ''::text, id
         Remote SQL: SELECT id, f1 FROM loct13
(5 rows)

--Testcase 576:
EXPLAIN (verbose, costs off)
DELETE FROM rem1_a_child;                 -- can be pushed down
                  QUERY PLAN                   
-----------------------------------------------
 Delete on public.rem1_a_child
   Remote SQL: DELETE FROM loct13 WHERE id = ?
   ->  Foreign Scan on public.rem1_a_child
         Output: id
         Remote SQL: SELECT id FROM loct13
(5 rows)

--Testcase 577:
DROP TRIGGER trig_stmt_after ON rem1_a_child;
-- Test with row-level ON INSERT triggers
--Testcase 578:
CREATE TRIGGER trig_row_before_insert
BEFORE INSERT ON rem1_a_child
FOR EACH ROW EXECUTE PROCEDURE trigger_data(23,'skidoo');
--Testcase 579:
EXPLAIN (verbose, costs off)
UPDATE rem1_a_child set f2 = '';          -- can be pushed down
                     QUERY PLAN                      
-----------------------------------------------------
 Update on public.rem1_a_child
   Remote SQL: UPDATE loct13 SET f2 = ? WHERE id = ?
   ->  Foreign Scan on public.rem1_a_child
         Output: id, f1, ''::text, id
         Remote SQL: SELECT id, f1 FROM loct13
(5 rows)

--Testcase 580:
EXPLAIN (verbose, costs off)
DELETE FROM rem1_a_child;                 -- can be pushed down
                  QUERY PLAN                   
-----------------------------------------------
 Delete on public.rem1_a_child
   Remote SQL: DELETE FROM loct13 WHERE id = ?
   ->  Foreign Scan on public.rem1_a_child
         Output: id
         Remote SQL: SELECT id FROM loct13
(5 rows)

--Testcase 581:
DROP TRIGGER trig_row_before_insert ON rem1_a_child;
--Testcase 582:
CREATE TRIGGER trig_row_after_insert
AFTER INSERT ON rem1_a_child
FOR EACH ROW EXECUTE PROCEDURE trigger_data(23,'skidoo');
--Testcase 583:
EXPLAIN (verbose, costs off)
UPDATE rem1_a_child set f2 = '';          -- can be pushed down
                     QUERY PLAN                      
-----------------------------------------------------
 Update on public.rem1_a_child
   Remote SQL: UPDATE loct13 SET f2 = ? WHERE id = ?
   ->  Foreign Scan on public.rem1_a_child
         Output: id, f1, ''::text, id
         Remote SQL: SELECT id, f1 FROM loct13
(5 rows)

--Testcase 584:
EXPLAIN (verbose, costs off)
DELETE FROM rem1_a_child;                 -- can be pushed down
                  QUERY PLAN                   
-----------------------------------------------
 Delete on public.rem1_a_child
   Remote SQL: DELETE FROM loct13 WHERE id = ?
   ->  Foreign Scan on public.rem1_a_child
         Output: id
         Remote SQL: SELECT id FROM loct13
(5 rows)

--Testcase 585:
DROP TRIGGER trig_row_after_insert ON rem1_a_child;
-- Test with row-level ON UPDATE triggers
--Testcase 586:
CREATE TRIGGER trig_row_before_update
BEFORE UPDATE ON rem1_a_child
FOR EACH ROW EXECUTE PROCEDURE trigger_data(23,'skidoo');
--Testcase 587:
EXPLAIN (verbose, costs off)
UPDATE rem1_a_child set f2 = '';          -- can't be pushed down
                           QUERY PLAN                           
----------------------------------------------------------------
 Update on public.rem1_a_child
   Remote SQL: UPDATE loct13 SET f1 = ? SET f2 = ? WHERE id = ?
   ->  Foreign Scan on public.rem1_a_child
         Output: id, f1, ''::text, id, rem1_a_child.*
         Remote SQL: SELECT id, f1, f2 FROM loct13
(5 rows)

--Testcase 588:
EXPLAIN (verbose, costs off)
DELETE FROM rem1_a_child;                 -- can be pushed down
                  QUERY PLAN                   
-----------------------------------------------
 Delete on public.rem1_a_child
   Remote SQL: DELETE FROM loct13 WHERE id = ?
   ->  Foreign Scan on public.rem1_a_child
         Output: id
         Remote SQL: SELECT id FROM loct13
(5 rows)

--Testcase 589:
DROP TRIGGER trig_row_before_update ON rem1_a_child;
--Testcase 590:
CREATE TRIGGER trig_row_after_update
AFTER UPDATE ON rem1_a_child
FOR EACH ROW EXECUTE PROCEDURE trigger_data(23,'skidoo');
--Testcase 591:
EXPLAIN (verbose, costs off)
UPDATE rem1_a_child set f2 = '';          -- can't be pushed down
                      QUERY PLAN                      
------------------------------------------------------
 Update on public.rem1_a_child
   Remote SQL: UPDATE loct13 SET f2 = ? WHERE id = ?
   ->  Foreign Scan on public.rem1_a_child
         Output: id, f1, ''::text, id, rem1_a_child.*
         Remote SQL: SELECT id, f1, f2 FROM loct13
(5 rows)

--Testcase 592:
EXPLAIN (verbose, costs off)
DELETE FROM rem1_a_child;                 -- can be pushed down
                  QUERY PLAN                   
-----------------------------------------------
 Delete on public.rem1_a_child
   Remote SQL: DELETE FROM loct13 WHERE id = ?
   ->  Foreign Scan on public.rem1_a_child
         Output: id
         Remote SQL: SELECT id FROM loct13
(5 rows)

--Testcase 593:
DROP TRIGGER trig_row_after_update ON rem1_a_child;
-- Test with row-level ON DELETE triggers
--Testcase 594:
CREATE TRIGGER trig_row_before_delete
BEFORE DELETE ON rem1_a_child
FOR EACH ROW EXECUTE PROCEDURE trigger_data(23,'skidoo');
--Testcase 595:
EXPLAIN (verbose, costs off)
UPDATE rem1_a_child set f2 = '';          -- can be pushed down
                     QUERY PLAN                      
-----------------------------------------------------
 Update on public.rem1_a_child
   Remote SQL: UPDATE loct13 SET f2 = ? WHERE id = ?
   ->  Foreign Scan on public.rem1_a_child
         Output: id, f1, ''::text, id
         Remote SQL: SELECT id, f1 FROM loct13
(5 rows)

--Testcase 596:
EXPLAIN (verbose, costs off)
DELETE FROM rem1_a_child;                 -- can't be pushed down
                    QUERY PLAN                     
---------------------------------------------------
 Delete on public.rem1_a_child
   Remote SQL: DELETE FROM loct13 WHERE id = ?
   ->  Foreign Scan on public.rem1_a_child
         Output: id, rem1_a_child.*
         Remote SQL: SELECT id, f1, f2 FROM loct13
(5 rows)

--Testcase 597:
DROP TRIGGER trig_row_before_delete ON rem1_a_child;
--Testcase 598:
CREATE TRIGGER trig_row_after_delete
AFTER DELETE ON rem1_a_child
FOR EACH ROW EXECUTE PROCEDURE trigger_data(23,'skidoo');
--Testcase 599:
EXPLAIN (verbose, costs off)
UPDATE rem1_a_child set f2 = '';          -- can be pushed down
                     QUERY PLAN                      
-----------------------------------------------------
 Update on public.rem1_a_child
   Remote SQL: UPDATE loct13 SET f2 = ? WHERE id = ?
   ->  Foreign Scan on public.rem1_a_child
         Output: id, f1, ''::text, id
         Remote SQL: SELECT id, f1 FROM loct13
(5 rows)

--Testcase 600:
EXPLAIN (verbose, costs off)
DELETE FROM rem1_a_child;                 -- can't be pushed down
                    QUERY PLAN                     
---------------------------------------------------
 Delete on public.rem1_a_child
   Remote SQL: DELETE FROM loct13 WHERE id = ?
   ->  Foreign Scan on public.rem1_a_child
         Output: id, rem1_a_child.*
         Remote SQL: SELECT id, f1, f2 FROM loct13
(5 rows)

--Testcase 601:
DROP TRIGGER trig_row_after_delete ON rem1_a_child;
-- ===================================================================
-- test inheritance features
-- ===================================================================
--Testcase 602:
CREATE TABLE a (id serial, aa TEXT);
ALTER TABLE a SET (autovacuum_enabled = 'false');
--Testcase 603:
CREATE FOREIGN TABLE b_a_child (bb TEXT) INHERITS (a)
  SERVER dynamodb_server OPTIONS (table_name 'loct', partition_key 'id');
--Testcase 604:
CREATE TABLE b (id integer, aa TEXT, bb TEXT, spdurl text)
   PARTITION BY LIST (spdurl);
--Testcase 605:
CREATE FOREIGN TABLE b_a PARTITION OF b FOR VALUES IN ('/node1/') SERVER spdsrv;
--Testcase 606:
INSERT INTO a(aa) VALUES('aaa');
--Testcase 607:
INSERT INTO a(aa) VALUES('aaaa');
--Testcase 608:
INSERT INTO a(aa) VALUES('aaaaa');
--Testcase 609:
INSERT INTO b_a_child(aa) VALUES('bbb');
--Testcase 610:
INSERT INTO b_a_child(aa) VALUES('bbbb');
--Testcase 611:
INSERT INTO b_a_child(aa) VALUES('bbbbb');
--Testcase 612:
SELECT tableoid::regclass, aa FROM a ORDER BY 1, 2;
 tableoid  |  aa   
-----------+-------
 a         | aaa
 a         | aaaa
 a         | aaaaa
 b_a_child | bbb
 b_a_child | bbbb
 b_a_child | bbbbb
(6 rows)

--Testcase 613:
SELECT tableoid::regclass, aa, bb FROM b ORDER BY 1, 2, 3;
 tableoid |  aa   | bb 
----------+-------+----
 b_a      | bbb   | 
 b_a      | bbbb  | 
 b_a      | bbbbb | 
(3 rows)

--Testcase 614:
SELECT tableoid::regclass, aa FROM ONLY a;
 tableoid |  aa   
----------+-------
 a        | aaa
 a        | aaaa
 a        | aaaaa
(3 rows)

--Testcase 615:
UPDATE a SET aa = 'zzzzzz' WHERE aa LIKE 'aaaa%';
--Testcase 616:
SELECT tableoid::regclass, aa FROM a ORDER BY 1, 2;
 tableoid  |   aa   
-----------+--------
 a         | aaa
 a         | zzzzzz
 a         | zzzzzz
 b_a_child | bbb
 b_a_child | bbbb
 b_a_child | bbbbb
(6 rows)

--Testcase 617:
SELECT tableoid::regclass, aa, bb FROM b ORDER BY 1, 2, 3;
 tableoid |  aa   | bb 
----------+-------+----
 b_a      | bbb   | 
 b_a      | bbbb  | 
 b_a      | bbbbb | 
(3 rows)

--Testcase 618:
SELECT tableoid::regclass, aa FROM ONLY a;
 tableoid |   aa   
----------+--------
 a        | aaa
 a        | zzzzzz
 a        | zzzzzz
(3 rows)

--Testcase 619:
UPDATE b_a_child SET aa = 'new';
--Testcase 620:
SELECT tableoid::regclass, aa FROM a;
 tableoid  |   aa   
-----------+--------
 a         | aaa
 a         | zzzzzz
 a         | zzzzzz
 b_a_child | new
 b_a_child | new
 b_a_child | new
(6 rows)

--Testcase 621:
SELECT tableoid::regclass, aa, bb FROM b;
 tableoid | aa  | bb 
----------+-----+----
 b_a      | new | 
 b_a      | new | 
 b_a      | new | 
(3 rows)

--Testcase 622:
SELECT tableoid::regclass, aa FROM ONLY a;
 tableoid |   aa   
----------+--------
 a        | aaa
 a        | zzzzzz
 a        | zzzzzz
(3 rows)

--Testcase 623:
UPDATE a SET aa = 'newtoo';
--Testcase 624:
SELECT tableoid::regclass, aa FROM a;
 tableoid  |   aa   
-----------+--------
 a         | newtoo
 a         | newtoo
 a         | newtoo
 b_a_child | newtoo
 b_a_child | newtoo
 b_a_child | newtoo
(6 rows)

--Testcase 625:
SELECT tableoid::regclass, aa, bb FROM b;
 tableoid |   aa   | bb 
----------+--------+----
 b_a      | newtoo | 
 b_a      | newtoo | 
 b_a      | newtoo | 
(3 rows)

--Testcase 626:
SELECT tableoid::regclass, aa FROM ONLY a;
 tableoid |   aa   
----------+--------
 a        | newtoo
 a        | newtoo
 a        | newtoo
(3 rows)

--Testcase 627:
DELETE FROM a;
--Testcase 628:
SELECT tableoid::regclass, aa FROM a;
 tableoid | aa 
----------+----
(0 rows)

--Testcase 629:
SELECT tableoid::regclass, aa, bb FROM b;
 tableoid | aa | bb 
----------+----+----
(0 rows)

--Testcase 630:
SELECT tableoid::regclass, aa FROM ONLY a;
 tableoid | aa 
----------+----
(0 rows)

--Testcase 631:
DROP TABLE a CASCADE;
NOTICE:  drop cascades to foreign table b_a_child
-- Check SELECT FOR UPDATE/SHARE with an inherited source table
--Testcase 632:
create table foo (f1 int, f2 int);
--Testcase 633:
create foreign table foo2_a_child (f3 int) inherits (foo)
  server dynamodb_server options (table_name 'loct1');
--Testcase 634:
create table foo2 (f1 int, f2 int, f3 int, spdurl text)
   PARTITION BY LIST (spdurl);
--Testcase 635:
CREATE FOREIGN TABLE foo2_a PARTITION OF foo2 FOR VALUES IN ('/node1/') SERVER spdsrv;
--Testcase 636:
create table bar (f1 int, f2 int);
--Testcase 637:
create foreign table bar2_a_child (f3 int) inherits (bar)
  server dynamodb_server options (table_name 'loct2');
--Testcase 638:
create table bar2 (f3 int, spdurl text)
  PARTITION BY LIST (spdurl);
--Testcase 639:
CREATE FOREIGN TABLE bar2_a PARTITION OF bar2 FOR VALUES IN ('/node1/') SERVER spdsrv;
alter table foo set (autovacuum_enabled = 'false');
alter table bar set (autovacuum_enabled = 'false');
alter foreign table foo2_a_child options (add partition_key 'f1');
alter foreign table bar2_a_child options (add partition_key 'f1');
--Testcase 640:
insert into foo values(1,1);
--Testcase 641:
insert into foo values(3,3);
--Testcase 642:
insert into foo2_a_child values(2,2,2);
--Testcase 643:
insert into foo2_a_child values(4,4,4);
--Testcase 644:
insert into bar values(1,11);
--Testcase 645:
insert into bar values(2,22);
--Testcase 646:
insert into bar values(6,66);
--Testcase 647:
insert into bar2_a_child values(3,33,33);
--Testcase 648:
insert into bar2_a_child values(4,44,44);
--Testcase 649:
insert into bar2_a_child values(7,77,77);
--Testcase 650:
explain (verbose, costs off)
select * from bar where f1 in (select f1 from foo) for update;
                                          QUERY PLAN                                          
----------------------------------------------------------------------------------------------
 LockRows
   Output: bar.f1, bar.f2, bar.ctid, foo.ctid, bar.*, bar.tableoid, foo.*, foo.tableoid
   ->  Hash Join
         Output: bar.f1, bar.f2, bar.ctid, foo.ctid, bar.*, bar.tableoid, foo.*, foo.tableoid
         Inner Unique: true
         Hash Cond: (bar.f1 = foo.f1)
         ->  Append
               ->  Seq Scan on public.bar bar_1
                     Output: bar_1.f1, bar_1.f2, bar_1.ctid, bar_1.*, bar_1.tableoid
               ->  Foreign Scan on public.bar2_a_child bar_2
                     Output: bar_2.f1, bar_2.f2, bar_2.ctid, bar_2.*, bar_2.tableoid
                     Remote SQL: SELECT f1, f2, f3 FROM loct2
         ->  Hash
               Output: foo.ctid, foo.f1, foo.*, foo.tableoid
               ->  HashAggregate
                     Output: foo.ctid, foo.f1, foo.*, foo.tableoid
                     Group Key: foo.f1
                     ->  Append
                           ->  Seq Scan on public.foo foo_1
                                 Output: foo_1.ctid, foo_1.f1, foo_1.*, foo_1.tableoid
                           ->  Foreign Scan on public.foo2_a_child foo_2
                                 Output: foo_2.ctid, foo_2.f1, foo_2.*, foo_2.tableoid
                                 Remote SQL: SELECT f1, f2, f3 FROM loct1
(23 rows)

--Testcase 651:
select * from bar where f1 in (select f1 from foo) for update;
 f1 | f2 
----+----
  1 | 11
  2 | 22
  3 | 33
  4 | 44
(4 rows)

--Testcase 652:
explain (verbose, costs off)
select * from bar where f1 in (select f1 from foo) for share;
                                          QUERY PLAN                                          
----------------------------------------------------------------------------------------------
 LockRows
   Output: bar.f1, bar.f2, bar.ctid, foo.ctid, bar.*, bar.tableoid, foo.*, foo.tableoid
   ->  Hash Join
         Output: bar.f1, bar.f2, bar.ctid, foo.ctid, bar.*, bar.tableoid, foo.*, foo.tableoid
         Inner Unique: true
         Hash Cond: (bar.f1 = foo.f1)
         ->  Append
               ->  Seq Scan on public.bar bar_1
                     Output: bar_1.f1, bar_1.f2, bar_1.ctid, bar_1.*, bar_1.tableoid
               ->  Foreign Scan on public.bar2_a_child bar_2
                     Output: bar_2.f1, bar_2.f2, bar_2.ctid, bar_2.*, bar_2.tableoid
                     Remote SQL: SELECT f1, f2, f3 FROM loct2
         ->  Hash
               Output: foo.ctid, foo.f1, foo.*, foo.tableoid
               ->  HashAggregate
                     Output: foo.ctid, foo.f1, foo.*, foo.tableoid
                     Group Key: foo.f1
                     ->  Append
                           ->  Seq Scan on public.foo foo_1
                                 Output: foo_1.ctid, foo_1.f1, foo_1.*, foo_1.tableoid
                           ->  Foreign Scan on public.foo2_a_child foo_2
                                 Output: foo_2.ctid, foo_2.f1, foo_2.*, foo_2.tableoid
                                 Remote SQL: SELECT f1, f2, f3 FROM loct1
(23 rows)

--Testcase 653:
select * from bar where f1 in (select f1 from foo) for share;
 f1 | f2 
----+----
  1 | 11
  2 | 22
  3 | 33
  4 | 44
(4 rows)

-- Now check SELECT FOR UPDATE/SHARE with an inherited source table,
-- where the parent is itself a foreign table
--Testcase 654:
create foreign table foo2child_a_child (f3 int) inherits (foo2_a_child)
  server dynamodb_server options (table_name 'loct4');
NOTICE:  moving and merging column "f3" with inherited definition
DETAIL:  User-specified column moved to the position of the inherited column.
--Testcase 655:
create table foo2child (f3 int, spdurl text)
   PARTITION BY LIST (spdurl);
--Testcase 656:
CREATE FOREIGN TABLE foo2child_a PARTITION OF foo2child FOR VALUES IN ('/node1/') SERVER spdsrv;
--Testcase 657:
explain (verbose, costs off)
select * from bar where f1 in (select f1 from foo2) for share;
                                                QUERY PLAN                                                 
-----------------------------------------------------------------------------------------------------------
 LockRows
   Output: bar.f1, bar.f2, bar.ctid, foo2.ctid, bar.*, bar.tableoid, ((foo2.*)::foo2), foo2.tableoid
   ->  Hash Join
         Output: bar.f1, bar.f2, bar.ctid, foo2.ctid, bar.*, bar.tableoid, ((foo2.*)::foo2), foo2.tableoid
         Inner Unique: true
         Hash Cond: (bar.f1 = foo2.f1)
         ->  Append
               ->  Seq Scan on public.bar bar_1
                     Output: bar_1.f1, bar_1.f2, bar_1.ctid, bar_1.*, bar_1.tableoid
               ->  Foreign Scan on public.bar2_a_child bar_2
                     Output: bar_2.f1, bar_2.f2, bar_2.ctid, bar_2.*, bar_2.tableoid
                     Remote SQL: SELECT f1, f2, f3 FROM loct2
         ->  Hash
               Output: foo2.ctid, foo2.f1, ((foo2.*)::foo2), foo2.tableoid
               ->  HashAggregate
                     Output: foo2.ctid, foo2.f1, ((foo2.*)::foo2), foo2.tableoid
                     Group Key: foo2.f1
                     ->  Foreign Scan on public.foo2_a foo2
                           Output: foo2.ctid, foo2.f1, foo2.*, foo2.tableoid
                             Remote SQL: SELECT f1, f2, f3 FROM loct1
(20 rows)

--Testcase 658:
select * from bar where f1 in (select f1 from foo2) for share;
 f1 | f2 
----+----
  2 | 22
  4 | 44
(2 rows)

--Testcase 659:
drop foreign table foo2child_a_child;
--Testcase 660:
drop table foo2child;
-- And with a local child relation of the foreign table parent
--Testcase 661:
create table foo2child (f3 int) inherits (foo2_a_child);
NOTICE:  moving and merging column "f3" with inherited definition
DETAIL:  User-specified column moved to the position of the inherited column.
--Testcase 662:
explain (verbose, costs off)
select * from bar where f1 in (select f1 from foo2) for share;
                                                QUERY PLAN                                                 
-----------------------------------------------------------------------------------------------------------
 LockRows
   Output: bar.f1, bar.f2, bar.ctid, foo2.ctid, bar.*, bar.tableoid, ((foo2.*)::foo2), foo2.tableoid
   ->  Hash Join
         Output: bar.f1, bar.f2, bar.ctid, foo2.ctid, bar.*, bar.tableoid, ((foo2.*)::foo2), foo2.tableoid
         Inner Unique: true
         Hash Cond: (bar.f1 = foo2.f1)
         ->  Append
               ->  Seq Scan on public.bar bar_1
                     Output: bar_1.f1, bar_1.f2, bar_1.ctid, bar_1.*, bar_1.tableoid
               ->  Foreign Scan on public.bar2_a_child bar_2
                     Output: bar_2.f1, bar_2.f2, bar_2.ctid, bar_2.*, bar_2.tableoid
                     Remote SQL: SELECT f1, f2, f3 FROM loct2
         ->  Hash
               Output: foo2.ctid, foo2.f1, ((foo2.*)::foo2), foo2.tableoid
               ->  HashAggregate
                     Output: foo2.ctid, foo2.f1, ((foo2.*)::foo2), foo2.tableoid
                     Group Key: foo2.f1
                     ->  Foreign Scan on public.foo2_a foo2
                           Output: foo2.ctid, foo2.f1, foo2.*, foo2.tableoid
                             Remote SQL: SELECT f1, f2, f3 FROM loct1
(20 rows)

--Testcase 663:
select * from bar where f1 in (select f1 from foo2) for share;
 f1 | f2 
----+----
  2 | 22
  4 | 44
(2 rows)

--Testcase 664:
drop table foo2child;
-- Check UPDATE with inherited target and an inherited source table
--Testcase 665:
explain (verbose, costs off)
update bar set f2 = f2 + 100 where f1 in (select f1 from foo);
                                          QUERY PLAN                                           
-----------------------------------------------------------------------------------------------
 Update on public.bar
   Update on public.bar
   Foreign Update on public.bar2_a_child bar_1
     Remote SQL: UPDATE loct2 SET f2 = ? WHERE f1 = ?
   ->  Hash Join
         Output: bar.f1, (bar.f2 + 100), bar.ctid, foo.ctid, foo.*, foo.tableoid
         Inner Unique: true
         Hash Cond: (bar.f1 = foo.f1)
         ->  Seq Scan on public.bar
               Output: bar.f1, bar.f2, bar.ctid
         ->  Hash
               Output: foo.ctid, foo.f1, foo.*, foo.tableoid
               ->  HashAggregate
                     Output: foo.ctid, foo.f1, foo.*, foo.tableoid
                     Group Key: foo.f1
                     ->  Append
                           ->  Seq Scan on public.foo foo_1
                                 Output: foo_1.ctid, foo_1.f1, foo_1.*, foo_1.tableoid
                           ->  Foreign Scan on public.foo2_a_child foo_2
                                 Output: foo_2.ctid, foo_2.f1, foo_2.*, foo_2.tableoid
                                 Remote SQL: SELECT f1, f2, f3 FROM loct1
   ->  Hash Join
         Output: bar_1.f1, (bar_1.f2 + 100), bar_1.f3, bar_1.f1, foo.ctid, foo.*, foo.tableoid
         Inner Unique: true
         Hash Cond: (bar_1.f1 = foo.f1)
         ->  Foreign Scan on public.bar2_a_child bar_1
               Output: bar_1.f1, bar_1.f2, bar_1.f3
               Remote SQL: SELECT f1, f2, f3 FROM loct2
         ->  Hash
               Output: foo.ctid, foo.f1, foo.*, foo.tableoid
               ->  HashAggregate
                     Output: foo.ctid, foo.f1, foo.*, foo.tableoid
                     Group Key: foo.f1
                     ->  Append
                           ->  Seq Scan on public.foo foo_1
                                 Output: foo_1.ctid, foo_1.f1, foo_1.*, foo_1.tableoid
                           ->  Foreign Scan on public.foo2_a_child foo_2
                                 Output: foo_2.ctid, foo_2.f1, foo_2.*, foo_2.tableoid
                                 Remote SQL: SELECT f1, f2, f3 FROM loct1
(39 rows)

--Testcase 666:
update bar set f2 = f2 + 100 where f1 in (select f1 from foo);
--Testcase 667:
select tableoid::regclass, * from bar order by 1,2;
   tableoid   | f1 | f2  
--------------+----+-----
 bar          |  1 | 111
 bar          |  2 | 122
 bar          |  6 |  66
 bar2_a_child |  3 | 133
 bar2_a_child |  4 | 144
 bar2_a_child |  7 |  77
(6 rows)

-- Check UPDATE with inherited target and an appendrel subquery
--Testcase 668:
explain (verbose, costs off)
update bar set f2 = f2 + 100
from
  ( select f1 from foo union all select f1+3 from foo ) ss
where bar.f1 = ss.f1;
                                  QUERY PLAN                                   
-------------------------------------------------------------------------------
 Update on public.bar
   Update on public.bar
   Foreign Update on public.bar2_a_child bar_1
     Remote SQL: UPDATE loct2 SET f2 = ? WHERE f1 = ?
   ->  Hash Join
         Output: bar.f1, (bar.f2 + 100), bar.ctid, (ROW(foo.f1))
         Hash Cond: (foo.f1 = bar.f1)
         ->  Append
               ->  Seq Scan on public.foo
                     Output: ROW(foo.f1), foo.f1
               ->  Foreign Scan on public.foo2_a_child foo_1
                     Output: ROW(foo_1.f1), foo_1.f1
                     Remote SQL: SELECT f1 FROM loct1
               ->  Seq Scan on public.foo foo_2
                     Output: ROW((foo_2.f1 + 3)), (foo_2.f1 + 3)
               ->  Foreign Scan on public.foo2_a_child foo_3
                     Output: ROW((foo_3.f1 + 3)), (foo_3.f1 + 3)
                     Remote SQL: SELECT f1 FROM loct1
         ->  Hash
               Output: bar.f1, bar.f2, bar.ctid
               ->  Seq Scan on public.bar
                     Output: bar.f1, bar.f2, bar.ctid
   ->  Merge Join
         Output: bar_1.f1, (bar_1.f2 + 100), bar_1.f3, bar_1.f1, (ROW(foo.f1))
         Merge Cond: (bar_1.f1 = foo.f1)
         ->  Sort
               Output: bar_1.f1, bar_1.f2, bar_1.f3
               Sort Key: bar_1.f1
               ->  Foreign Scan on public.bar2_a_child bar_1
                     Output: bar_1.f1, bar_1.f2, bar_1.f3
                     Remote SQL: SELECT f1, f2, f3 FROM loct2
         ->  Sort
               Output: (ROW(foo.f1)), foo.f1
               Sort Key: foo.f1
               ->  Append
                     ->  Seq Scan on public.foo
                           Output: ROW(foo.f1), foo.f1
                     ->  Foreign Scan on public.foo2_a_child foo_1
                           Output: ROW(foo_1.f1), foo_1.f1
                           Remote SQL: SELECT f1 FROM loct1
                     ->  Seq Scan on public.foo foo_2
                           Output: ROW((foo_2.f1 + 3)), (foo_2.f1 + 3)
                     ->  Foreign Scan on public.foo2_a_child foo_3
                           Output: ROW((foo_3.f1 + 3)), (foo_3.f1 + 3)
                           Remote SQL: SELECT f1 FROM loct1
(45 rows)

--Testcase 669:
update bar set f2 = f2 + 100
from
  ( select f1 from foo union all select f1+3 from foo ) ss
where bar.f1 = ss.f1;
--Testcase 670:
select tableoid::regclass, * from bar order by 1,2;
   tableoid   | f1 | f2  
--------------+----+-----
 bar          |  1 | 211
 bar          |  2 | 222
 bar          |  6 | 166
 bar2_a_child |  3 | 233
 bar2_a_child |  4 | 244
 bar2_a_child |  7 | 177
(6 rows)

-- Test forcing the remote server to produce sorted data for a merge join,
-- but the foreign table is an inheritance child.
-- truncate table loct1;
--Testcase 671:
DELETE FROM foo2_a_child;
truncate table only foo;
\set num_rows_foo 2000
--Testcase 672:
insert into foo2_a_child select generate_series(0, :num_rows_foo, 2), generate_series(0, :num_rows_foo, 2), generate_series(0, :num_rows_foo, 2);
--Testcase 673:
insert into foo select generate_series(1, :num_rows_foo, 2), generate_series(1, :num_rows_foo, 2);
SET enable_hashjoin to false;
SET enable_nestloop to false;
-- alter foreign table foo2 options (use_remote_estimate 'true');
-- --Testcase 674:
-- create index i_loct1_f1 on foo2_a_child(f1);
-- --Testcase 675:
-- create index i_foo_f1 on foo(f1);
-- analyze foo;
-- analyze loct1;
-- inner join; expressions in the clauses appear in the equivalence class list
--Testcase 676:
explain (verbose, costs off)
	select foo.f1, foo2.f1 from foo join foo2 on (foo.f1 = foo2.f1) order by foo.f2 offset 10 limit 10;
                               QUERY PLAN                                
-------------------------------------------------------------------------
 Limit
   Output: foo.f1, foo2.f1, foo.f2
   ->  Sort
         Output: foo.f1, foo2.f1, foo.f2
         Sort Key: foo.f2
         ->  Merge Join
               Output: foo.f1, foo2.f1, foo.f2
               Merge Cond: (foo2.f1 = foo.f1)
               ->  Sort
                     Output: foo2.f1
                     Sort Key: foo2.f1
                     ->  Foreign Scan on public.foo2_a foo2
                           Output: foo2.f1
                             Remote SQL: SELECT f1 FROM loct1
               ->  Sort
                     Output: foo.f1, foo.f2
                     Sort Key: foo.f1
                     ->  Append
                           ->  Seq Scan on public.foo foo_1
                                 Output: foo_1.f1, foo_1.f2
                           ->  Foreign Scan on public.foo2_a_child foo_2
                                 Output: foo_2.f1, foo_2.f2
                                 Remote SQL: SELECT f1, f2 FROM loct1
(23 rows)

--Testcase 677:
select foo.f1, foo2.f1 from foo join foo2 on (foo.f1 = foo2.f1) order by foo.f2 offset 10 limit 10;
 f1 | f1 
----+----
 20 | 20
 22 | 22
 24 | 24
 26 | 26
 28 | 28
 30 | 30
 32 | 32
 34 | 34
 36 | 36
 38 | 38
(10 rows)

-- outer join; expressions in the clauses do not appear in equivalence class
-- list but no output change as compared to the previous query
--Testcase 678:
explain (verbose, costs off)
	select foo.f1, foo2.f1 from foo left join foo2 on (foo.f1 = foo2.f1) order by foo.f2 offset 10 limit 10;
                               QUERY PLAN                                
-------------------------------------------------------------------------
 Limit
   Output: foo.f1, foo2.f1, foo.f2
   ->  Sort
         Output: foo.f1, foo2.f1, foo.f2
         Sort Key: foo.f2
         ->  Merge Right Join
               Output: foo.f1, foo2.f1, foo.f2
               Merge Cond: (foo2.f1 = foo.f1)
               ->  Sort
                     Output: foo2.f1
                     Sort Key: foo2.f1
                     ->  Foreign Scan on public.foo2_a foo2
                           Output: foo2.f1
                             Remote SQL: SELECT f1 FROM loct1
               ->  Sort
                     Output: foo.f1, foo.f2
                     Sort Key: foo.f1
                     ->  Append
                           ->  Seq Scan on public.foo foo_1
                                 Output: foo_1.f1, foo_1.f2
                           ->  Foreign Scan on public.foo2_a_child foo_2
                                 Output: foo_2.f1, foo_2.f2
                                 Remote SQL: SELECT f1, f2 FROM loct1
(23 rows)

--Testcase 679:
select foo.f1, foo2.f1 from foo left join foo2 on (foo.f1 = foo2.f1) order by foo.f2 offset 10 limit 10;
 f1 | f1 
----+----
 10 | 10
 11 |   
 12 | 12
 13 |   
 14 | 14
 15 |   
 16 | 16
 17 |   
 18 | 18
 19 |   
(10 rows)

RESET enable_hashjoin;
RESET enable_nestloop;
-- Test that WHERE CURRENT OF is not supported
begin;
declare c cursor for select * from bar where f1 = 7;
--Testcase 680:
fetch from c;
 f1 | f2  
----+-----
  7 | 177
(1 row)

--Testcase 681:
update bar set f2 = null where current of c;
ERROR:  WHERE CURRENT OF is not supported for this table type
rollback;
--Testcase 682:
explain (verbose, costs off)
delete from foo where f1 < 5 returning *;
                             QUERY PLAN                             
--------------------------------------------------------------------
 Delete on public.foo
   Output: foo.f1, foo.f2
   Delete on public.foo
   Foreign Delete on public.foo2_a_child foo_1
     Remote SQL: DELETE FROM loct1 WHERE f1 = ? RETURNING ALL OLD *
   ->  Seq Scan on public.foo
         Output: foo.ctid
         Filter: (foo.f1 < 5)
   ->  Foreign Scan on public.foo2_a_child foo_1
         Output: foo_1.f1
         Remote SQL: SELECT f1 FROM loct1 WHERE (f1 < 5)
(11 rows)

--Testcase 683:
delete from foo where f1 < 5 returning *;
 f1 | f2 
----+----
  1 |  1
  3 |  3
  2 |  2
  0 |  0
  4 |  4
(5 rows)

--Testcase 684:
explain (verbose, costs off)
update bar set f2 = f2 + 100 returning *;
                                QUERY PLAN                                
--------------------------------------------------------------------------
 Update on public.bar
   Output: bar.f1, bar.f2
   Update on public.bar
   Foreign Update on public.bar2_a_child bar_1
     Remote SQL: UPDATE loct2 SET f2 = ? WHERE f1 = ? RETURNING ALL NEW *
   ->  Seq Scan on public.bar
         Output: bar.f1, (bar.f2 + 100), bar.ctid
   ->  Foreign Scan on public.bar2_a_child bar_1
         Output: bar_1.f1, (bar_1.f2 + 100), bar_1.f3, bar_1.f1
         Remote SQL: SELECT f1, f2, f3 FROM loct2
(10 rows)

--Testcase 685:
update bar set f2 = f2 + 100 returning *;
 f1 | f2  
----+-----
  1 | 311
  2 | 322
  6 | 266
  3 | 333
  7 | 277
  4 | 344
(6 rows)

-- Test that UPDATE/DELETE with inherited target works with row-level triggers
--Testcase 686:
CREATE TRIGGER trig_row_before
BEFORE UPDATE OR DELETE ON bar2_a_child
FOR EACH ROW EXECUTE PROCEDURE trigger_data(23,'skidoo');
--Testcase 687:
CREATE TRIGGER trig_row_after
AFTER UPDATE OR DELETE ON bar2_a_child
FOR EACH ROW EXECUTE PROCEDURE trigger_data(23,'skidoo');
--Testcase 688:
explain (verbose, costs off)
update bar set f2 = f2 + 100;
                               QUERY PLAN                                
-------------------------------------------------------------------------
 Update on public.bar
   Update on public.bar
   Foreign Update on public.bar2_a_child bar_1
     Remote SQL: UPDATE loct2 SET f2 = ? SET f3 = ? WHERE f1 = ?
   ->  Seq Scan on public.bar
         Output: bar.f1, (bar.f2 + 100), bar.ctid
   ->  Foreign Scan on public.bar2_a_child bar_1
         Output: bar_1.f1, (bar_1.f2 + 100), bar_1.f3, bar_1.f1, bar_1.*
         Remote SQL: SELECT f1, f2, f3 FROM loct2
(9 rows)

--Testcase 689:
update bar set f2 = f2 + 100;
NOTICE:  trig_row_before(23, skidoo) BEFORE ROW UPDATE ON bar2_a_child
NOTICE:  OLD: (3,333,33),NEW: (3,433,33)
NOTICE:  trig_row_before(23, skidoo) BEFORE ROW UPDATE ON bar2_a_child
NOTICE:  OLD: (7,277,77),NEW: (7,377,77)
NOTICE:  trig_row_before(23, skidoo) BEFORE ROW UPDATE ON bar2_a_child
NOTICE:  OLD: (4,344,44),NEW: (4,444,44)
NOTICE:  trig_row_after(23, skidoo) AFTER ROW UPDATE ON bar2_a_child
NOTICE:  OLD: (3,333,33),NEW: (3,433,33)
NOTICE:  trig_row_after(23, skidoo) AFTER ROW UPDATE ON bar2_a_child
NOTICE:  OLD: (7,277,77),NEW: (7,377,77)
NOTICE:  trig_row_after(23, skidoo) AFTER ROW UPDATE ON bar2_a_child
NOTICE:  OLD: (4,344,44),NEW: (4,444,44)
--Testcase 690:
explain (verbose, costs off)
delete from bar where f2 < 400;
                            QUERY PLAN                             
-------------------------------------------------------------------
 Delete on public.bar
   Delete on public.bar
   Foreign Delete on public.bar2_a_child bar_1
     Remote SQL: DELETE FROM loct2 WHERE f1 = ?
   ->  Seq Scan on public.bar
         Output: bar.ctid
         Filter: (bar.f2 < 400)
   ->  Foreign Scan on public.bar2_a_child bar_1
         Output: bar_1.f1, bar_1.*
         Remote SQL: SELECT f1, f2, f3 FROM loct2 WHERE (f2 < 400)
(10 rows)

--Testcase 691:
delete from bar where f2 < 400;
NOTICE:  trig_row_before(23, skidoo) BEFORE ROW DELETE ON bar2_a_child
NOTICE:  OLD: (7,377,77)
NOTICE:  trig_row_after(23, skidoo) AFTER ROW DELETE ON bar2_a_child
NOTICE:  OLD: (7,377,77)
-- cleanup
--Testcase 692:
drop table foo cascade;
NOTICE:  drop cascades to foreign table foo2_a_child
--Testcase 693:
drop table bar cascade;
NOTICE:  drop cascades to foreign table bar2_a_child
-- Test pushing down UPDATE/DELETE joins to the remote server
--Testcase 694:
create table parent (a int, b text);
-- create foreign table remt1 (a int, b text)
--   server loopback options (table_name 'loct1');
--Testcase 695:
create foreign table remt1_a_child (a int, b text)
  server dynamodb_server options (table_name 'loct11', partition_key 'a');
--Testcase 696:
create table remt1 (a int, b text, spdurl text)
  PARTITION BY LIST (spdurl);
--Testcase 697:
CREATE FOREIGN TABLE remt1_a PARTITION OF remt1 FOR VALUES IN ('/node1/') SERVER spdsrv;
-- create foreign table remt2 (a int, b text)
--   server loopback options (table_name 'loct2');
--Testcase 698:
create foreign table remt2_a_child (a int, b text)
  server dynamodb_server options (table_name 'loct22', partition_key 'a');
--Testcase 699:
create table remt2 (a int, b text, spdurl text)
  PARTITION BY LIST (spdurl);
--Testcase 700:
CREATE FOREIGN TABLE remt2_a PARTITION OF remt2 FOR VALUES IN ('/node1/') SERVER spdsrv;
alter foreign table remt1_a_child inherit parent;
--Testcase 701:
insert into remt1_a_child values (1, 'foo');
--Testcase 702:
insert into remt1_a_child values (2, 'bar');
--Testcase 703:
insert into remt2_a_child values (1, 'foo');
--Testcase 704:
insert into remt2_a_child values (2, 'bar');
-- analyze remt1;
-- analyze remt2;
--Testcase 705:
explain (verbose, costs off)
update parent set b = parent.b || remt2.b from remt2 where parent.a = remt2.a returning *;
                                                                   QUERY PLAN                                                                    
-------------------------------------------------------------------------------------------------------------------------------------------------
 Update on public.parent
   Output: parent.a, parent.b, remt2.a, remt2.b, remt2.spdurl
   Update on public.parent
   Foreign Update on public.remt1_a_child parent_1
     Remote SQL: UPDATE loct11 SET b = ? WHERE a = ? RETURNING ALL NEW *
   ->  Hash Join
         Output: parent.a, (parent.b || remt2.b), parent.ctid, remt2.ctid, remt2.a, remt2.b, remt2.spdurl, ((remt2.*)::remt2), remt2.tableoid
         Hash Cond: (remt2.a = parent.a)
         ->  Foreign Scan on public.remt2_a remt2
               Output: remt2.b, remt2.ctid, remt2.a, remt2.spdurl, remt2.*, remt2.tableoid
                 Remote SQL: SELECT a, b FROM loct22
         ->  Hash
               Output: parent.a, parent.b, parent.ctid
               ->  Seq Scan on public.parent
                     Output: parent.a, parent.b, parent.ctid
   ->  Merge Join
         Output: parent_1.a, (parent_1.b || remt2.b), parent_1.a, remt2.ctid, remt2.a, remt2.b, remt2.spdurl, ((remt2.*)::remt2), remt2.tableoid
         Merge Cond: (parent_1.a = remt2.a)
         ->  Sort
               Output: parent_1.a, parent_1.b
               Sort Key: parent_1.a
               ->  Foreign Scan on public.remt1_a_child parent_1
                     Output: parent_1.a, parent_1.b
                     Remote SQL: SELECT a, b FROM loct11
         ->  Sort
               Output: remt2.b, remt2.ctid, remt2.a, remt2.spdurl, ((remt2.*)::remt2), remt2.tableoid
               Sort Key: remt2.a
               ->  Foreign Scan on public.remt2_a remt2
                     Output: remt2.b, remt2.ctid, remt2.a, remt2.spdurl, remt2.*, remt2.tableoid
                       Remote SQL: SELECT a, b FROM loct22
(30 rows)

--Testcase 706:
update parent set b = parent.b || remt2.b from remt2 where parent.a = remt2.a returning *;
 a |   b    | a |  b  | spdurl  
---+--------+---+-----+---------
 1 | foofoo | 1 | foo | /node1/
 2 | barbar | 2 | bar | /node1/
(2 rows)

--Testcase 707:
explain (verbose, costs off)
delete from parent using remt2 where parent.a = remt2.a returning parent;
                                  QUERY PLAN                                   
-------------------------------------------------------------------------------
 Delete on public.parent
   Output: parent.*
   Delete on public.parent
   Foreign Delete on public.remt1_a_child parent_1
     Remote SQL: DELETE FROM loct11 WHERE a = ? RETURNING ALL OLD *
   ->  Hash Join
         Output: parent.ctid, remt2.ctid, ((remt2.*)::remt2), remt2.tableoid
         Hash Cond: (remt2.a = parent.a)
         ->  Foreign Scan on public.remt2_a remt2
               Output: remt2.ctid, remt2.a, remt2.*, remt2.tableoid
                 Remote SQL: SELECT a, b FROM loct22
         ->  Hash
               Output: parent.ctid, parent.a
               ->  Seq Scan on public.parent
                     Output: parent.ctid, parent.a
   ->  Merge Join
         Output: parent_1.a, remt2.ctid, ((remt2.*)::remt2), remt2.tableoid
         Merge Cond: (parent_1.a = remt2.a)
         ->  Sort
               Output: parent_1.a
               Sort Key: parent_1.a
               ->  Foreign Scan on public.remt1_a_child parent_1
                     Output: parent_1.a
                     Remote SQL: SELECT a FROM loct11
         ->  Sort
               Output: remt2.ctid, remt2.a, ((remt2.*)::remt2), remt2.tableoid
               Sort Key: remt2.a
               ->  Foreign Scan on public.remt2_a remt2
                     Output: remt2.ctid, remt2.a, remt2.*, remt2.tableoid
                       Remote SQL: SELECT a, b FROM loct22
(30 rows)

--Testcase 708:
delete from parent using remt2 where parent.a = remt2.a returning parent;
   parent   
------------
 (1,foofoo)
 (2,barbar)
(2 rows)

-- cleanup
--Testcase 709:
drop foreign table remt1_a_child;
--Testcase 710:
drop table remt1;
--Testcase 711:
drop foreign table remt2_a_child;
--Testcase 712:
drop table remt2;
--Testcase 713:
drop table parent;
-- PGSpider Extension does not support INSERT/UPDATE/DELETE directly on
-- parent table, so we skip these test cases.
-- -- ===================================================================
-- -- test tuple routing for foreign-table partitions
-- -- ===================================================================
-- -- Test insert tuple routing
-- create table itrtest (a int, b text) partition by list (a);
-- create table loct1 (a int check (a in (1)), b text);
-- create foreign table remp1 (a int check (a in (1)), b text) server loopback options (table_name 'loct1');
-- create table loct2 (a int check (a in (2)), b text);
-- create foreign table remp2 (b text, a int check (a in (2))) server loopback options (table_name 'loct2');
-- alter table itrtest attach partition remp1 for values in (1);
-- alter table itrtest attach partition remp2 for values in (2);
-- insert into itrtest values (1, 'foo');
-- insert into itrtest values (1, 'bar') returning *;
-- insert into itrtest values (2, 'baz');
-- insert into itrtest values (2, 'qux') returning *;
-- insert into itrtest values (1, 'test1'), (2, 'test2') returning *;
-- select tableoid::regclass, * FROM itrtest;
-- select tableoid::regclass, * FROM remp1;
-- select tableoid::regclass, * FROM remp2;
-- delete from itrtest;
-- create unique index loct1_idx on loct1 (a);
-- -- DO NOTHING without an inference specification is supported
-- insert into itrtest values (1, 'foo') on conflict do nothing returning *;
-- insert into itrtest values (1, 'foo') on conflict do nothing returning *;
-- -- But other cases are not supported
-- insert into itrtest values (1, 'bar') on conflict (a) do nothing;
-- insert into itrtest values (1, 'bar') on conflict (a) do update set b = excluded.b;
-- select tableoid::regclass, * FROM itrtest;
-- delete from itrtest;
-- drop index loct1_idx;
-- -- Test that remote triggers work with insert tuple routing
-- create function br_insert_trigfunc() returns trigger as $$
-- begin
-- 	new.b := new.b || ' triggered !';
-- 	return new;
-- end
-- $$ language plpgsql;
-- create trigger loct1_br_insert_trigger before insert on loct1
-- 	for each row execute procedure br_insert_trigfunc();
-- create trigger loct2_br_insert_trigger before insert on loct2
-- 	for each row execute procedure br_insert_trigfunc();
-- -- The new values are concatenated with ' triggered !'
-- insert into itrtest values (1, 'foo') returning *;
-- insert into itrtest values (2, 'qux') returning *;
-- insert into itrtest values (1, 'test1'), (2, 'test2') returning *;
-- with result as (insert into itrtest values (1, 'test1'), (2, 'test2') returning *) select * from result;
-- drop trigger loct1_br_insert_trigger on loct1;
-- drop trigger loct2_br_insert_trigger on loct2;
-- drop table itrtest;
-- drop table loct1;
-- drop table loct2;
-- -- Test update tuple routing
-- create table utrtest (a int, b text) partition by list (a);
-- create table loct (a int check (a in (1)), b text);
-- create foreign table remp (a int check (a in (1)), b text) server loopback options (table_name 'loct');
-- create table locp (a int check (a in (2)), b text);
-- alter table utrtest attach partition remp for values in (1);
-- alter table utrtest attach partition locp for values in (2);
-- insert into utrtest values (1, 'foo');
-- insert into utrtest values (2, 'qux');
-- select tableoid::regclass, * FROM utrtest;
-- select tableoid::regclass, * FROM remp;
-- select tableoid::regclass, * FROM locp;
-- -- It's not allowed to move a row from a partition that is foreign to another
-- update utrtest set a = 2 where b = 'foo' returning *;
-- -- But the reverse is allowed
-- update utrtest set a = 1 where b = 'qux' returning *;
-- select tableoid::regclass, * FROM utrtest;
-- select tableoid::regclass, * FROM remp;
-- select tableoid::regclass, * FROM locp;
-- -- The executor should not let unexercised FDWs shut down
-- update utrtest set a = 1 where b = 'foo';
-- -- Test that remote triggers work with update tuple routing
-- create trigger loct_br_insert_trigger before insert on loct
-- 	for each row execute procedure br_insert_trigfunc();
-- delete from utrtest;
-- insert into utrtest values (2, 'qux');
-- -- Check case where the foreign partition is a subplan target rel
-- explain (verbose, costs off)
-- update utrtest set a = 1 where a = 1 or a = 2 returning *;
-- -- The new values are concatenated with ' triggered !'
-- update utrtest set a = 1 where a = 1 or a = 2 returning *;
-- delete from utrtest;
-- insert into utrtest values (2, 'qux');
-- -- Check case where the foreign partition isn't a subplan target rel
-- explain (verbose, costs off)
-- update utrtest set a = 1 where a = 2 returning *;
-- -- The new values are concatenated with ' triggered !'
-- update utrtest set a = 1 where a = 2 returning *;
-- drop trigger loct_br_insert_trigger on loct;
-- -- We can move rows to a foreign partition that has been updated already,
-- -- but can't move rows to a foreign partition that hasn't been updated yet
-- delete from utrtest;
-- insert into utrtest values (1, 'foo');
-- insert into utrtest values (2, 'qux');
-- -- Test the former case:
-- -- with a direct modification plan
-- explain (verbose, costs off)
-- update utrtest set a = 1 returning *;
-- update utrtest set a = 1 returning *;
-- delete from utrtest;
-- insert into utrtest values (1, 'foo');
-- insert into utrtest values (2, 'qux');
-- -- with a non-direct modification plan
-- explain (verbose, costs off)
-- update utrtest set a = 1 from (values (1), (2)) s(x) where a = s.x returning *;
-- update utrtest set a = 1 from (values (1), (2)) s(x) where a = s.x returning *;
-- -- Change the definition of utrtest so that the foreign partition get updated
-- -- after the local partition
-- delete from utrtest;
-- alter table utrtest detach partition remp;
-- drop foreign table remp;
-- alter table loct drop constraint loct_a_check;
-- alter table loct add check (a in (3));
-- create foreign table remp (a int check (a in (3)), b text) server loopback options (table_name 'loct');
-- alter table utrtest attach partition remp for values in (3);
-- insert into utrtest values (2, 'qux');
-- insert into utrtest values (3, 'xyzzy');
-- -- Test the latter case:
-- -- with a direct modification plan
-- explain (verbose, costs off)
-- update utrtest set a = 3 returning *;
-- update utrtest set a = 3 returning *; -- ERROR
-- -- with a non-direct modification plan
-- explain (verbose, costs off)
-- update utrtest set a = 3 from (values (2), (3)) s(x) where a = s.x returning *;
-- update utrtest set a = 3 from (values (2), (3)) s(x) where a = s.x returning *; -- ERROR
-- drop table utrtest;
-- drop table loct;
-- -- Test copy tuple routing
-- create table ctrtest (a int, b text) partition by list (a);
-- create table loct1 (a int check (a in (1)), b text);
-- create foreign table remp1 (a int check (a in (1)), b text) server loopback options (table_name 'loct1');
-- create table loct2 (a int check (a in (2)), b text);
-- create foreign table remp2 (b text, a int check (a in (2))) server loopback options (table_name 'loct2');
-- alter table ctrtest attach partition remp1 for values in (1);
-- alter table ctrtest attach partition remp2 for values in (2);
-- copy ctrtest from stdin;
-- 1	foo
-- 2	qux
-- \.
-- select tableoid::regclass, * FROM ctrtest;
-- select tableoid::regclass, * FROM remp1;
-- select tableoid::regclass, * FROM remp2;
-- -- Copying into foreign partitions directly should work as well
-- copy remp1 from stdin;
-- 1	bar
-- \.
-- select tableoid::regclass, * FROM remp1;
-- drop table ctrtest;
-- drop table loct1;
-- drop table loct2;
-- DynamoDB FDW does not support COPY FROM
-- -- ===================================================================
-- -- test COPY FROM
-- -- ===================================================================
-- --Testcase 714:
-- create foreign table rem2_a_child (id serial, f1 int, f2 text) server dynamodb_server options(table_name 'loc2', partition_key 'id');
-- --Testcase 715:
-- create table rem2 (id serial, f1 int, f2 text, spdurl text) PARTITION BY LIST (spdurl);
-- --Testcase 716:
-- CREATE FOREIGN TABLE rem2_a PARTITION OF rem2 FOR VALUES IN ('/node1/') SERVER spdsrv;
-- -- Test basic functionality
-- copy rem2_a_child (f1, f2) from stdin;
-- 1	foo
-- 2	bar
-- \.
-- --Testcase 717:
-- select * from rem2;
-- --Testcase 718:
-- delete from rem2_a_child;
-- -- Test check constraints
-- -- alter table loc2 add constraint loc2_f1positive check (f1 >= 0);
-- alter foreign table rem2_a_child add constraint rem2_f1positive check (f1 >= 0);
-- -- check constraint is enforced on the remote side, not locally
-- copy rem2_a_child (f1, f2) from stdin;
-- 1	foo
-- 2	bar
-- \.
-- copy rem2_a_child (f1, f2) from stdin; -- ERROR
-- -1	xyzzy
-- \.
-- --Testcase 719:
-- select * from rem2;
-- alter foreign table rem2_a_child drop constraint rem2_f1positive;
-- -- alter table loc2 drop constraint loc2_f1positive;
-- --Testcase 720:
-- delete from rem2_a_child;
-- -- Test local triggers
-- --Testcase 721:
-- create trigger trig_stmt_before before insert on rem2_a_child
-- 	for each statement execute procedure trigger_func();
-- --Testcase 722:
-- create trigger trig_stmt_after after insert on rem2_a_child
-- 	for each statement execute procedure trigger_func();
-- --Testcase 723:
-- create trigger trig_row_before before insert on rem2_a_child
-- 	for each row execute procedure trigger_data(23,'skidoo');
-- --Testcase 724:
-- create trigger trig_row_after after insert on rem2_a_child
-- 	for each row execute procedure trigger_data(23,'skidoo');
-- copy rem2_a_child (f1, f2) from stdin;
-- 1	foo
-- 2	bar
-- \.
-- --Testcase 725:
-- select * from rem2;
-- --Testcase 726:
-- drop trigger trig_row_before on rem2_a_child;
-- --Testcase 727:
-- drop trigger trig_row_after on rem2_a_child;
-- --Testcase 728:
-- drop trigger trig_stmt_before on rem2_a_child;
-- --Testcase 729:
-- drop trigger trig_stmt_after on rem2_a_child;
-- --Testcase 730:
-- delete from rem2_a_child;
-- --Testcase 731:
-- create trigger trig_row_before_insert before insert on rem2_a_child
-- 	for each row execute procedure trig_row_before_insupdate();
-- -- The new values are concatenated with ' triggered !'
-- copy rem2_a_child (f1, f2) from stdin;
-- 1	foo
-- 2	bar
-- \.
-- --Testcase 732:
-- select * from rem2;
-- --Testcase 733:
-- drop trigger trig_row_before_insert on rem2_a_child;
-- --Testcase 734:
-- delete from rem2_a_child;
-- --Testcase 735:
-- create trigger trig_null before insert on rem2_a_child
-- 	for each row execute procedure trig_null();
-- -- Nothing happens
-- copy rem2_a_child (f1, f2) from stdin;
-- 1	foo
-- 2	bar
-- \.
-- --Testcase 736:
-- select * from rem2;
-- --Testcase 737:
-- drop trigger trig_null on rem2_a_child;
-- --Testcase 738:
-- delete from rem2_a_child;
-- -- Test remote triggers
-- --Testcase 739:
-- create trigger trig_row_before_insert before insert on rem2_a_child
-- 	for each row execute procedure trig_row_before_insupdate();
-- -- The new values are concatenated with ' triggered !'
-- copy rem2_a_child(f1, f2) from stdin;
-- 1	foo
-- 2	bar
-- \.
-- --Testcase 740:
-- select * from rem2;
-- --Testcase 741:
-- drop trigger trig_row_before_insert on rem2_a_child;
-- --Testcase 742:
-- delete from rem2_a_child;
-- --Testcase 743:
-- create trigger trig_null before insert on rem2_a_child
-- 	for each row execute procedure trig_null();
-- -- Nothing happens
-- copy rem2_a_child (f1, f2) from stdin;
-- 1	foo
-- 2	bar
-- \.
-- --Testcase 744:
-- select * from rem2;
-- --Testcase 745:
-- drop trigger trig_null on rem2_a_child;
-- --Testcase 746:
-- delete from rem2_a_child;
-- -- Test a combination of local and remote triggers
-- --Testcase 747:
-- create trigger rem2_trig_row_before before insert on rem2_a_child
-- 	for each row execute procedure trigger_data(23,'skidoo');
-- --Testcase 748:
-- create trigger rem2_trig_row_after after insert on rem2_a_child
-- 	for each row execute procedure trigger_data(23,'skidoo');
-- --Testcase 749:
-- create trigger loc2_trig_row_before_insert before insert on loc2
-- 	for each row execute procedure trig_row_before_insupdate();
-- copy rem2_a_child (f1, f2) from stdin;
-- 1	foo
-- 2	bar
-- \.
-- --Testcase 750:
-- select * from rem2;
-- --Testcase 751:
-- drop trigger rem2_trig_row_before on rem2_a_child;
-- --Testcase 752:
-- drop trigger rem2_trig_row_after on rem2_a_child;
-- --Testcase 753:
-- drop trigger loc2_trig_row_before_insert on rem2_a_child;
-- --Testcase 754:
-- delete from rem2_a_child;
-- -- test COPY FROM with foreign table created in the same transaction
-- begin;
-- --Testcase 755:
-- create foreign table rem3_a_child (f1 int, f2 text)
-- 	server dynamodb_server options(table_name 'loc3');
-- --Testcase 756:
-- create table rem3 (f1 int, f2 text, spdurl text) PARTITION BY LIST (spdurl);
-- --Testcase 757:
-- CREATE FOREIGN TABLE rem3_a PARTITION OF rem3 FOR VALUES IN ('/node1/') SERVER spdsrv;
-- copy rem3_a_child (f1, f2) from stdin;
-- 1	foo
-- 2	bar
-- \.
-- commit;
-- --Testcase 758:
-- select * from rem3;
-- --Testcase 759:
-- drop foreign table rem3_a_child;
-- DynamoDB FDW does not support IMPORT FOREIGN SCHEMA
-- -- ===================================================================
-- -- test IMPORT FOREIGN SCHEMA
-- -- ===================================================================
-- CREATE SCHEMA import_source;
-- CREATE TABLE import_source.t1 (c1 int, c2 varchar NOT NULL);
-- CREATE TABLE import_source.t2 (c1 int default 42, c2 varchar NULL, c3 text collate "POSIX");
-- CREATE TYPE typ1 AS (m1 int, m2 varchar);
-- CREATE TABLE import_source.t3 (c1 timestamptz default now(), c2 typ1);
-- CREATE TABLE import_source."x 4" (c1 float8, "C 2" text, c3 varchar(42));
-- CREATE TABLE import_source."x 5" (c1 float8);
-- ALTER TABLE import_source."x 5" DROP COLUMN c1;
-- CREATE TABLE import_source."x 6" (c1 int, c2 int generated always as (c1 * 2) stored);
-- CREATE TABLE import_source.t4 (c1 int) PARTITION BY RANGE (c1);
-- CREATE TABLE import_source.t4_part PARTITION OF import_source.t4
--   FOR VALUES FROM (1) TO (100);
-- CREATE SCHEMA import_dest1;
-- IMPORT FOREIGN SCHEMA import_source FROM SERVER loopback INTO import_dest1;
-- \det+ import_dest1.*
-- \d import_dest1.*
-- -- Options
-- CREATE SCHEMA import_dest2;
-- IMPORT FOREIGN SCHEMA import_source FROM SERVER loopback INTO import_dest2
--   OPTIONS (import_default 'true');
-- \det+ import_dest2.*
-- \d import_dest2.*
-- CREATE SCHEMA import_dest3;
-- IMPORT FOREIGN SCHEMA import_source FROM SERVER loopback INTO import_dest3
--   OPTIONS (import_collate 'false', import_generated 'false', import_not_null 'false');
-- \det+ import_dest3.*
-- \d import_dest3.*
-- -- Check LIMIT TO and EXCEPT
-- CREATE SCHEMA import_dest4;
-- IMPORT FOREIGN SCHEMA import_source LIMIT TO (t1, nonesuch)
--   FROM SERVER loopback INTO import_dest4;
-- \det+ import_dest4.*
-- IMPORT FOREIGN SCHEMA import_source EXCEPT (t1, "x 4", nonesuch)
--   FROM SERVER loopback INTO import_dest4;
-- \det+ import_dest4.*
-- -- Assorted error cases
-- IMPORT FOREIGN SCHEMA import_source FROM SERVER loopback INTO import_dest4;
-- IMPORT FOREIGN SCHEMA nonesuch FROM SERVER loopback INTO import_dest4;
-- IMPORT FOREIGN SCHEMA nonesuch FROM SERVER loopback INTO notthere;
-- IMPORT FOREIGN SCHEMA nonesuch FROM SERVER nowhere INTO notthere;
-- -- Check case of a type present only on the remote server.
-- -- We can fake this by dropping the type locally in our transaction.
-- CREATE TYPE "Colors" AS ENUM ('red', 'green', 'blue');
-- CREATE TABLE import_source.t5 (c1 int, c2 text collate "C", "Col" "Colors");
-- CREATE SCHEMA import_dest5;
-- BEGIN;
-- DROP TYPE "Colors" CASCADE;
-- IMPORT FOREIGN SCHEMA import_source LIMIT TO (t5)
--   FROM SERVER loopback INTO import_dest5;  -- ERROR
-- ROLLBACK;
-- BEGIN;
-- CREATE SERVER fetch101 FOREIGN DATA WRAPPER postgres_fdw OPTIONS( fetch_size '101' );
-- SELECT count(*)
-- FROM pg_foreign_server
-- WHERE srvname = 'fetch101'
-- AND srvoptions @> array['fetch_size=101'];
-- ALTER SERVER fetch101 OPTIONS( SET fetch_size '202' );
-- SELECT count(*)
-- FROM pg_foreign_server
-- WHERE srvname = 'fetch101'
-- AND srvoptions @> array['fetch_size=101'];
-- SELECT count(*)
-- FROM pg_foreign_server
-- WHERE srvname = 'fetch101'
-- AND srvoptions @> array['fetch_size=202'];
-- CREATE FOREIGN TABLE table30000 ( x int ) SERVER fetch101 OPTIONS ( fetch_size '30000' );
-- SELECT COUNT(*)
-- FROM pg_foreign_table
-- WHERE ftrelid = 'table30000'::regclass
-- AND ftoptions @> array['fetch_size=30000'];
-- ALTER FOREIGN TABLE table30000 OPTIONS ( SET fetch_size '60000');
-- SELECT COUNT(*)
-- FROM pg_foreign_table
-- WHERE ftrelid = 'table30000'::regclass
-- AND ftoptions @> array['fetch_size=30000'];
-- SELECT COUNT(*)
-- FROM pg_foreign_table
-- WHERE ftrelid = 'table30000'::regclass
-- AND ftoptions @> array['fetch_size=60000'];
-- ROLLBACK;
-- PGSpider Extension only support Partition by List. This test is not
-- suitable.
-- -- ===================================================================
-- -- test partitionwise joins
-- -- ===================================================================
-- SET enable_partitionwise_join=on;
-- CREATE TABLE fprt1 (a int, b int, c varchar) PARTITION BY RANGE(a);
-- CREATE TABLE fprt1_p1 (LIKE fprt1);
-- CREATE TABLE fprt1_p2 (LIKE fprt1);
-- ALTER TABLE fprt1_p1 SET (autovacuum_enabled = 'false');
-- ALTER TABLE fprt1_p2 SET (autovacuum_enabled = 'false');
-- INSERT INTO fprt1_p1 SELECT i, i, to_char(i/50, 'FM0000') FROM generate_series(0, 249, 2) i;
-- INSERT INTO fprt1_p2 SELECT i, i, to_char(i/50, 'FM0000') FROM generate_series(250, 499, 2) i;
-- CREATE FOREIGN TABLE ftprt1_p1 PARTITION OF fprt1 FOR VALUES FROM (0) TO (250)
-- 	SERVER loopback OPTIONS (table_name 'fprt1_p1', use_remote_estimate 'true');
-- CREATE FOREIGN TABLE ftprt1_p2 PARTITION OF fprt1 FOR VALUES FROM (250) TO (500)
-- 	SERVER loopback OPTIONS (TABLE_NAME 'fprt1_p2');
-- ANALYZE fprt1;
-- ANALYZE fprt1_p1;
-- ANALYZE fprt1_p2;
-- CREATE TABLE fprt2 (a int, b int, c varchar) PARTITION BY RANGE(b);
-- CREATE TABLE fprt2_p1 (LIKE fprt2);
-- CREATE TABLE fprt2_p2 (LIKE fprt2);
-- ALTER TABLE fprt2_p1 SET (autovacuum_enabled = 'false');
-- ALTER TABLE fprt2_p2 SET (autovacuum_enabled = 'false');
-- INSERT INTO fprt2_p1 SELECT i, i, to_char(i/50, 'FM0000') FROM generate_series(0, 249, 3) i;
-- INSERT INTO fprt2_p2 SELECT i, i, to_char(i/50, 'FM0000') FROM generate_series(250, 499, 3) i;
-- CREATE FOREIGN TABLE ftprt2_p1 (b int, c varchar, a int)
-- 	SERVER loopback OPTIONS (table_name 'fprt2_p1', use_remote_estimate 'true');
-- ALTER TABLE fprt2 ATTACH PARTITION ftprt2_p1 FOR VALUES FROM (0) TO (250);
-- CREATE FOREIGN TABLE ftprt2_p2 PARTITION OF fprt2 FOR VALUES FROM (250) TO (500)
-- 	SERVER loopback OPTIONS (table_name 'fprt2_p2', use_remote_estimate 'true');
-- ANALYZE fprt2;
-- ANALYZE fprt2_p1;
-- ANALYZE fprt2_p2;
-- -- inner join three tables
-- EXPLAIN (COSTS OFF)
-- SELECT t1.a,t2.b,t3.c FROM fprt1 t1 INNER JOIN fprt2 t2 ON (t1.a = t2.b) INNER JOIN fprt1 t3 ON (t2.b = t3.a) WHERE t1.a % 25 =0 ORDER BY 1,2,3;
-- SELECT t1.a,t2.b,t3.c FROM fprt1 t1 INNER JOIN fprt2 t2 ON (t1.a = t2.b) INNER JOIN fprt1 t3 ON (t2.b = t3.a) WHERE t1.a % 25 =0 ORDER BY 1,2,3;
-- -- left outer join + nullable clause
-- EXPLAIN (VERBOSE, COSTS OFF)
-- SELECT t1.a,t2.b,t2.c FROM fprt1 t1 LEFT JOIN (SELECT * FROM fprt2 WHERE a < 10) t2 ON (t1.a = t2.b and t1.b = t2.a) WHERE t1.a < 10 ORDER BY 1,2,3;
-- SELECT t1.a,t2.b,t2.c FROM fprt1 t1 LEFT JOIN (SELECT * FROM fprt2 WHERE a < 10) t2 ON (t1.a = t2.b and t1.b = t2.a) WHERE t1.a < 10 ORDER BY 1,2,3;
-- -- with whole-row reference; partitionwise join does not apply
-- EXPLAIN (COSTS OFF)
-- SELECT t1.wr, t2.wr FROM (SELECT t1 wr, a FROM fprt1 t1 WHERE t1.a % 25 = 0) t1 FULL JOIN (SELECT t2 wr, b FROM fprt2 t2 WHERE t2.b % 25 = 0) t2 ON (t1.a = t2.b) ORDER BY 1,2;
-- SELECT t1.wr, t2.wr FROM (SELECT t1 wr, a FROM fprt1 t1 WHERE t1.a % 25 = 0) t1 FULL JOIN (SELECT t2 wr, b FROM fprt2 t2 WHERE t2.b % 25 = 0) t2 ON (t1.a = t2.b) ORDER BY 1,2;
-- -- join with lateral reference
-- EXPLAIN (COSTS OFF)
-- SELECT t1.a,t1.b FROM fprt1 t1, LATERAL (SELECT t2.a, t2.b FROM fprt2 t2 WHERE t1.a = t2.b AND t1.b = t2.a) q WHERE t1.a%25 = 0 ORDER BY 1,2;
-- SELECT t1.a,t1.b FROM fprt1 t1, LATERAL (SELECT t2.a, t2.b FROM fprt2 t2 WHERE t1.a = t2.b AND t1.b = t2.a) q WHERE t1.a%25 = 0 ORDER BY 1,2;
-- -- with PHVs, partitionwise join selected but no join pushdown
-- EXPLAIN (COSTS OFF)
-- SELECT t1.a, t1.phv, t2.b, t2.phv FROM (SELECT 't1_phv' phv, * FROM fprt1 WHERE a % 25 = 0) t1 FULL JOIN (SELECT 't2_phv' phv, * FROM fprt2 WHERE b % 25 = 0) t2 ON (t1.a = t2.b) ORDER BY t1.a, t2.b;
-- SELECT t1.a, t1.phv, t2.b, t2.phv FROM (SELECT 't1_phv' phv, * FROM fprt1 WHERE a % 25 = 0) t1 FULL JOIN (SELECT 't2_phv' phv, * FROM fprt2 WHERE b % 25 = 0) t2 ON (t1.a = t2.b) ORDER BY t1.a, t2.b;
-- -- test FOR UPDATE; partitionwise join does not apply
-- EXPLAIN (COSTS OFF)
-- SELECT t1.a, t2.b FROM fprt1 t1 INNER JOIN fprt2 t2 ON (t1.a = t2.b) WHERE t1.a % 25 = 0 ORDER BY 1,2 FOR UPDATE OF t1;
-- SELECT t1.a, t2.b FROM fprt1 t1 INNER JOIN fprt2 t2 ON (t1.a = t2.b) WHERE t1.a % 25 = 0 ORDER BY 1,2 FOR UPDATE OF t1;
-- RESET enable_partitionwise_join;
-- -- ===================================================================
-- -- test partitionwise aggregates
-- -- ===================================================================
-- CREATE TABLE pagg_tab (a int, b int, c text) PARTITION BY RANGE(a);
-- CREATE TABLE pagg_tab_p1 (LIKE pagg_tab);
-- CREATE TABLE pagg_tab_p2 (LIKE pagg_tab);
-- CREATE TABLE pagg_tab_p3 (LIKE pagg_tab);
-- INSERT INTO pagg_tab_p1 SELECT i % 30, i % 50, to_char(i/30, 'FM0000') FROM generate_series(1, 3000) i WHERE (i % 30) < 10;
-- INSERT INTO pagg_tab_p2 SELECT i % 30, i % 50, to_char(i/30, 'FM0000') FROM generate_series(1, 3000) i WHERE (i % 30) < 20 and (i % 30) >= 10;
-- INSERT INTO pagg_tab_p3 SELECT i % 30, i % 50, to_char(i/30, 'FM0000') FROM generate_series(1, 3000) i WHERE (i % 30) < 30 and (i % 30) >= 20;
-- -- Create foreign partitions
-- CREATE FOREIGN TABLE fpagg_tab_p1 PARTITION OF pagg_tab FOR VALUES FROM (0) TO (10) SERVER loopback OPTIONS (table_name 'pagg_tab_p1');
-- CREATE FOREIGN TABLE fpagg_tab_p2 PARTITION OF pagg_tab FOR VALUES FROM (10) TO (20) SERVER loopback OPTIONS (table_name 'pagg_tab_p2');;
-- CREATE FOREIGN TABLE fpagg_tab_p3 PARTITION OF pagg_tab FOR VALUES FROM (20) TO (30) SERVER loopback OPTIONS (table_name 'pagg_tab_p3');;
-- ANALYZE pagg_tab;
-- ANALYZE fpagg_tab_p1;
-- ANALYZE fpagg_tab_p2;
-- ANALYZE fpagg_tab_p3;
-- -- When GROUP BY clause matches with PARTITION KEY.
-- -- Plan with partitionwise aggregates is disabled
-- SET enable_partitionwise_aggregate TO false;
-- EXPLAIN (COSTS OFF)
-- SELECT a, sum(b), min(b), count(*) FROM pagg_tab GROUP BY a HAVING avg(b) < 22 ORDER BY 1;
-- -- Plan with partitionwise aggregates is enabled
-- SET enable_partitionwise_aggregate TO true;
-- EXPLAIN (COSTS OFF)
-- SELECT a, sum(b), min(b), count(*) FROM pagg_tab GROUP BY a HAVING avg(b) < 22 ORDER BY 1;
-- SELECT a, sum(b), min(b), count(*) FROM pagg_tab GROUP BY a HAVING avg(b) < 22 ORDER BY 1;
-- -- Check with whole-row reference
-- -- Should have all the columns in the target list for the given relation
-- EXPLAIN (VERBOSE, COSTS OFF)
-- SELECT a, count(t1) FROM pagg_tab t1 GROUP BY a HAVING avg(b) < 22 ORDER BY 1;
-- SELECT a, count(t1) FROM pagg_tab t1 GROUP BY a HAVING avg(b) < 22 ORDER BY 1;
-- -- When GROUP BY clause does not match with PARTITION KEY.
-- EXPLAIN (COSTS OFF)
-- SELECT b, avg(a), max(a), count(*) FROM pagg_tab GROUP BY b HAVING sum(a) < 700 ORDER BY 1;
-- DynamoDB does not support superuser
-- -- ===================================================================
-- -- access rights and superuser
-- -- ===================================================================
-- -- Non-superuser cannot create a FDW without a password in the connstr
-- CREATE ROLE regress_nosuper NOSUPERUSER;
-- GRANT USAGE ON FOREIGN DATA WRAPPER postgres_fdw TO regress_nosuper;
-- SET ROLE regress_nosuper;
-- SHOW is_superuser;
-- -- This will be OK, we can create the FDW
-- DO $d$
--     BEGIN
--         EXECUTE $$CREATE SERVER loopback_nopw FOREIGN DATA WRAPPER postgres_fdw
--             OPTIONS (dbname '$$||current_database()||$$',
--                      port '$$||current_setting('port')||$$'
--             )$$;
--     END;
-- $d$;
-- -- But creation of user mappings for non-superusers should fail
-- CREATE USER MAPPING FOR public SERVER loopback_nopw;
-- CREATE USER MAPPING FOR CURRENT_USER SERVER loopback_nopw;
-- CREATE FOREIGN TABLE ft1_nopw (
-- 	c1 int NOT NULL,
-- 	c2 int NOT NULL,
-- 	c3 text,
-- 	c4 timestamptz,
-- 	c5 timestamp,
-- 	c6 varchar(10),
-- 	c7 char(10) default 'ft1',
-- 	c8 user_enum
-- ) SERVER loopback_nopw OPTIONS (schema_name 'public', table_name 'ft1');
-- SELECT * FROM ft1_nopw LIMIT 1;
-- -- If we add a password to the connstr it'll fail, because we don't allow passwords
-- -- in connstrs only in user mappings.
-- DO $d$
--     BEGIN
--         EXECUTE $$ALTER SERVER loopback_nopw OPTIONS (ADD password 'dummypw')$$;
--     END;
-- $d$;
-- -- If we add a password for our user mapping instead, we should get a different
-- -- error because the password wasn't actually *used* when we run with trust auth.
-- --
-- -- This won't work with installcheck, but neither will most of the FDW checks.
-- ALTER USER MAPPING FOR CURRENT_USER SERVER loopback_nopw OPTIONS (ADD password 'dummypw');
-- SELECT * FROM ft1_nopw LIMIT 1;
-- -- Unpriv user cannot make the mapping passwordless
-- ALTER USER MAPPING FOR CURRENT_USER SERVER loopback_nopw OPTIONS (ADD password_required 'false');
-- SELECT * FROM ft1_nopw LIMIT 1;
-- RESET ROLE;
-- -- But the superuser can
-- ALTER USER MAPPING FOR regress_nosuper SERVER loopback_nopw OPTIONS (ADD password_required 'false');
-- SET ROLE regress_nosuper;
-- -- Should finally work now
-- SELECT * FROM ft1_nopw LIMIT 1;
-- -- unpriv user also cannot set sslcert / sslkey on the user mapping
-- -- first set password_required so we see the right error messages
-- ALTER USER MAPPING FOR CURRENT_USER SERVER loopback_nopw OPTIONS (SET password_required 'true');
-- ALTER USER MAPPING FOR CURRENT_USER SERVER loopback_nopw OPTIONS (ADD sslcert 'foo.crt');
-- ALTER USER MAPPING FOR CURRENT_USER SERVER loopback_nopw OPTIONS (ADD sslkey 'foo.key');
-- -- We're done with the role named after a specific user and need to check the
-- -- changes to the public mapping.
-- DROP USER MAPPING FOR CURRENT_USER SERVER loopback_nopw;
-- -- This will fail again as it'll resolve the user mapping for public, which
-- -- lacks password_required=false
-- SELECT * FROM ft1_nopw LIMIT 1;
-- RESET ROLE;
-- -- The user mapping for public is passwordless and lacks the password_required=false
-- -- mapping option, but will work because the current user is a superuser.
-- SELECT * FROM ft1_nopw LIMIT 1;
-- -- cleanup
-- DROP USER MAPPING FOR public SERVER loopback_nopw;
-- DROP OWNED BY regress_nosuper;
-- DROP ROLE regress_nosuper;
-- -- Clean-up
-- RESET enable_partitionwise_aggregate;
-- -- Two-phase transactions are not supported.
-- BEGIN;
-- SELECT count(*) FROM ft1;
-- -- error here
-- PREPARE TRANSACTION 'fdw_tpc';
-- ROLLBACK;
-- ===================================================================
-- test connection invalidation cases
-- ===================================================================
-- This test case is for closing the connection in pgfdw_xact_callback
BEGIN;
-- Connection xact depth becomes 1 i.e. the connection is in midst of the xact.
--Testcase 760:
SELECT 1 FROM ft1 LIMIT 1;
 ?column? 
----------
        1
(1 row)

-- DynamoDB FDW does not support use_remote_estimate option
-- -- Connection is not closed at the end of the alter statement in
-- -- pgfdw_inval_callback. That's because the connection is in midst of this
-- -- xact, it is just marked as invalid.
-- ALTER SERVER loopback OPTIONS (ADD use_remote_estimate 'off');
-- The invalid connection gets closed in pgfdw_xact_callback during commit.
COMMIT;
--Testcase 761:
DROP USER MAPPING FOR public SERVER dynamodb_server;
--Testcase 762:
DROP USER MAPPING FOR CURRENT_USER SERVER spdsrv;
--Testcase 763:
DROP SERVER dynamodb_server CASCADE;
NOTICE:  drop cascades to 14 other objects
DETAIL:  drop cascades to foreign table "S 1"."T 1"
drop cascades to foreign table "S 1"."T 2"
drop cascades to foreign table "S 1"."T 3"
drop cascades to foreign table "S 1"."T 4"
drop cascades to foreign table ft1_a_child
drop cascades to foreign table ft2_a_child
drop cascades to foreign table ft4_a_child
drop cascades to foreign table ft5_a_child
drop cascades to foreign table ft6_a_child
drop cascades to foreign table ft_empty_a_child
drop cascades to foreign table loct3_a_child
drop cascades to foreign table ft3_a_child
drop cascades to foreign table rem1_a_child
drop cascades to foreign table grem1_a_child
--Testcase 765:
DROP SERVER spdsrv CASCADE;
NOTICE:  drop cascades to 13 other objects
DETAIL:  drop cascades to foreign table ft1_a
drop cascades to foreign table ft2_a
drop cascades to foreign table ft4_a
drop cascades to foreign table ft5_a
drop cascades to foreign table ft6_a
drop cascades to foreign table ft_empty_a
drop cascades to foreign table loct3_a
drop cascades to foreign table ft3_a
drop cascades to foreign table rem1_a
drop cascades to foreign table grem1_a
drop cascades to foreign table b_a
drop cascades to foreign table foo2_a
drop cascades to foreign table bar2_a
--Testcase 766:
DROP EXTENSION dynamodb_fdw CASCADE;
--Testcase 767:
DROP EXTENSION pgspider_ext CASCADE;
